LocationAbbr,LocationDesc,HealthTopic,PolicyTopic,DataSource,Title,Status,Citation,DataType
MA,Massachusetts,Obesity,Task Forces/Councils,DNPAO,School Nutrition,Dead,S2322,Text
NY,New York,Physical Activity,Public Safety,DNPAO,Blighted Property,Dead,A10460,Text
WA,Washington,Nutrition,Appropriations,DNPAO,State Agency Food Purchasing Policy,Dead,S5653,Text
NJ,New Jersey,Nutrition,Access to Healthy Foods,DNPAO,An Act Making Appropriations,Enacted,A2800,Text
OR,Oregon,Nutrition,Fruits and Vegetables,DNPAO,Standards and Practices for Care and Services,Enacted,35125,Text
WY,Wyoming,Nutrition,School Nutrition,DNPAO,Healthy Food Initiative Act,Dead,H194,Text
MI,Michigan,Nutrition,Food Assistance Programs,DNPAO,Vendor Contracts,Dead,H5764,Text
FL,Florida,Physical Activity,Pedestrians/Walking,DNPAO,"""Project Criteria, Management Plan, Land Exchanges""",Enacted,39380,Text
NY,New York,Nutrition,Farm Direct Foods,DNPAO,School Districts Purchase of Food Products,Dead,S4924,Text
WA,Washington,Nutrition,Incentives,DNPAO,Coordinated School Health Public Private Partnership,Dead,H3098,Text
MN,Minnesota,Nutrition,Access to Healthy Foods,DNPAO,Agriculture,Dead,H255,Text
NJ,New Jersey,Nutrition,Healthier Food Retail and Food Deserts,DNPAO,"""An act making appropriations for the support of the State Government and the several public purposes for the fiscal year ending June 30, 2016 and regulating the disbursement thereof.""",Enacted,SB2016,Text
ID,Idaho,Obesity,Body Mass Index (BMI),DNPAO,Local Land Use Planning and Production,Enacted,H148,Text
TX,Texas,Obesity,Health Insurance Coverage,DNPAO,Sweetened Beverages Tax,Dead,H2213,Text
NJ,New Jersey,Nutrition,Agriculture and Farming,DNPAO,An Act Concerning Water Supply Protection and Open Space and Farmland Preservation<br>,Dead,S813,Text
WA,Washington,Nutrition,Access to Healthy Foods,DNPAO,State Agency Food Purchasing Policy,Dead,S5653,Text
CA,California,Physical Activity,Access to Recreational Opportunities,DNPAO,Business Regulations,Enacted,21464,Text
NY,New York,Obesity,Body Mass Index (BMI),DNPAO,Omnibus Obesity and Respiratory Illness Reduction Act,Introduced,AB5322,Text
OR,Oregon,Nutrition,Fruits and Vegetables,DNPAO,An Act Making Appropriations<br>,Enacted,S500,Text
HI,Hawaii,Nutrition,Incentives,DNPAO,An Act Relating to the Establishment of an Agribusiness Cooperative Program<br>,Dead,H2363,Text
TX,Texas,Obesity,Appropriations,DNPAO,Basic Care for Pre-Kindergarten Age Children,Enacted,R18526,Text
MN,Minnesota,Physical Activity,Bicycling,DNPAO,Transportation,Dead,S807,Text
MN,Minnesota,Obesity,Appropriations,DNPAO,Transportation,Dead,S1439,Text
MA,Massachusetts,Obesity,Appropriations,DNPAO,Development of Transportation Infrastructure,Dead,H3177,Text
NY,New York,Nutrition,Disparities/Equity,DNPAO,An act Making Appropriations for the Support of Government<br>,Enacted,A9755,Text
AR,Arkansas,Nutrition,Access to Healthy Foods,DNPAO,Cottage Food and Farmers Market Permit Exemptions,Enacted,H1323,Text
MO,Missouri,Obesity,Marketing Restrictions,DNPAO,Streamlined Sales and Use Tax Agreement,Dead,H966,Text
FL,Florida,Obesity,Appropriations,DNPAO,Incorporations by Reference,Enacted,R34737,Text
WA,Washington,Obesity,Menu Labeling,DNPAO,Housing Everyone Financing Tool Program,Dead,S5856,Text
DC,District of Columbia,Obesity,Menu Labeling,DNPAO,Fort Totten Project,Dead,B414,Text
CT,Connecticut,Nutrition,Farm Direct Foods,DNPAO,Locally Grown Products by Residents,Dead,H5385,Text
MN,Minnesota,Nutrition,Task Forces/Councils,DNPAO,Stadiums,Dead,H1441,Text
DC,District of Columbia,Obesity,Menu Labeling,DNPAO,Allegro Apartments Workforce Housing,Dead,B326,Text
DE,Delaware,Physical Activity,Bicycling,DNPAO,Bicycles,Dead,S120,Text
MA,Massachusetts,Obesity,Appropriations,DNPAO,Transportation System Modernization,Dead,H4047,Text
SC,South Carolina,Physical Activity,Appropriations,DNPAO,Physical Education And Nutritional Standards,Enacted,H3499,Text
NM,New Mexico,Obesity,Appropriations,DNPAO,Public Schools and Reserve Officer Training,Dead,H132,Text
MS,Mississippi,Obesity,Task Forces/Councils,DNPAO,Council On Obesity Prevention And Management,Enacted,HB989,Text
IL,Illinois,Obesity,Appropriations,DNPAO,Act Amendments,Dead,S2348,Text
KS,Kansas,Obesity,Task Forces/Councils,DNPAO,Bariatric Surgery Study,Enacted,H2672,Text
AL,Alabama,Nutrition,Agriculture and Farming,DNPAO,To Make Appropriations <br>,Enacted,H325,Text
DE,Delaware,Physical Activity,Bicycling,DNPAO,Street and State Highway Access,Enacted,R2494,Text
ME,Maine,Physical Activity,Task Forces/Councils,DNPAO,An Act to Study Obesity and Methods to Reduce the Cost of Health Care and Increase the Public Health<br>,Enacted,H363,Text
NY,New York,Nutrition,Farm Direct Foods,DNPAO,Statewide and Regional Farm Guides,Dead,A6811,Text
NY,New York,Physical Activity,Task Forces/Councils,DNPAO,Office Of Nutrition And Fitness,Dead,S1735,Text
NJ,New Jersey,Obesity,Appropriations,DNPAO,Nutrition Program,Dead,A2549,Text
MD,Maryland,Nutrition,Task Forces/Councils,DNPAO,An Act Concerning the Study of the Implementation of a Hub and Spoke Program in the Southern Maryland Region,Enacted,HB1019,Text
MA,Massachusetts,Obesity,Appropriations,DNPAO,Labeling of Food,Dead,HD907,Text
SC,South Carolina,Nutrition,Incentives,DNPAO,An Act to Make Appropriations,Enacted,H4878,Text
FL,Florida,Obesity,Appropriations,DNPAO,Affordable Housing,Enacted,H639,Text
NY,New York,Obesity,Sugar Sweetened Beverages,DNPAO,Sale of Certain Foods in Vending Machines,Dead,S4552,Text
MD,Maryland,Obesity,Appropriations,DNPAO,Department of Education,Dead,S865,Text
ME,Maine,Obesity,Food Restrictions,DNPAO,Farm and Fish to School Program,Enacted,H1060,Text
MD,Maryland,Nutrition,Farmers Markets,DNPAO,Raw Agricultural Products Sales,Enacted,S228,Text
HI,Hawaii,Physical Activity,Bicycling,DNPAO,Walk and Bike School Bus Programs,Dead,HCR159,Text
MA,Massachusetts,Obesity,Appropriations,DNPAO,Land Use Regulations and Zoning,Dead,H1443,Text
NY,New York,Obesity,Appropriations,DNPAO,Governor's Council on Physical Fitness,Dead,S2621,Text
WV,West Virginia,Nutrition,School Nutrition,DNPAO,Standards for School Nutrition,Enacted,6299,Text
NY,New York,Nutrition,Food Assistance Programs,DNPAO,An Act to Amend the Elder Law and the Agriculture and Markets Law,Dead,S7452,Text
TX,Texas,Obesity,Appropriations,DNPAO,Public School Student Physical Activity Requirements,Dead,H3682,Text
KS,Kansas,Nutrition,Farm Direct Foods,DNPAO,Food and Beverages Available to Students,Enacted,S154,Text
OR,Oregon,Nutrition,Medical Care,DNPAO,Use of State Highway Fund Moneys,Dead,S943,Text
MN,Minnesota,Nutrition,Trans Fats,DNPAO,Stadiums,Dead,S1164,Text
TN,Tennessee,Nutrition,Farmers Markets,DNPAO,Taxes,Dead,S1636,Text
MI,Michigan,Nutrition,Appropriations,DNPAO,Recreational Authorities,Dead,S270,Text
NJ,New Jersey,Nutrition,Appropriations,DNPAO,Pediatric Medical Day Care Facilities,Enacted,R18610,Text
CA,California,Obesity,Food Restrictions,DNPAO,Public Health: Food Justice,Dead,A1488,Text
HI,Hawaii,Obesity,Appropriations,DNPAO,Task Force for Loss of Agricultural Lands,Dead,HR172,Text
NY,New York,Physical Activity,Media Campaigns,DNPAO,New York State Governors Council on Physical Fitness,Dead,S2856,Text
GA,Georgia,Nutrition,Appropriations,DNPAO,Children's Transition Care Centers,Enacted,R5169,Text
NY,New York,Obesity,Sugar Sweetened Beverages,DNPAO,Restricting the Display of Certain Foods and Beverages<br>,Dead,A8812,Text
MO,Missouri,Nutrition,Access to Healthy Foods,DNPAO,Farm to Institution Initiative,Dead,H1833,Text
PA,Pennsylvania,Nutrition,Appropriations,DNPAO,National Fresh Food Financing Initiative,Enacted,HR728,Text
WA,Washington,Nutrition,Farmers Markets,DNPAO,Trans Fat,Dead,S5857,Text
ID,Idaho,Nutrition,Food Assistance Programs,DNPAO,Alcohol and Substance Use Disorders Treatment and Recovery Support Services Facilities and Programs<br>,Enacted,8847,Text
HI,Hawaii,Obesity,Health Insurance Coverage,DNPAO,Tax Credits,Dead,H409,Text
OR,Oregon,Nutrition,Farmers Markets,DNPAO,Nutrition,Dead,H2924,Text
MA,Massachusetts,Obesity,Food Restrictions,DNPAO,Food Policy Council,Dead,H4255,Text
MN,Minnesota,Obesity,Appropriations,DNPAO,Transportation,Dead,S3169,Text
IN,Indiana,Physical Activity,Public Safety,DNPAO,Public Safety Funding,Dead,S234,Text
AR,Arkansas,Nutrition,Agriculture and Farming,DNPAO,Corrections Facilities Appropriation,Enacted,H1518,Text
DE,Delaware,Physical Activity,Built Environment and Street-Scale Design,DNPAO,Bicycles,Dead,S120,Text
MA,Massachusetts,Nutrition,Access to Healthy Foods,DNPAO,Sweetened Snack Subsidy,Dead,HD1994,Text
CA,California,Obesity,Appropriations,DNPAO,Teachers: Physical Education Professional,Enacted,S601,Text
FL,Florida,Obesity,Appropriations,DNPAO,Growth Management,Dead,H7127,Text
CA,California,Nutrition,Disparities/Equity,DNPAO,An Act Relating to Public Health  <br>,Dead,A2204,Text
HI,Hawaii,Physical Activity,Safe Routes to Schools,DNPAO,School Traffic Safety,Enacted,H983,Text
AZ,Arizona,Nutrition,Healthier Food Retail and Food Deserts,DNPAO,Temporary Soft Drink Tax,Dead,H2759,Text
CA,California,Nutrition,Task Forces/Councils,DNPAO,Food and Agriculture: Omnibus Bill,Enacted,A222,Text
NY,New York,Nutrition,Appropriations,DNPAO,Deficiency Budget,Dead,S2806,Text
CA,California,Nutrition,Task Forces/Councils,DNPAO,Health Care Reform,Dead,S92,Text
OH,Ohio,Obesity,Appropriations,DNPAO,Drug Testing Requirement for Adults on Assistance,Dead,S69,Text
NY,New York,Obesity,Food Restrictions,DNPAO,Definition of Greenmarket,Vetoed,S1676,Text
MN,Minnesota,Physical Activity,Pedestrians/Walking,DNPAO,Capital Improvements,Dead,S1367,Text
AR,Arkansas,Nutrition,Disparities/Equity,DNPAO,Appropriation to the Department of Human Services,Dead,H1471,Text
OK,Oklahoma,Nutrition,Incentives,DNPAO,Revenue And Taxation,Dead,H1636,Text
CA,California,Obesity,Marketing Restrictions,DNPAO,Land Use: Housing Element: Regional Housing Need,Dead,A542,Text
WV,West Virginia,Physical Activity,Bicycling,DNPAO,Patient Centered Medical Homes Pilot Projects,Enacted,S414,Text
CA,California,Physical Activity,Appropriations,DNPAO,Housing and Emergency Shelter Trust Fund Acts,Dead,A221,Text
TX,Texas,Nutrition,Nutrition Standards,DNPAO,Sweetened Beverages Tax,Dead,H2213,Text
MN,Minnesota,Physical Activity,Built Environment and Street-Scale Design,DNPAO,Stadiums,Dead,H1441,Text
MS,Mississippi,Physical Activity,Incentives,DNPAO,Exercise Equipment Retail Sales Tax,Dead,H141,Text
TX,Texas,Obesity,Body Mass Index (BMI),DNPAO,Texas Transportation Commission,Dead,H1105,Text
SC,South Carolina,Nutrition,Appropriations,DNPAO,Appropriations,Enacted,H4813,Text
MO,Missouri,Nutrition,Appropriations,DNPAO,Farm to Table Advisory Board,Dead,H830,Text
WV,West Virginia,Nutrition,Task Forces/Councils,DNPAO,Food Council,Dead,HCR69,Text
CA,California,Nutrition,Appropriations,DNPAO,Health and Human Services: Federal Grant Opportunities,Dead,A70,Text
TX,Texas,Nutrition,Media Campaigns,DNPAO,Sweetened Beverages Tax,Dead,H2213,Text
NY,New York,Nutrition,Food Assistance Programs,DNPAO,An Act to Amend the Elder Law and the Agriculture and Markets Law<br>,Dead,A10308,Text
NM,New Mexico,Physical Activity,Appropriations,DNPAO,Relating to Capital Expenditures,Enacted,SB60,Text
HI,Hawaii,Obesity,Appropriations,DNPAO,Child Nutrition Programs,Enacted,HCR167,Text
TX,Texas,Nutrition,Food Assistance Programs,DNPAO,Foods Stamps and WIC Voucher Acceptance,Dead,S344,Text
HI,Hawaii,Obesity,Health Insurance Coverage,DNPAO,Medicaid,Dead,H569,Text
NC,North Carolina,Nutrition,Initiatives and Programs,DNPAO,Video Gaming and Profit Sharing,Dead,S1407,Text
OK,Oklahoma,Nutrition,Medical Care,DNPAO,"Roads, Bridges And Ferries",Dead,S425,Text
OR,Oregon,Nutrition,Farmers Markets,DNPAO,WIC Vendor and Farmer Administration,Enacted,R30455,Text
NY,New York,Nutrition,Trans Fats,DNPAO,Relates to Obesity Prevention<br>,Dead,S6423,Text
CA,California,Obesity,Appropriations,DNPAO,Local Government Omnibus Act of 2010,Dead,S894,Text
NJ,New Jersey,Nutrition,Farmers Markets,DNPAO,An Act Making Appropriations <br>,Enacted,S2003,Text
MI,Michigan,Nutrition,Initiatives and Programs,DNPAO,House Resolution,Enacted,HR409,Text
OK,Oklahoma,Nutrition,Appropriations,DNPAO,Revenue And Taxation,Dead,H1298,Text
DC,District of Columbia,Nutrition,Appropriations,DNPAO,Fiscal Year 2012 Budget Support Emergency Act,Enacted,B338,Text
PA,Pennsylvania,Physical Activity,Appropriations,DNPAO,Oil Company Gross Profits Tax,Dead,H8a,Text
HI,Hawaii,Nutrition,Farm Direct Foods,DNPAO,Home Organic Produce Cooperatives,Dead,HR266,Text
RI,Rhode Island,Obesity,Liability and Indemnity,DNPAO,Taxation,Dead,S675,Text
MO,Missouri,Obesity,Appropriations,DNPAO,State and Local Sales Tax Exemption,Dead,S658,Text
MT,Montana,Nutrition,Agriculture and Farming,DNPAO,Healthy Choices by Medicaid Recipients,Dead,D2115,Text
VT,Vermont,Nutrition,Farmers Markets,DNPAO,Farmers Markets,Enacted,H192,Text
LA,Louisiana,Physical Activity,Pedestrians/Walking,DNPAO,Local Traffic,Enacted,HCR42,Text
ME,Maine,Nutrition,Fruits and Vegetables,DNPAO,School Food Service Programs,Enacted,SB376,Text
WA,Washington,Nutrition,Medical Care,DNPAO,Bicycle and Pedestrian Traffic Safety Curriculum,Enacted,H1129,Text
CA,California,Physical Activity,Physical Education Requirements,DNPAO,An Act Relating to Physical Education,Dead,A200,Text
CA,California,Nutrition,Access to Healthy Foods,DNPAO,Food Literacy Awareness Month,Enacted,ACR161,Text
FL,Florida,Nutrition,Liability and Indemnity,DNPAO,Parks and Open Space Florida Forever Program,Enacted,R34881,Text
IN,Indiana,Nutrition,Nutrition Standards,DNPAO,Elimination of Trans Fat in School Food<br>,Dead,S357,Text
WI,Wisconsin,Obesity,Disparities/Equity,DNPAO,Day Care Centers,Dead,S313,Text
OK,Oklahoma,Nutrition,School Nutrition,DNPAO,Sales Tax,Dead,S728,Text
RI,Rhode Island,Physical Activity,Public Transportation,DNPAO,Highways,Dead,S952,Text
TX,Texas,Obesity,Disparities/Equity,DNPAO,Basic Care Requirements For Toddlers,Enacted,R18525,Text
PA,Pennsylvania,Nutrition,Farm Direct Foods,DNPAO,Farmers Market Construction Exemptions,Dead,H2419,Text
MD,Maryland,Nutrition,Medical Care,DNPAO,Special Taxing Districts,Enacted,S828,Text
CA,California,Obesity,Appropriations,DNPAO,Budget Act of 2011,Dead,A98,Text
LA,Louisiana,Obesity,Menu Labeling,DNPAO,Neighborhood Enhancement Program,Enacted,S732,Text
NJ,New Jersey,Obesity,Body Mass Index (BMI),DNPAO,An Act Providing for a State Employee Wellness  Incentive Program<br>,Dead,S2010,Text
NY,New York,Nutrition,School Nutrition,DNPAO,Food Task Force,Dead,S2874,Text
TX,Texas,Nutrition,Food Assistance Programs,DNPAO,Nutritious Foods,Enacted,H1622,Text
CA,California,Nutrition,Access to Healthy Foods,DNPAO,Retail Food Facilities: Toys and Incentives,Dead,A1100,Text
RI,Rhode Island,Obesity,Menu Labeling,DNPAO,Food and Drugs,Dead,S534,Text
WV,West Virginia,Physical Activity,Physical Education Requirements,DNPAO,Physical Education Requirements,Enacted,S785,Text
NY,New York,Obesity,Task Forces/Councils,DNPAO,Healthy Schools Act,Dead,A11075,Text
CA,California,Physical Activity,Bicycling,DNPAO,Environment: California-Mexico Border,Enacted,A1079,Text
CA,California,Nutrition,Healthier Food Retail and Food Deserts,DNPAO,Healthy Options for Everyone Act of 2014,Introduced,AB1661,Text
AL,Alabama,Obesity,Appropriations,DNPAO,State Appropriations,Dead,H910,Text
UT,Utah,Obesity,Food Restrictions,DNPAO,Short Title - Locally Produced Agriculture,Dead,H396,Text
MO,Missouri,Nutrition,Appropriations,DNPAO,Healthy Food Pilot Program,Dead,H32,Text
VT,Vermont,Nutrition,Food Assistance Programs,DNPAO,Nutrition Assistance Program,Enacted,H408,Text
NC,North Carolina,Obesity,Access to Drinking Water,DNPAO,Healthy Schools Act,Dead,H840,Text
MO,Missouri,Physical Activity,Physical Education Requirements,DNPAO,Public Schools Ballroom Dance Courses,Dead,H169,Text
FL,Florida,Obesity,Access to Drinking Water,DNPAO,Healthy and Fit Florida Act,Dead,S2614,Text
DC,District of Columbia,Physical Activity,Physical Education Requirements,DNPAO,Healthy Schools,Enacted,B564,Text
GA,Georgia,Physical Activity,"Parks, Recreation and Trails",DNPAO,Revenue and Tax,Dead,H73,Text
MS,Mississippi,Physical Activity,Physical Education Requirements,DNPAO,Healthy Living Instruction,Dead,H614,Text
ND,North Dakota,Nutrition,Agriculture and Farming,DNPAO,Expenses Of The Department Of Health,Enacted,S2004,Text
TX,Texas,Physical Activity,Physical Activity Requirements,DNPAO,An Act Relating to Health Education in Public Schools <br>,Enacted,S19,Text
HI,Hawaii,Physical Activity,"Parks, Recreation and Trails",DNPAO,Mauka Area Rules<br>,Enacted,1367,Text
MD,Maryland,Obesity,Food Restrictions,DNPAO,Local Educational Agency,Enacted,H751,Text
NM,New Mexico,Physical Activity,Access to Recreational Opportunities,DNPAO,Public School Facilities,Enacted,S378,Text
CT,Connecticut,Physical Activity,Physical Education Requirements,DNPAO,Adult Education Coursework,Dead,S941,Text
DE,Delaware,Nutrition,School Nutrition,DNPAO,Trans Fats In Schools,Enacted,H3,Text
MA,Massachusetts,Obesity,Menu Labeling,DNPAO,School Nutrition,Dead,H2092,Text
NC,North Carolina,Physical Activity,Physical Education Requirements,DNPAO,Physical Education Requirements,Dead,H1373,Text
OR,Oregon,Physical Activity,Built Environment and Street-Scale Design,DNPAO,Use of State Highway Fund Moneys,Dead,S943,Text
MN,Minnesota,Obesity,Body Mass Index (BMI),DNPAO,Capital Improvements,Dead,H1292,Text
OK,Oklahoma,Nutrition,Nutrition Standards,DNPAO,School Nutrition,Dead,S632,Text
CA,California,Nutrition,Task Forces/Councils,DNPAO,Health and Human Services: Federal Grant Opportunities,Dead,A70,Text
CA,California,Physical Activity,Pedestrians/Walking,DNPAO,Safe Routes to School,Dead,A516,Text
MD,Maryland,Nutrition,Farm Direct Foods,DNPAO,Agricultural Product Sales,Enacted,S198,Text
RI,Rhode Island,Physical Activity,Physical Education Requirements,DNPAO,Rules and Regulations for School Health Programs,Enacted,5542,Text
IN,Indiana,Physical Activity,Task Forces/Councils,DNPAO,Student Nutrition and Physical Activity,Enacted,S111,Text
CA,California,Obesity,Appropriations,DNPAO,Public Contracts: Healthy and Sustainable Food,Dead,A727,Text
SC,South Carolina,Obesity,Incentives,DNPAO,Sweetened Beverage Tax Act,Dead,H4831,Text
MD,Maryland,Nutrition,Access to Healthy Foods,DNPAO,Organic and Locally Grown Agricultural Products,Dead,S939,Text
TX,Texas,Obesity,Food Restrictions,DNPAO,Beverages Sold to Students in Schools,Vetoed,HB217,Text
KY,Kentucky,Nutrition,Farmers Markets,DNPAO,Appropriations and Revenue,Dead,H290,Text
WV,West Virginia,Physical Activity,Task Forces/Councils,DNPAO,Child Safety,Dead,HCR156,Text
CO,Colorado,Nutrition,Nutrition Standards,DNPAO,An Act Concerning Nutrition in School<br>,Enacted,S129,Text
MI,Michigan,Nutrition,Task Forces/Councils,DNPAO,Agriculture Industry,Dead,H4531,Text
WA,Washington,Nutrition,Fruits and Vegetables,DNPAO,Taxation,Enacted,S6143,Text
NJ,New Jersey,Physical Activity,Physical Activity Requirements,DNPAO,Recess Requirements,Introduced,SB1594,Text
MO,Missouri,Obesity,Appropriations,DNPAO,Farm to Table Advisory Board,Dead,S162,Text
MO,Missouri,Nutrition,Farmers Markets,DNPAO,State and Local Sales Tax Exemption,Dead,H1864,Text
KS,Kansas,Obesity,Food Restrictions,DNPAO,Dairy and Milk Inspection,Enacted,H2566,Text
AR,Arkansas,Nutrition,Appropriations,DNPAO,Area Agency on Aging Capital Improvement,Enacted,HB2066,Text
AK,Alaska,Obesity,Food Restrictions,DNPAO,Grown Agricultural Products,Enacted,H70,Text
FL,Florida,Obesity,Appropriations,DNPAO,Use of Wireless Communications Devices and Driving,Dead,S158,Text
VT,Vermont,Nutrition,School Nutrition,DNPAO,Agriculture Economic Development,Dead,S99,Text
MT,Montana,Nutrition,Food Assistance Programs,DNPAO,Recommendations on Reducing Childhood Hunger,Dead,D1088,Text
DC,District of Columbia,Obesity,Disparities/Equity,DNPAO,Workplace Wellness,Dead,B143,Text
MI,Michigan,Obesity,Food Restrictions,DNPAO,Community Health Appropriations,Dead,H4436,Text
WA,Washington,Physical Activity,Bicycling,DNPAO,Complete Streets Grant Program,Enacted,H1071,Text
HI,Hawaii,Nutrition,Disparities/Equity,DNPAO,General Excise Tax,Dead,S852,Text
DC,District of Columbia,Nutrition,Access to Healthy Foods,DNPAO,Supermarket Tax Abatement,Enacted,B917,Text
MA,Massachusetts,Obesity,Disparities/Equity,DNPAO,Out of School Time Programming,Dead,SD1474,Text
ND,North Dakota,Obesity,Food Restrictions,DNPAO,Sustainable Agriculture,Enacted,S2438,Text
KY,Kentucky,Physical Activity,"Parks, Recreation and Trails",DNPAO,Legislative Research Commission,Enacted,HCR8,Text
MA,Massachusetts,Nutrition,Farm Direct Foods,DNPAO,School Nutrition,Dead,S2314,Text
TN,Tennessee,Nutrition,Medical Care,DNPAO,Speeding in Marked School Zone,Dead,S1083,Text
NJ,New Jersey,Nutrition,Appropriations,DNPAO,State Health Benefits Program State Employee Wellness,Dead,A3864,Text
AR,Arkansas,Nutrition,Appropriations,DNPAO,Legislative Projects,Enacted,S626,Text
NM,New Mexico,Physical Activity,Physical Activity Requirements,DNPAO,Comprehensive Strategic Plan for Health,Enacted,SB34,Text
IL,Illinois,Nutrition,Appropriations,DNPAO,Commission to End Hunger Membership,Enacted,S262,Text
NY,New York,Nutrition,Fruits and Vegetables,DNPAO,An Act in Relation to Combating Incidences of Adult and Childhood Obesity<br>,Dead,A10101,Text
CA,California,Physical Activity,Public Safety,DNPAO,Redevelopment,Dead,A1250,Text
UT,Utah,Physical Activity,Built Environment and Street-Scale Design,DNPAO,Mortgages,Enacted,H275,Text
FL,Florida,Obesity,Body Mass Index (BMI),DNPAO,Growth Management,Enacted,H7207,Text
MN,Minnesota,Physical Activity,Physical Education Requirements,DNPAO,Education,Dead,H673,Text
AK,Alaska,Physical Activity,Pedestrians/Walking,DNPAO,Joe Williams Coastal Trail,Enacted,H42,Text
NY,New York,Nutrition,Farmers Markets,DNPAO,Health and Mental Hygiene Budget,Dead,S54,Text
HI,Hawaii,Obesity,Appropriations,DNPAO,Health,Dead,S1506,Text
WV,West Virginia,Physical Activity,Built Environment and Street-Scale Design,DNPAO,State Roads,Dead,H2025,Text
OR,Oregon,Nutrition,Agriculture and Farming,DNPAO,Agricultural Products,Enacted,H2336,Text
HI,Hawaii,Nutrition,Farm Direct Foods,DNPAO,An Act Related to Hawaii-grown Produce,Dead,H2245,Text
WV,West Virginia,Nutrition,Farm Direct Foods,DNPAO,Livestock Care Standards Board,Enacted,H4201,Text
NH,New Hampshire,Physical Activity,Built Environment and Street-Scale Design,DNPAO,Bicycle Lighting,Dead,LSR2599,Text
NY,New York,Nutrition,Task Forces/Councils,DNPAO,Statewide School Nutrition Standards,Dead,A11027,Text
NY,New York,Nutrition,Agriculture and Farming,DNPAO,An Act Making  Appropriations    <br>,Dead,S6253,Text
MA,Massachusetts,Nutrition,Sodium,DNPAO,Environmental and Health Impact Reports,Dead,H1157,Text
HI,Hawaii,Nutrition,Farm Direct Foods,DNPAO,Important Agricultural Lands,Dead,SR66,Text
CA,California,Nutrition,Agriculture and Farming,DNPAO,Budget Act of 2011,Dead,A92,Text
SC,South Carolina,Nutrition,Trans Fats,DNPAO,Trans Fats,Dead,S50,Text
WA,Washington,Physical Activity,Bicycling,DNPAO,Greenhouse Gas Emissions,Dead,S5687,Text
PA,Pennsylvania,Obesity,Appropriations,DNPAO,Interscholastic Athletic Opportunities,Dead,H2061,Text
HI,Hawaii,Obesity,Task Forces/Councils,DNPAO,Weight Management and Obesity Treatment for Children,Dead,SCR124,Text
UT,Utah,Nutrition,Farm Direct Foods,DNPAO,Dairy Act,Enacted,H311,Text
OH,Ohio,Nutrition,Farm Direct Foods,DNPAO,Nutritional Standards,Dead,H373,Text
AZ,Arizona,Obesity,Disparities/Equity,DNPAO,Transaction Privilege Tax and Soft Drinks,Dead,H2727,Text
MN,Minnesota,Physical Activity,Pedestrians/Walking,DNPAO,Capital Improvements,Dead,S656,Text
MS,Mississippi,Physical Activity,Disparities/Equity,DNPAO,Council on Combating Obesity,Dead,H924,Text
NY,New York,Obesity,Appropriations,DNPAO,NYS Housing Opportunity Zones Act,Dead,A4001,Text
CT,Connecticut,Obesity,Liability and Indemnity,DNPAO,Tax on Soft Drinks,Dead,S38,Text
CT,Connecticut,Obesity,Incentives,DNPAO,Tax on Soft Drinks,Dead,S38,Text
MS,Mississippi,Physical Activity,Task Forces/Councils,DNPAO,Sweetened Beverages and Syrups Tax,Dead,H414,Text
WI,Wisconsin,Nutrition,Nutrition Standards,DNPAO,Physical Fitness Assessments,Dead,A620,Text
OK,Oklahoma,Nutrition,Food Assistance Programs,DNPAO,Public Health And Safety,Dead,S1349,Text
MD,Maryland,Physical Activity,"Parks, Recreation and Trails",DNPAO,Annual Corrective Bill,Enacted,S455,Text
OH,Ohio,Obesity,Portion Size,DNPAO,School Nutrition and Health,Enacted,S210,Text
WA,Washington,Obesity,Appropriations,DNPAO,Motorcycles and Bicycles,Dead,H1403,Text
IL,Illinois,Nutrition,Food Security,DNPAO,Menu Education and Labeling Act,Dead,H5036,Text
MO,Missouri,Obesity,Food Restrictions,DNPAO,State and Local Sales Tax Exemption,Dead,S658,Text
AL,Alabama,Obesity,Appropriations,DNPAO,City of Center Point,Enacted,H511,Text
CT,Connecticut,Nutrition,Agriculture and Farming,DNPAO,Community Supported Agriculture,Dead,H5800,Text
NC,North Carolina,Nutrition,Task Forces/Councils,DNPAO,Child Care Commission,Dead,S1287,Text
MD,Maryland,Nutrition,Task Forces/Councils,DNPAO,Health Insurance,Dead,S1071,Text
MS,Mississippi,Physical Activity,Physical Activity Requirements,DNPAO,Comprehensive School Health Education Program,Dead,H963,Text
WI,Wisconsin,Obesity,Disparities/Equity,DNPAO,High School Credit for Extracurricular Sports,Dead,A130,Text
CT,Connecticut,Nutrition,Farm Direct Foods,DNPAO,An Act Making Appropriations<br>,Enacted,H5692,Text
NM,New Mexico,Physical Activity,Appropriations,DNPAO,An Act Making Appropriations <br>,Enacted,s611,Text
VT,Vermont,Nutrition,Appropriations,DNPAO,Economic Development,Enacted,H287,Text
IL,Illinois,Obesity,Food Restrictions,DNPAO,Farm Fresh Schools Program Act,Enacted,H78,Text
AL,Alabama,Nutrition,Appropriations,DNPAO,Farmers Market,Enacted,HR439,Text
TX,Texas,Obesity,Appropriations,DNPAO,Food Stamps,Dead,S1088,Text
