LocationAbbr,LocationDesc,HealthTopic,PolicyTopic,DataSource,Title,Status,Citation,DataType
CO,Colorado,Obesity,Appropriations,DNPAO,BEST Grant Rules,Enacted,R9837,Text
CA,California,Nutrition,Farmers Markets,DNPAO,"Agriculture: Fruits, Nuts, Vegetables: State Grown Act",Dead,A1960,Text
NY,New York,Nutrition,Fruits and Vegetables,DNPAO,Establishment of a Community Gardens  Task Force,Dead,A7479,Text
RI,Rhode Island,Obesity,Liability and Indemnity,DNPAO,Sales and Use Taxes for Vending Machines,Dead,S59,Text
MA,Massachusetts,Obesity,Appropriations,DNPAO,Development of Underused State Owned Property,Dead,H2962,Text
MA,Massachusetts,Physical Activity,Pedestrians/Walking,DNPAO,Safety of Road Users,Dead,H3079,Text
TX,Texas,Nutrition,Appropriations,DNPAO,Raw Milk Product Regulations,Dead,S237,Text
TX,Texas,Nutrition,Farm Direct Foods,DNPAO,An Act Appropriating Money,Enacted,H1,Text
IL,Illinois,Physical Activity,"Parks, Recreation and Trails",DNPAO,Park Zone Speed Limits,Enacted,S509,Text
NY,New York,Nutrition,Access to Healthy Foods,DNPAO,Amending the Agriculture and Markets Law,Enacted,SB2438,Text
NY,New York,Nutrition,Trans Fats,DNPAO,Prohibited Sale Or Use of Artificial Trans Fats,Dead,A8443,Text
IN,Indiana,Nutrition,Agriculture and Farming,DNPAO,Farm-to-School<br>,Dead,H1089,Text
AR,Arkansas,Physical Activity,Pedestrians/Walking,DNPAO,Game and Fish Commission Duties,Dead,HJR1007,Text
NC,North Carolina,Obesity,Appropriations,DNPAO,Sustainable Local Food Advisory Council,Enacted,S1067,Text
UT,Utah,Nutrition,Appropriations,DNPAO,Department of Agriculture Amendments,Enacted,S47,Text
TN,Tennessee,Nutrition,Appropriations,DNPAO,Food and Food Products,Dead,H51,Text
FL,Florida,Physical Activity,Physical Education Requirements,DNPAO,Health Education Requirements,Dead,S1370,Text
TX,Texas,Physical Activity,Incentives,DNPAO,Sweetened Beverages Tax,Dead,H2214,Text
NJ,New Jersey,Nutrition,Farm Direct Foods,DNPAO,Special Occasion Events Conducted on Preserved Farmland,Dead,SB2074,Text
IA,Iowa,Physical Activity,Public Safety,DNPAO,Local Option Sales Tax Urban Renewal Projects,Enacted,R7531,Text
MA,Massachusetts,Physical Activity,Safe Routes to Schools,DNPAO,Transportation System Modernization,Enacted,S2087,Text
MI,Michigan,Physical Activity,Incentives,DNPAO,Uniform Employee Health Care,Dead,H4140,Text
TX,Texas,Nutrition,Appropriations,DNPAO,School Good Health Advertising,Dead,S1528,Text
WA,Washington,Obesity,Incentives,DNPAO,Taxation,Enacted,S6143,Text
RI,Rhode Island,Obesity,Body Mass Index (BMI),DNPAO,Legislation,Enacted,S2241,Text
HI,Hawaii,Nutrition,Agriculture and Farming,DNPAO,General Excise Tax,Dead,S852,Text
TN,Tennessee,Nutrition,Access to Healthy Foods,DNPAO,Tort Liability and Reform,Enacted,H1151,Text
MA,Massachusetts,Obesity,Appropriations,DNPAO,Fiscal Year 2011 Budget,Dead,H4600,Text
VA,Virginia,Physical Activity,Physical Education Requirements,DNPAO,Physical Education Requirement,Dead,H1644,Text
ME,Maine,Nutrition,Trans Fats,DNPAO,Individual and Small Group Health Plans,Enacted,H979,Text
MS,Mississippi,Nutrition,Incentives,DNPAO,Nonprofit Organizations Sales Tax,Dead,H1441,Text
VA,Virginia,Physical Activity,Bicycling,DNPAO,Secondary Street Acceptance Requirements,Enacted,R7217,Text
MN,Minnesota,Nutrition,Media Campaigns,DNPAO,Capital Investment,Dead,H2571,Text
SD,South Dakota,Nutrition,Medical Care,DNPAO,Bicycle Passing Restrictions,Dead,S70,Text
CT,Connecticut,Obesity,Appropriations,DNPAO,Transportation Laws,Enacted,HB5527,Text
CA,California,Nutrition,Disparities/Equity,DNPAO,An Act Relating to Public  Health<br>,Dead,A2246,Text
NY,New York,Physical Activity,Task Forces/Councils,DNPAO,Task Force on Occupational Wellness,Dead,S5051,Text
RI,Rhode Island,Nutrition,Medical Care,DNPAO,Towns & Cities,Dead,S2901,Text
NM,New Mexico,Physical Activity,Appropriations,DNPAO,Small Cities Development Block Grants,Enacted,R5293,Text
KY,Kentucky,Obesity,Body Mass Index (BMI),DNPAO,An Act Relating to School Collection of Data <br>,Dead,S39,Text
MA,Massachusetts,Obesity,Appropriations,DNPAO,Livable Communities and Zoning Reform Act,Dead,S97,Text
MN,Minnesota,Obesity,Body Mass Index (BMI),DNPAO,Greenhouse Gas Emissions Reduction,Dead,H1035,Text
NY,New York,Physical Activity,Task Forces/Councils,DNPAO,Senior Benefits Card Program,Dead,A1711,Text
NY,New York,Nutrition,Farmers Markets,DNPAO,An Act to Amend the New York State Urban Development Corporation Act,Enacted,S614,Text
DC,District of Columbia,Nutrition,Disparities/Equity,DNPAO,Hospital and Medical Services Corporation,Enacted,B568,Text
HI,Hawaii,Obesity,Appropriations,DNPAO,Bicycle Safety,Dead,H37,Text
OR,Oregon,Nutrition,Breastfeeding,DNPAO,Board of Direct Entry Midwifery<br> <br><br>,Enacted,32372,Text
LA,Louisiana,Obesity,Appropriations,DNPAO,Local Traffic,Enacted,HCR42,Text
NM,New Mexico,Nutrition,Appropriations,DNPAO,Fresh Fruit in School,Dead,H386,Text
TX,Texas,Physical Activity,Task Forces/Councils,DNPAO,Public School Campus Improvement Plans,Dead,S225,Text
NC,North Carolina,Nutrition,Incentives,DNPAO,Childhood Obesity Legislative Task Force,Dead,H218,Text
MA,Massachusetts,Physical Activity,Public Transportation,DNPAO,Livable Communities,Dead,S96,Text
MN,Minnesota,Nutrition,Agriculture and Farming,DNPAO,Appropriations,Dead,S1779,Text
CT,Connecticut,Physical Activity,Public Transportation,DNPAO,Municipal Revenue Diversification,Dead,H6561,Text
TX,Texas,Nutrition,Appropriations,DNPAO,Beverage Tax Imposition,Dead,S1004,Text
RI,Rhode Island,Physical Activity,Disabilities,DNPAO,Motor and Other Vehicles,Dead,H5096,Text
MT,Montana,Nutrition,Access to Healthy Foods,DNPAO,Regulation of Retail Food Establishment Exemptions,Enacted,H191,Text
MA,Massachusetts,Nutrition,Farmers Markets,DNPAO,Liability of Farmer Markets,Dead,H2840,Text
NC,North Carolina,Nutrition,Incentives,DNPAO,Technical Assistance Healthy Lifestyle,Dead,H1467,Text
LA,Louisiana,Nutrition,Appropriations,DNPAO,State Sales and Use Tax,Enacted,S82,Text
NJ,New Jersey,Physical Activity,Public Safety,DNPAO,Playground Safety Subcode,Enacted,R19567,Text
MD,Maryland,Physical Activity,Appropriations,DNPAO,Sustainable Communities Tax Credit Certifications,Enacted,R10197,Text
CA,California,Nutrition,Nutrition Standards,DNPAO,Crime Prevention and Corrections,Enacted,20920,Text
FL,Florida,Obesity,Food Restrictions,DNPAO,Reducing and Streamlining Regulations,Dead,H5007,Text
CA,California,Obesity,Appropriations,DNPAO,Agriculture: Victory Garden Growers,Dead,S362,Text
WA,Washington,Physical Activity,Public Transportation,DNPAO,Funds for State Ferry System,Dead,S5698,Text
HI,Hawaii,Nutrition,Vending,DNPAO,Tax Credits,Dead,S800,Text
MA,Massachusetts,Obesity,Appropriations,DNPAO,Land Use and Community Housing Development,Dead,S2482,Text
KS,Kansas,Nutrition,School Nutrition,DNPAO,Obesity Prevention Council,Dead,H2255,Text
NY,New York,Nutrition,Farmers Markets,DNPAO,"Education, Labor and Family Assistance Budget",Enacted,A153,Text
WA,Washington,Nutrition,Appropriations,DNPAO,Annual School Reporting,Dead,H1632,Text
NC,North Carolina,Nutrition,Agriculture and Farming,DNPAO,Department of Health and Human Services,Dead,S1288,Text
IL,Illinois,Obesity,Menu Labeling,DNPAO,Innovation Development and Economy Act,Enacted,S1712,Text
DE,Delaware,Obesity,Media Campaigns,DNPAO,Nutrition Information,Dead,S81,Text
WI,Wisconsin,Obesity,Appropriations,DNPAO,Local Tax Districts,Dead,A963,Text
IN,Indiana,Nutrition,Food Assistance Programs,DNPAO,Fresh food initiative; food desert grant and loan program<br>,Enacted,SEA15,Text
VA,Virginia,Nutrition,Farmers Markets,DNPAO,Local Restrictions on Farm Businesses,Dead,S348,Text
CA,California,Nutrition,Fruits and Vegetables,DNPAO,Budget Act of 2009,Dead,A105,Text
MI,Michigan,Nutrition,Food Assistance Programs,DNPAO,Community Health,Dead,S299,Text
MN,Minnesota,Obesity,Appropriations,DNPAO,Health,Dead,H905,Text
RI,Rhode Island,Physical Activity,Built Environment and Street-Scale Design,DNPAO,Motor and Other Vehicles,Dead,H5914,Text
HI,Hawaii,Nutrition,School Nutrition,DNPAO,Homeless Assistance,Dead,HR85,Text
WA,Washington,Physical Activity,Public Transportation,DNPAO,Cost of Ferry System,Enacted,H3209,Text
HI,Hawaii,Physical Activity,Incentives,DNPAO,Medicaid,Dead,H569,Text
MA,Massachusetts,Nutrition,Task Forces/Councils,DNPAO,Barnstable County,Dead,H4138,Text
DE,Delaware,Obesity,Disparities/Equity,DNPAO,Physical Activity,Enacted,H471,Text
NY,New York,Physical Activity,Task Forces/Councils,DNPAO,Physical Education/Activity Pilot,Introduced,SB2490,Text
WI,Wisconsin,Obesity,Appropriations,DNPAO,Food Processing Plants,Enacted,R21476,Text
LA,Louisiana,Nutrition,Food Assistance Programs,DNPAO,Insurance and Tobacco or Weight,Dead,H272,Text
VA,Virginia,Obesity,Appropriations,DNPAO,Purchase of State Grown Food Products,Dead,S1090,Text
GA,Georgia,Obesity,Appropriations,DNPAO,Motor Vehicles,Enacted,S196,Text
UT,Utah,Nutrition,Farm Direct Foods,DNPAO,Farmers Market Exemptions,Enacted,H145,Text
MD,Maryland,Nutrition,Incentives,DNPAO,Maryland Combating Childhood Obesity Grant Program,Dead,S829,Text
NY,New York,Nutrition,Media Campaigns,DNPAO,Department of Health,Dead,A217,Text
HI,Hawaii,Nutrition,Appropriations,DNPAO,Nutritious Meal Programs,Dead,SCR181,Text
NY,New York,Obesity,Menu Labeling,DNPAO,Trans fat reduction; Menu Labeling; breastfeeding rights; BMI in schools; PE/PA requirements; Bicycle parking,Introduced,SB1668,Text
IL,Illinois,Obesity,Appropriations,DNPAO,Food Handling Regulation Enforcement,Enacted,S1852,Text
CA,California,Nutrition,Medical Care,DNPAO,Transportation,Enacted,S734,Text
TX,Texas,Nutrition,Food Security,DNPAO,An Act Appropriating Money,Enacted,H1,Text
MT,Montana,Obesity,Food Restrictions,DNPAO,Tax Incentive for Producers,Dead,D964,Text
VT,Vermont,Nutrition,Access to Healthy Foods,DNPAO,Agriculture Economic Development,Dead,S99,Text
VA,Virginia,Physical Activity,Built Environment and Street-Scale Design,DNPAO,Traffic Lights,Dead,H1991,Text
NC,North Carolina,Obesity,Portion Size,DNPAO,Commonsense Consumption Act,Enacted,HB683,Text
MS,Mississippi,Physical Activity,Physical Activity Requirements,DNPAO,Kindergarten Guidelines 2012<br>,Enacted,13581,Text
GA,Georgia,Nutrition,Agriculture and Farming,DNPAO,State Fiscal Year Appropriations,Enacted,H947,Text
NY,New York,Nutrition,Trans Fats,DNPAO,An Act to Amend Public Health Law <br>,Dead,S7229,Text
NC,North Carolina,Physical Activity,Bicycling,DNPAO,Active Living Plan Grants,Dead,H1469,Text
HI,Hawaii,Nutrition,Appropriations,DNPAO,Statewide Plan to Implement Waste of Milk,Dead,HR14,Text
AR,Arkansas,Nutrition,Food Assistance Programs,DNPAO,Social Services Block Grant Pre-Expenditure Report,Enacted,R5725,Text
FL,Florida,Physical Activity,Pedestrians/Walking,DNPAO,Growth Management,Dead,S1512,Text
TX,Texas,Physical Activity,Physical Education Requirements,DNPAO,School Physical Education,Dead,S1525,Text
NY,New York,Physical Activity,Physical Education Requirements,DNPAO,An Act to Amend the Education Law (Senate),Introduced,SB2437,Text
NY,New York,Nutrition,Access to Healthy Foods,DNPAO,An Act Making Appropriations for the Support of  Government<br>,Enacted,A9760,Text
RI,Rhode Island,Physical Activity,Incentives,DNPAO,An Act Relating to Taxation,Introduced,SB751,Text
NY,New York,Physical Activity,Physical Education Requirements,DNPAO,Relates to Obesity Prevention<br>,Dead,S6423,Text
IL,Illinois,Nutrition,Food Assistance Programs,DNPAO,Food Stamp Benefits,Dead,H6137,Text
IA,Iowa,Physical Activity,Built Environment and Street-Scale Design,DNPAO,Law Enforcement,Dead,HSB603,Text
MI,Michigan,Obesity,Appropriations,DNPAO,Vacant Land,Dead,H4632,Text
NY,New York,Nutrition,Farmers Markets,DNPAO,Funding for Construction of Regional Farmers Markets,Dead,A6427,Text
NM,New Mexico,Nutrition,Media Campaigns,DNPAO,Nutrition Council,Dead,S400,Text
MN,Minnesota,Nutrition,Agriculture and Farming,DNPAO,Agriculture,Dead,S1507,Text
NH,New Hampshire,Nutrition,Agriculture and Farming,DNPAO,An Act Establishing a Committee<br>,Enacted,H1211,Text
VT,Vermont,Nutrition,Farm Direct Foods,DNPAO,Sugar-Sweetened Beverages,Dead,H151,Text
ME,Maine,Nutrition,Access to Healthy Foods,DNPAO,Electronic Benefits Transfers and Farmers Markets,Dead,S227,Text
AL,Alabama,Nutrition,Liability and Indemnity,DNPAO,Government Appropriations,Dead,H379,Text
DE,Delaware,Nutrition,Media Campaigns,DNPAO,Nutrition Information,Dead,S81,Text
MO,Missouri,Physical Activity,Built Environment and Street-Scale Design,DNPAO,Complete Streets Policies,Enacted,HCR23,Text
MN,Minnesota,Physical Activity,Pedestrians/Walking,DNPAO,Capital Improvements,Dead,S1352,Text
DE,Delaware,Nutrition,Farm Direct Foods,DNPAO,Roadside Stands,Enacted,H187,Text
IL,Illinois,Obesity,Food Restrictions,DNPAO,Fresh Produce in Schools,Enacted,S615,Text
NY,New York,Nutrition,Farmers Markets,DNPAO,An Act to Amend the Agriculture and Market Law,Introduced,AB7572,Text
OH,Ohio,Obesity,Body Mass Index (BMI),DNPAO,"Wellness, Disease Management, Transparency",Enacted,R16199,Text
MD,Maryland,Physical Activity,Bicycling,DNPAO,Rules of the Road,Enacted,S51,Text
OK,Oklahoma,Obesity,Appropriations,DNPAO,Public Health And Safety,Enacted,H2774,Text
OK,Oklahoma,Obesity,Appropriations,DNPAO,Motor Vehicles,Enacted,SB1473,Text
RI,Rhode Island,Nutrition,Medical Care,DNPAO,Towns & Cities,Dead,H8269,Text
CA,California,Physical Activity,Pedestrians/Walking,DNPAO,Budget Act of 2009: Revisions,Dead,A10c,Text
NY,New York,Nutrition,Farm Direct Foods,DNPAO,An Act to Amend the Agriculture and Markets Law,Introduced,SB2332,Text
NY,New York,Nutrition,Farmers Markets,DNPAO,"An Act to Amend the Agriculture and Markets Law, and the Education Law<br>",Enacted,S4886,Text
VA,Virginia,Physical Activity,Physical Education Requirements,DNPAO,Public Schools,Dead,S934,Text
FL,Florida,Obesity,Health Insurance Coverage,DNPAO,State Employees Health Insurance Benefits,Dead,S7096,Text
KS,Kansas,Physical Activity,Built Environment and Street-Scale Design,DNPAO,Bicycle Traffic Laws,Dead,H2174,Text
AR,Arkansas,Nutrition,Appropriations,DNPAO,Appropriation to the Department of Career Education,Enacted,S373,Text
TN,Tennessee,Physical Activity,Pedestrians/Walking,DNPAO,Recreational Areas,Dead,S2022,Text
HI,Hawaii,Nutrition,Fruits and Vegetables,DNPAO,An Act Related to Hawaii-grown Produce,Dead,H2245,Text
KY,Kentucky,Nutrition,Nutrition Standards,DNPAO,Legislative Task Force on Childhood Obesity,Enacted,HCR13,Text
NV,Nevada,Obesity,Appropriations,DNPAO,Redevelopment Agencies,Enacted,S92,Text
NY,New York,Nutrition,Medical Care,DNPAO,Parking in a Bicycle Lane,Dead,A1825,Text
NY,New York,Obesity,Food Restrictions,DNPAO,Urban and Regional Farmers Markets Facilities,Dead,S4019,Text
MD,Maryland,Nutrition,Agriculture and Farming,DNPAO,Poultry and Rabbits,Dead,S912,Text
NY,New York,Nutrition,Farm Direct Foods,DNPAO,New York State Healthy Kids Act,Dead,A8250,Text
HI,Hawaii,Nutrition,Appropriations,DNPAO,Vertical Farms,Dead,SCR33,Text
PA,Pennsylvania,Physical Activity,Bicycling,DNPAO,House Resolution,Enacted,HR203,Text
MN,Minnesota,Physical Activity,School Siting,DNPAO,Environment,Dead,S549,Text
SC,South Carolina,Obesity,Appropriations,DNPAO,Student Snack Food Consumption,Dead,S227,Text
MS,Mississippi,Nutrition,Access to Healthy Foods,DNPAO,Nonprofit Organizations Sales Tax,Dead,H1441,Text
MA,Massachusetts,Obesity,Appropriations,DNPAO,Regulation of Bottled Water,Dead,H1019,Text
GA,Georgia,Physical Activity,Access to Recreational Opportunities,DNPAO,An Act Related to Torts<br>,Dead,S484,Text
WV,West Virginia,Nutrition,Appropriations,DNPAO,Food Council,Dead,HCR69,Text
KY,Kentucky,Obesity,Appropriations,DNPAO,Swimming Pool Safety,Dead,H258,Text
MO,Missouri,Obesity,Health Insurance Coverage,DNPAO,"PPO 300 Plan, HDHP, Copay, and HMO Plan Limitations",Enacted,R19165,Text
TX,Texas,Nutrition,Food Policy Councils,DNPAO,Healthy Foods Availability,Enacted,S343,Text
NV,Nevada,Obesity,Appropriations,DNPAO,Redevelopment Agencies,Enacted,S92,Text
UT,Utah,Physical Activity,Appropriations,DNPAO,Short Title - State Agency and Higher Education,Enacted,S6,Text
WV,West Virginia,Physical Activity,Pedestrians/Walking,DNPAO,Planning and Development of State Roads,Dead,H2917,Text
HI,Hawaii,Nutrition,Healthier Food Retail and Food Deserts,DNPAO,Taxation,Dead,S1179,Text
NC,North Carolina,Nutrition,Appropriations,DNPAO,Childhood Obesity Legislative Task Force,Dead,S242,Text
OH,Ohio,Nutrition,Farm Direct Foods,DNPAO,Livestock Care Standards Board,Enacted,SJR6,Text
NY,New York,Obesity,Food Restrictions,DNPAO,Local Produce Tax Credit,Dead,A7509,Text
MN,Minnesota,Nutrition,Agriculture and Farming,DNPAO,Agriculture,Dead,H1886,Text
DC,District of Columbia,Physical Activity,Pedestrians/Walking,DNPAO,Union Station North District Establishment,Enacted,R1559,Text
VA,Virginia,Nutrition,Food Assistance Programs,DNPAO,Budget Bill,Dead,S850,Text
WA,Washington,Obesity,Appropriations,DNPAO,Fiscal Reform,Dead,H3070,Text
DC,District of Columbia,Obesity,Menu Labeling,DNPAO,Grocery Store Terms and Conditions,Dead,B22,Text
CA,California,Nutrition,Healthier Food Retail and Food Deserts,DNPAO,Taxation: Sweetened Beverages: Pediatric Obesity Fund,Dead,A2100,Text
CT,Connecticut,Obesity,Menu Labeling,DNPAO,Growth and State Planning,Dead,H6469,Text
NY,New York,Obesity,Appropriations,DNPAO,Contract With Neighborhood Preservation Company,Dead,S5258,Text
RI,Rhode Island,Obesity,Incentives,DNPAO,Taxation,Dead,S2779,Text
MN,Minnesota,Obesity,Appropriations,DNPAO,Agriculture,Dead,H1511,Text
IL,Illinois,Nutrition,School Nutrition,DNPAO,Chicago School District Article of the School Code,Dead,S1850,Text
TX,Texas,Nutrition,Trans Fats,DNPAO,Supplemental Nutrition Assistance Program,Dead,H3451,Text
DC,District of Columbia,Physical Activity,Task Forces/Councils,DNPAO,An Act Concerning Wellness,Dead,B34,Text
NY,New York,Nutrition,Appropriations,DNPAO,Additional Taxes,Dead,A2455,Text
MI,Michigan,Nutrition,Correctional Facilities Farms Programs,DNPAO,An Act Relating to Inmate Labor<br>,Enacted,H5658,Text
MO,Missouri,Nutrition,Medical Care,DNPAO,Affirmative Defense,Enacted,S368,Text
FL,Florida,Nutrition,School Nutrition,DNPAO,Healthy Lifestyles,Enacted,S1324,Text
FL,Florida,Obesity,Appropriations,DNPAO,Energy,Enacted,H7135,Text
MS,Mississippi,Nutrition,Appropriations,DNPAO,Health and Human Services Agencies,Dead,H955,Text
OK,Oklahoma,Obesity,Menu Labeling,DNPAO,License Discounts For Healthy Restaurants,Dead,S677,Text
HI,Hawaii,Nutrition,Healthier Food Retail and Food Deserts,DNPAO,General Excise Taxes on Snack Foods,Dead,S2239,Text
NJ,New Jersey,Obesity,Appropriations,DNPAO,Revenue Allocation District Financing,Dead,S2299,Text
NY,New York,Obesity,Appropriations,DNPAO,Peconic Bay Region,Dead,A528,Text
CO,Colorado,Nutrition,Initiatives and Programs,DNPAO,Family Child Care Homes,Enacted,R10245,Text
OK,Oklahoma,Nutrition,Farm Direct Foods,DNPAO,Public Health And Safety,Enacted,H2774,Text
HI,Hawaii,Obesity,Appropriations,DNPAO,State Nutrition,Dead,HR236,Text
MI,Michigan,Nutrition,Food Assistance Programs,DNPAO,Uniform Health Coverage Plan,Dead,H6586,Text
WV,West Virginia,Nutrition,Medical Care,DNPAO,Pedestrian And Transit Ways,Dead,H2917,Text
MA,Massachusetts,Nutrition,Initiatives and Programs,DNPAO,An Act Making Appropriations,Enacted,H5300,Text
HI,Hawaii,Nutrition,Food Security,DNPAO,An Act Relating to Sustainability,Dead,S2512,Text
ME,Maine,Physical Activity,Pedestrians/Walking,DNPAO,Recreational Development Funds,Enacted,H416,Text
OH,Ohio,Nutrition,Healthier Food Retail and Food Deserts,DNPAO,Standards for Vending Machine Foods in Schools,Dead,S24,Text
DC,District of Columbia,Obesity,Disparities/Equity,DNPAO,Hospital and Medical Services Corporation,Enacted,B568,Text
CA,California,Physical Activity,Appropriations,DNPAO,Budget Act of 2011,Dead,A92,Text
TX,Texas,Nutrition,Access to Healthy Foods,DNPAO,Trans Fat Restrictions on School Districts,Dead,H3467,Text
VA,Virginia,Physical Activity,Task Forces/Councils,DNPAO,Statewide Pedestrian Plan,Enacted,SB393,Text
MO,Missouri,Nutrition,Farm Direct Foods,DNPAO,Farm to Table Advisory Board,Dead,H830,Text
HI,Hawaii,Obesity,Appropriations,DNPAO,School Gardens,Dead,HR113,Text
DC,District of Columbia,Obesity,Appropriations,DNPAO,Contract Approval and Payment Authorization,Enacted,B106,Text
KY,Kentucky,Obesity,Initiatives and Programs,DNPAO,Healthy Lifestyles<br>,Dead,H549,Text
MD,Maryland,Nutrition,Disparities/Equity,DNPAO,Maryland Food and Nutrition Policy Council,Dead,H441,Text
TX,Texas,Physical Activity,Public Safety,DNPAO,Gulfton Area Municipal Management District,Enacted,H3828,Text
TX,Texas,Physical Activity,Public Transportation,DNPAO,2011 Housing Tax Credit Program,Enacted,R19257,Text
MO,Missouri,Nutrition,Access to Healthy Foods,DNPAO,Farm to Table Advisory Board,Dead,H830,Text
HI,Hawaii,Nutrition,Appropriations,DNPAO,Department of Education,Dead,H198,Text
CA,California,Physical Activity,Bicycling,DNPAO,Transportation Finance: Highway Users Tax Account,Dead,A30d,Text
LA,Louisiana,Nutrition,Agriculture and Farming,DNPAO,Rural Development,Enacted,HCR173,Text
NM,New Mexico,Obesity,Appropriations,DNPAO,Application/Grant Assistance Procedures,Enacted,R5499,Text
HI,Hawaii,Nutrition,Access to Healthy Foods,DNPAO,Child Nutrition Programs,Enacted,HCR167,Text
CT,Connecticut,Nutrition,Agriculture and Farming,DNPAO,Community Investment Account,Enacted,H6262,Text
CA,California,Nutrition,Task Forces/Councils,DNPAO,School Instructional Gardens: Pupil Nutrition,Enacted,A1535,Text
SC,South Carolina,Nutrition,Appropriations,DNPAO,Insurance Trade Practices,Dead,S316,Text
OK,Oklahoma,Nutrition,Access to Healthy Foods,DNPAO,Healthy Communities,Dead,S1818,Text
LA,Louisiana,Nutrition,Access to Healthy Foods,DNPAO,Resolution to create a task force to study food deserts,Enacted,HCR205,Text
VT,Vermont,Nutrition,Food Assistance Programs,DNPAO,Unified Health Systems,Enacted,H202,Text
NV,Nevada,Obesity,Front of Package Labeling,DNPAO,Use of Athletic Fields for Youth Sports,Enacted,A227,Text
OR,Oregon,Nutrition,Appropriations,DNPAO,State Farm and Garden Programs in Schools,Enacted,H3601a,Text
NH,New Hampshire,Nutrition,Appropriations,DNPAO,Poultry Sales,Dead,LSR87,Text
MS,Mississippi,Obesity,Appropriations,DNPAO,Mississippi Major Economic Impact,Dead,H683,Text
WA,Washington,Nutrition,Appropriations,DNPAO,Appropriations,Enacted,H1244,Text
LA,Louisiana,Nutrition,Initiatives and Programs,DNPAO,House  Resolution<br>,Enacted,HR43,Text
MN,Minnesota,Nutrition,Appropriations,DNPAO,Taxation,Dead,S2781,Text
MS,Mississippi,Nutrition,Agriculture and Farming,DNPAO,Appropriation,Enacted,H63b,Text
WA,Washington,Physical Activity,Public Transportation,DNPAO,Statewide Transportation System,Dead,H2908,Text
MT,Montana,Obesity,Food Restrictions,DNPAO,Appropriations by Budget Amendment,Dead,D121,Text
TX,Texas,Nutrition,Nutrition Standards,DNPAO,Sweetened Beverages Tax,Dead,H2214,Text
CT,Connecticut,Obesity,Appropriations,DNPAO,Human Services Technical Corrections,Enacted,S851,Text
NY,New York,Nutrition,Appropriations,DNPAO,Advisory Committee on Public Wellness,Dead,S8186,Text
MA,Massachusetts,Physical Activity,"Parks, Recreation and Trails",DNPAO,River Access Commission,Dead,S394,Text
GA,Georgia,Obesity,Sugar Sweetened Beverages,DNPAO,Group Day Care Homes,Enacted,R5327,Text
MN,Minnesota,Nutrition,Liability and Indemnity,DNPAO,Capital Investment,Dead,S679,Text
NM,New Mexico,Nutrition,School Nutrition,DNPAO,NUTRITION AND WELLNESS,Enacted,6296,Text
NC,North Carolina,Nutrition,Agriculture and Farming,DNPAO,Appropriations Act of 2007,Enacted,H2437,Text
TX,Texas,Nutrition,Farm Direct Foods,DNPAO,Raw Milk Product Regulations,Dead,S237,Text
WA,Washington,Nutrition,School Nutrition,DNPAO,Foods And Beverages Sold At Public Schools,Enacted,SB5436,Text
UT,Utah,Physical Activity,Built Environment and Street-Scale Design,DNPAO,Cycling Laws on Roadway,Dead,H155,Text
IL,Illinois,Nutrition,Appropriations,DNPAO,School Wellness Policy,Enacted,S162,Text
WV,West Virginia,Nutrition,Medical Care,DNPAO,State Excess Lottery Revenue Fund,Dead,H3264,Text
MI,Michigan,Obesity,Health Insurance Coverage,DNPAO,Group Wellness Coverage,Enacted,S848,Text
DC,District of Columbia,Nutrition,Access to Healthy Foods,DNPAO,Approval and Payment Authorization,Enacted,R83,Text
WY,Wyoming,Obesity,Task Forces/Councils,DNPAO,Healthy Food Initiative Act,Dead,H194,Text
DC,District of Columbia,Nutrition,Farmers Markets,DNPAO,Budget Support Congressional Review,Enacted,B583,Text
MN,Minnesota,Obesity,Appropriations,DNPAO,Capital Improvements,Dead,H1292,Text
TN,Tennessee,Nutrition,Appropriations,DNPAO,Taxes,Dead,H897,Text
WV,West Virginia,Obesity,Food Restrictions,DNPAO,Budget Bill,Dead,S150,Text
NY,New York,Nutrition,Farm Direct Foods,DNPAO,School Food Regulations,Dead,A2969,Text
CA,California,Physical Activity,Physical Education Requirements,DNPAO,An Act Addressing Education: Physical Education<br>,Enacted,A1793,Text
CA,California,Obesity,Appropriations,DNPAO,Local Planning: Transit Village Development Districts,Dead,A485,Text
IL,Illinois,Obesity,Disparities/Equity,DNPAO,Amends the Personnel Code,Dead,H3779,Text
MI,Michigan,Obesity,Body Mass Index (BMI),DNPAO,Transit Facilities,Enacted,H5998,Text
WA,Washington,Physical Activity,Safe Routes to Schools,DNPAO,Additive Transportation Funding,Dead,S5925,Text
NY,New York,Physical Activity,Disparities/Equity,DNPAO,Advisory Committee on Public Wellness,Dead,S8186,Text
NY,New York,Physical Activity,Access to Recreational Opportunities,DNPAO,Use of School Facilities,Dead,A5354,Text
CA,California,Nutrition,Fruits and Vegetables,DNPAO,"Agriculture: Fruits, Nuts, Vegetables: State Grown Act",Dead,A1960,Text
WA,Washington,Physical Activity,Built Environment and Street-Scale Design,DNPAO,Local Electric Carts,Dead,H2588,Text
NC,North Carolina,Nutrition,Farmers Markets,DNPAO,Department of Health and Human Services,Dead,S1288,Text
MN,Minnesota,Physical Activity,Public Safety,DNPAO,Capital Improvements,Dead,H2893,Text
