LocationAbbr,LocationDesc,HealthTopic,PolicyTopic,DataSource,Title,Status,Citation,DataType
HI,Hawaii,Nutrition,School Nutrition,DNPAO,Healthy Lifestyle Education,Dead,HCR120,Text
MA,Massachusetts,Nutrition,Appropriations,DNPAO,Student Nutrition and Wellness,Dead,HD1736,Text
NY,New York,Nutrition,Breastfeeding,DNPAO,Trans fat reduction; Menu Labeling; breastfeeding rights; BMI in schools; PE/PA requirements; Bicycle parking,Introduced,SB1668,Text
WI,Wisconsin,Obesity,Menu Labeling,DNPAO,Tax Incremental Financing Districts,Dead,S55,Text
DC,District of Columbia,Nutrition,Liability and Indemnity,DNPAO,Budget Support Act,Enacted,B19203,Text
ME,Maine,Nutrition,Agriculture and Farming,DNPAO,Local Food Production,Dead,LR809,Text
HI,Hawaii,Nutrition,Appropriations,DNPAO,Beginning Farmer Assessment Task Force,Dead,H212,Text
GA,Georgia,Nutrition,Food Security,DNPAO,Food Service Establishments,Enacted,H1303,Text
CT,Connecticut,Nutrition,Access to Healthy Foods,DNPAO,Healthy School Food and Beverages,Enacted,S373,Text
MT,Montana,Obesity,Health Insurance Coverage,DNPAO,Healthy Choices by Medicaid Recipients,Dead,D2115,Text
NY,New York,Nutrition,Task Forces/Councils,DNPAO,Omnibus Obesity and Respiratory Illness Reduction Act,Introduced,AB5322,Text
CA,California,Obesity,Health Insurance Coverage,DNPAO,Education: Physical Education,Dead,A2705,Text
CO,Colorado,Nutrition,Appropriations,DNPAO,Increased Payments to The State,Dead,S73,Text
HI,Hawaii,Physical Activity,Disabilities,DNPAO,Eleventh Senatorial District,Dead,S1027,Text
VA,Virginia,Obesity,Appropriations,DNPAO,Uniform Statewide Building Code,Dead,H2045,Text
VT,Vermont,Nutrition,Agriculture and Farming,DNPAO,Economic Development,Dead,H231,Text
WA,Washington,Physical Activity,Pedestrians/Walking,DNPAO,Speed Violations,Dead,S5712,Text
ME,Maine,Nutrition,Access to Healthy Foods,DNPAO,Farm and Fish to School Program,Enacted,H1060,Text
DC,District of Columbia,Nutrition,Appropriations,DNPAO,Budget Support Act,Enacted,B19203,Text
RI,Rhode Island,Nutrition,Appropriations,DNPAO,Seafood Marketing,Enacted,H6259,Text
NY,New York,Nutrition,Food Assistance Programs,DNPAO,Health and Mental Hygiene Budget<br>,Enacted,S2104,Text
TX,Texas,Nutrition,Medical Care,DNPAO,Transportation Commission,Dead,S513,Text
CA,California,Obesity,Appropriations,DNPAO,Schools and Local Public Safety Protection Act,Dead,SCA1a,Text
TX,Texas,Obesity,Appropriations,DNPAO,School District Assess the Physical Fitness of Students,Dead,H3007,Text
NY,New York,Nutrition,Appropriations,DNPAO,Cooperative Agreements for Personnel Services,Dead,A6079,Text
MN,Minnesota,Physical Activity,Bicycling,DNPAO,Taxation,Dead,S1445,Text
NM,New Mexico,Nutrition,Healthier Food Retail and Food Deserts,DNPAO,School Meal Nutrition Rules,Enacted,H61,Text
AR,Arkansas,Physical Activity,Task Forces/Councils,DNPAO,Health and Safety of Students in Public School,Enacted,H1743,Text
KY,Kentucky,Physical Activity,Physical Activity Requirements,DNPAO,Legislative Task Force on Childhood Obesity,Enacted,HCR13,Text
MI,Michigan,Nutrition,Farmers Markets,DNPAO,Downtown Development Authorities,Dead,H4084,Text
HI,Hawaii,Physical Activity,Public Transportation,DNPAO,Mauka Area Rules<br>,Enacted,1367,Text
MA,Massachusetts,Obesity,Sugar Sweetened Beverages,DNPAO,Sweetened Snack Subsidy,Dead,HD1994,Text
MN,Minnesota,Nutrition,Access to Healthy Foods,DNPAO,An Act Relating to Public Safety  <br>,Dead,S2001,Text
MN,Minnesota,Physical Activity,Built Environment and Street-Scale Design,DNPAO,Traffic Regulations,Enacted,H2616,Text
MA,Massachusetts,Nutrition,Task Forces/Councils,DNPAO,Health of Group Insurance Commission Population,Dead,S1180,Text
NY,New York,Nutrition,Access to Healthy Foods,DNPAO,State Farm Grown Products,Dead,A6408,Text
OR,Oregon,Nutrition,Access to Healthy Foods,DNPAO,Supplemental Assistance to Purchase Food Directly from Farmers,Enacted,HB2992,Text
TX,Texas,Obesity,Appropriations,DNPAO,Specialty License Plates,Dead,H1834,Text
RI,Rhode Island,Nutrition,Appropriations,DNPAO,State Affairs and Government,Dead,S2428,Text
LA,Louisiana,Nutrition,Farmers Markets,DNPAO,An Act Making Appropriations <br>,Enacted,H1,Text
MO,Missouri,Obesity,Food Restrictions,DNPAO,Farm to Table Advisory Board,Dead,S162,Text
FL,Florida,Obesity,Menu Labeling,DNPAO,Statewide Legacy Communities Initiative,Dead,H1253,Text
CA,California,Physical Activity,Public Safety,DNPAO,Fremont Redevelopment Agency,Dead,A14,Text
MI,Michigan,Obesity,Appropriations,DNPAO,Brownfield Redevelopment,Enacted,H5566,Text
HI,Hawaii,Obesity,Food Restrictions,DNPAO,School Lunches and Local Produce,Dead,S813,Text
FL,Florida,Physical Activity,Built Environment and Street-Scale Design,DNPAO,Neighborhoods Improvement Act,Dead,S1010,Text
NC,North Carolina,Physical Activity,"Parks, Recreation and Trails",DNPAO,Appropriations Act of 2007,Enacted,H2437,Text
IL,Illinois,Physical Activity,Public Safety,DNPAO,Crosswalk Right of Way,Enacted,S441,Text
MA,Massachusetts,Physical Activity,Public Safety,DNPAO,Development of Underused State Owned Real Property,Dead,H2987,Text
MD,Maryland,Obesity,Appropriations,DNPAO,Public School,Dead,H1062,Text
CA,California,Physical Activity,Public Transportation,DNPAO,Administration of Transportation Funds,Enacted,A216,Text
NJ,New Jersey,Obesity,Menu Labeling,DNPAO,Qualification for Redevelopment Authority Financing,Vetoed,S1794,Text
MA,Massachusetts,Obesity,Body Mass Index (BMI),DNPAO,Environmental and Health Impact Reports,Dead,H1157,Text
ME,Maine,Physical Activity,Public Transportation,DNPAO,Transit Oriented Development Districts,Enacted,S511,Text
KY,Kentucky,Nutrition,Trans Fats,DNPAO,Health and Nutrition in Schools,Enacted,S172,Text
OR,Oregon,Nutrition,Appropriations,DNPAO,Senior Farm Direct Nutrition Program,Enacted,R30719,Text
MN,Minnesota,Physical Activity,Bicycling,DNPAO,Natural Resources,Dead,S450,Text
MS,Mississippi,Obesity,Body Mass Index (BMI),DNPAO,An Act Concerning Body Mass Index Measuring<br>,Dead,H221,Text
ME,Maine,Nutrition,Appropriations,DNPAO,Breast Feeding Exemption From Jury Duty,Dead,H231,Text
MO,Missouri,Nutrition,Farm Direct Foods,DNPAO,Farm to Table Advisory Board,Dead,H830,Text
AK,Alaska,Obesity,Health Insurance Coverage,DNPAO,Insurance,Enacted,H175,Text
VA,Virginia,Physical Activity,Bicycling,DNPAO,Operation of Bicycles Regulations,Dead,S1234,Text
MN,Minnesota,Physical Activity,Appropriations,DNPAO,Capital Improvements,Dead,H259,Text
ME,Maine,Nutrition,Fruits and Vegetables,DNPAO,Blueberry Industry,Dead,LR1421,Text
TN,Tennessee,Physical Activity,Built Environment and Street-Scale Design,DNPAO,Traffic Safety,Dead,H3131,Text
HI,Hawaii,Obesity,Appropriations,DNPAO,Hawaii Agricultural Products,Enacted,HCR298,Text
WY,Wyoming,Obesity,Food Restrictions,DNPAO,Healthy Food Initiative Act,Dead,H194,Text
OK,Oklahoma,Nutrition,Incentives,DNPAO,Schools,Dead,H1634,Text
WA,Washington,Nutrition,Agriculture and Farming,DNPAO,Local Farms and Healthy Kids and Communities,Enacted,S6483,Text
RI,Rhode Island,Nutrition,Appropriations,DNPAO,Education,Dead,S173,Text
WI,Wisconsin,Nutrition,Breastfeeding,DNPAO,Public Breast Feeding,Enacted,A57,Text
CA,California,Nutrition,Farm Direct Foods,DNPAO,State Property: Vending Machines,Enacted,S441,Text
NY,New York,Obesity,Food Restrictions,DNPAO,State Budget,Enacted,A159,Text
NC,North Carolina,Nutrition,Vending,DNPAO,School Vending Machines,Dead,H899,Text
WA,Washington,Physical Activity,"Parks, Recreation and Trails",DNPAO,Statewide Transportation Planning,Dead,S5128,Text
NH,New Hampshire,Obesity,Appropriations,DNPAO,Transportation Policy,Dead,S316,Text
NJ,New Jersey,Obesity,Body Mass Index (BMI),DNPAO,Body Mass Index Screenings<br>,Dead,S1111,Text
TN,Tennessee,Obesity,Menu Labeling,DNPAO,Industrial Development,Enacted,S1334,Text
ID,Idaho,Nutrition,Media Campaigns,DNPAO,Rules of the Preferred Promotion Program,Enacted,R8145,Text
AR,Arkansas,Nutrition,Agriculture and Farming,DNPAO,"LOCAL FOOD, FARMS, AND JOBS ACT <br>",Enacted,HB1839,Text
NY,New York,Nutrition,Appropriations,DNPAO,State Fiscal Year 2011-2012 Funding,Dead,A4010,Text
WA,Washington,Nutrition,Incentives,DNPAO,Property Tax Exemption,Enacted,H2402,Text
NY,New York,Obesity,Task Forces/Councils,DNPAO,Trans fat reduction; Menu Labeling; breastfeeding rights; BMI in schools; PE/PA requirements; Bicycle parking,Introduced,SB1668,Text
TX,Texas,Nutrition,Agriculture and Farming,DNPAO,Farm to School Coordination Task Force,Dead,H1840,Text
AZ,Arizona,Obesity,Liability and Indemnity,DNPAO,State Employee Health Insurance,Dead,H2514,Text
IL,Illinois,Nutrition,Access to Healthy Foods,DNPAO,Flavored Milk in School Lunch Program,Dead,H1566,Text
WI,Wisconsin,Physical Activity,Initiatives and Programs,DNPAO,An Act Relating to Income and Franchise Tax Credit for Workplace Wellness Programs<br><br>,Dead,A220,Text
NY,New York,Nutrition,Access to Healthy Foods,DNPAO,Buy From the Backyard Act,Dead,SB978,Text
GA,Georgia,Nutrition,Agriculture and Farming,DNPAO,Farm to School Programs,Enacted,SR508,Text
IL,Illinois,Physical Activity,Pedestrians/Walking,DNPAO,Safe Routes to School Construction Program,Enacted,H744,Text
WA,Washington,Physical Activity,Built Environment and Street-Scale Design,DNPAO,Complete Streets Grant Program,Dead,H2911,Text
KY,Kentucky,Nutrition,Access to Healthy Foods,DNPAO,Nutrition Program For Older Persons,Enacted,20001,Text
VT,Vermont,Nutrition,Agriculture and Farming,DNPAO,Executive Branch,Dead,H376,Text
TN,Tennessee,Physical Activity,Physical Education Requirements,DNPAO,Education,Dead,S2475,Text
VA,Virginia,Obesity,Appropriations,DNPAO,Statewide Pedestrian Plan,Enacted,SB393,Text
MA,Massachusetts,Obesity,Initiatives and Programs,DNPAO,An Act Improving the Quality of Health Care<br>,Dead,S2262,Text
DE,Delaware,Nutrition,Task Forces/Councils,DNPAO,The Delaware Universal Breakfast Fund,Dead,H441,Text
SC,South Carolina,Nutrition,Incentives,DNPAO,Sweetened Beverage Tax Act,Dead,H4831,Text
MI,Michigan,Nutrition,Trans Fats,DNPAO,Facilities and Development,Enacted,H5989,Text
NY,New York,Nutrition,Appropriations,DNPAO,Food Commodity in Package Form,Dead,S2608,Text
SC,South Carolina,Obesity,Food Restrictions,DNPAO,Litigation Settlement,Dead,H4506,Text
WI,Wisconsin,Nutrition,Agriculture and Farming,DNPAO,Sales and Use Tax,Enacted,R21547,Text
WA,Washington,Nutrition,Appropriations,DNPAO,An act relating to the capital budget,Enacted,HB1115,Text
TX,Texas,Nutrition,Incentives,DNPAO,Programs to Improve Health of Public School Students,Dead,HJR9,Text
ME,Maine,Nutrition,Medical Care,DNPAO,"Prevention, Health Promotion, and Optional Treatments",Enacted,R9327,Text
MA,Massachusetts,Physical Activity,Bicycling,DNPAO,Transportation System Modernization,Dead,S2023,Text
TX,Texas,Physical Activity,Built Environment and Street-Scale Design,DNPAO,Montecillo Municipal Management District,Enacted,H3831,Text
AL,Alabama,Physical Activity,Task Forces/Councils,DNPAO,To Make Appropriations      <br>,Enacted,H272,Text
GA,Georgia,Obesity,Menu Labeling,DNPAO,Food Service Establishments,Enacted,H1303,Text
NY,New York,Nutrition,Access to Healthy Foods,DNPAO,Establishing a Community Garden Task Force<br>,Dead,S4906,Text
KY,Kentucky,Nutrition,Point of Purchase Promotion,DNPAO,Restaurant Display of Caloric Information,Dead,H246,Text
IA,Iowa,Nutrition,Media Campaigns,DNPAO,An Act Relating to the Iowa Hot Lunch Challenge<br>,Dead,H2093,Text
VT,Vermont,Nutrition,Farm Direct Foods,DNPAO,An Act Relating to the Rozo McLaughlin Farm-to-School Program,Enacted,SB33,Text
HI,Hawaii,Nutrition,Task Forces/Councils,DNPAO,An Act Relating to Sustainability,Dead,S2512,Text
HI,Hawaii,Nutrition,Task Forces/Councils,DNPAO,Child Nutrition Programs,Dead,HR145,Text
OK,Oklahoma,Obesity,Sugar Sweetened Beverages,DNPAO,An Act Relating to Beverages in Schools<br>,Dead,H2699,Text
MI,Michigan,Nutrition,Breastfeeding,DNPAO,Breastfeeding in Public,Dead,H5515,Text
MA,Massachusetts,Nutrition,Point of Purchase Promotion,DNPAO,Labeling of Food,Dead,HD907,Text
CT,Connecticut,Nutrition,Access to Healthy Foods,DNPAO,Nutrition Assistance,Dead,S194,Text
HI,Hawaii,Nutrition,Appropriations,DNPAO,Taro Security,Enacted,H2832,Text
CA,California,Physical Activity,Built Environment and Street-Scale Design,DNPAO,An Act Relating to Transportation<br>,Enacted,A516,Text
NC,North Carolina,Physical Activity,Physical Education Requirements,DNPAO,Childhood Obesity Legislative Task Force,Dead,H218,Text
NE,Nebraska,Obesity,Health Insurance Coverage,DNPAO,Wellness Program Study,Dead,LR148,Text
MO,Missouri,Obesity,Food Restrictions,DNPAO,State and Local Sales Tax Exemption,Dead,H1864,Text
MS,Mississippi,Nutrition,Access to Healthy Foods,DNPAO,Edwards Street Fellowship Center,Dead,H1440,Text
AR,Arkansas,Nutrition,Agriculture and Farming,DNPAO,Appropriation to the Department of Human Services,Dead,H1471,Text
CA,California,Physical Activity,Pedestrians/Walking,DNPAO,Planning: Circulation Element: Transportation,Enacted,A1358,Text
NM,New Mexico,Nutrition,Medical Care,DNPAO,Bicycle Program,Dead,H402,Text
CA,California,Obesity,Appropriations,DNPAO,State Planning,Dead,A441,Text
NJ,New Jersey,Obesity,Body Mass Index (BMI),DNPAO,Smart Housing Incentive Act,Dead,A3632,Text
TX,Texas,Physical Activity,Pedestrians/Walking,DNPAO,Transportation Alternatives Set-Aside Program,Enacted,REG439032,Text
TN,Tennessee,Obesity,Appropriations,DNPAO,Students,Dead,S3063,Text
NY,New York,Nutrition,Agriculture and Farming,DNPAO,Tax Exemption for Buildings on Agricultural Land,Dead,S669,Text
LA,Louisiana,Physical Activity,Pedestrians/Walking,DNPAO,Failure to Yield,Dead,H167,Text
MA,Massachusetts,Obesity,Food Restrictions,DNPAO,Farmers Markets,Dead,H4000,Text
AR,Arkansas,Physical Activity,Public Transportation,DNPAO,Economic Development Commission,Enacted,S110,Text
NJ,New Jersey,Obesity,Appropriations,DNPAO,Qualification for Redevelopment Authority Financing,Vetoed,S1794,Text
PA,Pennsylvania,Obesity,Appropriations,DNPAO,Public School Code of 1949,Dead,H1504,Text
ME,Maine,Nutrition,Access to Healthy Foods,DNPAO,Raw Milk Sales,Dead,H292,Text
NH,New Hampshire,Nutrition,Farm Direct Foods,DNPAO,Keep Local Farms Program,Dead,LSR2856,Text
ME,Maine,Physical Activity,Public Transportation,DNPAO,Recreational Development Funds,Enacted,H416,Text
GA,Georgia,Nutrition,Healthier Food Retail and Food Deserts,DNPAO,Sales and Use Taxes,Enacted,H1221,Text
IL,Illinois,Obesity,Menu Labeling,DNPAO,Housing and Transportation Affordability,Enacted,S374,Text
LA,Louisiana,Obesity,Appropriations,DNPAO,Municipalities,Dead,S702,Text
MT,Montana,Nutrition,Appropriations,DNPAO,Soft Drink and Sugared Beverage Excise Tax,Dead,D1204,Text
NV,Nevada,Physical Activity,Access to Recreational Opportunities,DNPAO,Use of Athletic Fields for Youth Sports,Enacted,A227,Text
WA,Washington,Physical Activity,Bicycling,DNPAO,Enforcement of Crosswalk Violations,Enacted,S6363,Text
NY,New York,Obesity,Appropriations,DNPAO,Macombs Damp Park Baseball Stadium Development,Enacted,S5818,Text
CA,California,Nutrition,Appropriations,DNPAO,"Agriculture: Fruits, Nuts, Vegetables: State Grown Act",Dead,A1960,Text
AZ,Arizona,Obesity,Appropriations,DNPAO,Children's Physical Activity Grant,Enacted,SB1186,Text
PA,Pennsylvania,Nutrition,Farm Direct Foods,DNPAO,Agricultural Surplus System,Enacted,H2139,Text
NY,New York,Physical Activity,Disparities/Equity,DNPAO,Low-Income Housing Credit Qualified Allocation Plan,Enacted,R20868,Text
DC,District of Columbia,Nutrition,Access to Healthy Foods,DNPAO,Nutritional Standards for Food Sold at Parks,Dead,B930,Text
MA,Massachusetts,Nutrition,Food Policy Councils,DNPAO,Food Policy Council,Enacted,H4568,Text
ME,Maine,Obesity,Sugar Sweetened Beverages,DNPAO,Physical Education Curriculum,Dead,H802,Text
SC,South Carolina,Obesity,Health Insurance Coverage,DNPAO,Insurance Trade Practices,Dead,S316,Text
MT,Montana,Nutrition,Farm Direct Foods,DNPAO,Recommendations on Reducing Childhood Hunger,Dead,D1088,Text
NY,New York,Nutrition,Access to Healthy Foods,DNPAO,Senior Benefits Card Program,Dead,S2023,Text
NJ,New Jersey,Physical Activity,Pedestrians/Walking,DNPAO,An Act Establishing the Smart Housing Incentives Act<br>,Dead,A1430,Text
NM,New Mexico,Nutrition,Farmers Markets,DNPAO,New Mexico Food and Farms Day,Enacted,SM25,Text
MN,Minnesota,Nutrition,Appropriations,DNPAO,Human Services,Dead,H646,Text
NY,New York,Nutrition,Point of Purchase Promotion,DNPAO,Eligibility for High School Athletic Competition,Dead,S6934,Text
MS,Mississippi,Nutrition,Trans Fats,DNPAO,Town of Como,Enacted,H1723,Text
MA,Massachusetts,Nutrition,Medical Care,DNPAO,Bicycle and Motor Vehicle Collisions At Intersections,Dead,H2190,Text
IL,Illinois,Nutrition,Liability and Indemnity,DNPAO,Appropriations and Reappropriations,Dead,H2189,Text
MO,Missouri,Physical Activity,Bicycling,DNPAO,Affirmative Defense,Enacted,S368,Text
HI,Hawaii,Obesity,Health Insurance Coverage,DNPAO,Medicaid Wellness Pilot Program,Dead,S425,Text
MN,Minnesota,Obesity,Appropriations,DNPAO,Capital Improvements,Dead,S781,Text
TX,Texas,Physical Activity,Physical Education Requirements,DNPAO,Curriculum Requirements,Enacted,R16690,Text
NY,New York,Nutrition,Agriculture and Farming,DNPAO,Appropriations for Support of Government,Enacted,A22v,Text
MA,Massachusetts,Nutrition,Food Assistance Programs,DNPAO,School Nutrition,Dead,H4438,Text
RI,Rhode Island,Obesity,Sugar Sweetened Beverages,DNPAO,Taxation,Dead,S295,Text
TN,Tennessee,Physical Activity,Safe Routes to Schools,DNPAO,Department of Transportation,Dead,S1386,Text
MS,Mississippi,Nutrition,Incentives,DNPAO,Healthy Foods,Enacted,H1170,Text
RI,Rhode Island,Physical Activity,Built Environment and Street-Scale Design,DNPAO,Building Rhode Island Program,Enacted,5249,Text
IL,Illinois,Obesity,Food Restrictions,DNPAO,An Act Concerning Health  <br>,Dead,H5700,Text
IL,Illinois,Obesity,Appropriations,DNPAO,Department Of Commerce And Economic Opportunity,Dead,S3918,Text
NY,New York,Obesity,Task Forces/Councils,DNPAO,"An act to amend the education law, in relation to authorizing the screening for childhood obesity and instruction in good health and reducing the incidence of obesity",Introduced,SB1521,Text
WA,Washington,Obesity,Body Mass Index (BMI),DNPAO,Funds for State Ferry System,Dead,S5698,Text
IA,Iowa,Obesity,Appropriations,DNPAO,Local Foods,Dead,SSB1179,Text
NC,North Carolina,Nutrition,Task Forces/Councils,DNPAO,Technical Assistance Healthy Lifestyle,Dead,H1467,Text
TN,Tennessee,Nutrition,Access to Healthy Foods,DNPAO,Tort Liability and Reform,Enacted,H1151,Text
TX,Texas,Nutrition,Food Assistance Programs,DNPAO,An Act Relating to Establishing a Pilot Program for the Purchase of Produce at Farmersâ Markets under Certain Nutrition Assistance Programs,Introduced,HB3705,Text
FL,Florida,Obesity,Appropriations,DNPAO,Physical Fitness and Health,Enacted,SB2372,Text
MS,Mississippi,Nutrition,Appropriations,DNPAO,Local School Health Councils,Enacted,H319,Text
CA,California,Obesity,Appropriations,DNPAO,Neighborhood Stabilization Program Grants,Dead,A290,Text
RI,Rhode Island,Obesity,Food Restrictions,DNPAO,School Food and Beverage Restrictions,Enacted,S2696,Text
NJ,New Jersey,Nutrition,Food Assistance Programs,DNPAO,State Budget FY 2009 and 2010,Enacted,A4100,Text
MA,Massachusetts,Physical Activity,Pedestrians/Walking,DNPAO,Slope Resources Areas,Enacted,R9588,Text
SC,South Carolina,Nutrition,Healthier Food Retail and Food Deserts,DNPAO,Student Snack Food Consumption,Dead,S227,Text
UT,Utah,Obesity,Health Insurance Coverage,DNPAO,Obesity Report by Public Employees Health Plan<br>,Enacted,HB295,Text
RI,Rhode Island,Physical Activity,"Parks, Recreation and Trails",DNPAO,Towns & Cities,Dead,H8269,Text
IL,Illinois,Nutrition,Agriculture and Farming,DNPAO,An Act Making Appropriations,Dead,S2404,Text
NJ,New Jersey,Physical Activity,"Parks, Recreation and Trails",DNPAO,Playground Safety Subcode,Enacted,R19567,Text
NY,New York,Nutrition,Fruits and Vegetables,DNPAO,Amending the Agriculture and Markets Law,Enacted,SB2438,Text
KY,Kentucky,Nutrition,Farm Direct Foods,DNPAO,Department of Agriculture,Enacted,HCR207,Text
CT,Connecticut,Obesity,Appropriations,DNPAO,Bicycle and Pedestrian Access,Enacted,S735,Text
KY,Kentucky,Obesity,Incentives,DNPAO,State Employee Health Insurance,Dead,H32,Text
TX,Texas,Nutrition,Disparities/Equity,DNPAO,An Act Relating to the Establishment of a Community Development Grocery Store Revolving Loan Fund Program,Introduced,HB725,Text
FL,Florida,Nutrition,Appropriations,DNPAO,Healthy Schools for Healthy Lives Act,Dead,H7219,Text
NY,New York,Nutrition,Correctional Facilities Farms Programs,DNPAO,Condition of African American Men Study,Dead,A999,Text
PA,Pennsylvania,Nutrition,Agriculture and Farming,DNPAO,Fiscal Appropriations,Dead,H1943,Text
OH,Ohio,Nutrition,Farmers Markets,DNPAO,WIC Program,Enacted,R14784,Text
MA,Massachusetts,Nutrition,Farm Direct Foods,DNPAO,Farmers Markets,Dead,H4000,Text
NY,New York,Nutrition,Appropriations,DNPAO,Sale of Certain Foods in Vending Machines,Dead,A6900,Text
NM,New Mexico,Nutrition,Liability and Indemnity,DNPAO,Community Bicycle Recycling,Dead,H281,Text
NY,New York,Nutrition,Healthier Food Retail and Food Deserts,DNPAO,High Fructose Corn Syrup,Dead,A10574,Text
MS,Mississippi,Nutrition,Appropriations,DNPAO,School Curriculum,Dead,H902,Text
TX,Texas,Physical Activity,Pedestrians/Walking,DNPAO,Grayson County,Enacted,H534,Text
MA,Massachusetts,Obesity,Body Mass Index (BMI),DNPAO,Transportation System Modernization,Dead,S10,Text
NM,New Mexico,Nutrition,Appropriations,DNPAO,Local Food Systems,Enacted,HJM20,Text
TN,Tennessee,Physical Activity,Pedestrians/Walking,DNPAO,Redevelopment Projects,Enacted,S1919,Text
MA,Massachusetts,Nutrition,Fruits and Vegetables,DNPAO,Nutritional Meals in the Public Schools,Dead,H1056,Text
MA,Massachusetts,Obesity,Appropriations,DNPAO,Public School Sport Program Funding,Dead,S2122,Text
MA,Massachusetts,Obesity,Disparities/Equity,DNPAO,Physical Activity in Schools,Dead,H457,Text
MD,Maryland,Physical Activity,Public Transportation,DNPAO,An Act Concerning Maryland Smart Growth Investment Fund Workgroup,Introduced,HB1170,Text
TX,Texas,Nutrition,Sodium,DNPAO,Supplemental Nutrition Assistance Program,Dead,H3451,Text
CT,Connecticut,Obesity,Appropriations,DNPAO,Adult Education Coursework,Dead,S941,Text
ME,Maine,Nutrition,Healthier Food Retail and Food Deserts,DNPAO,An act to implement the recommendations of the Maine economic growth council regarding prosperity,Introduced,SB436,Text
KY,Kentucky,Nutrition,Appropriations,DNPAO,Restaurant Display of Caloric Information,Dead,S86,Text
MN,Minnesota,Nutrition,Medical Care,DNPAO,Capital Improvements,Dead,S246,Text
TX,Texas,Obesity,Health Insurance Coverage,DNPAO,Sweetened Beverages Tax,Dead,H2214,Text
KS,Kansas,Nutrition,Task Forces/Councils,DNPAO,Extending the local food and farm task force,Enacted,SB314,Text
MA,Massachusetts,Obesity,Body Mass Index (BMI),DNPAO,Healthy Child Scholarship,Dead,S602,Text
CA,California,Nutrition,Liability and Indemnity,DNPAO,Budget Act of 2010,Enacted,S870,Text
TX,Texas,Obesity,Appropriations,DNPAO,Students Food Containing Industrial Produced Trans Fat,Dead,S1533,Text
MN,Minnesota,Physical Activity,"Parks, Recreation and Trails",DNPAO,Capital Investment,Dead,H1050,Text
MN,Minnesota,Physical Activity,Appropriations,DNPAO,Capital Investment,Dead,H1499,Text
UT,Utah,Obesity,Appropriations,DNPAO,Short Title - Operation of Bicycles and Mopeds,Dead,H424,Text
OH,Ohio,Obesity,Appropriations,DNPAO,Bicycle Helmet Law,Dead,S77,Text
ME,Maine,Nutrition,Farm Direct Foods,DNPAO,Farmers Market,Enacted,H1124,Text
MI,Michigan,Nutrition,Access to Healthy Foods,DNPAO,EDUCATIONâAPPROPRIATIONSâSCHOOL BUDGETS,Enacted,SB801,Text
MA,Massachusetts,Obesity,Body Mass Index (BMI),DNPAO,Student Nutrition and Wellness,Dead,H446,Text
NM,New Mexico,Physical Activity,Appropriations,DNPAO,An Act Relating to the Expenditure of Public Money<br>,Enacted,S710,Text
MN,Minnesota,Nutrition,Liability and Indemnity,DNPAO,Capital Improvements,Dead,S257,Text
CT,Connecticut,Nutrition,Incentives,DNPAO,Vending Machine Sales,Dead,S177,Text
VT,Vermont,Nutrition,Farm Direct Foods,DNPAO,Agriculture Economic Development,Dead,S99,Text
MD,Maryland,Nutrition,Food Assistance Programs,DNPAO,Health Insurance Wellness Incentives,Enacted,S638,Text
OK,Oklahoma,Nutrition,Initiatives and Programs,DNPAO,An Act Relating to Schools<br>,Dead,H2733,Text
GA,Georgia,Nutrition,Medical Care,DNPAO,Residential Mental Health Facilities,Enacted,R5149,Text
ID,Idaho,Nutrition,Agriculture and Farming,DNPAO,Rules of the Preferred Promotion Program,Enacted,R8145,Text
KY,Kentucky,Nutrition,Food Assistance Programs,DNPAO,State Employee Health Insurance,Dead,H32,Text
MD,Maryland,Nutrition,Task Forces/Councils,DNPAO,Neighborhood Business Development Program Financial Assistance for Food Deserts,Enacted,HB451,Text
MI,Michigan,Nutrition,Task Forces/Councils,DNPAO,Agriculture Industry,Dead,H6412,Text
ME,Maine,Nutrition,Appropriations,DNPAO,Farmers Market,Enacted,H1124,Text
NY,New York,Physical Activity,Built Environment and Street-Scale Design,DNPAO,Passing a Bicycle on a Roadway,Dead,A10697,Text
NC,North Carolina,Nutrition,Access to Healthy Foods,DNPAO,Adult Day Care Programs,Enacted,S512,Text
OH,Ohio,Nutrition,Disparities/Equity,DNPAO,Commercial Activity Tax Credit,Dead,S288,Text
CA,California,Nutrition,Food Assistance Programs,DNPAO,The Office of Farm to Fork,Dead,AB38,Text
MD,Maryland,Nutrition,Farmers Markets,DNPAO,Raw Agricultural Products Sales,Enacted,S228,Text
NV,Nevada,Obesity,Appropriations,DNPAO,Sidewalk Maintenance,Enacted,A231,Text
SC,South Carolina,Nutrition,Vending,DNPAO,Student Snack Food Consumption,Dead,S227,Text
MN,Minnesota,Obesity,Incentives,DNPAO,Agriculture,Dead,H1039,Text
NY,New York,Nutrition,School Nutrition,DNPAO,Calcium Purchasing Preference Initiative,Dead,S265,Text
HI,Hawaii,Nutrition,Incentives,DNPAO,Health,Dead,S1506,Text
MD,Maryland,Nutrition,Access to Healthy Foods,DNPAO,Proposed Appropriations,Enacted,H70,Text
