Park,Title,CC,Rating,Underwriter,Park Address,Location,Unnamed: 10
Museum of Science and Industry,Wonder Woman,Y,PG-13,The Museum of Science & Industry,5700 S. Lake Shore Dr.,"(41.79142028, -87.58014777)",
Winnemac Park,Spider-Man: Into the Spider-Verse,Y,PG,Friends of Winnemac Park,5100 N. Leavitt St,"(41.97406708, -87.68437099)",
Dunbar Park,Black Panther,Y,PG-13,,300 E. 31st St.,"(41.83849698, -87.62015738)",
Ward (A. Montgomery) Park,Black Panther,Y,PG-13,The River North Resident's Association,630 N. Kingsbury St.,"(41.893015, -87.64125791)",
Donovan Playground Park,Goosebumps 2,Y,PG,,3620 S.Lituanica Ave.,"(41.82797656, -87.64781283)",
Hermosa Park,Aquaman,Y,PG-13,,2240 N. Kilbourn Ave.,"(41.92192999, -87.73907239)",
Bartelme (Mary) Park,Space Jam,Y,PG,The Mary Bartelme Park Advisory Council,115 S. Sangamon St.,"(41.87994748, -87.65066137)",
Portage Park,Dirty Dancing,Y,PG-13,,4100 N. Long Ave.,"(41.95510787, -87.76228458)",
Chopin Park,Trolls,Y,NR,,3420 N. Long Ave.,"(41.94291712, -87.76188146)",
Jonquil Playlot Park,Spider-Man: Homecoming,Y,PG-13,The Wrightwood Neighbors Association,1001 W. Wrightwood Ave.,"(41.92889597, -87.65385229)",
Commercial Club Playground,The Incredibles 2,Y,PG,,1845 W. Rice St.,"(41.89676186, -87.67398364)",
South Shore Cultural Center,Moana,Y,PG,,7059 S. South Shore Drive,"(41.76660302, -87.56632372)",
La Follette Park,Spider-Man: Into the Spider-Verse,Y,PG,,1333 N. Laramie Ave.,"(41.90505469, -87.75569246)",
Roberts Square Playlot Park,The Rugrats Movie (1998),Y,G,,5230 W. Argyle St.,"(41.97166987, -87.75892379)",
Adams Playground Park,Mary Poppins Returns,Y,PG,,1919 N. Seminary Ave.,"(41.91669986, -87.65522827)",
Union Park,The Incredibles 2,Y,PG,The West Loop Community Organization,1501 W. Randolph St.,"(41.88471128, -87.66428183)",
Wentworth Park,Ralph Breaks the Internet,Y,PG,,5625 S. Mobile Ave.,"(41.78970398, -87.7791043)",
Mann Park,Smallfoot,Y,PG,,3035 E. 130st St.,"(41.65905937, -87.54940208)",
Gage Park,Mary Poppins Returns,Y,PG,,2411 W. 55th St.,"(41.79374925, -87.684513)",
Park No. 564 - Big Marsh,Captain Marvel,Y,PG-13,,11555 S. Stony Island Ave.,"(41.68482787, -87.57630433)",
Oz Park,Ghostbusters (1984),Y,PG,The Oz Park Advisory Council,2021 N. Burling St.,"(41.9189011, -87.64717807)",
Ada Park,Rampage,Y,PG-13,,11250 S. Ada St.,"(41.68856983, -87.65578778)",
Blackhawk Park,The Incredibles 2,Y,PG,,2318 N. Lavergne Ave.,"(41.92293421, -87.7513379)",
Humboldt Park,Smallfoot,Y,PG,,1440 N. Sacramento,"(-87.701792, 41.902822)",
Brooks Park,Mary Poppins Returns,Y,PG,The Edison Park Chamber of Commerce,7100 N. Harlem Ave.,"(42.00994549, -87.80680465)",
Kedvale Park,Spider-Man: Into the Spider-Verse,Y,PG,,4134 W. Hirsch St.,"(41.90634312, -87.73022479)",
Chippewa Park,Bee Movie,Y,PG,JCC Chicago,6748 N. Sacramento Ave.,"(42.00438076, -87.70475177)",
West Chatham Park,Black Panther,Y,PG-13,,8223 S. Princeton Ave.,"(41.74443787, -87.63156363)",
Palmer Park,Jumanji: Welcome to the Jungle,Y,PG-13,,201 E. 111th St.,"(41.69254319, -87.61813446)",
Buttercup Playlot Park,After School Cartoons,N,NR,,4901 N. Sheridan Rd.,"(41.97166865, -87.65473895)",
Green Briar Park,Alice in Wonderland,Y,G,,2650 W. Peterson Ave.,"(41.99056874, -87.69659414)",
Garfield Park,The Princess and the Frog,Y,G,,100 N. Central Park Ave.,"(41.88335532, -87.71566523)",
Portage Park,A Dog's Way Home,Y,PG,,4100 N. Long Ave.,"(41.95510787, -87.76228458)",
Maggie Daley Park,Ralph Breaks the Internet,Y,PG,,337 E. Randolph St.,"(41.88422161, -87.61933906)",
Veteran's Memorial Park,Ralph Breaks the Internet,Y,PG,,2820 E. 98th St.,"(41.71739698, -87.55556913)",
Buttercup Playlot Park,Come Drink With Me,N,NR,,4901 N. Sheridan Rd.,"(41.97166865, -87.65473895)",
Berger Park Cultural Center,Some Like It Hot,Y,NR,,6205 N. Sheridan Rd.,"(41.99480562, -87.65538421)",
Senn Playlot Park,Ralph Breaks the Internet,Y,PG,,5887 N. Ridge Ave.,"(41.98893587, -87.66850696)",
Vittum Park,Ralph Breaks the Internet,Y,PG,,5010 W. 50th St.,"(41.80218518, -87.74838435)",
Ward (A. Montgomery) Park,Mary Poppins Returns,Y,PG,The River North Resident's Association,630 N. Kingsbury St.,"(41.893015, -87.64125791)",
Maggie Daley Park,Cloudy With a Chance of Meatballs,Y,PG,The Museum of Science and Industry,337 E. Randolph St.,"(41.88422161, -87.61933906)",
Mamie Till-Mobley Park,Coco,Y,PG,,6404 S. Ellis Ave.,"(41.77835204, -87.60055506)",
Marquette Park,Hotel Transylvania 3,Y,PG,,6743 S. Kedzie Ave.,"(41.77040513, -87.70279647)",
Unity Playlot Park,Mary Poppins Returns,Y,PG,The Unity Park Advisory Council,2636 N. Kimball Ave.,"(41.92949896, -87.71237758)",
Hayes Park,Spider-Man: Into the Spider-Verse,Y,PG,The Forest Preserve District of Cook County,2936 W. 85th St.,"(41.73874188, -87.69676781)",
Grant Park: Logan Monument,Chicago,Y,PG-13,,900 S. Michigan Ave.,"(41.87055847, -87.62428661)",
Chicago History Museum,"To Wong Foo, Thanks for Everything, Julie Newmar",Y,PG-13,The Chicago History Museum,1601 N. Clark St.,"(41.91131036, -87.63156657)",
Gross Park,Mary Poppins Returns,Y,PG,,2708 W. Lawrence Ave.,"(41.96865935, -87.69662091)",
Chicago Women's Park and Gardens,First Man,Y,PG-13,The Prairie District Neighborhood Alliance,1801 S. Indiana Ave.,"(41.85783824, -87.62218405)",
Loyola Park,The Gazelle's Dance / El Baile de la Gacela,Y,NR,The International Latino Cultural Center,1230 W. Greenleaf Ave.,"(42.01052218, -87.66130892)",
Kosciuszko Park,Black Panther,Y,PG-13,The Kosciuszko Park Advisory Council,2732 N. Avers Ave.,"(41.9310234, -87.72343588)",
Kilbourn Park,Goonies,Y,PG,,3501 N. Kilbourn Ave.,"(41.94450485, -87.73951111)",
DuSable Museum of African American History,Spider-Man: Into the Spider-Verse,Y,PG,The DuSable Museum of African American History,740 E. 56th Pl.,"(41.79248002, -87.60685252)",
Harold Washington Playlot Park,Cabaret,Y,PG,,5200 S. Hyde Park Blvd.,"(41.80047033, -87.58450476)",
Normandy Playground Park,Mary Poppins Returns,Y,PG,,6660 W. 52nd St.,"(41.79785925, -87.78923279)",
