Institution Name Primary,Type,Event Date,Institution Name (Secondary),Identification Number (Secondary)
"National Bank of Watervliet, The",Former Bank/Trust Company,19880624,Norstar Bank of Callicoon,114025.0
First National Bank of Mount Vernon,Former Bank/Trust Company,19000000,First National Bank of Mount Vernon,
Homer National Bank,Former Bank/Trust Company,19930826,NSA Bank,114041.0
Marine Midland Bank - Central,Bank,19800201,"Marine Midland Bank, N.A.",8500023.0
"New York Bank For Savings, The",Savings Banks,19910531,"Key Bank of Western New York, N.A.",8500140.0
"Bank of New Rochelle, The",Former Bank/Trust Company,19531001,Peoples National Bank & Trust Co White Plains,8000237.0
Irving Trust Company,Trust Company,18710000,Mutual Benefit Life Policy Loan & Trust Co NY,
President and Directors of the Manhattan Company,Former Bank/Trust Company,20041113,"JPMorgan Chase Bank, National Association",
Bank of Hicksville,Former Bank/Trust Company,19601101,"Meadow Brook National Bank, The",
"New York Security and Trust Company, The",Former Bank/Trust Company,19690217,Chemical Bank,
Key Bank of Central New York,Former Bank/Trust Company,19290401,Liberty National Bank & Trust Co. of Syracuse,8500237.0
First Chartered Savings & Loan Association,Former Savings and Loan,19870819,,
Madison Trust Company,Former Bank/Trust Company,19300501,Chase National Bank of the City of New York,8500003.0
Observer Dispatch & Press Employees Credit Union,Credit Unions,19991101,G.P.O Federal Credit Union,5800851.0
Elmhurst Building & Loan Association,Former Savings and Loan,19481217,Woodside Savings & Loan Association,
Highland National Bank & Trust Co of Newburgh,Former Bank/Trust Company,18650000,Highland National Bank & Trust Co of Newburgh,
First Bank and Trust Company of Ithaca,Former Bank/Trust Company,18640000,First National Bank of Ithaca,
UBS AG,Foreign Branches,20030327,UBS AG,
Washington Irving Savings & Loan Association,Former Savings and Loan,19301200,Sunnyside Savings and Loan Association,
Mutual Savings & Loan & Building Assoc of Rome NY,Former Savings and Loan,19180216,,
Bank Dagang Negara,Foreign Agencies,19930104,P.T. Bank Dagang Negara (Persero),
Rockaway Savings & Loan Association (1913-1924),Former Savings and Loan,19350000,,
Buffalo Savings & Loan Association (1925-1963),Former Savings and Loan,19710701,Niagara Permanent Savings & Loan Association,8300257.0
Pacific National Bank in New York,Former Bank/Trust Company,19261211,American Exchange Irving Trust Co.,
First National Bank of Caledonia,Former Bank/Trust Company,19721229,"Chase Manhattan Bank of Greater Rochester, N. A.",8500027.0
"Banco Central Hispanoamericano, S.A.",Foreign Branches,19911230,Banco Hispano Americano,502018.0
"Chase Manhattan Bank, The (1799-9/1965)",Former Bank/Trust Company,19260801,"Greenpoint Bank of Brooklyn, The",8000387.0
"Fidelity Trust & Guaranty Co of Buffalo, The",Trust Company,20000320,Chase Trust Company,170075.0
Federation Bank of New York,Former Bank/Trust Company,19200000,Federation Bank of New York,
"Bank of New York, The (9/1922-10/1989)",Former Bank/Trust Company,19220901,Bank of New York (1784-8/1922),8000270.0
Beacon Federal Savings & Loan Association,Former Savings and Loan,19710331,Beacon Federal Savings & Loan Association,
First Chartered Savings & Loan Association,Former Savings and Loan,19910531,Manufacturers and Traders Trust Company,113003.0
"Chemical Bank, The (1823-1865)",Trust Company,20041113,"JPMorgan Chase Bank, National Association",
Pearl River Savings & Loan Association,Former Savings and Loan,19711229,Pearl River Federal Savings & Loan Association,
"Syracuse Trust Company, The",Bank,19990329,HSBC Bank USA,
"Luzerne-Hadley Bank, The",Former Bank/Trust Company,19971113,Fleet Bank N.A.,5801998.0
Chancellor Trust Company,Limited Purpose Trust Company,19980703,INVESCO (NY) Trust Company,
"Chase National Bank of the City of New York, The",Former Bank/Trust Company,19211101,Metropolitan National Bank of the City of NY,8000322.0
Key Bank of Long Island,Former Bank/Trust Company,19920616,Key Bank of New York (6/92-8/93),
"North Country Savings Bank, The",Savings Banks,19721001,"North Country Savings Bank, The",
Deutsche Genossenschaftsbank,Foreign Branches,20020225,DZ Bank AG Duetsche Zentral-Genossenschaftsbank,
"Banco Mexicano Somex, S.A.",Foreign Agencies,19801007,"Banco Mexicano Somex, S.A.",
"Key Bank of Southeastern New York, N.A.",Former Bank/Trust Company,19811231,Kingston Trust Company,8000137.0
Third Ward Savings & Loan Association,Former Savings and Loan,19380608,"Polish Savings & Loan Assoc of Richmond, New York",8200082.0
First Federal Savings & Loan Assoc of Suffern,Former Savings and Loan,19441218,Ramapo Valley Savings & Loan Association,8200345.0
"Eastport National Bank, The",Former Bank/Trust Company,19750119,Chemical Bank,103011.0
"First Fidelity Bank, N.A., New York",Bank,19930615,"First Fidelity Trust Company, New York",106046.0
First National Bank of Caledonia,Former Bank/Trust Company,19660801,Bank of Caledonia,8000074.0
Chemung Canal Trust Company,Trust Company,20090529,Bank of Canton,5801257.0
Community Mutual Savings Bank of Southern NY,Savings Banks,20070403,"Community Mutual Savings Bank, FSB",
Franklin National Bank in New York,Former Bank/Trust Company,19230000,Franklin National Bank in New York,
Bank of East Syracuse,Former Bank/Trust Company,19560201,First Trust and Deposit Company,8000223.0
International-Madison Bank and Trust Company,Former Bank/Trust Company,19291001,Madison State Bank,8000433.0
Niagara Frontier Bank of New York,Former Bank/Trust Company,19751222,Bank of Buffalo,8000071.0
Andover State Bank,Former Bank/Trust Company,18940000,Andover State Bank,
Italian American Trust Company,Former Bank/Trust Company,19230207,Irving Bank-Columbia Trust Co.,
"Port Leyden National Bank, The",Former Bank/Trust Company,19200000,"Port Leyden National Bank, The",
"Banco Espirito Santo e Commercial de Lisboa, S.A.",Foreign Branches,19970124,"Banco Espirito Santo e Commercial de Lisboa, S.A.",
Hiam Solomon Credit Union,Former Credit Union,19400916,Hiam Solomon Credit Union,
Market Bank of New York,Former Bank/Trust Company,19290201,Irving Trust Company,
Bank of Angelica,Former Bank/Trust Company,19940701,Fleet Bank,
First Trust Company of Albany,Trust Company,19610501,"Johnstown Bank, The",8000134.0
Center Moriches Bank,Former Bank/Trust Company,19490630,South Bay Bank,
Utica National Bank and Trust Company,Former Bank/Trust Company,19311101,First Citizens Bank & Trust Company of Utica,
"Fidelity Trust & Guaranty Co of Buffalo, The",Trust Company,19460629,Bank of Corfu,93.0
Mercantile Trust Company,Former Bank/Trust Company,19170000,Mercantile Trust and Deposit Company,
Dexia Credit Local de France,Foreign Branches,19901105,Credit Local de France - CAECL SA,
"Fleet Bank of New York, N.A.",Trust Company,19610301,Liberty Bank and Trust Company,8000072.0
Bergen Bank A/S,Foreign Branches,20040119,DNB Bank ASA,570333.0
Produce Exchange Trust Company,Former Bank/Trust Company,19960714,Chemical Bank,103011.0
Prospect Home Building & Loan Association,Former Savings and Loan,19920901,"Home Savings of America, Bowery Division, FSB",270018.0
Schenectady Federal Savings & Loan Association,Savings Banks,19990903,Hudson River Bank & Trust,208006.0
"Manufacturers National Bank of Troy, The",Former Bank/Trust Company,19800201,"Marine Midland Bank, N.A.",8500023.0
Security State Bank,Former Bank/Trust Company,19280901,Bank of Sicily Trust Company,
Nyack Bank and Trust Company,Former Bank/Trust Company,19691201,Marine Midland National Bank of Southeastern NY,1170005.0
"New York Security and Trust Company, The",Former Bank/Trust Company,19490901,Fulton Trust Company of New York,8000024.0
City Savings Bank of Brooklyn,Former Savings Bank,19640424,"Greater New York Savings Bank, The",207003.0
Chatham National Bank of New York,Former Bank/Trust Company,19320209,Manufacturers Trust Company,113004.0
"New York Bank For Savings, The",Savings Banks,19870819,Goldome,
"Chase National Bank of the City of New York, The",Former Bank/Trust Company,19650901,"Chase Manhattan Bank, N.A., The",5800033.0
Bankers Trust of Jamestown,Former Bank/Trust Company,19831216,"Key Bank of Western New York, N.A.",8500140.0
Prosperity Fund Credit Union,Former Credit Union,19150000,Prosperity Fund Credit Union,
"Buffalo Savings Bank, The",Savings Banks,19910531,"East New York Savings Bank, The",205001.0
First National Bank of Buffalo,Bank,19300000,Niagara National Bank of Buffalo,
Irving Bank and Trust Company,Trust Company,19810115,"Irving Bank Canada, Ltd.",49.0
First Hungarian Credit Union,Former Credit Union,19300709,,
National Copper Bank of New York,Former Bank/Trust Company,19100201,Mechanics National Bank of the City of New York,8000320.0
Bank of Philadelphia,Former Bank/Trust Company,18880000,Bank of Philadelphia,
Korea Exchange Bank,Foreign Branches,19670906,Foreign Exchange Bank of Korea,
"Chase Manhattan Bank of Mid-Hudson, N.A.",Former Bank/Trust Company,19960714,"Chase Manhattan Bank, The",
Emigrant Mercantile Bank,Savings Banks,20121231,Emigrant Savings Bank - Brooklyn/Queens,270063.0
Ocean Hill Community Counsel Credit Union,Former Credit Union,19740509,Ocean Hill Community Counsel Credit Union,
Commercial Exchange Bank of New York,Former Bank/Trust Company,19620101,First National City Bank,
"Hokkaido Bank, Ltd., The",Foreign Branches,19880406,"Hokkaido Bank, Ltd., The",
State Trust Company of North Tonawanda,Former Bank/Trust Company,19800201,"Marine Midland Bank, N.A.",8500023.0
Watervliet Teachers Credit Union,Former Credit Union,19441125,,
Law Debenture Trust Company,Limited Purpose Trust Company,20020508,Law Debenture Trust Company,
Chemical Bank,Trust Company,19780929,Chemical Bank of Rochester,80.0
Security Trust Company,Former Bank/Trust Company,19540801,Farmers' & Mechanics' Trust Company,8000061.0
"Standard Trust Company of New York, The",Trust Company,19590424,Morgan Guaranty Trust Company of New York,
"Yasuda Trust and Banking, Ltd., The",Foreign Representative Offices,20020327,"Mizuho Asset Trust & Banking Co., Ltd.",
Safety Building-Loan & Savings Assoc of Albany,Former Savings and Loan,19450000,,
Frontier City Savings & Loan Association,Former Savings and Loan,19310117,Frontier City Savings & Loan Association,
Cassa di Risparmio Delle Provincie Lombarde,Foreign Branches,19850831,Cassa di Risparmio Delle Provincie Lombarde,
Cutters Big Brothers Credit Union,Former Credit Union,19380428,Cutters Big Brothers Credit Union,
"Key Bank, N.A.",Trust Company,19471201,Rensselaer County Bank and Trust Company,8000194.0
Westchester Federal Savings Bank,Former Savings and Loan,20040630,HSBC Bank USA,
North Fork Bank,Trust Company,19910628,Eastchester Savings Bank,205003.0
Empire City Savings Bank,Former Savings Bank,19920612,Ridgewood Savings Bank,218004.0
Bank of Jamestown,Former Bank/Trust Company,19831216,"Key Bank of Western New York, N.A.",8500140.0
"Argentaria, Caja Postal y Banco Hipotecario, S.A.",Foreign Branches,19990203,"Argentaria, Caja Postal y Banco Hipotecario, S.A.",
Union Trust Company of Rochester,Bank,19991231,Republic Bank of New York,170040.0
Universal Savings Bank,Former Savings Bank,19920901,"Home Savings of America, Bowery Division, FSB",270018.0
First Trust Company of Allegany County,Former Bank/Trust Company,19570601,First Trust Company of Allegany County,
"Bank of Orange County, The",Former Bank/Trust Company,19880624,Norstar Bank of Upstate NY,
Liberty National Bank and Trust Company,Trust Company,19921001,Fleet Bank of New York,114025.0
JPMorgan Chase Bank,Trust Company,19960714,"Chase Manhattan Bank, N.A., The",5800033.0
"Chase Manhattan Bank, The (1799-9/1965)",Former Bank/Trust Company,19281001,"First Bank of Whitestone, The",8000394.0
Banco Union S.A.C.A.,Foreign Agencies,19750910,Banco Union C.A.,
Bowery National Bank of New York,Former Bank/Trust Company,19760000,"Citibank, N.A.",
First Bank & Trust Company of Utica (1940-1958),Former Bank/Trust Company,19991231,Republic Bank of New York,170040.0
American Deposit and Loan Company,Former Bank/Trust Company,19960714,Chemical Bank,103011.0
"First National Bank of Ardsley, The",Former Bank/Trust Company,19550101,"County Trust Company, The",8000239.0
"Brooklyn & NY Arcanum Blding,Loan & Savings Assoc",Former Savings and Loan,19800211,Bowery Savings Bank (5/1834-10/1985),8100165.0
Bingham State Bank,Former Bank/Trust Company,19291101,Genesee River National Bank of Mt. Morris,8500094.0
First National Bank of Allegany,Former Bank/Trust Company,19621201,First National Bank of Olean,140.0
National Nassau Bank of New York,Former Bank/Trust Company,19140601,Irving National Bank,45.0
Irving Trust Company (11/1917-3/1920),Former Bank/Trust Company,19180301,Market and Fulton National Bank of New York,8500190.0
"Chase Lincoln First Bank, National Association",Former Bank/Trust Company,19930101,"Chase Manhattan Bank, N.A., The",5800033.0
Food Dealers Industrial Bank,Former Bank/Trust Company,19611201,Central State Bank,
"Windsor Bank, The",Former Bank/Trust Company,19270000,"Windsor Bank, The",
Bank of New South Wales,Former Foreign Agency,19800000,,
First Trust Company of Albany,Trust Company,19730228,Montgomery County Trust Company,8000260.0
"State Bank of Seneca Falls, N.Y.",Former Bank/Trust Company,19840401,Security Trust Company of Rochester,8000254.0
IBJ Schroder Bank & Trust Company,Trust Company,19861222,IBJ Schroder Bank & Trust Company,
Bank of Worcester,Former Bank/Trust Company,19930826,Key Bank of New York,
Fleet Bank (6/92-6/94),Trust Company,19870918,Norstar Bank,
First National Bank & Trust Company of Freeport,Former Bank/Trust Company,19570201,"Bank of Malverne, The",8000247.0
Chemical Bank New York Trust Company,Trust Company,19751110,"Chemical Bank of Suffolk, N.A.",75.0
Marine Midland Trust Company of Western New York,Bank,19360102,Bank of East Aurora,8000494.0
Macy Employees Credit Union,Former Credit Union,19471105,,
Columbia - Knickerbocker Trust Cc.,Trust Company,19230207,Irving Bank-Columbia Trust Co.,
OFI Trust Company,Limited Purpose Trust Company,20130501,OFI Global Trust Company,
"New York Bank For Savings, The",Savings Banks,19910531,,
Albank Commercial,Bank,19990528,"Charter One Bank, F.S.B.",218011.0
Lasco Credit Union,Former Credit Union,19410307,Lasco Credit Union,
Hide and Leather National Bank in New York,Former Bank/Trust Company,19030201,Western National Bank of the U.S. in New York,
"Bank of Long Island, N.A.",Former Bank/Trust Company,19971113,Fleet Bank N.A.,5801998.0
"Western Union Financial Holdings, L.L.C.",Investment Company (Article XII),20060928,"Western Union Financial Holdings, L.L.C.",
Geneva Permanent Loan & Saving Association,Former Savings and Loan,19371001,Geneva Federal Savings & Loan Association,
United National Bank in New York,Trust Company,19280301,United Capitol National Bank & Trust Co of NY,
M & T Trust Company,Trust Company,20071130,Partners Trust Municipal Bank,108004.0
First State Bank of Spring Valley,Former Bank/Trust Company,19821101,"Barclays Bank of New York, N.A.",5800003.0
Port Richmond Co-Operative Savings & Loan Assoc,Former Savings and Loan,19710101,Northfield Savings Bank (1/71-6/83),270017.0
Irving Trust Company,Trust Company,20080701,Mellon Securities Trust Company,113054.0
Trust and Deposit Company of Onondaga,Former Bank/Trust Company,19570401,"First National Bank of Morrisville, The",8500093.0
Mechanics' Bank of the City of New York,Former Bank/Trust Company,19260401,Chase National Bank of the City of New York,8500003.0
Marine Midland Bank Trust Company of Southern NY,Bank,18530000,Elmira Bank,
"First National Bank of Ardsley, The",Former Bank/Trust Company,19891006,"Bank of New York, The",
Nordic Banking Corporation,Investment Company (Article XII),19750610,Nordic American Banking Corporation,
"Nippon Fudosan Bank, Limited, The",Foreign Representative Offices,20010104,"Aozora Bank, Ltd.",
State Bank of Victoria,Foreign Agencies,19850711,Commissioners of the State Bank of Victoria,
"Chase Lincoln First Bank, National Association",Former Bank/Trust Company,19790101,First-City National Bank of Binghamton,8500269.0
American Deposit and Loan Company,Former Bank/Trust Company,18710000,Traders Deposit Company,
General Electric Credit Corporation,Investment Company (Article XII),19871116,General Electric Capital Corporation,
Postal Employees Credit Union,Credit Unions,19950525,Postal Employees Credit Union,
Bank of Orchard Park,Former Bank/Trust Company,19940701,Fleet Bank,
Marine Midland Bank - Western,Bank,19800201,"Marine Midland Bank, N.A.",8500023.0
"National Union Bank of New York, The",Former Bank/Trust Company,19290504,Guaranty Trust Company of New York,113026.0
Central Trust Company of New York,Bank,18730000,Central Trust Company of New York,
Nassau County Trust Company,Former Bank/Trust Company,20010717,Citibank N. A.,4400000.0
Oswego County Trust Company,Former Bank/Trust Company,19530101,Syracuse Trust Company,5000015.0
Bank of Syosset,Former Bank/Trust Company,19531201,Hempstead Bank,8000262.0
Nassau Trust Company,Former Bank/Trust Company,19870918,Norstar Bank,
Marine Midland Trust Company of the Mohawk Valley,Former Bank/Trust Company,19400906,First Citizens Bank & Trust Company of Utica,8000473.0
Niagara County Bank,Former Bank/Trust Company,19990329,HSBC Bank USA,
Citizens Bank of Monroe,Former Bank/Trust Company,19920619,Chemical Bank,103011.0
Heritage Savings Bank,Former Savings Bank,19790430,Albany Savings Bank,8100002.0
"Sherman National Bank of New York, The",Former Bank/Trust Company,19260917,Irving Bank and Trust Company,
Banco Credito y Ahorro Ponceno,Former Foreign Agency,20000616,,
"Schoharie County Bank, The",Former Bank/Trust Company,19880624,Norstar Bank of Callicoon,114025.0
Profit Loan Association,Former Savings and Loan,19360000,Profit Savings & Loan Association,
Fallkill Bank,Former Bank/Trust Company,19680201,State of New York National Bank,
Rensselaer County Bank and Trust Company,Former Bank/Trust Company,19471201,Natl Commercial Bank & Trust Company of Albany,170007.0
Svenska Handelsbanken PLC,Foreign Branches,19870508,Svenska Handelsbanken,
Central National Bank of Yonkers,Former Bank/Trust Company,19290000,Central National Bank of Yonkers,
Garden City Bank and Trust Company,Former Bank/Trust Company,19891006,Irving Trust Company,102015.0
275 Broadhollow Road Bank,Bank,20070801,New Commercial Bank of New York LLC,
Monte Dei Paschi di Siena,Foreign Branches,19830204,Monte Dei Paschi di Siena,
Mohawk Bank of Schenectady,Former Bank/Trust Company,19880624,Norstar Bank of Upstate NY,
"Citizens Bank of Penn Yan, The",Former Bank/Trust Company,18990000,"Citizens Bank of Penn Yan, The",
Gjensidige NOR Sparebank ASA,Foreign Branches,20040119,Den Norske Bank ASA,504010.0
Chemical Bank New York Trust Company,Trust Company,18650000,Chemical National Bank of New York,
Scandinavian Savings & Loan Association,Former Savings and Loan,18871023,Scandinavian Building & Mutual Loan of NY & Bklyn,
Marine Midland Bank - Northern,Bank,19991231,Republic Bank of New York,170040.0
"Niagara Frontier Federal Employees Credit Union,",Credit Unions,19310205,Niagara Falls Federal Employees Credit Union,
"Marine National Bank of Buffalo, The",Bank,19510401,State Trust Company of North Tonawanda,8000177.0
Banco de la Ciudad de Buenos Aires,Foreign Representative Offices,19990827,Banco de la Ciudad de Buenos Aires,
First Savings Bank of Port Washington,Former Savings and Loan,19800701,"Dime Savings Bank of New York, The",8100047.0
Ogdensburg Trust Company,Former Bank/Trust Company,19880624,Norstar Bank of Upstate NY,
"Homestead Aid Association of Whitestown, NY",Former Savings and Loan,18830403,"Homestead Aid Association of Whitestown, New York",
Highland Savings & Loan Association,Former Savings and Loan,19620101,Savings & Loan Association of Kingston,8200100.0
Plaza Credit Union of Corona,Credit Unions,19790409,Central Credit Union,460301.0
Seventh Ward National Bank of New York,Former Bank/Trust Company,18330000,Seventh Ward Bank,
"UniCredit Banca di Roma, S.p.A.",Foreign Branches,20020701,Banca di Roma S.p.A.,
Morris Plan Company of Albany,Trust Company,19840926,,
Credit Agricole Indosuez,Foreign Branches,19800112,,
Oneida Federal Savings & Loan Association,Former Savings and Loan,19820630,"Albany Savings Bank, FSB",
Record Newspaper Credit Union,Former Credit Union,19380628,Record Newspaper Credit Union,
First National Bank & Trust Company of Freeport,Former Bank/Trust Company,19490000,Meadow Brook National Bank of Freeport,
Morris Plan Company of Syracuse,Former Bank/Trust Company,19720101,"Lincoln First Bank-Central, N.A.",
National Bank of Bay Ridge in New York,Former Bank/Trust Company,19620101,First National City Bank,
Irving National Bank of New York,Former Bank/Trust Company,19891006,"Bank of New York, The",
"German-American Bank of Buffalo, NY",Former Bank/Trust Company,19620301,Bank of Orchard Park,8000264.0
"Bank of Kyoto, Ltd., The",Foreign Branches,19880809,"Bank of Kyoto, Ltd., The",
Irving Trust Company,Trust Company,19961201,"Bank of New York (NJ), The",5800990.0
"Meadow Brook National Bank, The",Former Bank/Trust Company,19550401,Bank of New Hyde Park,8000168.0
"Sullivan County Trust Company, The",Former Bank/Trust Company,19630401,National Bank & Trust Company of Port Jervis,8500110.0
Manufacturers Hanover Trust Company/Mid-Hudson,Former Bank/Trust Company,19920619,Chemical Bank,103011.0
South Bay Bank,Former Bank/Trust Company,19490630,South Bay Bank,
Greenwich Bank of the City of New York,Former Bank/Trust Company,20041113,"JPMorgan Chase Bank, National Association",
Chohung Bank of New York,Bank,20071130,North Atlanta National Bank,5801220.0
J. Henry Schroder Banking Corporation,Trust Company,19861222,IBJ Schroder Bank & Trust Company,
Marine Midland Bank - Rochester,Bank,19931231,Marine Midland Bank,5800183.0
Citizens Trust Company of Adams,Former Bank/Trust Company,19630601,Marine Midland Trust Company of Northern New York,
Profit Savings & Loan Association,Former Savings and Loan,19390624,Profit Federal Savings & Loan Association,
Mamaronneck Co-Operative Savings & Loan Assoc,Former Savings and Loan,18901224,Mamaronneck Co-Operative Savings & Loan Assoc,
"Nippon Fudosan Bank, Limited, The",Foreign Representative Offices,20020930,,
Frontier Permanent Building & Loan Assoc,Former Savings and Loan,18881001,Frontier Permanent Building & Loan Assoc,
Nyack Bank and Trust Company,Former Bank/Trust Company,19691201,"Marine Midland Bank of Southeastern N.Y., N.A.",
First Farmers' Savings & Loan Association,Former Savings and Loan,19140812,First Farmers' Savings & Loan Association,
Mutual Benefit Life Policy Loan & Trust Co. of NY,Trust Company,19260917,Irving Bank and Trust Company,
First Citizens Bank & Trust Company of Utica,Former Bank/Trust Company,19991231,Republic Bank of New York,170040.0
"First National Bank of Morrisville, The",Former Bank/Trust Company,19880101,"Key Bank of Central N.Y., N.A.",8500171.0
First National Bank of Silver Creek,Bank,19571129,Manufacturers and Traders Trust Company,113003.0
Nordbanken,Foreign Branches,19951229,Nordbanken AB,2214006.0
Manufacturers' Trust Company (1895-1903),Former Bank/Trust Company,18950000,Manufacturers' Trust Company (1895-1903),
Utica National Bank and Trust Company,Former Bank/Trust Company,20040630,HSBC Bank USA,
Bank of East Aurora,Former Bank/Trust Company,19991231,HSBC Bank USA,
American Bank & Trust Company,Trust Company,19290000,"Harbor State Bank, The",
Great Neck Trust Company,Former Bank/Trust Company,19150000,Bank of Nassau County,
College Point Savings Bank,Savings Banks,19851231,"Home Savings Bank, The",
First Natl Bank of Staten Island at New Brighton,Former Bank/Trust Company,20041113,"JPMorgan Chase Bank, National Association",
Nordea Bank Finland Plc,Foreign Branches,20011221,Nordea Bank Finland Plc,
Central Valley National Bank,Former Bank/Trust Company,19110000,Central Valley National Bank,
First Trust Company of Allegany County,Former Bank/Trust Company,19851201,Norstar Bank (Rochester),
Habib American Bank,Trust Company,19831107,Habib American Bank,
Church Lane Savings Bank,Former Savings Bank,19250000,Church Lane Savings Bank,
Manhattan Savings Bank,Savings Banks,19900502,Manhattan Savings Bank (5/42-5/90),213.0
Bank of Southold,Former Bank/Trust Company,20070801,"Capital One, N.A.",5801214.0
"Valley National Bank, Wallkill, NY, The",Former Bank/Trust Company,19930826,Key Bank of New York,
"Hongkong and Shanghai Banking Corporation, The",Foreign Representative Offices,19731130,,
Bangkok Metropolitan Bank Public Limited Company,Foreign Agencies,19960823,,
Mitsubishi Trust & Banking Corporation (U.S.A.),Trust Company,20160919,,
Liberty Savings & Loan Association,Former Savings and Loan,19200000,Liberty Savings & Loan Association,
Key Bank,Former Bank/Trust Company,19730101,Bankers Trust Company of Western New York,
Commercial Trust Company (1884-1900),Trust Company,20080701,"Bank of New York Mellon, The",
Italian American Trust Company,Former Bank/Trust Company,19090000,Savoy Trust Company,
People's Bank For Savings of New Rochelle,Savings Banks,19881012,River Bank America,
New York Exchange Bank in the City of New York,Trust Company,19070201,Irving National Exchange Bank of New York,
"Bankers Trust Company of Albany, N.A.",Trust Company,19670701,North Creek National Bank,8000175.0
Longacre Bank,Former Bank/Trust Company,20041113,"JPMorgan Chase Bank, National Association",
"New York Trust Company, The",Former Bank/Trust Company,19040301,"New York Trust Company, The",
"Nippon Fudosan Bank, Limited, The",Foreign Representative Offices,19770120,"Nippon Fudosan Bank, Limited, The",
Knickerbocker Trust Company,Trust Company,19140801,Columbia Trust Company,
"Mega International Commercial Bank Co., Ltd.",Foreign Branches,19360402,Bank of China,
"Multibanco Comermex, S.A.",Foreign Agencies,19790503,,
