Institution Name Primary,Identification Number Primary,Type,Event Type
New-York Dry Dock Company,8000350,Former Bank/Trust Company,Bnk Business To
"Saitama Bank, Ltd., The",570111,Foreign Branches,Name Change To
Central Hudson Employees Federal Credit Union,5800628,Credit Unions,Convert Federal
National Bank and Loan Company of Watertown,8500177,Former Bank/Trust Company,Name Change To
Cho Hung Bank,2203014,Foreign Representative Offices,Closed
Seaboard Natl Bank of the City of NY (3/22-6/29),8000321,Former Bank/Trust Company,Name Change To
Atlas Savings and Loan Association,301007,Savings & Loans,NYS Chartered
National Bank and Loan Company of Watertown,8500177,Former Bank/Trust Company,Established
Center Moriches Bank,8000078,Former Bank/Trust Company,Name Change To
"Goldome, FSB",207008,Savings Banks,Name Change To
Citizens Trust Company of Brooklyn,113004,Trust Company,Acquire By Merger
Highland-Quassaick Nat Bnk & Trust Co of Newburgh,8500150,Former Bank/Trust Company,Name Change To
Greene County Savings Bank,207006,Savings Banks,Established
Electric City Bank,8000460,Former Bank/Trust Company,Convert Federal
"CU of Employees Conference Committee, New York",461304,Credit Unions,Acquire By Merger
Trust and Deposit Company of Onondaga,8000223,Former Bank/Trust Company,Name Change To
Merchants National Bank in Plattsburg,8500109,Former Bank/Trust Company,Name Change To
Mohawk National Bank of Schenectady,8500121,Former Bank/Trust Company,Name Change To
Frontier National Bank of Buffalo,8500240,Former Bank/Trust Company,Name Change To
Wm. H. Seward & Co.,8000058,Former Bank/Trust Company,Merge To State
Bingham State Bank,8000463,Former Bank/Trust Company,Name Change To
"Union Bancaire Privee, CBI-TDB",2203000,Foreign Representative Offices,Licensed
Armour 120 Broadway Credit Union,8300053,Former Credit Union,Acquire By Merger
National Citizens Bank of the City of New York,8000333,Former Bank/Trust Company,Name Change To
Oneonta Savings & Loan Association,8200091,Former Savings and Loan,Convert Federal
"Home Savings of America, FSB-NY",270027,Savings Banks,Name Change To
Republic Bank of New York,170040,Trust Company,Established
Irving Trust Company,102015,Trust Company,Acquire By Merger
"Mid-Hudson Savings Bank, FSB",8600001,Former Savings Bank,NYS Chartered
Deutsche Bank Trust Company,5000020,Limited Purpose Trust Company,Convert Federal
"Mutual Bank, The",8000323,Former Bank/Trust Company,Established
National Bank and Loan Company of Watertown,8500177,Former Bank/Trust Company,Convert Federal
Food Dealers Credit Union,8300334,Former Credit Union,Closed
American Savings and Loan Association,301003,Savings & Loans,Liquidated
Mercantile Trust Company,8000321,Former Bank/Trust Company,Convert Federal
Osborne Trust Company,8000096,Former Bank/Trust Company,Merge To Federal
Globe Exchange Bank,8000429,Former Bank/Trust Company,Acquire By Merger
"Mega International Commercial Bank Co., Ltd.",609004,Foreign Branches,Acquire By Merger
Standard Chartered Bank Limited,519004,Foreign Branches,Name Change To
Coal & Iron National Bank of the City of New York,8000375,Former Bank/Trust Company,Name Change To
"Mutual Bank, The",8000323,Former Bank/Trust Company,Merge To Federal
"Suffolk County Trust Company, The",8000197,Former Bank/Trust Company,Merge To Federal
"Haitong Bank, S.A.",570351,Foreign Branches,Name Change To
Capital National Bank & Trust Company of New York,8500208,Former Bank/Trust Company,Convert Federal
Central Hanover Bank and Trust Company,137,Bank,Convert Federal
Glen Cove Nassau Union Trust Company,8000108,Former Bank/Trust Company,Merge To Federal
Manufacturers Hanover Trust Company/Central NY,8500152,Former Bank/Trust Company,Established
JPMorgan Chase Bank,103011,Trust Company,Acquire By Merger
Security National Bank of Long Island,74,Bank,Name Change To
Syracuse Savings Bank,114035,Savings Banks,Name Change To
Oneida County Trust Company,8000473,Former Bank/Trust Company,Name Change To
"Bank of Greene County, The",207006,Savings Banks,Name Change To
Commercial Trust Company (1884-1900),102015,Trust Company,Acquire By Merger
Savoy Trust Company,8000380,Former Bank/Trust Company,Name Change To
"Fidelity Trust Company of Buffalo, The",113003,Trust Company,Acquire By Merger
Eleventh Ward Bank,8000342,Former Bank/Trust Company,Name Change To
"First Trust Company of Albany, N.A.",170006,Trust Company,Convert Federal
Central Natl Bank of the City of NY (1926-1930),8000396,Former Bank/Trust Company,Merge To State
Church Lane Savings Bank,8100157,Former Savings Bank,Name Change To
Baldwin's Bank of Penn Yan,8000250,Former Bank/Trust Company,Name Change To
Albany County Savings Bank,270011,Savings Banks,Name Change To
Farmers National Bank of Adams,8500252,Former Bank/Trust Company,Name Change To
Security National Bank of Huntington,74,Bank,Merge To State
Industrial Bank of New York,113,Bank,Name Change To
Mechanics National Bank of the City of New York,8000320,Former Bank/Trust Company,Name Change To
Norstar Bank of Central N.Y.,114035,Savings Banks,Name Change To
"National Commercial Bank of New York, The",8500200,Former Bank/Trust Company,Name Change To
State Bank of Churchville,8000081,Former Bank/Trust Company,Name Change To
"National City Bank of New York, The",4400000,Trust Company,Acquire By Merger
Cazenovia National Bank,8500036,Former Bank/Trust Company,Convert Federal
Bank of Ellicottville,104,Bank,Merge To State
"Home Bank, The",8000346,Former Bank/Trust Company,Name Change To
American Express Credit Union,8300050,Former Credit Union,NYS Chartered
Rome City Bank,8000202,Former Bank/Trust Company,Established
Jefferson Savings & Loan Association,8200072,Former Savings and Loan,Merge To State
Banco Central of New York,102040,Trust Company,Name Change To
Excelsior Empire Savings Bank,270020,Savings Banks,Name Change To
Emigrant Mercantile Bank,205007,Savings Banks,Name Change To
Insurance Credit Union,8300340,Former Credit Union,NYS Chartered
Farmers' & Mechanics' SB of the City of Lockport,212002,Savings Banks,Acquire By Merger
First Federal S & L Assoc of Niagara County,370004,Savings & Loans,Convert State
Columbia - Knickerbocker Trust Cc.,102015,Trust Company,Name Change To
Progressive Alliance Credit Union,461605,Credit Unions,NYS Chartered
Fallkill National Bank & Trust Co of Poughkeepsie,8500153,Former Bank/Trust Company,Convert Federal
Morton Trust Company (1899),8000369,Former Bank/Trust Company,Name Change To
Orleans County Co-Operative Savings & Loan Assoc,8200251,Former Savings and Loan,NYS Chartered
Seaboard Natl Bank of the City of NY (3/22-6/29),8000321,Former Bank/Trust Company,Converted To
"First National Bank of Whitestone, The",8000394,Former Bank/Trust Company,Name Change To
Den Norske Bank (U.S.) Banking Corporation,704002,Investment Company (Article XII),Name Change To
Bank Muamalat Malaysia Berhad,502021,Foreign Branches,Name Change To
Nordea Bank Finland Plc,570324,Foreign Branches,Acquire By Merger
Chemical Bank New York Trust Company,103011,Trust Company,Acquire By Merger
ICE Trust U.S. LLC,5100014,Limited Purpose Trust Company,Convert Federal
General Electric Credit Corporation,707001,Investment Company (Article XII),Name Change To
Northfield Savings Bank,270025,Savings Banks,Acquire By Merger
"Key Bank of Eastern New York, NA",170007,Trust Company,Acquire By Merger
Polish Co-Operative Savings & Loan Assocaiation,8200172,Former Savings and Loan,Liquidated
Security Trust Company,8000254,Former Bank/Trust Company,Acquire By Merger
Central Trust Company,103008,Trust Company,Acquire By Merger
Bank of North America (10/58-5/67),8000029,Former Bank/Trust Company,Name Change To
"Rome Savings Bank, The",218007,Savings Banks,Convert Federal
Rockland County Trust Company,8000500,Former Bank/Trust Company,Name Change To
Arcadia Bank,8000454,Former Bank/Trust Company,NYS Chartered
Security National Bank,74,Bank,Established
Garden City Bank,8000107,Former Bank/Trust Company,Name Change To
New York Private Bank & Trust,205007,Savings Banks,Name Change To
Chatham & Phenix National Bank of New York,8500206,Former Bank/Trust Company,Convert Federal
"Herkimer County Trust Company, The",108004,Trust Company,Name Change To
First State Bank of Oriskany Falls,8000511,Former Bank/Trust Company,Name Change To
"Citizens State Bank, Lyndonville",8000153,Former Bank/Trust Company,Merge To State
Northfield Savings Bank (1/71-6/83),270017,Savings Banks,Name Change To
Matinecock Bank of Locust Valley,8000147,Former Bank/Trust Company,Merge To State
Corning Savings & Loan Association,8200032,Former Savings and Loan,Convert Federal
Adirondack National Bank & Trust Co Saranac Lake,8500117,Former Bank/Trust Company,Name Change To
Trust Company of America (5/1905-2/1912),8000299,Former Bank/Trust Company,Acquire By Merger
Ithaca Savings Bank,270021,Savings Banks,Name Change To
Patchogue Citizens Bank & Trust Company,8000248,Former Bank/Trust Company,Acquire By Merger
"Key Bank of Eastern New York, NA",170007,Trust Company,Acquire By Merger
Oswego County National Bank,8500165,Former Bank/Trust Company,Merge To State
Lloyds TSB Bank plc,512001,Foreign Branches,Name Change To
"Bank of Tokyo - Mitsubishi, Ltd., The",513001,Foreign Branches,Acquire By Merger
Fallkill Bank and Trust Company,8500153,Former Bank/Trust Company,Convert Federal
Skaneateles Savings Bank,219009,Savings Banks,NYS Chartered
Fidata Trust Company New York,106050,Trust Company,NYS Chartered
Salamanca Trust Company,119001,Trust Company,Acquire By Merger
Bank of New South Wales,9000075,Former Foreign Agency,Licensed
"German American Bank, The",8000016,Former Bank/Trust Company,Acquire By Merger
Manufacturers Bank of Brooklyn,109,Bank,Name Change To
First Federal Savings & Loan Assoc of Kingston,8200276,Former Savings and Loan,NYS Chartered
Geneseo Valley Bank,8500062,Former Bank/Trust Company,Name Change To
New Paltz Savings Bank,209002,Savings Banks,Merge To Federal
Citizens Bank of Arcade,72,Bank,Acquire By Merger
American National Bank of Jamestown,8500249,Former Bank/Trust Company,Convert State
Commercial Exchange Bank of the City of New York,8500218,Former Bank/Trust Company,Name Change To
Highland National Bank & Trust Co of Newburgh,8500150,Former Bank/Trust Company,Established
Bedford Bank,8000416,Former Bank/Trust Company,Established
New York Edison Savings & Loan Association,8200037,Former Savings and Loan,Convert Federal
Lincoln-Alliance Bank and Trust Company,8000199,Former Bank/Trust Company,Name Change To
Corn Exchange Bank Trust Company,8000017,Former Bank/Trust Company,Name Change To
First National Bank of Olean,140,Trust Company,Acquire By Merger
Fidelity Trust Company,5000013,Bank,Name Change To
Irving National Exchange Bank of New York,45,Trust Company,Name Change To
Manufacturers' Trust Company (1895-1903),8000440,Former Bank/Trust Company,Established
Commercial Exchange Bank of the City of New York,8500218,Former Bank/Trust Company,Name Change To
"Western New York Savings Bank, The",176,Savings Banks,Convert Federal
Geneseo Valley Bank,8500062,Former Bank/Trust Company,Merge To State
First Federal Savings & Loan Association,8200067,Former Savings and Loan,Convert Federal
"Lincoln First Bank-Central, N.A.",8500128,Former Bank/Trust Company,Acquire By Merger
"First Trust Company of Albany, N.A.",170006,Trust Company,Acquire By Merger
Liberty Bank of Buffalo,8000072,Former Bank/Trust Company,Name Change To
Commercial Trust Company of Buffalo,8000472,Former Bank/Trust Company,Acquire By Merger
Westchester County Savings Bank,216004,Savings Banks,Acquire By Merger
Bank of Baroda,502024,Foreign Branches,Licensed
Bergen Bank A/S,504010,Foreign Branches,Merge To State
Northfield Bank,270025,Savings Banks,Convert State
Liberty Bank and Trust Company,8000072,Former Bank/Trust Company,Acquire By Merger
Natexis Banque Populaires,502032,Foreign Branches,Name Change To
Co-Op Home Savings & Loan Assoc of Spring Valley,8200030,Former Savings and Loan,Acquire By Merger
Tri-Boro Stationers Credit Union,8300224,Former Credit Union,Liquidated
Sycamore & Johnson Savings & Loan Association,8200029,Former Savings and Loan,NYS Chartered
Broadway Bank,8500188,Former Bank/Trust Company,Name Change To
Nyack Savings & Loan Association,8200088,Former Savings and Loan,Name Change To
Italian American Trust Company,8000380,Former Bank/Trust Company,Convert Federal
Marine Midland Bank - Western,5000014,Bank,Acquire By Merger
"Bancomer, S.N.C.",602020,Foreign Agencies,Name Change To
Walton Co-Operative Savings & Loan Association,8200120,Former Savings and Loan,Convert Federal
Bank of New York and Trust Company,8000241,Former Bank/Trust Company,Name Change To
Bowling Green Trust Company,8000301,Former Bank/Trust Company,Merge To State
Ramapo Trust Company,8000220,Former Bank/Trust Company,Name Change To
Niagara County Bank,8500085,Former Bank/Trust Company,Name Change To
Knickerbocker Trust Company,44,Trust Company,Name Change To
Seaboard Bank of the City of New York,8000321,Former Bank/Trust Company,Established
Kyowa Saitama Bank Trust Company of New York,170008,Trust Company,Name Change To
Liberty National Bank & Trust Co. of Syracuse,8500237,Former Bank/Trust Company,Merge To State
Austrian Hungarian Credit Union,460601,Credit Unions,Merge To State
United National Bank in New York,120,Trust Company,Merge To State
Orleans Savings Bank,8100068,Former Savings Bank,NYS Chartered
"Long Island Trust Company, N.A.",8000107,Former Bank/Trust Company,Name Change To
Chase Trust Company,170075,Trust Company,NYS Chartered
National Bank of Canada,2214004,Foreign Representative Offices,Licensed
Rome Municipal Employees Credit Union,8300254,Former Credit Union,Convert Federal
Highland National Bank & Trust Co of Newburgh,8500150,Former Bank/Trust Company,Acquire By Merger
Sayville Bank and Trust Company,8000208,Former Bank/Trust Company,Name Change To
"Key Bank of Western New York, N.A.",8500140,Former Bank/Trust Company,Acquire By Merger
Sag Harbor Savings Bank,270003,Savings Banks,Merge To State
Buffalo Teachers Federation Credit Union,8300074,Former Credit Union,NYS Chartered
Rye Trust Company,8000206,Former Bank/Trust Company,Merge To Federal
"Long-Term Credit Bank of Japan, Limited, The",2270171,Foreign Representative Offices,Name Change To
Groveland State Bank,8000116,Former Bank/Trust Company,Name Change To
Citizens' Central National Bank of New York,8000333,Former Bank/Trust Company,Convert Federal
"Fleet Bank of New York, N.A.",170048,Trust Company,Name Change To
Greenwich Savings & Loan Association,8200060,Former Savings and Loan,NYS Chartered
First Citizens Bank & Trust Company of Utica,8000473,Former Bank/Trust Company,Acquire By Merger
UMB Bank and Trust Company,170036,Trust Company,Name Change To
Varick Bank of New York,8000373,Former Bank/Trust Company,Merge To State
Irving Trust Company (11/1917-3/1920),8500186,Former Bank/Trust Company,Name Change To
Marine Midland National Bank of Southeastern NY,1170005,Former Bank/Trust Company,Acquire By Merger
Eighth Avenue Bank,8000308,Former Bank/Trust Company,Merge To State
Saratoga National Bank of Saratoga Springs,8500118,Former Bank/Trust Company,Merge To Federal
Security Savings & Loan Association of Buffalo,8200176,Former Savings and Loan,Merge To State
Granite National Bank of Brooklyn in New York,8500234,Former Bank/Trust Company,Name Change To
"Industrial Bank of Japan, Limited, The",509002,Foreign Branches,Licensed
Ithaca Savings Bank,270021,Savings Banks,NYS Chartered
FNS Bank of New York,106046,Trust Company,Merge To Federal
"Rondout National Bank of Kingston, The",8500100,Former Bank/Trust Company,Merge To State
"UniCredit Banca di Roma, S.p.A.",570329,Foreign Branches,Closed
Third National Bank of the City of New York,8500228,Former Bank/Trust Company,Name Change To
Credit Lyonnais,503006,Foreign Branches,Licensed
"Mattituck Bank, The",8500089,Former Bank/Trust Company,Sav Bnk To Trust
Roosevelt Savings Bank of the City of New York,218009,Savings Banks,Name Change To
Village Savings Bank,222001,Savings Banks,Name Change To
Credit Agricole Indosuez,502028,Foreign Branches,Licensed
Pacific Bank,8500193,Former Bank/Trust Company,Convert Federal
Christiania Bank OG Kreditkasse ASA,503019,Foreign Branches,Name Change To
Marine Midland Trust Company of Cortland,8000088,Former Bank/Trust Company,Name Change To
Natl Commercial Bank & Trust Company of Albany,170007,Trust Company,Acquire By Merger
"Columbia Banking, Savings & Loan Association",8200027,Former Savings and Loan,Acquire By Merger
"Chemical Bank of Suffolk, N.A.",75,Bank,Name Change To
"Chase Manhattan Bank, The (1799-9/1965)",8000257,Former Bank/Trust Company,Acquire By Merger
Security Trust Company of Rochester,8000254,Former Bank/Trust Company,Acquire By Merger
Saugerties Co-Operative Savings & Loan Assoc,8200099,Former Savings and Loan,Name Change To
Amalgamated Bank,101003,Trust Company,Acquire By Merger
"Mutual Bank, The",8000323,Former Bank/Trust Company,Convert Federal
Yorkville Credit Union,8300342,Former Credit Union,Closed
American Bond and Mortgage Gurarantee Company,8000300,Former Bank/Trust Company,Name Change To
Williamsburg Savings Bank,213001,Savings Banks,Name Change To
New York Exchange Bank in the City of New York,45,Trust Company,Name Change To
Mount Morris Bank,8000349,Former Bank/Trust Company,Name Change To
Fair City Co-Operative Savings & Loan Assoc,8200041,Former Savings and Loan,Name Change To
Camillus Bank,8000075,Former Bank/Trust Company,Merge To State
M & T Trust Company,113003,Trust Company,Acquire By Merger
Fulton Trust Company of New York,8000024,Former Bank/Trust Company,Name Change To
"Southern National Bank of New York, The",8500196,Former Bank/Trust Company,Merge To State
Genesee River National Bank of Mt. Morris,8500094,Former Bank/Trust Company,Acquire By Merger
Fifth National Bank of the City of New York,117,Bank,Merge To State
Insurance Loan Trust Company,8000499,Former Bank/Trust Company,Name Change To
Tappan Zee National Bank of Nyack,76,Bank,Name Change To
Saitama Bank Trust Company of New York,170008,Trust Company,NYS Chartered
American Express Bank and Trust Company,8000297,Former Bank/Trust Company,Name Change To
Bank of America National Association,8500212,Former Bank/Trust Company,Merge To Federal
Institutional Investors Mutual Fund Inc.,5600005,NYS Regulated Corporations,Name Change To
Plaza Trust Company,8000337,Former Bank/Trust Company,Acquire By Merger
Fishkill Savings Bank,8100040,Former Savings Bank,Name Change To
Baldwin's Bank of Penn Yan,8000250,Former Bank/Trust Company,Merge To Federal
Rockland Savings Bank,8100115,Former Savings Bank,Established
Fulton Trust Company of New York,8000024,Former Bank/Trust Company,Name Change To
Businessmen's League Benevolent Credit Union,8300077,Former Credit Union,NYS Chartered
"North Fork Bank and Trust Company, The",170002,Trust Company,Merge To State
Inter-County Savings Bank,209002,Savings Banks,Acquire By Merger
First Trust and Deposit Company,8000223,Former Bank/Trust Company,Acquire By Merger
Empire State Trust Company,8000362,Former Bank/Trust Company,Name Change To
"First Trust Company of Albany, N.A.",170006,Trust Company,Acquire By Merger
Republic National Bank of New York,170040,Trust Company,Acquire By Merger
United Permanent Savings and Loan Association,13,Savings & Loans,NYS Chartered
Harbor State Bank,42,Trust Company,Bank To Trust Co.
Garden City Bank,8000107,Former Bank/Trust Company,Convert Federal
T.B.I. Credit Union,462001,Credit Unions,Name Change To
Alliance Bank,8000199,Former Bank/Trust Company,Name Change To
Drug Store Employees No. 1199 Credit Union,461202,Credit Unions,Name Change To
Town of New Utrecht Co-Op Building & Loan Assoc,8200005,Former Savings and Loan,NYS Chartered
Marine Midland Bank - Rochester,5000016,Bank,Acquire By Merger
Olean Savings & Loan Association,8200090,Former Savings and Loan,Merge To State
Marine Midland Bank - Southern,5000017,Bank,Name Change To
Lloyds Bank plc,512001,Foreign Branches,Licensed
IBJ Schroder Banking Corporation,109009,Trust Company,Acquire By Merger
Freehold Savings and Loan Association,8200160,Former Savings and Loan,Assets Sold To
Shell Eastern Head Office Credit Union,8300211,Former Credit Union,Liquidated
Gotham National Bank,116,Bank,Name Change To
Kensington Savings & Loan Association,8200287,Former Savings and Loan,Assets Sold To
Albany Exchange Savings Bank,8100038,Former Savings Bank,Merge To State
Broadway Savings Institution,8100018,Former Savings Bank,Merge To State
Hanover National Bank of the City of New York,8000271,Former Bank/Trust Company,Name Change To
Voorheesville Savings & Loan Association,8200118,Former Savings and Loan,Merge To State
"Peoples Bank of Potsdam, N.Y., The",8000190,Former Bank/Trust Company,Name Change To
"Manufacturers Hanover Trust Co./Western NY, N.A.",140,Trust Company,Acquire By Merger
Market Bank of New York,8500190,Former Bank/Trust Company,Name Change To
Yasuda Bank and Trust Company (U.S.A.),170037,Trust Company,Name Change To
"Wells, Fargo & Company's Bank",8000331,Former Bank/Trust Company,Convert Federal
Profit Federal Savings & Loan Association,8200209,Former Savings and Loan,NYS Chartered
Bowery and East River National Bank of New York,8500215,Former Bank/Trust Company,Acquire By Merger
Rose Hill Savings Bank,177,Savings Banks,Liquidated
Endicott National Bank,8500054,Former Bank/Trust Company,Name Change To
"Saitama Bank, Ltd., The",570111,Foreign Branches,Licensed
Central Park Savings Bank,8100072,Former Savings Bank,NYS Chartered
"Gunma Bank, Ltd., The",507004,Foreign Branches,Licensed
Mutual Trust Company (1929),8000360,Former Bank/Trust Company,Established
Elmira Bank & Trust Company,5000017,Bank,Name Change To
United States Savings Bank,8100134,Former Savings Bank,LID Sold To
Macy's Bank,113001,Bank,Closed
International Acceptance Trust Company,8000275,Former Bank/Trust Company,Name Change To
Tappan Zee National Bank,76,Bank,Name Change To
Industrial Bank of Commerce,149,Bank,Merge To State
State Bank of Bolivar,8000067,Former Bank/Trust Company,Company Sold To
Gotham National Bank,116,Bank,Convert Federal
Peekskill National Bank and Trust Company,8500104,Former Bank/Trust Company,Merge To State
Chemical Bank,103011,Trust Company,Acquire By Merger
Chenango Savings & Loan Association,8200025,Former Savings and Loan,Convert Federal
Bradford Trust Company (Limited Purpose Trust Co),106050,Trust Company,Liquidated
"BBVA Bancomer, S.A. Institution de Banca Multiple",602020,Foreign Agencies,Name Change To
Dexia Credit Local S.A.,603010,Foreign Branches,Licensed
"Nassau Bank, The",8500192,Former Bank/Trust Company,Name Change To
Security National Bank of Long Island,74,Bank,Name Change To
Amalgamated Bank,101003,Trust Company,NYS Chartered
Manufacturers and Traders Trust Company M&T Bank,113003,Trust Company,Name Change To
"Eastport National Bank, The",8500261,Former Bank/Trust Company,Merge To State
Rushville State Bank,8000205,Former Bank/Trust Company,Established
State Bank of Albany,8000267,Former Bank/Trust Company,Acquire By Merger
Guarantee Credit Union,8300331,Former Credit Union,Closed
Westerleigh Building Loan & Savings Association,8200127,Former Savings and Loan,Convert Federal
National City Bank of Brooklyn,8500189,Former Bank/Trust Company,Name Change To
Hudson Trust Company,8000365,Former Bank/Trust Company,Converted To
"Pacific National Bank of New York, The",8500193,Former Bank/Trust Company,Name Change To
Citizens Bank of Arcade,72,Bank,Name Change To
Morton Trust Company (1899),8000369,Former Bank/Trust Company,Name Change To
Nordic American Banking Corporation,704002,Investment Company (Article XII),Name Change To
Fleet Trust Company,114031,Subsidiary Trust Company,Merge To State
Union Bank of Finland,521007,Foreign Branches,Licensed
Sixth Avenue Bank of New York,40,Bank,Name Change To
Sumitomo Mitsui Banking Corporation,519006,Foreign Branches,Name Change To
Groveland State Bank,8000116,Former Bank/Trust Company,Convert Federal
State Bank of Bolivar,8000067,Former Bank/Trust Company,Established
Citizens Bank of Arcade,72,Bank,Merge To State
W.W.W.U. Local 65 Credit Union,8300405,Former Credit Union,Name Change To
"Clinton Bank, The",8000411,Former Bank/Trust Company,Name Change To
First Trust and Deposit Company,8000223,Former Bank/Trust Company,Merge To Federal
Hudson River Trust Company,8000127,Former Bank/Trust Company,Name Change To
Banco de Credito S.A.,2202005,Foreign Representative Offices,Revoked
Peoples Savings & Loan Association (Long Island),8200093,Former Savings and Loan,Acquire By Merger
Port Jervis Savings & Loan Association,8200044,Former Savings and Loan,Convert State
State Bank of Suffolk,8000062,Former Bank/Trust Company,Acquire By Merger
Nassau Union Bank,8500064,Former Bank/Trust Company,Merge To State
"Windsor National Bank, The",8500143,Former Bank/Trust Company,Convert Federal
Union Dime Savings Bank,175,Savings Banks,Name Change To
"Chemical Bank, The (1823-1865)",103011,Trust Company,Converted To
Northern New York Trust Company,5000018,Bank,Name Change To
"Citizens Trust Company of Patchogue, The",8000248,Former Bank/Trust Company,Established
M.I.A. Credit Union,8300285,Former Credit Union,NYS Chartered
National Bank and Loan Company of Watertown,8500177,Former Bank/Trust Company,Merge To State
Akron Safe Deposit Company,1701001,Safe Deposit Company,Licensed
Glen Cove Nassau Union Trust Company,8000108,Former Bank/Trust Company,Name Change To
Korea Commercial Bank of New York,5000008,Bank,NYS Chartered
Frontier City Savings & Loan Association,8200253,Former Savings and Loan,Name Change To
State Bank of Edwards and Star Lake,8000099,Former Bank/Trust Company,Acquire By Merger
"Citizens National Bank, The",2203009,Foreign Representative Offices,Name Change To
Key Trust Company,5801004,Subsidiary Trust Company,Acquire By Merger
State Bank of Albany,8000267,Former Bank/Trust Company,Acquire By Merger
