Institution Name Primary,Identification Number Primary,Type,Event Type
Carver Municipal Bank,5100010,Bank,Closed
"National Bank of Phelps, The",8500107,Former Bank/Trust Company,Name Change To
Oneida Savings Bank,215002,Savings Banks,Merge To Federal
Mercantile National Bank of the City of New York,8500187,Former Bank/Trust Company,Acquire By Merger
Speedwell Credit Union,8300258,Former Credit Union,Closed
Marine Midland Bank - Western,5000014,Bank,Name Change To
First Savings & Loan Association of Troy,8200049,Former Savings and Loan,Convert Federal
Wyoming County Bank,123002,Trust Company,Name Change To
Wayne County Trust Company,8000459,Former Bank/Trust Company,Convert State
Jackson Heights Savings & Loan Association,8200071,Former Savings and Loan,Acquire By Merger
Erie County Savings Bank,8100028,Former Savings Bank,Acquire By Merger
"Kelley, Drayton & Company Credit Union",8300335,Former Credit Union,NYS Chartered
Banque Nationale de Paris,502033,Foreign Branches,Licensed
Bank of Rockville Centre Trust Company,8000200,Former Bank/Trust Company,Name Change To
"Port Morris Bank, The",8000437,Former Bank/Trust Company,Name Change To
Natexis Banque Populaires,502032,Foreign Branches,Name Change To
Shoe and Leather Bank,8000322,Former Bank/Trust Company,Convert Federal
Progressive Credit Union,461605,Credit Unions,Acquire By Merger
"Banco Espirito Santo, S.A.",502073,Foreign Branches,Name Change To
Manufacturers Hanover Trust Company,113004,Trust Company,Acquire By Merger
National Bank of North America,8500008,Former Bank/Trust Company,Acquire By Merger
"Chase Manhattan Bank, The",103011,Trust Company,Succeeded By
"Toyo Trust & Banking Company, Limited, The",2270165,Foreign Representative Offices,Licensed
Marine Midland Grace Trust Company of New York,5000013,Bank,Acquire By Merger
Commercial State Bank & Trust Company of New York,8000029,Former Bank/Trust Company,Acquire By Merger
"Chemical Bank, The (1823-1865)",103011,Trust Company,Acquire By Merger
Five Star New York Trust Company,5100008,Limited Purpose Trust Company,NYS Chartered
Manufacturers Hanover Trust Company,113004,Trust Company,Acquire By Merger
Terminal Trust Company,8000356,Former Bank/Trust Company,Merge To State
Bank of Orchard Park,8000264,Former Bank/Trust Company,Merge To State
Cooperative Credit Union (1915-1957),8300300,Former Credit Union,Liquidated
"Citizens National Bank of Waverly, The",8500136,Former Bank/Trust Company,Merge To State
Lloyds Bank plc,512001,Foreign Branches,Name Change To
"Banco Mercantil, C.A.",602048,Foreign Agencies,Name Change To
The Royal Bank of Scotland N.V.,501001,Foreign Branches,Name Change To
"Key Bank of Central N.Y., N.A.",8000223,Former Bank/Trust Company,Convert Federal
"State Bank of Seneca Falls, N.Y.",8000215,Former Bank/Trust Company,Merge To State
Co-Operative Savings & Loan Assoc. of Hamburg,8200156,Former Savings and Loan,Convert Federal
Fordham Savings Bank,165,Savings Banks,Name Change To
International Banking Corporation,609003,Foreign Agencies,Licensed
Irving National Bank of New York,8500175,Former Bank/Trust Company,Name Change To
Oneida National Bank & Trust Co. of Central NY,8500131,Former Bank/Trust Company,Name Change To
Fleet Bank (6/92-6/94),114036,Trust Company,Merge To State
Saratoga Savings Bank,8100074,Former Savings Bank,Failed
Irving Bank in the City of New York,8500175,Former Bank/Trust Company,Name Change To
Sattlers Credit Union,470001,Credit Unions,Name Change To
Metropolitan Bank (1905-4/1906),8000319,Former Bank/Trust Company,Name Change To
State Bank of Palmyra,8000459,Former Bank/Trust Company,Merge To State
Chatham Phenix National Bank & Trust Company,126,Trust Company,Bank To Trust Co.
Marine Trust Company of Western New York,5000014,Bank,Name Change To
Merchants Exchange Natl Bank of the City of NY,8500213,Former Bank/Trust Company,Merge To Federal
Suffern National Bank and Trust Company,8500126,Former Bank/Trust Company,Merge To State
New Rochelle Trust Company,8000172,Former Bank/Trust Company,Merge To Federal
Oppenheimer Capital Trust Company,112012,Limited Purpose Trust Company,Name Change To
Lehigh Valley Employees Credit Union,8300148,Former Credit Union,Liquidated
Mercantile Trust & Deposit Company,8000321,Former Bank/Trust Company,Name Change To
Union Savings Bank of New York,8100132,Former Savings Bank,Merge To State
Freehold Savings and Loan Association,8200160,Former Savings and Loan,NYS Chartered
National Bank of Northern New York,8500133,Former Bank/Trust Company,Name Change To
Marine Midland Bank - Rochester,5000016,Bank,Convert Federal
Phoenix Bank,8500207,Former Bank/Trust Company,Merge To Federal
Marine Midland Bank - Western,5000014,Bank,Acquire By Merger
Seoul Bank,602030,Foreign Agencies,Merge To State
"Chase Manhattan Bank of Greater Rochester, N. A.",8500027,Former Bank/Trust Company,Merge To State
Broadway Trust Company,8500186,Former Bank/Trust Company,Merge To State
Jeff Bank,5000164,Bank,Conversion Of
Arkport State Bank,8000050,Former Bank/Trust Company,Merge To Federal
Nassau Trust Company,8000108,Former Bank/Trust Company,Name Change To
Erie Federal Savings & Loan Association,203,Savings & Loans,Name Change To
Onbank & Trust Co.,170001,Trust Company,Established
First Industrial Bank Rochester NY,8000484,Former Bank/Trust Company,Name Change To
Irving Trust Company (11/1917-3/1920),8500186,Former Bank/Trust Company,Acquire By Merger
Mechanics National Bank of the City of New York,8000320,Former Bank/Trust Company,Convert Federal
Silver Creek Co-Operative Savings & Loan Assoc.,8200150,Former Savings and Loan,Name Change To
"Banco Bilbao Vizcaya Argentaria, S.A.",502077,Foreign Branches,Formed/Merger of
East Brooklyn Savings and Loan Assocaition,316001,Savings & Loans,NYS Chartered
UFJ Bank Limited,519002,Foreign Branches,Merge To State
German Savings Bank of Morrisania,8100083,Former Savings Bank,Failed
"Hiram Maxfield State Bank, The",8000165,Former Bank/Trust Company,Merge To Federal
Coal and Iron Bank of the City of New York,8000375,Former Bank/Trust Company,Acquire By Merger
Credit Local de France - Caecl SA,603010,Foreign Branches,Name Change To
"Exchange Bank of Olean, The",8000184,Former Bank/Trust Company,Converted To
Emigrant Savings Bank of Buffalo,8100055,Former Savings Bank,Name Change To
Bankers Trust Company of Central New York,8000228,Former Bank/Trust Company,Merge To State
Great Neck Trust Company,8000115,Former Bank/Trust Company,Acquire By Merger
Manufacturers and Traders Trust Company M&T Bank,113003,Trust Company,Acquire By Merger
Citizens Trust Company of Fredonia,102,Trust Company,Merge To State
First Suffolk National Bank of Huntington,74,Bank,Name Change To
Republic Mase Bank Limited,513009,Foreign Branches,Licensed
Credito Italiano,503008,Foreign Branches,Licensed
Columbia Trust Company,102015,Trust Company,Purchase Branches
"Citizens and Farmers Trust Company, Adams NY",8000041,Former Bank/Trust Company,Convert Federal
"Luzerne-Hadley Bank, The",8000138,Former Bank/Trust Company,Merge To State
Arab American Bank,170035,Trust Company,Name Change To
Security National Bank of Long Island,74,Bank,Established
Citizens National Bank of Wellsville,8500140,Former Bank/Trust Company,Company Sold To
"Key Bank of New York, N.A.",170007,Trust Company,Convert State
"Banco Mercantil de Sao Paulo, S.A.",502039,Foreign Branches,Agency To Branch
South Brooklyn Savings & Loan Association,8200362,Former Savings and Loan,Merge To State
"Rochester Community Savings Bank, The",5801006,Savings Banks,Merge To Federal
Norstar Bank (Rochester),8000254,Former Bank/Trust Company,Acquire By Merger
"HSBC Bank USA, National Association",170040,Trust Company,Acquire By Merger
Power City Trust Company,8000173,Former Bank/Trust Company,Established
"Bank of New York, Albany, The",8000042,Former Bank/Trust Company,Acquire By Merger
"Citizens Bank of Penn Yan, The",8000251,Former Bank/Trust Company,Name Change To
Central National Bank of Yonkers,8500144,Former Bank/Trust Company,Merge To State
"Fleet Bank of New York, N.A.",170048,Trust Company,Merge To Federal
Banque de L'Indochine et de Suez,502028,Foreign Branches,Licensed
First National Bank & Trust Company of Elmira,5000017,Bank,Convert State
U.W.W.E. Local 65 Credit Union,8300405,Former Credit Union,Name Change To
Mechanicville Co-Operative Savings & Loan Assoc,8200078,Former Savings and Loan,Merge To State
Hudson River Credit Union,5800422,Credit Unions,Acquire By Merger
West New Brighton Bank,8000040,Former Bank/Trust Company,Convert Federal
Irving Bank-Columbia Trust Co.,102015,Trust Company,Purchase Branches
"First of Boston International Corporation, The",9000063,Former Foreign Agency,Licensed
Newark New York Savings & Loan Association,8200339,Former Savings and Loan,Closed
"Key Bank of Western New York, N.A.",8500140,Former Bank/Trust Company,Acquire By Merger
Security Trust Company,8000254,Former Bank/Trust Company,Merge To State
United Loan Industrial Bank,8000038,Former Bank/Trust Company,Bank To Trust Co.
"County National Bank, Middletown",8500151,Former Bank/Trust Company,Name Change To
Farmers Loan and Trust Company,8000417,Former Bank/Trust Company,Acquire By Merger
First National Bank of Buffalo,97,Bank,Merge To State
College Point National Bank of New York,8500004,Former Bank/Trust Company,Name Change To
Bank of Utica,102025,Trust Company,Established
Garden City Bank,8000107,Former Bank/Trust Company,Acquire By Merger
Bank Leumi Le-Israel B.M.,602023,Foreign Agencies,Closed
"Empire Savings Bank, FSB",8600000,Former Savings Bank,Name Change To
State Bank of Albany,8000267,Former Bank/Trust Company,Acquire By Merger
Hammondsport Savings & Loan Association,8200138,Former Savings and Loan,Closed
American Exchange Irving Trust Co.,102015,Trust Company,Name Change To
"Morris Plan Company of New York, The",149,Bank,Name Change To
"Mid-Hudson Savings Bank, FSB",8600001,Former Savings Bank,Name Change To
Corn Exchange Bank,8000017,Former Bank/Trust Company,Name Change To
"Sumitomo Bank, Limited, The",519006,Foreign Branches,Merge To State
Citizens Bank of Arcade,72,Bank,Acquire By Merger
Saratoga National Bank of Saratoga Springs,8500118,Former Bank/Trust Company,Merge To State
Boulevard Bank,8000010,Former Bank/Trust Company,Established
Troy Co-Operative Savings & Loan Association,8200115,Former Savings and Loan,Convert Federal
Home Savings Bank (1/1893-12/1985),8100164,Former Savings Bank,Established
Citizens National Bank of Springville,8500125,Former Bank/Trust Company,Name Change To
Marine Midland Trust Company of Rockland County,8000180,Former Bank/Trust Company,Name Change To
Fourteenth Street Bank in the City of New York,8000410,Former Bank/Trust Company,Name Change To
M & T Trust Company,113003,Trust Company,Acquire By Merger
Liberty Bank and Trust Company,8000072,Former Bank/Trust Company,Name Change To
"Marine National Bank of Buffalo, The",5000014,Bank,Convert Federal
Home Building & Loan Assoc of Spring Valley,8200270,Former Savings and Loan,Merge To State
Press Company Credit Union,8300189,Former Credit Union,NYS Chartered
Market Savings Bank,8100056,Former Savings Bank,NYS Chartered
Calyon,502028,Foreign Branches,Name Change To
Republic Bank For Savings,213001,Savings Banks,Acquire By Merger
Bankers Trust of Jamestown,8000246,Former Bank/Trust Company,Name Change To
"Seamen's Bank For Savings, The",270016,Savings Banks,Convert Federal
Ontario County Trust Company,8000076,Former Bank/Trust Company,Name Change To
Bank of Sicily Trust Company,8000422,Former Bank/Trust Company,Merge To State
Banca Intesa S.p.A.,570321,Foreign Branches,Licensed
Bank of Elba,8000100,Former Bank/Trust Company,Name Change To
Union Square Bank of the City of New York,8000352,Former Bank/Trust Company,Name Change To
Bank of East Syracuse,8000097,Former Bank/Trust Company,Merge To State
Traders National Bank of Brooklyn in New York,8500227,Former Bank/Trust Company,Established
Nordbanken,516006,Foreign Branches,Licensed
Commercial Exchange National Bank of New York,8500218,Former Bank/Trust Company,Merge To Federal
Astoria FS & LA,5800077,Savings & Loans,Acquire By Merger
"Key Bank, National Association",5801003,Trust Company,Acquire By Merger
Citi Fiduciary Trust Company,119032,Limited Purpose Trust Company,Merge To Federal
Lincoln-Alliance Bank,8000199,Former Bank/Trust Company,Name Change To
First Westchester National Bank of New Rochelle,8500102,Former Bank/Trust Company,Name Change To
Hamburg Savings & Loan Association,8200066,Former Savings and Loan,Assets Sold To
"Dreyfus Trust Company (N.Y.), The",104007,Limited Purpose Trust Company,Name Change To
Phenix National Bank of the City of New York,8500207,Former Bank/Trust Company,Established
Fourth National Bank of the City of New York,8000309,Former Bank/Trust Company,Merge To Federal
UFJ Trust Bank Limited,2270165,Foreign Representative Offices,Branch To Rep Off
City and County Savings Bank,208007,Savings Banks,NYS Chartered
Oppenheimer Trust Company,112012,Limited Purpose Trust Company,Name Change To
Farmers National Bank of Amsterdam,8500016,Former Bank/Trust Company,Merge To State
East River Bank,8500215,Former Bank/Trust Company,Acquire By Merger
"Key Bank of Eastern New York, NA",170007,Trust Company,Name Change To
Security Trust Company,8000254,Former Bank/Trust Company,Name Change To
Jugobanka - United Bank,610001,Foreign Agencies,Licensed
College Point Savings Bank,181,Savings Banks,Name Change To
Manufacturers-Citizens Trust Co.,113004,Trust Company,Acquire By Merger
"Fifth Avenue Bank of New York, The",8000021,Former Bank/Trust Company,Merge To State
"Manufacturers Hanover, National Association",140,Trust Company,Merge To State
Roosevelt Savings Bank of the City of New York,218009,Savings Banks,Merge To State
Irving Bank of New York,45,Trust Company,Acquire By Merger
Fifth Avenue Savings & Loan Assoc (1889-1936),8200358,Former Savings and Loan,NYS Chartered
Montgomery County Trust Company,8000260,Former Bank/Trust Company,Merge To Federal
"National Bank of New Zealand Limited,The",2214002,Foreign Representative Offices,Licensed
"Citizens' National Bank of New York, The",8000333,Former Bank/Trust Company,Name Change To
Oystermen's National Bank of Sayville,8500254,Former Bank/Trust Company,Merge To State
Guaranty Trust Company of New York,113026,Trust Company,Name Change To
Guaranty Trust Company of New York,113026,Trust Company,Acquire By Merger
Niagara County National Bank and Trust Company,8500085,Former Bank/Trust Company,Established
Bank of Batavia,8000495,Former Bank/Trust Company,Name Change To
Fleet Bank of New York,114025,Trust Company,Name Change To
National Bank of Great Neck,8500066,Former Bank/Trust Company,Convert State
Rome Trust Company,8000202,Former Bank/Trust Company,Merge To Federal
Nassau Trust Company,8000108,Former Bank/Trust Company,Name Change To
BancBoston Trust Company of New York,102062,Limited Purpose Trust Company,Liquidated
Maybrook Savings & Loan Association,8200331,Former Savings and Loan,Liquidated
"Longacre National Bank of New York, The",8500209,Former Bank/Trust Company,Convert Federal
Metropolitan National Bank of the City of NY,8000322,Former Bank/Trust Company,Merge To State
American Trust Company (1919-11/1930),8000274,Former Bank/Trust Company,Merge To State
"Banco Mercantil C.A., S.A.C.A., S.A.I.C.A.",602048,Foreign Agencies,Liquidated
"Washington Bank, The",8000381,Former Bank/Trust Company,Name Change To
Marine Midland Bank - Western,5000014,Bank,Convert State
Marine Midland National Bank of Troy,1170006,Former Bank/Trust Company,Established
Kookmin Bank,570315,Foreign Branches,NYS Chartered
National City Bank of Troy,8500129,Former Bank/Trust Company,Acquire By Merger
Staten Island Savings Bank,219011,Savings Banks,NYS Chartered
"Manufacturers Hanover, National Association",140,Trust Company,Established
Marine Midland Bank Trust Company of Southern NY,5000017,Bank,Convert Federal
Peoples Savings & Loan Association (Long Island),8200093,Former Savings and Loan,Name Change To
Extebank,105010,Trust Company,Name Change To
Bankers Trust of Jamestown,8000246,Former Bank/Trust Company,Acquire By Merger
Union Bank of Switzerland,521002,Foreign Branches,Convert Federal
New York Life Insurance and Trust Company,8000241,Former Bank/Trust Company,Acquire By Merger
M & T Trust Company,113003,Trust Company,Name Change To
Banca Intesa S.p.A.,570321,Foreign Branches,Acquire By Merger
German Exchange Bank of the City of New York,8500218,Former Bank/Trust Company,Name Change To
Commonwealth Bank of Australia,9000060,Former Foreign Agency,Closed
Hudson Savings & Loan Association,8200069,Former Savings and Loan,Merge To State
Neuberger Berman Trust Company,170043,Limited Purpose Trust Company,Name Change To
Hudson River Trust Company,8000127,Former Bank/Trust Company,Name Change To
"State Bank of Shortsville, The",8000216,Former Bank/Trust Company,NYS Chartered
Mechanics and Farmers Savings Bank of Albany,8100035,Former Savings Bank,NYS Chartered
Mizuho Bank (USA),170020,Trust Company,Acquire By Merger
National Shoe & Leather Bank of the City of NY,8000322,Former Bank/Trust Company,Merge To State
Genesee Savings & Loan Association,8200369,Former Savings and Loan,Convert State
Morgan Stanley Trust Company,113061,Limited Purpose Trust Company,Merge To State
National Commercial Bank & Trust Company,170007,Trust Company,Acquire By Merger
Republic Bank of New York,170040,Trust Company,Acquire By Merger
Rochester Clothing Workers Credit Union,8300200,Former Credit Union,Liquidated
"Port Richmond National Bank, The",8500011,Former Bank/Trust Company,Merge To State
Ontario County Trust Company,8000076,Former Bank/Trust Company,Company Sold To
Banque de L'Union Europeenne,9100001,Former Foreign Branch,Licensed
Queensboro Savings Bank,8100158,Former Savings Bank,Established
Chemical Bank,103011,Trust Company,Acquire By Merger
Mechanics' Bank of Williamsburgh,109,Bank,Name Change To
Elmira Trust Company,103020,Trust Company,Acquire By Merger
Republic National Bank of New York,170040,Trust Company,Acquire By Merger
"Poughkeepsie Savings Bank, FSB, The",5800065,Registered CRB Institution,Acquire By Merger
Bank of Huntington,8000129,Former Bank/Trust Company,Name Change To
Seaway National Bank,8500263,Former Bank/Trust Company,Name Change To
Credit Industriel et Commercial (2/74-6/84),570056,Foreign Branches,Licensed
First National Bank of Belfast,8500019,Former Bank/Trust Company,Name Change To
Manhattan Savings & Loan Association,8200077,Former Savings and Loan,NYS Chartered
Lawyers Title and Trust Company,8000370,Former Bank/Trust Company,Acquire By Merger
Peoples Bank of Buffalo,87,Bank,Established
"Chase Lincoln First Bank, National Association",8500128,Former Bank/Trust Company,Acquire By Merger
Usona Credit Union,8300322,Former Credit Union,Name Change To
Mechanics Savings Bank of Beacon,8100061,Former Savings Bank,NYS Chartered
Canadian Imperial Bank of Commerce (New York),170016,Trust Company,NYS Chartered
Chemical Corn Exchange Bank,103011,Trust Company,Acquire By Merger
Van Norden Trust Company,8000318,Former Bank/Trust Company,Merge To State
Yonkers National Bank and Trust Company,8500255,Former Bank/Trust Company,Name Change To
Skaneateles Savings Bank,219009,Savings Banks,Merge To State
Salamanca Trust Company,119001,Trust Company,Acquire By Merger
German Savings Bank of Brooklyn,8100064,Former Savings Bank,Acquire By Merger
Seaboard Bank,8000328,Former Bank/Trust Company,Convert Federal
"State Bank, The",121,Trust Company,Merge To State
HSBC New York Trust Company,170081,Limited Purpose Trust Company,Merge To Federal
Peoples Trust Company of Bklyn N.A. of New York,8500214,Former Bank/Trust Company,Merge To Federal
Bayside Savings & Loan Association,8200293,Former Savings and Loan,NYS Chartered
Alliance Bank,8000199,Former Bank/Trust Company,Acquire By Merger
North River Savings Bank,8100066,Former Savings Bank,Merge To State
Western Division Credit Union,462302,Credit Unions,NYS Chartered
National Bank of Fredonia,8500059,Former Bank/Trust Company,Name Change To
Albank Commercial,5000034,Bank,NYS Chartered
Queens County Trust Company,8000390,Former Bank/Trust Company,Merge To State
Bank of Gowanda,8000112,Former Bank/Trust Company,Name Change To
Coal and Iron Bank of the City of New York,8000375,Former Bank/Trust Company,Name Change To
Niagara County Savings & Loan Association,8200046,Former Savings and Loan,Assets Sold To
State Bank of Richmond County,8000289,Former Bank/Trust Company,Merge To State
National Commercial Bank & Trust Company,170007,Trust Company,Acquire By Merger
Andover National Bank,8000491,Former Bank/Trust Company,Name Change To
Central Valley Savings & Loan Association,8200250,Former Savings and Loan,Name Change To
Forty Main Street Bank,8000121,Former Bank/Trust Company,Merge To State
"State Bank of Shortsville, The",8000216,Former Bank/Trust Company,Merge To State
"Bank of New York, The (9/1922-10/1989)",8000241,Former Bank/Trust Company,Purchased Assets
Niagara County Bank,8500085,Former Bank/Trust Company,Name Change To
Real Estate Trust Company of New York,8000024,Former Bank/Trust Company,Name Change To
National Bank and Trust Company of Norwich,8000139,Former Bank/Trust Company,Acquire By Merger
"Citizens Bank of Locke, N.Y.",8000145,Former Bank/Trust Company,Name Change To
Citizens Bank of Brooklyn,8000013,Former Bank/Trust Company,Merge To State
Newspaper Employees Credit Union,461401,Credit Unions,NYS Chartered
Emigrant Savings Bank - Brooklyn/Queens,270063,Savings Banks,Merge To State
Norstar Bank of Long Island (8/83-3/87),8000262,Former Bank/Trust Company,Merge To Federal
Northern Westchester Bank,8000263,Former Bank/Trust Company,Name Change To
Transport IRT Credit Union,8300395,Former Credit Union,NYS Chartered
American Savings Bank (10/64-4/81),8100020,Former Savings Bank,Name Change To
"Bank of Hammondsport, The",8000119,Former Bank/Trust Company,Convert Federal
Sixth Avenue Credit Union,461905,Credit Unions,Acquire By Merger
Merrill Lynch Trust Company of New York,170068,Limited Purpose Trust Company,Merge To Federal
North Fork Bank & Trust Company (12/50-12/81),114021,Trust Company,Acquire By Merger
Wheatly Hills National Bank of Westbury,8500141,Former Bank/Trust Company,Merge To State
Genesee Street Savings and Loan Association,8200161,Former Savings and Loan,Merge To State
First National Bank of Batavia,8500262,Former Bank/Trust Company,Name Change To
"Nassau Bank, The",8500192,Former Bank/Trust Company,Convert State
C.I.T. Financial Corporation,703005,Investment Company (Article XII),Name Change To
"Mercantil, C.A., Banco Universal",2270211,Foreign Representative Offices,Licensed
International Acceptance Trust Company,8000275,Former Bank/Trust Company,Acquire By Merger
Bank of Skaneateles,8500124,Former Bank/Trust Company,Name Change To
Bayerische Hypotheken-und Verinsbank AG,521001,Foreign Branches,Name Change To
"City Bank of Syracuse, The",8000464,Former Bank/Trust Company,Name Change To
Shell Employees Credit Union,8300211,Former Credit Union,Liquidated
"Banca Serfin, S.N.C.",602036,Foreign Agencies,Closed
Korea Long Term Credit Bank,2211004,Foreign Branches,Rep Off-Branch
"German-American Bank of Buffalo, NY",8000072,Former Bank/Trust Company,Name Change To
Manufacturers and Traders Trust Company,113003,Trust Company,Acquire By Merger
Bank of America (1812-1928),8500212,Former Bank/Trust Company,Established
Harbor State Bank,42,Trust Company,Name Change To
Genesee Savings & Loan Association,8200369,Former Savings and Loan,Merge To State
Bangkok Metropolitan Bank Public Limited Company,602022,Foreign Agencies,Licensed
"Peekskill Building, Savings & Loan Association",8200285,Former Savings and Loan,Name Change To
First Federal S & L Assoc of Niagara County,370004,Savings & Loans,Assets Sold To
Commercial Credit Union of Brooklyn,8300080,Former Credit Union,Merge To State
Bedford Co-operative Building-Loan Association,8200071,Former Savings and Loan,Convert Federal
Lincoln Savings Bank of Brooklyn,8100064,Former Savings Bank,Convert Federal
Citibank (Western) N.A.,8500108,Former Bank/Trust Company,Acquire By Merger
Alliance Bank,8000199,Former Bank/Trust Company,Acquire By Merger
First National Bank of Allegany,8500015,Former Bank/Trust Company,Name Change To
Adirondack National Bank & Trust Co Saranac Lake,8500117,Former Bank/Trust Company,Name Change To
"New York Trust Company, The",8000031,Former Bank/Trust Company,Acquire By Merger
"Toronto-Dominion Bank, The",2220002,Foreign Representative Offices,Licensed
Summit Bank,5801007,Bank,NYS Chartered
"Citizens Savings Bank, FSB",270021,Savings Banks,Converted To
Catskill Savings Bank,203001,Savings Banks,Merge To Federal
Madrid Bank,8000154,Former Bank/Trust Company,Merge To Federal
Williamsville Savings & Loan Association,8200184,Former Savings and Loan,Merge To State
Dime Savings Bank of Brooklyn,8100047,Former Savings Bank,NYS Chartered
Manufacturers and Traders Trust Company,113003,Trust Company,Acquire By Merger
Kenmore Savings and Loan Association,8200168,Former Savings and Loan,Convert Federal
"Plaza Bank, The",8000294,Former Bank/Trust Company,Established
Ossining Trust Company,8000504,Former Bank/Trust Company,Established
"Manufacturers Hanover Trust Co./Western NY, N.A.",140,Trust Company,Name Change To
Metropolitan National Bank of the City of NY,8000322,Former Bank/Trust Company,Converted To
"North Country Savings Bank, The",214005,Savings Banks,NYS Chartered
Yorkville Bank,115,Bank,Established
Mechanics' Bank of the City of New York,8000320,Former Bank/Trust Company,Convert Federal
"Bayside Bank, The",8000402,Former Bank/Trust Company,Convert Federal
CFCU Community Credit Union,5800412,Credit Unions,Acquire By Merger
Bank of Batavia,8000495,Former Bank/Trust Company,Convert Federal
Trust Company of America (5/1905-2/1912),8000299,Former Bank/Trust Company,Name Change To
Copenhagen National Bank,8500043,Former Bank/Trust Company,Name Change To
