Institution Name Primary,Type,Event Date,Institution Name (Secondary),Identification Number (Secondary)
Fifth National Bank of the City of New York,Bank,19920619,Chemical Bank,103011.0
"Gansevoort Bank, The",Former Bank/Trust Company,20041113,"JPMorgan Chase Bank, National Association",
National Bank in the City of New York,Former Bank/Trust Company,18290000,National Bank in the City of New York,
Christiania Bank OG Kreditkasse,Foreign Branches,20131203,,
"Bank of Flatbush, The",Former Bank/Trust Company,19040000,Prospect Park Bank of Brooklyn,
Equitable Co-Operative Building & Loan Assoc,Former Savings and Loan,19920901,"Home Savings of America, Bowery Division, FSB",270018.0
"Oswego County Savings Bank, The",Savings Banks,18700000,"Oswego County Savings Bank, The",
Ogdensburg Bank,Former Bank/Trust Company,19971113,Fleet Bank N.A.,5801998.0
Banca di Roma S.p.A. (12/93 - 06/02),Foreign Branches,19931223,Banca di Roma S.p.A. (12/93 - 6/02),
Banco Mercantil de Sao Paulo S.A. Finasa,Foreign Branches,20020903,,
Columbia Trust Company,Trust Company,18840201,Commercial Trust Company (1884-1900),
Bank of Steuben,Trust Company,19191231,,
Israel Discount Trust Company,Trust Company,19671102,IDB Trust Company,
"Royal Bank of Scotland PLC, The",Foreign Branches,19850930,"Royal Bank of Scotland PLC, The",
Bank of Huntington,Former Bank/Trust Company,19561001,Huntington Station Bank,8000130.0
IBEW Credit Union,Former Credit Union,19760218,,
Norstar Bank of Callicoon,Trust Company,19880624,Norstar Bank of Callicoon,
Imperial Bank of Canada,Former Foreign Agency,19610719,Canadian Imperial Bank of Commerce,
Northfield Savings Bank,Savings Banks,18870201,Northfield Building-Loan & Savings Association,
Marine Midland Bank (12/75-2/80),Trust Company,19760101,Marine Midland Bank - Western,5000014.0
Nathan Schweitzer Company Credit Union,Former Credit Union,19341030,Nathan Schweitzer Company Credit Union,
Citizens' Bank (Waverly),Former Bank/Trust Company,19991231,HSBC Bank USA,
"First Bank of Whitestone, The",Former Bank/Trust Company,19960714,Chemical Bank,103011.0
Mechanics & Metals Natl Bank of the City of NY,Former Bank/Trust Company,19220701,"Lincoln National Bank of New York, The",8000317.0
Central Union Trust Company of New York,Bank,19610908,Manufacturers Hanover Trust Company,
First Federal Savings & Loan Assoc of Hamburg,Former Savings and Loan,19130514,Co-Operative Savings & Loan Assoc. of Hamburg,
"Central Bank of Rochester, The",Trust Company,19720628,First National Bank of Painted Poat,69.0
Baltic States Bank,Former Bank/Trust Company,19750119,Chemical Bank,103011.0
Rensselaer County Bank,Former Bank/Trust Company,19800101,"Key Bank, N.A.",
Clinton County Savings Bank,Former Savings Bank,18690000,Clinton County Savings Bank,
BPD Bank,Bank,19900406,BPD International Bank,
Shell Eastern Head Office Credit Union,Former Credit Union,19370000,Shell Employees Credit Union,
UFJ Trust Bank Limited,Foreign Representative Offices,19760322,"Toyo Trust and Banking Company, Ltd, The",
Geneva Trust Company,Former Bank/Trust Company,19790101,"Lincoln First Bank-Central, N.A.",8500128.0
Bay Ridge Savings Federal Savings & Loan Assoc,Former Savings and Loan,18950317,Town of New Utrecht Co-Op Building & Loan Assoc,
"Hamilton National Bank of New York, The",Former Bank/Trust Company,19960714,Chemical Bank,103011.0
Reliable Credit Union,Former Credit Union,19230000,Reliable Credit Union,
Cresent Credit Union,Former Credit Union,19270518,Cresent Credit Union,
Marine Trust Company of Western New York,Bank,19510401,Marine Midland Trust Company of Albion,8000045.0
"Windsor Bank, The",Former Bank/Trust Company,19270000,"Windsor Bank, The",
Republic Bank For Savings,Savings Banks,19900502,Manhattan Savings Bank,
Seaboard Bank,Former Bank/Trust Company,19300501,Chase National Bank of the City of New York,8500003.0
Union National Bank of Franklinville,Former Bank/Trust Company,18820000,Union National Bank of Franklinville,
Corn Exchange Bank Trust Company,Former Bank/Trust Company,19020101,Mechanics and Traders' Bank of Brooklyn,8000348.0
"State Bank of Seneca Falls, N.Y.",Former Bank/Trust Company,19940701,Fleet Bank,
First National Bank of Wolcott,Former Bank/Trust Company,19841201,Security Norstar Bank,
City Bank of New York,Trust Company,19210601,Commercial Exchange National Bank of New York,8500218.0
United National Bank of Long Island in New York,Former Bank/Trust Company,19760101,"Bank of New York, The (9/1922-10/1989)",8000241.0
Chatham National Bank of New York,Former Bank/Trust Company,19110000,Phenix National Bank of the City of New York,8500207.0
Chemical Bank,Trust Company,19640201,First National Bank of Mount Vernon,8500095.0
Queens-Bellaire Bank,Former Bank/Trust Company,19210000,Queens-Bellaire Bank,
"Marine Bank of Buffalo, The",Bank,19990329,HSBC Bank USA,
Manufacturers Hanover Trust Company/Capital Reg.,Former Bank/Trust Company,19660000,Fidelity Bank of Colonie,
Bronx National Bank of the City of New York,Former Bank/Trust Company,19550301,"Chase Manhattan Bank, The (1799-9/1965)",
Suffolk County Savings & Loan Association,Former Savings and Loan,19230716,Suffolk County Savings & Loan Association,
Meadow Brook National Bank of Freeport,Former Bank/Trust Company,19570201,"Bank of Malverne, The",8000247.0
Herkimer Co-Operative Savings & Loan Assoc,Former Savings and Loan,19430000,Herkimer Savings & Loan Association,
FNS Bank of New York,Trust Company,19930615,"First Fidelity Bank, N.A., New York",5800004.0
"LeRoy National Bank, The",Former Bank/Trust Company,19841201,Security Norstar Bank,
Eastern District Savings Bank of City of Brooklyn,Savings Banks,18951125,Eastern District Savings Bank of City of Brooklyn,
Union Dime Savings Bank,Savings Banks,19830926,"Goldome, FSB",
Chemical Bank,Trust Company,18650000,Chemical National Bank of New York,
"First National Bank of Marcellus, The",Former Bank/Trust Company,19970113,"Key Bank, National Association",5801003.0
"National Commercial Bank of New York, The",Former Bank/Trust Company,19230101,,
Parchester Federal Credit Union,Credit Unions,20080310,Independent (NY) Federal Credit Union,
"Marine Midland Bank - Eastern, N.A.",Former Bank/Trust Company,20040630,HSBC Bank USA,
"Kyungki Bank, Ltd.",Foreign Representative Offices,19940512,"Kyungki Bank, Ltd.",
Columbia Bank,Bank,19230814,Manufacturers Trust Company,113004.0
Irving Bank in the City of New York,Former Bank/Trust Company,19290201,Irving Trust Company,
Northern New York Trust Company,Bank,19530201,"People's Trust Company of Malone, The",8000155.0
American Exchange Irving Trust Co.,Trust Company,19810115,"Irving Bank Canada, Ltd.",49.0
Bloomingdale Savings Bank,Former Savings Bank,18750101,,
Home Savings Bank (1/1893-12/1985),Former Savings Bank,19920901,"Home Savings of America, FSB-NY",270027.0
Lynbrook Federal Savings & Loan Association,Former Savings and Loan,19350401,Lynbrook Federal Savings & Loan Association,
Manhattan Savings Institution,Savings Banks,19900502,Manhattan Savings Bank,
"Wells, Fargo & Company's Bank",Former Bank/Trust Company,19550301,President and Directors of the Manhattan Company,8000257.0
"Valley National Bank, Wallkill, NY, The",Former Bank/Trust Company,19891101,"Key Bank of Eastern New York, N.A.",
Oyster Bay Trust Company,Former Bank/Trust Company,19870309,Norstar Bank of Long Island,
Onondaga Savings Bank,Savings Banks,19980401,Manufacturers & Traders Trust Company,113003.0
First Commercial Bank of Philadelphia,Former Bank/Trust Company,20040630,HSBC Bank USA,
Canarsie State Bank,Former Bank/Trust Company,19610908,Manufacturers Hanover Trust Company,
National Westminster Bank plc,Foreign Branches,19700101,National Westminster Bank Limited,
A.P.W. Employees Credit Union,Former Credit Union,19400617,A.P.W. Employees Credit Union,
Kingston Co-Operative Savings & Loan Assoc,Former Savings and Loan,19390000,Savings & Loan Association of Kingston,
Korea Commercial Bank of New York,Bank,19840120,Korea Commercial Bank of New York,
National Bank of Wyoming,Bank,19720216,Wyoming County Bank,
"Bank of Kobe, Limited, The",Foreign Branches,19630216,"Bank of Kobe, Limited, The",
Bank of Westbury Trust Company,Former Bank/Trust Company,19891006,"Bank of New York, The",
Corning Co-Operative Savings & Loan Assoc,Former Savings and Loan,19731001,Alfred Mutual Savings & Loan Association,8200002.0
Watertown Savings Bank,Savings Banks,18931002,Watertown Savings Bank,
East Hampton National Bank,Former Bank/Trust Company,19310601,Osborne Trust Company,8000096.0
Shinhan Bank America,Bank,20090501,Shinhan Bank America,
Black Rock Savings & Loan Association,Former Savings and Loan,19300000,Black Rock Savings & Loan Association,
Oystermen's National Bank of Sayville,Former Bank/Trust Company,18990000,Oystermen's National Bank of Sayville,
Capital National Bank & Trust Company of New York,Former Bank/Trust Company,19280301,United Capitol National Bank & Trust Co of NY,
Mattituck National Bank and Trust Company,Former Bank/Trust Company,19921001,,
"Norwest Trust Company, New York",Limited Purpose Trust Company,19830711,"Norwest Trust Company, New York",
Equity Credit Union,Former Credit Union,19361228,,
PIMCO Trust Company,Limited Purpose Trust Company,19940307,Oppenheimer Capital Trust Company,
Bank of Sheepshead Bay,Former Bank/Trust Company,20041113,"JPMorgan Chase Bank, National Association",
"Bankers Trust of Suffolk, N.A.",Trust Company,19640201,"Bankers Trust of Suffolk, n.a.",
"State Bank of Sea Cliff, N.Y., The",Former Bank/Trust Company,19571001,Franklin National Bank of Long Island,
Lincoln First Bank of Rochester,Former Bank/Trust Company,19930101,"Chase Manhattan Bank, N.A., The",5800033.0
Deutsche Genossenschaftsbank,Foreign Branches,20020225,DZ Bank AG Duetsche Zentral-Genossenschaftsbank,
Hongkong and Shanghai Banking Corporation Limited,Foreign Representative Offices,19900627,Global Union Bank,5000006.0
National Bank of Greece,Former Foreign Agency,19330000,,
"Yonkers Building and Loan Association, The",Former Savings and Loan,18880118,"Yonkers Building and Loan Association, The",
East Side Savings Bank For Sailors,Former Savings Bank,18860301,,
City Bank of Brooklyn,Former Bank/Trust Company,19230101,Irving Bank of New York,
Banque Indosuez,Foreign Branches,19820831,Banque Indosuez,
Central Mercantile Bank and Trust Company,Former Bank/Trust Company,19261001,American Bank of New York,8000420.0
Brooklyn Laundrymen's Credit Union,Former Credit Union,19620511,Hyfin Credit Union,6.0
Korea Exchange Bank,Foreign Branches,19670906,Foreign Exchange Bank of Korea,
Italian Savings & Loan Association,Former Savings and Loan,19391215,Westerleigh Savings & Loan Association,8200127.0
Second National Bank of Elmira,Bank,19760101,Marine Midland Bank (12/75-2/80),170046.0
"First Data Financial Holdings, L.L.C.",Investment Company (Article XII),20060928,"Western Union Financial Holdings, L.L.C.",
State Bank of South Australia,Foreign Agencies,19950907,,
Ithaca Trust Company,Trust Company,18910918,Ithaca Trust Company,
Woori America Bank,Bank,19840120,Korea Commercial Bank of New York,
Erie Federal Savings & Loan Association,Savings & Loans,19410724,People's Dime Savings & Loan Association No. 2,8200171.0
First National Bank of Salamanca,Former Bank/Trust Company,19971113,Fleet Bank N.A.,5801998.0
Five Star Bank,Trust Company,20051203,Wyoming County Bank,123002.0
Long Island National Bank of Hicksville,Former Bank/Trust Company,19800930,Long Island Trust Company,8000107.0
Commercial Bank of North America,Former Bank/Trust Company,19620501,Peoples National Bank of Brooklyn in New York,8500010.0
"Michinoku Bank, Ltd., The",Foreign Representative Offices,19991210,,
Chemical Bank,Trust Company,19780929,Chemical Bank of Syracuse,81.0
Wm. H. Seward & Co.,Former Bank/Trust Company,19760101,Marine Midland Bank (12/75-2/80),170046.0
Third National Bank of Syracuse,Former Bank/Trust Company,19910601,"Key Bank of New York, N.A.",
Goldome Bank For Savings,Savings Banks,19811218,Union Dime Savings Bank,175.0
Richmond County Building & Mutual Loan Assoc,Savings & Loans,19831210,Richmond County Savings & Loan Association,
Jefferson Savings & Loan Association,Former Savings and Loan,19150527,Jefferson Savings & Loan Association,
Seventh Ward Bank,Former Bank/Trust Company,19120801,Irving National Bank,
Medina Trust Company,Former Bank/Trust Company,19700101,Marine Midland Bank - Western,
"Saugerties National Bank and Trust Company, The",Former Bank/Trust Company,19960714,Chemical Bank,103011.0
Marine Midland Bank - Southern,Bank,19991231,HSBC Bank USA,
Nyack Savings & Loan Association,Former Savings and Loan,19710930,Port Jervis Savings & Loan Association,8200044.0
Erie Savings & Loan Association,Savings & Loans,19500517,North Main Savings & Loan Association,8200131.0
Commercial Bank of North America,Former Bank/Trust Company,19620301,State Bank of Long Beach,8000149.0
"Key Bank of New York, N.A.",Trust Company,19930826,Key Bank of New York,
Irving Bank-Columbia Trust Co.,Trust Company,19230207,Irving Bank of New York,45.0
Jackson Heights Savings & Loan Association,Former Savings and Loan,18880101,Bedford Co-operative Building-Loan Association,
"Hudson City Savings Institution, The",Savings Banks,19990903,Schenectady Federal Savings Bank,5800060.0
"Citizens State Bank, Lyndonville",Former Bank/Trust Company,19110000,"Citizens State Bank, Lyndonville",
Astoria FS & LA,Savings & Loans,18881204,Central Permanent Building & Loan Association,
"Bank of Hammondsport, The",Former Bank/Trust Company,19790101,"Lincoln First Bank-Central, N.A.",8500128.0
"Chemical Bank, The (1823-1865)",Trust Company,19541015,Corn Exchange Bank Trust Company,8000017.0
"Bank of New Rochelle, The",Former Bank/Trust Company,19531001,"Westchester Bank and Trust Company, The",
City Bank of New York,Trust Company,19760101,"Citibank (Suffolk), N.A.",8500264.0
Manufacturers Bank of Cohoes,Former Bank/Trust Company,19880624,Norstar Bank of Callicoon,114025.0
Monroe Savings Bank,Former Savings Bank,19720601,Wayland Dime Savings & Loan Association,8200124.0
"Kerhonkson National Bank, The",Former Bank/Trust Company,19920616,Key Bank of New York (6/92-8/93),
Jeff Bank,Bank,20121221,The First National Bank of Jeffersonville,
Bank of Genesee,Trust Company,19281301,Genesee Trust Company,
Shinhan Bank,Foreign Branches,19820917,,
Garfield National Bank of the City of New York,Former Bank/Trust Company,19290101,Chase National Bank of the City of New York,8500003.0
Centerville Station Co-Operative Credit Union,Former Credit Union,19150000,Centerville Station Co-Operative Credit Union,
Chemical National Bank of New York,Trust Company,19961201,"Chase Manhattan Bank, National Association",170067.0
"BBVA Bancomer, S.A. Institution de Banca Multiple",Foreign Agencies,20010305,"BBVA Bancomer, S.A. Institution de Banca Multiple, Grupo Financiero BBVA Bancome",
Montrose Industrial Bank,Former Bank/Trust Company,19650301,Bank of North America (10/58-5/67),
Credit Agricole Indosuez,Foreign Branches,19800112,,
Svenska International Limited,Foreign Branches,19951010,Svenska Handelsbanken AB,
Bank of Commerce in New York (1839-1865),Trust Company,18650000,National Bank of Commerce in New York,
Seaboard Bank,Former Bank/Trust Company,19960714,"Chase Manhattan Bank, The",
Seaway National Bank,Former Bank/Trust Company,19920608,Fleet Bank of New York,
Deutsche Bank Trust Company Americas,Trust Company,19681129,Northern Westchester National Bank,65.0
First National Bank of Wolcott,Former Bank/Trust Company,19921001,Fleet Bank of New York,114025.0
"Bank of Long Island, N.A.",Former Bank/Trust Company,19810501,Bank of Long Island N.A.,
Wheatly Hills National Bank of Westbury,Former Bank/Trust Company,19830801,Norstar Bank of Long Island (8/83-3/87),
International Union Bank,Former Bank/Trust Company,19291001,International-Madison Bank and Trust Company,
P.T. Bank Ekspor Impor Indonesia (Persero),Foreign Agencies,19930104,P.T. Bank Ekspor Impor Indonesia,
Merita Bank Plc,Foreign Branches,20011221,Nordea Bank Finland Plc,
Saugerties Co-Operative Savings & Loan Assoc,Former Savings and Loan,19820809,"Statewide Savings & Loan, FS & LA",
Ninth Ward Bank,Former Bank/Trust Company,18811201,Garfield National Bank of the City of New York,
Five Star Bank,Trust Company,20051203,"Bath National Bank, The",5800098.0
"Bankers Trust Company of Hudson Valley, N.A.",Former Bank/Trust Company,18520000,Fallkill Bank,
C.I.T. Finance Corporation,Investment Company (Article XII),19860429,"CIT Group/Equipment Financing, Inc.",
Northside State Bank,Former Bank/Trust Company,19250000,Northside State Bank,
First Trust Company of Allegany County,Former Bank/Trust Company,19840401,Security Trust Company of Rochester,8000254.0
Niagara County Savings Bank,Former Savings Bank,19920101,"Fleet Bank of New York, N.A.",
"Key Bank of Eastern New York, NA",Trust Company,19910601,"Key Bank of New York, N.A.",
Empire Trust Company,Former Bank/Trust Company,19020000,McVickar Realty Trust Company,
"Schenectady Savings Bank, F.A. (1981)",Former Savings Bank,19810629,"Schenectady Savings Bank, F.A. (1981)",
Springfield Gardens National Bank of New York,Former Bank/Trust Company,19601101,Meadow Brook National Bank of Nassau County,8500008.0
First National Bank of Salamanca,Former Bank/Trust Company,19920101,"Fleet Bank of New York, N.A.",
Meadow Brook National Bank of Freeport,Former Bank/Trust Company,19601101,Colonial Trust Company,8000015.0
Bank of Farmingdale,Former Bank/Trust Company,19621001,Franklin National Bank,
Banco de Santander - Puerto Rico,Foreign Branches,20000616,Commercebank N.A.,
Bank of Holland,Bank,18931021,Bank of Holland,
Westerleigh Building Loan & Savings Association,Former Savings and Loan,19820616,"Westerleigh Savings, A Federal Savings & Loan",
"London and Brazilian Bank, Ltd.",Former Foreign Agency,19120000,"London and Brazilian Bank, Ltd.",
Marine Trust Company of Buffalo,Bank,19461101,Bank of Attica,8000054.0
Flushing Bank,Bank,20070501,Flushing Commercial Bank,
"New York Produce Exchange National Bank, The",Former Bank/Trust Company,19650901,"Chase Manhattan Bank, N.A., The",5800033.0
Trust and Deposit Company of Onondaga,Former Bank/Trust Company,19910601,"Key Bank of New York, N.A.",
"Tokyo Sowa Bank, Ltd., The",Foreign Representative Offices,19931110,"Tokyo Sowa Bank, Ltd., The",
Terminal Trust Company,Former Bank/Trust Company,19541015,Chemical Corn Exchange Bank,
"Shiga Bank, Ltd., The",Foreign Branches,19910228,"Shiga Bank, Ltd., The",
Mechanics National Bank of the City of New York,Former Bank/Trust Company,18100000,Mechanics' Bank of the City of New York,
Hempstead Bank,Former Bank/Trust Company,19870309,Norstar Bank of Long Island,
"Bank of Hammondsport, The",Former Bank/Trust Company,19960714,"Chase Manhattan Bank, The",
"Chase Manhattan Bank of Western New York, N.A.",Former Bank/Trust Company,20041113,"JPMorgan Chase Bank, National Association",
"Dreyfus Trust Company, The",Limited Purpose Trust Company,20080701,"Bank of New York Mellon, The",102015.0
German Exchange Bank of the City of New York,Former Bank/Trust Company,19210601,National City Bank of New York,4400000.0
Bank Brussels Lambert S.A./N.V.,Foreign Representative Offices,19981120,Bank Brussels Lambert S.A./N.V.,
Andover National Bank,Former Bank/Trust Company,19910601,"Key Bank of Eastern New York, N.A.",170007.0
Citizens Bank of Arcade,Bank,18900000,Citizens Bank of Arcade,
Dutchess Bank & Trust Company,Former Bank/Trust Company,19891006,Irving Trust Company,102015.0
Genesee County Loan Association,Former Savings and Loan,18790415,Genesee County Loan Association,
Continental National Bank of New York,Former Bank/Trust Company,18530000,Continental Bank,
Norstar Bank (Rochester),Former Bank/Trust Company,19580301,Baldwin's Bank of Penn Yan,8000250.0
Slavonic Immigrant bank,Former Bank/Trust Company,19290801,Interstate Trust Company,8000298.0
Niagara County Savings Bank,Former Savings Bank,19971113,Fleet Bank N.A.,5801998.0
"Key Bank of New York, N.A.",Trust Company,19630401,National Commercial Bank and Trust Company,
Phoenix Bank,Former Bank/Trust Company,19150900,"Century National Bank of New York, The",126.0
Vassar Bank,Former Bank/Trust Company,19931231,Marine Midland Bank,5800183.0
Nationar,Trust Company,19330906,Savings Banks Trust Company,
Bank Leumi USA,Bank,19730413,Bank Leumi Trust Company of New York,
"First National Bank of Poughkeepsie, The",Former Bank/Trust Company,19760101,Marine Midland Bank (12/75-2/80),170046.0
Key Bank,Former Bank/Trust Company,19910601,"Key Bank of New York, N.A.",
Citizens Bank of Arcade,Bank,19710716,,
"Southern National Bank of New York, The",Former Bank/Trust Company,19180301,Irving Trust Company (11/1917-3/1920),8500186.0
Suffern National Bank and Trust Company,Former Bank/Trust Company,19700201,Empire National Bank,8500151.0
Nationar,Trust Company,19980513,,
United International Bank,Bank,20151120,Preferred Bank,5801361.0
"Watertown National Bank, The",Former Bank/Trust Company,19930826,NSA Bank,114041.0
Citizens Trust Company (Clyde),Former Bank/Trust Company,19291230,Citizens Trust Company (Clyde),
Tuckahoe Savings and Loan Association,Savings & Loans,19400000,Tuckahoe Savings and Loan Association,
Bensonhurst National Bank of Brooklyn in New York,Former Bank/Trust Company,20041113,"JPMorgan Chase Bank, National Association",
Banco Santander Puerto Rico,Foreign Branches,19780331,Banco de Santander - Puerto Rico,
"State Savings, F.A.",Former Savings and Loan,19820630,State Savings F.A.,
Title Guarantee and Trust Company,Trust Company,18830000,German-American Loan & Trust Co of City of NY,
Merrill Lynch International Finance Corporation,Investment Company (Article XII),19840327,Merrill Lynch International Finance Corporation,
Westfield Savings & Loan Association,Former Savings and Loan,19910531,,
New-York Chemical Manufacturing Company,Trust Company,19780929,"Chemical Bank - Eastern, N.A.",79.0
"Bank of Tokyo Trust Company, The",Trust Company,19960401,Mitsubishi Bank Trust Company of New York,113058.0
"Standard National Bank, Woodside, N.Y.",Bank,19960714,"Chase Manhattan Bank, The",
"Marine Midland Bank of Southeastern N.Y., N.A.",Former Bank/Trust Company,18640000,"First National Bank of Poughkeepsie, The",
Discount National Bank of New York,Former Bank/Trust Company,19620101,First National City Bank,
American Exchange Irving Trust Co.,Trust Company,19230207,Irving Bank of New York,45.0
"North Java Company, Private Bankers",Non NYS Institutions,19361231,Wyoming County Bank and Trust Company,
Manufacturers & Traders - Peoples Trust Company,Trust Company,20030401,Allfirst Bank,5801137.0
Fort Plain National Bank,Former Bank/Trust Company,19880624,Norstar Bank of Callicoon,114025.0
Bank of Rockville Centre Trust Company,Former Bank/Trust Company,19630601,Chemical Bank New York Trust Company,103011.0
Kookmin Bank,Foreign Representative Offices,19990104,Korea Long Term Credit Bank,2211004.0
Bankers Trust Company of New York,Limited Purpose Trust Company,20060117,Deutsche Bank Trust Company New York,
"Banco da Lavoura de Minas Gerais, S.A.",Foreign Branches,19710412,"Banco Real, S.A.",
Liberty Bank and Trust Company,Former Bank/Trust Company,18820000,"German-American Bank of Buffalo, NY",
Hamilton Trust Company,Former Bank/Trust Company,19960714,"Chase Manhattan Bank, The",
"Northfield Savings Bank, FSB",Former Savings Bank,18870201,Northfield Building-Loan & Savings Association,
"First National Bank of Weedsport, The",Former Bank/Trust Company,19790330,Key Bank of Central New York,
Niagara Frontier Bank of New York,Former Bank/Trust Company,19891006,Irving Trust Company,102015.0
Morton Trust Company (1899),Former Bank/Trust Company,19000000,State Trust Company,143.0
Protective Savings & Loan Association,Former Savings and Loan,19260000,Protective Savings & Loan Association,
Northport Trust Company,Former Bank/Trust Company,20041113,"JPMorgan Chase Bank, National Association",
HSBC Bank USA (12/93-12/99),Trust Company,20040630,HSBC Bank USA,
Stuyvesant Falls Building and Loan Association,Former Savings and Loan,19811031,City and County Savings Bank,208007.0
Niagara County Savings & Loan Association,Former Savings and Loan,19910531,Manufacturers Hanover Trust Company,113004.0
National Nassau Bank of New York,Former Bank/Trust Company,19230101,Irving Bank of New York,
Security National Bank of Huntington,Bank,20041113,"JPMorgan Chase Bank, National Association",
Orangetown Savings & Loan Association,Former Savings and Loan,19620701,Provident Savings & Loan Association,8200096.0
Coal and Iron Bank of the City of New York,Former Bank/Trust Company,19991231,HSBC Bank USA,
Kingsboro National Bank of Brooklyn in New York,Former Bank/Trust Company,19290000,Kingsboro National Bank of Brooklyn in New York,
Van Norden Trust Company,Former Bank/Trust Company,19020000,Van Norden Trust Company,
Metropolitan Savings Bank,Former Savings Bank,20040630,HSBC Bank USA,
Suffern National Bank and Trust Company,Former Bank/Trust Company,19800911,"Bank of New York, The (9/1922-10/1989)",8000241.0
White Plains Federal Savings & Loan Association,Former Savings and Loan,19161204,White Plains Savings & Loan Association,
Ogaki Kyoritsu Bank Ltd.,Foreign Representative Offices,20021224,Ogaki Kyoritsu Bank Ltd.,
"Southern National Bank of New York, The",Former Bank/Trust Company,19200301,New York National Irving Bank,
Rockville Center Savings & Loan Association,Former Savings and Loan,19821025,Nassau Federal Savings and Loan Association,
Medina Trust Company,Former Bank/Trust Company,19760101,Marine Midland Bank (12/75-2/80),170046.0
Irving Savings Bank,Former Savings Bank,19540802,American Savings Bank (1/1882-8/1954),8100128.0
"Saugerties Bank, The",Former Bank/Trust Company,19960714,Chemical Bank,103011.0
Real Estate Trust Company of New York,Former Bank/Trust Company,19690217,Chemical Bank,
Electric City Bank,Former Bank/Trust Company,19650901,Marine Midland Trust Company of Western New York,
