Institution Name Primary,Type,Event Date,Institution Name (Secondary),Identification Number (Secondary)
Columbus Trust Company,Former Bank/Trust Company,19910601,"Key Bank of New York, N.A.",
Manufacturers Hanover Trust Company/Mid-Hudson,Former Bank/Trust Company,19960714,"Chase Manhattan Bank, The",
DKF Trust Company (USA),Trust Company,20030306,"Mizuho Trust & Banking Co., Ltd.",
American Savings Bank (1/1882-8/1954),Former Savings Bank,19540802,Irving Savings Bank,8100020.0
Apple Bank For Savings,Savings Banks,19321231,Commonwealth Savings Bank of New York City,158.0
"Amsterdam Savings Bank, FSB",Savings Banks,19981116,Mohawk Community Bank,5800039.0
Wappinger Savings Bank,Former Savings Bank,18690000,Wappinger Savings Bank,
Banque Francaise du Commerce Exterieur,Foreign Branches,20070216,Natixis,
"Gotham Bank, The",Former Bank/Trust Company,19590401,"Gotham Bank, The",
Dollar Savings Bank of New York,Savings Banks,19920212,Emigrant Savings Bank,205007.0
Manufacturers and Traders Trust Company,Trust Company,19451031,Citizens National Bank of Lancaster,90.0
Metropolitan Nat Bnk & Trust Co of the City of NY,Former Bank/Trust Company,19030000,Atlantic Trust Company,8000405.0
First Savings & Loan Association of Syracuse,Former Savings and Loan,19870819,,
Industry Savings & Loan Association,Former Savings and Loan,19550803,Industry Federal Savings & Loan Association,
Emigrant Savings Bank,Savings Banks,20060120,Emigrant Bank,
Emigrant Savings Bank,Savings Banks,19670414,Emigrant Savings Bank,
Central Realty Bond Exchange and Trust Company,Former Bank/Trust Company,19150201,Lawyers' Title and Trust Company,
Morris Plan Company of Schenectady,Bank,19340000,Morris Plan Industrial Bank of Schenectady,
Italian American Trust Company,Former Bank/Trust Company,19891006,"Bank of New York, The",
Provident Savings & Loan Association,Former Savings and Loan,19820421,"Provident Savings, A Federal Savings & Loan",
Mohawk Bank of Schenectady,Former Bank/Trust Company,19971113,Fleet Bank N.A.,5801998.0
"Seneca County Trust Company of Seneca Falls, N.Y.",Former Bank/Trust Company,19240000,"Seneca County Trust Company of Seneca Falls, NY",
"Oneida Bank, The",Former Bank/Trust Company,19940701,Fleet Bank,
First Citizens Bank & Trust Company of Utica,Former Bank/Trust Company,19991231,Republic Bank of New York,170040.0
City Trust Company of New York,Former Bank/Trust Company,20041113,"JPMorgan Chase Bank, National Association",
Banco Central of New York,Trust Company,19301126,Union Bank of Bronx County,41.0
Nassau Union Bank,Former Bank/Trust Company,19531001,Glen Cove Trust Company,8000108.0
North Hempstead FS & LA of Port Washington,Former Savings and Loan,19350629,North Hempstead FS & LA of Port Washington,
Chemical Corn Exchange Bank,Trust Company,19541015,Chemical Corn Exchange Bank,
Livingston County Trust Company,Former Bank/Trust Company,19300601,Genesee Valley Natl Bank & Trust Co of Geneseo,8500062.0
"Export-Import Bank of Korea, The",Foreign Representative Offices,19940506,"Export-Import Bank of Korea, The",
Kenmore Savings and Loan Association,Former Savings and Loan,19750701,Niagara First Savings & Loan Association,
Eleventh Ward Bank,Former Bank/Trust Company,19020501,Corn Exchange Bank,8000017.0
"Chase Manhattan Bank of Northern New York, N.A.",Former Bank/Trust Company,19760101,"Chase Manhattan Bank, N.A., The",5800033.0
Nyack National Bank and Trust Company,Former Bank/Trust Company,19760101,Marine Midland Bank (12/75-2/80),170046.0
Nyack Bank and Trust Company,Former Bank/Trust Company,19681201,Lafayette Bank and Trust Company of Suffern,8000221.0
M & T Trust Company,Trust Company,19330130,Manufacturers and Traders Trust Company,
United Workers Credit Union,Credit Unions,20050526,United Workers Credit Union,
"Peoples Bank of Hamburg, The",Former Bank/Trust Company,19920101,"Fleet Bank of New York, N.A.",
Tinton Credit Union,Former Credit Union,19230528,Tinton Credit Union,
Armour New York City Credit Union,Former Credit Union,19360608,Armour Fort Greene Credit Union,8300373.0
Peoples National Bank & Trust Co of White Plains,Former Bank/Trust Company,19240000,Peoples National Bank & Trust Co White Plains,
Farmers' & Mechanics' SB of the City of Lockport,Savings Banks,20021108,Cayuga Bank,170069.0
Irving Bank of New York,Trust Company,19120801,Irving National Bank,
Nyack Savings & Loan Association,Former Savings and Loan,19830926,"Goldome, FSB",
M & T Trust Company,Trust Company,20030613,"Allfirst Trust Company of Pennsylvania, National Association",5801086.0
Marine Midland Trust Company of Central New York,Bank,19760101,Marine Midland Bank (12/75-2/80),170046.0
Bowery Savings Bank (5/1834-10/1985),Former Savings Bank,19920901,"Home Savings of America, Bowery Division, FSB",270018.0
Manufacturers & Traders - Peoples Trust Company,Trust Company,19460629,Merchants National Bank of Dunkirk,94.0
"Franklin Savings Bank in the City of NY, The",Savings Banks,19830729,"American Savings Bank, F.S.B.",
Rising Star Credit Union,Former Credit Union,19310720,,
Sixth Ward Savings Bank,Savings Banks,19740701,Hudson Savings & Loan Association,8200069.0
"Irvington National Bank and Trust Company, The",Former Bank/Trust Company,19891006,Irving Trust Company,102015.0
Union National Bank of Franklinville,Former Bank/Trust Company,19921001,Fleet Bank of New York,114025.0
Jeff-Lewis Savings & Loan Association,Former Savings and Loan,19700501,Jeff-Lewis Savings & Loan Association,
"Bank of North Collins, The",Former Bank/Trust Company,19850101,"Norstar Bank, N.A.",
Marine Midland Bank - Central,Bank,19450810,Bank of Manlius,8000503.0
Bank of the Metropolis,Former Bank/Trust Company,18710000,Bank of the Metropolis,
"Buffalo Savings Bank, The",Savings Banks,19870819,,
Guaranty Securities Corporation,Investment Company (Article XII),19180307,Continental Guaranty Corporation,
Manufacturers and Traders Trust Company,Trust Company,19550831,Bank of Clarence,98.0
Western Division Credit Union,Credit Unions,19980603,Osmose Employees Federal Credit Union,5800840.0
"Barclays Bank of New York, N.A.",Bank,19740531,First Westchester National Bank,8500102.0
"Central Bank & Trust Company of New York, N.A.",Former Bank/Trust Company,19810401,"Central National Bank of New York, N.A.",
Eighth Avenue Bank,Former Bank/Trust Company,18940000,Eighth Avenue Bank,
Champlain Valley Savings & Loan Association,Former Savings and Loan,19340720,Champlain Valley FS & LA of Plattsburgh,
Cazenovia National Bank,Former Bank/Trust Company,19880101,"Key Bank of Central N.Y., N.A.",8500171.0
Mechanics National Bank of the City of New York,Former Bank/Trust Company,19960714,"Chase Manhattan Bank, The",
Five Star New York Trust Company,Limited Purpose Trust Company,20060807,Five Star New York Trust Company,
United States Savings Bank,Former Savings Bank,19320711,Dry Dock Savings Institution,166.0
Farmers' & Mechanics' Trust Company,Former Bank/Trust Company,19120000,Farmers' & Mechanics' Trust Company,
Farmers' & Mechanics' SB of the City of Lockport,Savings Banks,20100409,"First Niagara Bank, NA",
Phenix Bank of the City of New York,Former Bank/Trust Company,19960714,"Chase Manhattan Bank, The",
"Mizuho Asset Trust & Banking Co., Ltd.",Foreign Representative Offices,20030306,"Mizuho Trust & Banking Co., Ltd.",170037.0
Seaboard Natl Bank of the City of NY (1885-3/22),Former Bank/Trust Company,19220301,Seaboard Natl Bank of the City of NY (3/22-6/29),
Security Trust Company,Former Bank/Trust Company,18920000,Security Trust Company of Rochester,
Freehold Savings and Loan Association,Former Savings and Loan,19630329,Community Savings & Loan Association (Buffalo),8200029.0
Glen Cove Nassau Union Trust Company,Former Bank/Trust Company,19971113,Fleet Bank N.A.,5801998.0
Swedbank (Sparbankernas Bank),Foreign Branches,20070416,Swedbank AB,
Belfast National Bank,Former Bank/Trust Company,19921001,Fleet Bank of New York,114025.0
"Westchester Bank and Trust Company, The",Former Bank/Trust Company,19011001,New Rochelle Trust Company,
Niagara County Bank,Former Bank/Trust Company,18560000,Niagara County Bank,
"Atlantic State Bank, The",Former Bank/Trust Company,19960714,"Chase Manhattan Bank, The",
Fleet Bank N.A.,Trust Company,20040401,"Bank of America, N.A.",
Owego National Bank,Former Bank/Trust Company,18830000,Owego National Bank,
Up-town Savings Bank,Former Savings Bank,18751201,,
New York Savings Bank,Savings Banks,19910531,,
Wheatly Hills National Bank of Westbury,Former Bank/Trust Company,19870309,"Peconic Bank, The",114036.0
Erie County Social Welfare Credit Union,Credit Unions,19920625,A. T. & M. Corp. Employees Credit Union,460101.0
Pan American Trust Company,Trust Company,19760915,Bank Leumi Trust Company of New York,170011.0
Harris Trust Company of New York,Limited Purpose Trust Company,20040922,,
Metropolitan National Bank of the City of NY,Former Bank/Trust Company,18650000,National Shoe & Leather Bank of the City of NY,
P.T. Bank Central Asia (Persero),Foreign Representative Offices,19941014,P.T. Bank Central Asia (Persero),
Long Island National Bank of Hicksville,Former Bank/Trust Company,19870218,"Bank of New York, The (9/1922-10/1989)",8000241.0
Endicott Bank of New York,Former Bank/Trust Company,19760101,"Bank of New York, The (9/1922-10/1989)",8000241.0
Pkbanken International (US) Banking Corporation,Investment Company (Article XII),19861022,Pkbanken International (US) Banking Corporation,
Coal & Iron National Bank of the City of New York,Former Bank/Trust Company,19040000,Coal & Iron Natioal Bank of the City of New York,
Emanu-el Credit Union,Former Credit Union,19360804,Emanu-el Credit Union,
Stuyvesant Credit Union,Former Credit Union,19240402,Stuyvesant Credit Union,
Chemical National Bank of New York,Trust Company,20041113,"JPMorgan Chase Bank, National Association",
Citibank (New York State) N.A.,Former Bank/Trust Company,19720000,"Citibank (Western), N.A.",
Peoples Westchester Savings Bank,Savings Banks,19780301,Peoples Westchester Savings Bank,
"Banco Espirito Santo, S.A.",Foreign Branches,20000921,"Banco Espirito Santo, S.A.",
"Prudential Bank, The",Bank,19960714,"Chase Manhattan Bank, The",
Mineola Savings & Loan Association,Former Savings and Loan,19600000,Peoples Savings & Loan Association (Long Island),
Continental Savings & Loan Association,Former Savings and Loan,19300000,Scandinavian Savings & Loan Association,
Phenix Bank of the City of New York,Former Bank/Trust Company,18650000,Phenix National Bank of the City of New York,
Svenska Handelsbanken PLC,Foreign Branches,19860823,Svenska International Limited,
Onondaga County Welfare Credit Union,Former Credit Union,19660412,,
Equitable Savings & Loan Assoc (1939-1945),Former Savings and Loan,19450409,South Brooklyn Savings & Loan Association,8200362.0
Habib American Bank,Trust Company,20031223,Habib Bank of New Jersey,5801155.0
Oyster Bay Trust Company,Former Bank/Trust Company,19920601,Fleet Bank (6/92-6/94),
Fulton Bank (Brooklyn),Former Bank/Trust Company,20041113,"JPMorgan Chase Bank, National Association",
Buffalo Industrial Bank,Former Bank/Trust Company,19760101,"Bank of New York, The (9/1922-10/1989)",8000241.0
Continental Bank & Trust Company of New York,Former Bank/Trust Company,19290801,Mutual Trust Company (1929),8000360.0
First National Bank of Silver Creek,Bank,19120000,First National Bank of Silver Creek,
Sampo Bank plc,Foreign Representative Offices,20010410,,
Community National Bank of Buffalo,Former Bank/Trust Company,19630401,Liberty National Bank and Trust Company,170048.0
Island State Bank,Former Bank/Trust Company,19940701,Fleet Bank of New York,114025.0
Harlem Savings Bank,Savings Banks,19321231,Commonwealth Savings Bank of New York City,158.0
Marine Midland Bank Trust Company of Southern NY,Bank,19390225,Elmira Bank & Trust Company,
Electric City Bank,Former Bank/Trust Company,19700101,Marine Midland Bank - Western,
National Savings Bank of Buffalo,Former Savings Bank,18670425,National Savings Bank of Buffalo,
Rochester Community Savings Bank,Savings Banks,19440531,"Community Savings Bank of Rochester, The",
Lincoln-Alliance Bank,Former Bank/Trust Company,19440601,Geneva Trust Company,8000502.0
"Citizens National Bank of Waverly, The",Former Bank/Trust Company,19260000,Citizens National Bank of Waverly,
"National Bank of Phelps, The",Former Bank/Trust Company,19920101,"Fleet Bank of New York, N.A.",
Germania Savings Bank,Former Savings Bank,19830822,Metropolitan Federal Savings Bank,8500167.0
Manhattan Savings Institution,Savings Banks,19420512,Metropolitan Savings Bank,8100024.0
Hempstead Bank,Former Bank/Trust Company,19560401,Wheatly Hills National Bank of Westbury,8500141.0
Polish Co-Operative Savings & Loan Assocaiation,Former Savings and Loan,19910531,"East New York Savings Bank, The",205001.0
Nassau Trust Company of the City of Brooklyn,Former Bank/Trust Company,19140601,Mechanics' Bank (Brooklyn),8000285.0
"Citizens Trust Company of Patchogue, The",Former Bank/Trust Company,19330325,Patchogue Citizens Bank & Trust Company,
Genesee Federal Savings & Loan Association,Former Savings and Loan,19830926,,
"Key Bank of Western New York, N.A.",Former Bank/Trust Company,19831216,"Key Bank, Jamestown",8000246.0
Southold Savings Bank,Trust Company,20070801,"Capital One, N.A.",5801214.0
Midland Bank Limited,Former Foreign Agency,19650112,Midland Bank Limited,
Irving Bank-Columbia Trust Co.,Trust Company,19000601,New York and London Trust Company,
Liberty National Bank,Trust Company,19640301,Peoples Bank of Erie County,8000118.0
Briggs Bank of Clyde,Former Bank/Trust Company,19830401,Key Bank,
Broadway National Bank & Trust Co of New York,Former Bank/Trust Company,19670501,National Bank of North America,
Citizens Savings Bank of New York City,Former Savings Bank,19420715,Manhattan Savings Institution,213.0
First National Bank of Elmsford,Former Bank/Trust Company,19760101,"Bank of New York, The (9/1922-10/1989)",8000241.0
Savings Bank of Ridgewood,Savings Banks,19920612,American Savings Bank,201002.0
Manhattan Savings Bank,Savings Banks,18510409,Williamsburg Savings Bank,
Manufacturers Bank of Brooklyn,Bank,19920619,Chemical Bank,103011.0
"First National Bank of Whitestone, The",Former Bank/Trust Company,20041113,"JPMorgan Chase Bank, National Association",
"Southern National Bank of New York, The",Former Bank/Trust Company,19891006,"Bank of New York, The",
"Fleet Bank of New York, N.A.",Trust Company,19650401,Dunkirk Trust Company,8000094.0
Goshen Savings & Loan Association,Savings & Loans,19830831,Middletown Savings Bank,213006.0
United National Bank (Callicoon),Former Bank/Trust Company,19320000,First National Bank of Callicoon,
New York Co-Operative Federal Savings & Loan,Former Savings and Loan,19350504,New York Co-Operative FS & LA,
Real Estate Loan and Trust Company of New York,Former Bank/Trust Company,19060401,Fulton Trust Company of New York,
ABN AMRO Bank N.V.,Foreign Representative Offices,20100809,ABN AMRO Bank N.V.,
Hudson Valley National Bank,Trust Company,20071119,"Hudson Valley Bank, N.A.",
Credit Lyonnais,Foreign Representative Offices,19941024,Credit Lyonnais,
Rose Hill Savings Bank,Savings Banks,18540417,Rose Hill Savings Bank,
Silver Creek National Bank,Former Bank/Trust Company,19760101,Citibank (New York State) N.A.,
"J & W Seligman Trust Company, N.A.",Trust Company,19950428,JWS Trust Company,
Elmira Bank & Trust Company,Bank,19990329,HSBC Bank USA,
First Natl Bank of Staten Island at New Brighton,Former Bank/Trust Company,19690217,Chemical Bank,
Nassau Trust Company,Former Bank/Trust Company,19830801,Norstar Bank of Long Island (8/83-3/87),
City Savings Bank of Albany,Savings Banks,19350629,City and County Savings Bank,
Credit Local de France - Caecl SA,Foreign Branches,20010404,Dexia Credit Local S.A.,
First Trust Company of Albany,Trust Company,19930826,Key Bank of New York,114041.0
Long Island Bank,Former Bank/Trust Company,19760908,Long Island National Bank,8500075.0
Murray Hill Trust Company,Former Bank/Trust Company,19550301,First National City Bank of New York,
Bank of Nassau County,Former Bank/Trust Company,19311102,First Natl Bank of Great Neck at Great Neck Sta.,8500251.0
Merrill Lynch International Finance Corporation,Investment Company (Article XII),20090820,,
Liberty National Bank and Trust Company,Trust Company,19630901,State Bank of Newfane,8000167.0
"Peoples National Bank of Greenport, The",Former Bank/Trust Company,19921001,North Fork Bank,
"Savings Bank of Utica, The",Savings Banks,20020208,SBU Bank,
Jamestown Metal Employees Credit Union,Credit Unions,19400930,Lodge 1558 I. A. of M. Credit Union,
"Bayerische Vereinsbank, ART",Former Foreign Agency,19840000,,
Institutional Investors Capital Appreciation Fund,NYS Regulated Corporations,20071025,,
Goldome,Savings Banks,19870819,,
First Trust and Deposit Company,Former Bank/Trust Company,19800627,Homer National Bank,8500076.0
Central Federal Savings & Loan Assoc (Albany),Former Savings and Loan,18910216,Central Savings & Loan of Albany,
Western Savings and Loan Association,Former Savings and Loan,18940108,Western Savings and Loan Association,
"Key Bank of Eastern New York, NA",Trust Company,19970113,"Key Bank, National Association",5801003.0
"Bank of the Ryukyus, LTD.",Foreign Representative Offices,19931110,"Bank of the Ryukyus, Ltd.",
Greenwich Bank of the City of New York,Former Bank/Trust Company,18300000,Greenwich Bank of the City of New York,
Geddes Savings & Loan Association,Former Savings and Loan,19490207,Geddes Savings & Loan Association,
"Hokkoku Bank, Ltd., The",Foreign Representative Offices,19931025,"Hokkoku Bank, Ltd., The",
National Bank of Westchester,Former Bank/Trust Company,20041113,"JPMorgan Chase Bank, National Association",
Genesee National Bank of Buffalo,Former Bank/Trust Company,19510428,Marine Trust Company of Western New York,
"Anglo-South American Trust Company, The",Limited Purpose Trust Company,19990920,Harris Trust Company of New York,
"First National Bank of Poughkeepsie, The",Former Bank/Trust Company,19991231,Republic Bank of New York,170040.0
Canaseraga State Bank,Former Bank/Trust Company,19570601,First Trust Company of Allegany County,
Goldome Bank For Savings,Savings Banks,19910531,,
Central Trust of China,Foreign Representative Offices,19960731,,
Globe Credit Union,Former Credit Union,19190724,Globe Credit Union,
Marine Midland Bank - New York,Bank,19300701,Marine Midland Trust Company of New York,
Flushing and Queens County Bank,Former Bank/Trust Company,19290501,Corn Exchange Bank Trust Company,
"Chase Manhattan Bank, The",Trust Company,19961201,"Chase Manhattan Bank, National Association",170067.0
"Bank of Tokyo Trust Company, The",Trust Company,20060101,Bank of Tokyo - Mitsubishi UFJ Trust Company,
Fidelity Bank and Trust Company,Former Bank/Trust Company,19920619,Chemical Bank,103011.0
Peoples Bank of Rockland County,Former Bank/Trust Company,19600901,Peoples Bank of Rockland County,
New York Community Bank,Savings Banks,20071001,Synergy Bank,5801218.0
Atlantic National Bank of the City of New York,Former Bank/Trust Company,19550301,First National City Bank of New York,
Bank of the Hudson,Savings Banks,18310416,Poughkeepsie Savings Bank,
Citizens Central Bank,Bank,19810901,Central Trust Company,
Emigrant Bank,Savings Banks,18500410,"Emigrant Industrial Savings Bank, The",
Hewitt Employees Credit Union,Former Credit Union,19400630,Hewitt Employees Credit Union,
Century National Bank and Trust Company,Former Bank/Trust Company,20070801,"Capital One, N.A.",5801214.0
Fourteenth Street Bank in the City of New York,Former Bank/Trust Company,19110801,"Security Bank of New York, The",
Boulevard Bank,Former Bank/Trust Company,19290000,Boulevard Bank,
Nyack Savings & Loan Association,Former Savings and Loan,19390000,Nyack Savings & Loan Association,
Equitable Trust Company of New York(1871-5/1930),Former Bank/Trust Company,19960714,"Chase Manhattan Bank, The",
Franklin National Bank of Long Island,Bank,19621001,Franklin National Bank,
C.I.T. Corporation,Investment Company (Article XII),19450426,C.I.T. Corporation,
Bankers Trust Company New York Limited,Limited Purpose Trust Company,19910327,Bankers Trust Company New York Limited,
Security Loan Association,Former Savings and Loan,18810517,Security Loan Association,
Westfield Savings & Loan Association,Former Savings and Loan,19910531,Manufacturers and Traders Trust Company,113003.0
Lincoln Savings Bank of Brooklyn,Former Savings Bank,19301016,Church Lane Savings Bank,8100157.0
County Trust Company of New York,Trust Company,19260000,County Trust Company of New York,
American Exchange National Bank,Bank,19891006,"Bank of New York, The",
Niagara Permanent Savings & Loan Association,Former Savings and Loan,19730101,Kensington Savings & Loan Association,8200287.0
Greenpoint Credit Union,Former Credit Union,19820826,,
Citizens Trust Company of Fredonia,Trust Company,19570830,Manufacturers and Traders Trust Company,113003.0
Retail Employees No. 1130 Credit Union,Credit Unions,19751001,District 1199 Credit Union,
"Portchester Savings Bank, The",Savings Banks,19491230,Port Chester Savings Bank,
"Prudential Bank, The",Bank,19291001,Midtown Bank of New York (10/1929-8/1931),
Troy Hebrew Credit Union,Former Credit Union,19670605,,
Queens National Bank of New York,Former Bank/Trust Company,19601101,Meadow Brook National Bank of Nassau County,8500008.0
Matteawan Savings Bank of Beacon,Former Savings Bank,19100101,Matteawan Savings Bank of Beacon,
Rose Hill Savings Bank,Savings Banks,19630816,Bank For Savings in the City of New York,8100000.0
"Barclays Bank of New York, N.A.",Bank,19710317,Barclays Bank of New York,
Banco Central Hispano - USA,Trust Company,19740115,United Americas Bank,
"Community Savings Bank of Rochester, The",Savings Banks,18690000,"East Side Savings Bank of Rochester, The",
Marine Midland Bank - Western,Bank,19760101,Marine Midland Bank (12/75-2/80),170046.0
"Depository Trust Company, The",Limited Purpose Trust Company,19980831,Participants Trust Company,116009.0
Dutchess County Savings Bank,Former Savings Bank,18510709,Dutchess County Savings Bank,
"Key Bank of Western New York, N.A.",Former Bank/Trust Company,19680201,Citizens National Bank and Trust Company,
First National Bank and Trust Company of Ithaca,Former Bank/Trust Company,19921001,Fleet Bank of New York,114025.0
Rome City Bank,Former Bank/Trust Company,19971113,Fleet Bank N.A.,5801998.0
"Key Bank of Eastern New York, NA",Trust Company,19621201,Trust Company of Fulton County,8000109.0
Ogdensburg Trust Company,Former Bank/Trust Company,19880624,Norstar Bank of Upstate NY,
"German-American Bank of Buffalo, NY",Former Bank/Trust Company,19630111,First National Bank of Batavia,8500262.0
Flatbush Savings Bank,Former Savings Bank,19970930,Astoria FS & LA,5800077.0
"HSBC Bank USA, National Association",Trust Company,20020902,HSBC Oregon Shell Bank,5801104.0
Midtown Bank of New York (10/1929-8/1931),Bank,19291001,Midtown Bank of New York (1927-10/1929),8000404.0
Prague Credit Bank,Former Foreign Agency,19390000,Anglo Prague Credit Bank,
Park Bank,Former Bank/Trust Company,19290801,Chase National Bank of the City of New York,8500003.0
"Bank of New York Mellon, The",Trust Company,19230207,Irving Bank-Columbia Trust Co.,
Korea First Bank,Foreign Agencies,19770511,Korea First Bank,
Chemical Bank New York Trust Company,Trust Company,18230000,New-York Chemical Manufacturing Company,
"Hachijuni Bank, Ltd., The",Foreign Representative Offices,19870304,"Hachijuni Bank, Ltd., The",
First Federal Savings & Loan Assoc of Syracuse,Former Savings and Loan,19910531,Manufacturers Hanover Trust Company,113004.0
Security National Bank of Huntington,Bank,19551101,"Bank of Northern Brookhaven, The",8000253.0
First Bank and Trust Company of Corning,Former Bank/Trust Company,19940701,Fleet Bank,
Italian Savings Bank of the City of New York,Savings Banks,19960628,Marine Midland Bank,5800183.0
"Key Bank of New York, N.A.",Trust Company,19630401,National Commercial Bank and Trust Company,
"Bank of United States, The",Former Bank/Trust Company,19300924,,
Ideal Credit Union,Credit Unions,19350313,Brotherhood Ideal Credit Union,
"Oneida Saving, Building and Loan Association",Former Savings and Loan,19820630,"Albany Savings Bank, FSB",
Equitable Savings & Loan Association,Former Savings and Loan,19450409,Equitable Savings & Loan Assoc (1939-1945),8200039.0
Union Trust Company of New York,Former Bank/Trust Company,19960714,"Chase Manhattan Bank, The",
Commonwealth Bank,Bank,19960714,"Chase Manhattan Bank, The",
Oystermen's National Bank of Sayville,Former Bank/Trust Company,19910601,"Key Bank of New York, N.A.",
"Key Bank of New York, N.A.",Trust Company,19520801,Hudson River Trust Company,8000127.0
Coal and Iron Bank of the City of New York,Former Bank/Trust Company,19260200,Coal and Iron Bank of the City of New York,
Community Mutual Savings Bank of Southern NY,Savings Banks,19800201,Community Mutual Savings Bank of Southern NY,
Sumitomo Mitsui Banking Corporation,Foreign Branches,19520917,"Bank of Osaka, Ltd., The (1952)",
Pittsford National Bank,Former Bank/Trust Company,19870401,"Norstar Bank, N.A.",170048.0
Bowery Bank of New York,Former Bank/Trust Company,18650000,Bowery National Bank of New York,
Glen Cove Nassau Union Trust Company,Former Bank/Trust Company,19531001,Nassau Union Bank,8500064.0
Christiania Banking (US) Corporation,Investment Company (Article XII),19860916,Christiania Banking (US) Corporation,
Bank of Steuben,Trust Company,20090220,Steuben Trust Company,
"Mitsui Trust and Banking Company, Limited, The",Foreign Branches,19990630,,
"First National Bank of Highland, The",Former Bank/Trust Company,19920229,Manufacturers and Traders Trust Company,113003.0
Chemung Valley Savings & Loan Association,Former Savings and Loan,18750401,Chemung Valley Mutual Loan Association,
Fallkill National Bank & Trust Co of Poughkeepsie,Former Bank/Trust Company,19750430,Bankers Trust of Rockland County,8000219.0
