Institution Name Primary,Identification Number Primary,Type,Event Type
"Bank of Northern Brookhaven, The",8000253,Former Bank/Trust Company,Name Change To
New-York Manufacturing Company,8000408,Former Bank/Trust Company,Merge To State
Cornwall National Bank,8500045,Former Bank/Trust Company,Established
Tappan Zee National Bank of Nyack,76,Bank,Convert Federal
Marine Trust Company of Western New York,5000014,Bank,Name Change To
Franklin National Bank in New York,8000310,Former Bank/Trust Company,Merge To State
Manufacturers and Traders Trust Company,113003,Trust Company,Acquire By Merger
Merchants and Farmers National Bank of Dansville,8500049,Former Bank/Trust Company,Merge To State
Barclays Bank D.C.O.,502034,Foreign Branches,Name Change To
Watkins State Bank,8000498,Former Bank/Trust Company,Established
1199 SEIU Credit Union,461202,Credit Unions,Name Change To
Morris Plan Industrial Bank of Schenectady,84,Bank,Established
Peoples Bank of Haverstraw,8000120,Former Bank/Trust Company,Established
Commercial Bank of North America,8000029,Former Bank/Trust Company,Name Change To
National Bank of Northern New York,8500133,Former Bank/Trust Company,Name Change To
Tappan Zee National Bank,76,Bank,Merge To State
Trust Company of Wyoming County,123002,Trust Company,Merge To State
Mechanics & Metals Natl Bank of the City of NY,8000320,Former Bank/Trust Company,Name Change To
Mineola Savings & Loan Association,8200333,Former Savings and Loan,Convert Federal
Bank of Great Neck,102050,Bank,Merge To State
"Luzerne-Hadley Bank, The",8000138,Former Bank/Trust Company,Established
Daiwa Bank Trust Company,170018,Trust Company,Liquidated
Peoples Savings Bank of Yonkers,197,Savings Banks,Merge To Federal
Commercial Trust Company (1884-1900),102015,Trust Company,Name Change To
Hongkong and Shanghai Banking Corporation Limited,2270172,Foreign Representative Offices,Agency To Branch
Amalgamated Bank of New York,101003,Trust Company,Name Change To
Steuben Trust Company,119016,Trust Company,Branches Sold To
Fairport National Bank and Trust Company,8500257,Former Bank/Trust Company,Name Change To
National Bank of Middletown,8500151,Former Bank/Trust Company,Merge To State
White Plains Federal Savings & Loan Association,8200286,Former Savings and Loan,Convert Federal
Bowery and East River National Bank of New York,8500215,Former Bank/Trust Company,Acquire By Merger
Bayerische Vereinsbank Aktiengesellschaft,521001,Foreign Branches,Name Change To
Dry Dock Savings Institution,166,Savings Banks,Merge To State
Spring Valley Savings & Loan Association,8200030,Former Savings and Loan,Name Change To
Phenix Bank of the City of New York,8500207,Former Bank/Trust Company,Convert Federal
Nyack Building Co-Operative Savings & Loan Assoc,8200088,Former Savings and Loan,NYS Chartered
"Aetna National Bank of New York, The",8500199,Former Bank/Trust Company,Convert State
Merchants' Bank of Canada,9000008,Former Foreign Agency,Closed
Rugby National Bank of Brooklyn,8500244,Former Bank/Trust Company,Closed
NongHyup Bank,570381,Foreign Branches,NYS Chartered
Bankers Trust Company,102027,Trust Company,Acquire By Merger
"Kredietbank, N.V.",511002,Foreign Branches,Licensed
Glen Cove Trust Company,8000108,Former Bank/Trust Company,Bank To Trust Co.
Bank of Elba,8000100,Former Bank/Trust Company,Merge To State
Emigrant Savings Bank,205007,Savings Banks,Name Change To
Orange County Building & Loan Association # 2,8200361,Former Savings and Loan,NYS Chartered
"Rome Savings Bank, The",218007,Savings Banks,NYS Chartered
First Trust Union Bank,8000234,Former Bank/Trust Company,Name Change To
Government Securities Clearing Corp,5600003,NYS Regulated Corporations,NYS Chartered
"Chase Manhattan Bank of Eastern New York, N.A.",8500014,Former Bank/Trust Company,Merge To Federal
Home Building & Loan Assoc of Spring Valley,8200270,Former Savings and Loan,NYS Chartered
Peoples National Bank of Brooklyn in New York,8500010,Former Bank/Trust Company,Merge To State
Natl Bank of Niagara & Trust Co of Niagara Falls,8500242,Former Bank/Trust Company,Established
Trust and Deposit Company of Onondaga,8000223,Former Bank/Trust Company,Acquire By Merger
Shawmut Trust Company,119028,Limited Purpose Trust Company,NYS Chartered
Goldome Bank For Savings,207008,Savings Banks,Name Change To
Bank of Seoul and Trust Company,602030,Foreign Agencies,Name Change To
Retail Employees No. 1199 Credit Union,461202,Credit Unions,Name Change To
First National Bank and Trust Company of Ithaca,8000131,Former Bank/Trust Company,Name Change To
New-York Chemical Manufacturing Company,103011,Trust Company,Acquire By Merger
Union Trust Company of New York,8000295,Former Bank/Trust Company,Convert Federal
Homestead Savings & Loan Association (Buffalo),8200063,Former Savings and Loan,Acquire By Merger
Hartford Trust Company of NY (Limited Purpose),119028,Limited Purpose Trust Company,Name Change To
"First National Bank of Tully, The",8500130,Former Bank/Trust Company,Convert Federal
"Sumitomo Bank, Limited, The",519006,Foreign Branches,Licensed
National Bank of Commerce in New York,141,Trust Company,Succeeded By
Dexia Credit Local,603010,Foreign Branches,Name Change To
Port Washington Savings and Loan Association,17,Savings & Loans,Convert Federal
Scandinavian Savings & Loan Association,8200233,Former Savings and Loan,Name Change To
United Bank and Trust Company,8000038,Former Bank/Trust Company,Bank To Trust Co.
Chatham & Phenix National Bank of New York,8500206,Former Bank/Trust Company,Name Change To
Wm. H. Seward & Co.,8000058,Former Bank/Trust Company,Name Change To
First-City National Bank of Binghamton,8500269,Former Bank/Trust Company,Established
Bank of North America (10/58-5/67),8000029,Former Bank/Trust Company,Bank To Trust Co.
Institution For Savings of Merchants' Clerks,270014,Savings Banks,Convert State
Goldome,207008,Savings Banks,Name Change To
"Key Bank of Western New York, N.A.",8500140,Former Bank/Trust Company,Acquire By Merger
Citizens Trust Company of Fredonia,102,Trust Company,Established
Mohawk Bank of Schenectady,8500121,Former Bank/Trust Company,Established
Bank For Savings in the City of New York,8100000,Former Savings Bank,Assets Sold To
"Sixpenny Savings Bank, Rochester",8100029,Former Savings Bank,NYS Chartered
Bank Brussels Lambert S.A./N.V.,2270154,Foreign Representative Offices,NYS Chartered
Bank of New York and Trust Company,8000241,Former Bank/Trust Company,Acquire By Merger
Taurus Finance S.A.,2202026,Foreign Representative Offices,Licensed
"Pacific Bank, The",8500193,Former Bank/Trust Company,Name Change To
Peoples Westchester Savings Bank,216004,Savings Banks,Acquire By Merger
Yorkville Savings Bank,8100106,Former Savings Bank,Established
Cooperstown Savings & Loan Association,8200256,Former Savings and Loan,NYS Chartered
Itau Unibanco S.A.,502043,Foreign Branches,Agency To Branch
Bank of Nassau County,8000115,Former Bank/Trust Company,Merge To Federal
Mitsubishi Trust & Banking Corporation (U.S.A.),170026,Trust Company,Liquidated
"Toronto-Dominion Bank, The",2220002,Foreign Representative Offices,Closed
Capitalia S.p.A.,502015,Foreign Branches,Name Change To
Peoples Westchester County Savings Bank,216004,Savings Banks,Name Change To
Metropolitan National Bank of Syracuse,8000225,Former Bank/Trust Company,Established
Gateway State Bank,107001,Trust Company,Merge To State
Banco Nacional de Obras Y Servicio Publicos,8400018,Former For Rep Office,Licensed
"Patchogue Bank, The",8000248,Former Bank/Trust Company,Name Change To
New York Commercial Bank,112013,Bank,Name Change To
Lockport Savings Bank,212002,Savings Banks,Purchased LID of
"Banco di Santo Spirito, S.P.A.",502015,Foreign Branches,Name Change To
Bank of Washington Heights,8000399,Former Bank/Trust Company,Merge To State
First Trust Company of Tonawanda,8000226,Former Bank/Trust Company,Merge To State
Bankers Company of New York,9000061,Former Foreign Agency,Licensed
"Bank of Northern Brookhaven, The",8000253,Former Bank/Trust Company,Name Change To
Nanuet National Bank,8500096,Former Bank/Trust Company,Established
Cross-County Savings & Loan Association,8200015,Former Savings and Loan,Name Change To
Armour Tenth Avenue Credit Union,8300371,Former Credit Union,Liquidated
Bank Melli Iran,2202037,Foreign Representative Offices,Licensed
"Ogaki Kyoritsu Bank, Ltd., The",2270194,Foreign Representative Offices,New License Issue
United Northern Federal Savings Bank,1170014,Savings Banks,Name Change To
Retail Employees No. 1199 Credit Union,461202,Credit Unions,Name Change To
Spring Valley Savings & Loan Association,8200030,Former Savings and Loan,Name Change To
Banca di Roma S.P.A. (12/73 - 12/93),570017,Foreign Branches,Name Change To
Marine Trust Company of Buffalo,5000014,Bank,Name Change To
Goodell Permanent Loan Association,8200163,Former Savings and Loan,S&L To Saving Bnk
Peoples Savings Bank of New York,197,Savings Banks,Name Change To
Copenhagen National Bank,8500043,Former Bank/Trust Company,Merge To State
Norstar Bank (Rochester),8000254,Former Bank/Trust Company,Merge To Federal
Trust Company of North America,8000037,Former Bank/Trust Company,Name Change To
Chemical Bank and Trust Company,103011,Trust Company,Name Change To
Commonwealth Bank,118,Bank,Convert Federal
"Fidelity Trust Company of Buffalo, The",113003,Trust Company,Acquire By Merger
Oneida National Bank,8500131,Former Bank/Trust Company,Convert Federal
Sayville Bank and Trust Company,8000208,Former Bank/Trust Company,Convert Federal
Irving National Exchange Bank of New York,45,Trust Company,Name Change To
State Bank of Pearl River,8000249,Former Bank/Trust Company,Name Change To
Walton Co-Operative Savings & Loan Association,8200120,Former Savings and Loan,NYS Chartered
Manufacturers & Traders - Peoples Trust Company,113003,Trust Company,Acquire By Merger
Battery Park National Bank of New York,8000415,Former Bank/Trust Company,Name Change To
Huguenot Trust Company of New Rochelle,8000170,Former Bank/Trust Company,Company Sold To
First Westchester National Bank,8500102,Former Bank/Trust Company,Convert Federal
Spring Valley Savings & Loan Association,8200030,Former Savings and Loan,Name Change To
Global Union Bank,5000006,Bank,Assets Sold To
Hamburg Savings Bank,208004,Savings Banks,Acquire By Merger
"Longacre National Bank of New York, The",8500209,Former Bank/Trust Company,Name Change To
Gainesville National Bank,18,Bank,Established
Nyack Building Co-Operative Savings & Loan Assoc,8200088,Former Savings and Loan,Name Change To
Bank of Lawrence,8000141,Former Bank/Trust Company,Established
Banco de Galacia Y Buenos Aires,2207000,Foreign Representative Offices,Name Change To
Northfield Savings & Loan Association,8200359,Former Savings and Loan,NYS Chartered
Globe Bank and Trust Company,8000429,Former Bank/Trust Company,Acquire By Merger
Riverside Co-Operative Savings & Loan Association,8200173,Former Savings and Loan,NYS Chartered
First Rochester Community Credit Union,461806,Credit Unions,Name Change To
"Exchange Bank of Olean, The",8000184,Former Bank/Trust Company,Merge To State
Columbus Bank,8000492,Former Bank/Trust Company,Established
American National Bank of Jamestown,8500249,Former Bank/Trust Company,Convert Federal
Erie County Trust Company,8000095,Former Bank/Trust Company,Convert Federal
Sycamore & Johnson Savings & Loan Association,8200029,Former Savings and Loan,Name Change To
Zurich Capital Markets Trust Company,5100002,Limited Purpose Trust Company,Liquidated
Fidata Trust Company New York,106050,Trust Company,Name Change To
Maple City Savings and Loan Association,313001,Savings & Loans,Acquire By Merger
Ithaca Trust Company,120003,Trust Company,Name Change To
"Royal Bank and Trust Company, The",170038,Trust Company,Liquidated
Marine Midland Trust Company of Albion,8000045,Former Bank/Trust Company,Name Change To
"Johnstown Bank, The",8000134,Former Bank/Trust Company,Assets Sold To
Chatham National Bank of New York,8500206,Former Bank/Trust Company,Merge To State
Emigrant Savings Bank - Long Island,270065,Savings Banks,NYS Chartered
"Banca Serfin, S.N.C.",602036,Foreign Agencies,Name Change To
State Bank of Endicott,105003,Trust Company,Merge To State
"Juroku Bank, Ltd., The",510002,Foreign Branches,Licensed
Emigrant Bank,205007,Savings Banks,Acquire By Merger
"Banco Urquijo Union, S.A.",24,Former Foreign Agency,Name Change To
Mechanics National Bank of the City of New York,8000320,Former Bank/Trust Company,Acquire By Merger
Glen Bank and Trust Company,8000233,Former Bank/Trust Company,Merge To State
Security Savings & Loan Association of Buffalo,8200176,Former Savings and Loan,Merge To State
Norstar Bank of Commerce,149,Bank,Name Change To
Second National Bank of the City of New York,8500229,Former Bank/Trust Company,Merge To Federal
Madison Trust Company,8000318,Former Bank/Trust Company,Merge To State
"Aetna National Bank of New York, The",8500199,Former Bank/Trust Company,Name Change To
"Asahi Bank, Limited, The",2270189,Foreign Representative Offices,Name Change To
Queens County Trust Company,8000390,Former Bank/Trust Company,Established
Wayland Dime Savings & Loan Association,8200124,Former Savings and Loan,NYS Chartered
Brooklyn-NY Savings & Loan Association,8200187,Former Savings and Loan,Name Change To
Lincoln National Bank of the City of New York,8500191,Former Bank/Trust Company,Name Change To
Banca di Roma S.P.A. (12/73 - 12/93),570017,Foreign Branches,Closed
Italian Cloak Makers Local #48 Credit Union,8300141,Former Credit Union,Liquidated
Baldwin's Bank of Penn Yan,8000250,Former Bank/Trust Company,Merge To State
Prospect Home Building & Loan Association,8200198,Former Savings and Loan,Merge To State
Leather Manufacturers' Bank,8000316,Former Bank/Trust Company,Convert Federal
Central Industrial Bank,8000012,Former Bank/Trust Company,NYS Chartered
Manufacturers and Traders Trust Company M&T Bank,113003,Trust Company,Acquire By Merger
Lincoln-Alliance Bank,8000199,Former Bank/Trust Company,Acquire By Merger
Riverside Credit Union,461804,Credit Unions,NYS Chartered
Silver Creek National Bank,8500268,Former Bank/Trust Company,Merge To Federal
"Schenectady Trust Company, The",120009,Bank,Convert Federal
"Eastport National Bank, The",8500261,Former Bank/Trust Company,Established
National Bank of Bay Ridge in New York,8500232,Former Bank/Trust Company,Name Change To
Knitted Outerwear Savings & Loan Association,8200343,Former Savings and Loan,Name Change To
275 Broadhollow Road Bank,5000054,Bank,Merge To State
Bankers Trust Company,102027,Trust Company,Acquire By Merger
"Buffalo Savings Bank, The",207008,Savings Banks,Acquire By Merger
Discount National Bank of New York,8500220,Former Bank/Trust Company,Name Change To
Mutual Savings Bank of Auburn,203002,Savings Banks,Convert Federal
"Westchester Bank and Trust Company, The",8000172,Former Bank/Trust Company,Established
Hibernia Trust Company,8000015,Former Bank/Trust Company,Merge To Federal
Lawyers' Title Insurance and Trust Company,8000370,Former Bank/Trust Company,Merge To State
Prudential Savings Bank,8100018,Former Savings Bank,Acquire By Merger
New-York Chemical Manufacturing Company,103011,Trust Company,Acquire By Merger
Unibank A/S,2270182,Foreign Representative Offices,Acquire By Merger
Citizens Bank of Brooklyn,8000013,Former Bank/Trust Company,Merge To Federal
Market and Fulton National Bank of New York,8500190,Former Bank/Trust Company,Established
Bank of America (1812-1928),8500212,Former Bank/Trust Company,Name Change To
Anglo-Czechoslovak and Prague Credit Bank,9000066,Former Foreign Agency,Closed
City Trust Company of New York,8000303,Former Bank/Trust Company,Merge To State
"Bayside Bank, The",8000402,Former Bank/Trust Company,Convert State
Brotherhood of Locomotive Engineers Co-Op Trust,8000356,Former Bank/Trust Company,Name Change To
East River National Bank of the City of New York,8500215,Former Bank/Trust Company,Name Change To
Elmira Teachers Credit Union,8300104,Former Credit Union,Liquidated
First American Bank of New York,106043,Trust Company,Name Change To
Neuberger & Berman Trust Company,170043,Limited Purpose Trust Company,Name Change To
Power City Bank,8000173,Former Bank/Trust Company,Name Change To
Bank of New York National Banking Association,8000270,Former Bank/Trust Company,Convert State
"Wallkill National Bank, The",8500154,Former Bank/Trust Company,Convert Federal
Farmers National Bank of Amsterdam,8500016,Former Bank/Trust Company,Merge To Federal
Marine Midland Trust Company of New York,5000013,Bank,Convert State
Woodside Savings & Loan Association,8200130,Former Savings and Loan,Name Change To
Dime Savings Bank of Brooklyn,8100047,Former Savings Bank,Name Change To
"Governor and Company of the Bank of Ireland, The",507001,Foreign Branches,Licensed
Bank of Seoul and Trust Company,602030,Foreign Agencies,Name Change To
Norstar Bank of Callicoon,114025,Trust Company,Acquire By Merger
New-York Dry Dock Company,8000350,Former Bank/Trust Company,Merge To State
Midtown Bank of New York (1927-10/1929),8000404,Former Bank/Trust Company,Convert Federal
Up-town Savings Bank,8100062,Former Savings Bank,Name Change To
Varick Bank of New York,8000373,Former Bank/Trust Company,Name Change To
Chemical Bank New York Trust Company,103011,Trust Company,Name Change To
Jefferson Savings Bank,206,Savings Banks,Name Change To
"Oneida Bank, The",8500131,Former Bank/Trust Company,Name Change To
Knickerbocker Trust Company,44,Trust Company,Name Change To
Twelfth Ward Savings Bank,8100135,Former Savings Bank,Merge To State
First Trust Union Bank,8000234,Former Bank/Trust Company,Name Change To
Natl Commercial Bank & Trust Company of Albany,170007,Trust Company,Acquire By Merger
First National Bank and Trust Company of Hudson,8500078,Former Bank/Trust Company,Name Change To
Fulton Bank (Brooklyn),8000283,Former Bank/Trust Company,Convert Federal
Highland-Quassaick Nat Bnk & Trust Co of Newburgh,8500150,Former Bank/Trust Company,Name Change To
Niagara County Bank,8500085,Former Bank/Trust Company,Name Change To
"Clinton Bank, The",8000411,Former Bank/Trust Company,Convert Federal
Home Trust Company of New York,8000371,Former Bank/Trust Company,Merge To State
State Bank of Belmont,8000064,Former Bank/Trust Company,Name Change To
Allied Irish Banks plc,501002,Foreign Branches,Licensed
"Bankers Trust Company of Hudson Valley, N.A.",8500153,Former Bank/Trust Company,Acquire By Merger
Deutsche Verkhersbank,2270167,Foreign Representative Offices,Licensed
Northside State Bank,8000483,Former Bank/Trust Company,Name Change To
Statewide Savings & Loan,8200100,Former Savings and Loan,Name Change To
Mercantile Loan & Warehouse Company,53,Trust Company,Established
Rome Trust Company,8000202,Former Bank/Trust Company,Established
Sakura Trust Company,170031,Limited Purpose Trust Company,Acquire By Merger
Key Bank of New York (6/92-8/93),170007,Trust Company,Name Change To
"National City Bank of New York, The",4400000,Trust Company,Established
Chemical Bank,103011,Trust Company,Acquire By Merger
"Banpais, S.A.",2202032,Foreign Representative Offices,Licensed
Sullivan County National Bank of Liberty,8500099,Former Bank/Trust Company,Merge To State
Orange County Trust Company,115004,Trust Company,NYS Chartered
"Fukutoku Bank, LTD., The",606004,Foreign Branches,Closed
New York and London Trust Company,102015,Trust Company,Name Change To
Fidelity Bank of Colonie,8000185,Former Bank/Trust Company,Name Change To
Produce Exchange Trust Company,8000301,Former Bank/Trust Company,Name Change To
Societe de Banque Privee,619002,Foreign Agencies,Licensed
Chemical Bank New York Trust Company,103011,Trust Company,Acquire By Merger
First National Bank of Mount Vernon,8500095,Former Bank/Trust Company,Name Change To
"County Trust Company, The",8000239,Former Bank/Trust Company,Acquire By Merger
Lincoln-Alliance Bank and Trust Company,8000199,Former Bank/Trust Company,Name Change To
Highland National Bank & Trust Co of Newburgh,8500150,Former Bank/Trust Company,Convert Federal
IDB Trust Company,170024,Trust Company,Name Change To
"Evergreen Bank, N.A.",5800117,Bank,Established
Empire State Bank (1888-12/1896),8000343,Former Bank/Trust Company,Merge To State
IDB Trust Company,170024,Trust Company,Acquire By Merger
Fairport Permanent Loan Association,306001,Savings & Loans,Convert Federal
First Suffolk National Bank of Huntington,74,Bank,Convert Federal
Goodell Permanent Loan Association,8200163,Former Savings and Loan,Liquidated
Marine Midland National Bank of Southeastern NY,1170005,Former Bank/Trust Company,Name Change To
First National Bank and Trust Company of Corning,8500044,Former Bank/Trust Company,Convert State
Chemical Bank New York Trust Company,103011,Trust Company,Acquire By Merger
Mutual Alliance Trust Company,8000409,Former Bank/Trust Company,Merge To Federal
Bankers' Trust Company of New York (1899),8000407,Former Bank/Trust Company,Merge To State
D.S.E. Credit Union,470001,Credit Unions,Name Change To
Canajoharie Building Savings and Loan Association,303001,Savings & Loans,Convert Federal
Citizens National Bank of Potsdam,8500259,Former Bank/Trust Company,Convert Federal
Slavonic Immigrant bank,8000302,Former Bank/Trust Company,Established
Neuberger Berman Trust Company,170043,Limited Purpose Trust Company,Merge To Federal
Lefcourt Normandie National Bank of New York,8500222,Former Bank/Trust Company,Name Change To
"Kerhonkson National Bank, The",8500082,Former Bank/Trust Company,Name Change To
Heritage Savings Bank,8100123,Former Savings Bank,Merge To State
First Federal S & L Assoc of Niagara County,370004,Savings & Loans,Merge To State
National Copper Bank of New York,8000324,Former Bank/Trust Company,Name Change To
First Trust Company of Wellsville,8000234,Former Bank/Trust Company,Name Change To
Union Bank of Israel Ltd.,2270193,Foreign Representative Offices,Closed
Bank of Angelica,8000048,Former Bank/Trust Company,Merge To Federal
East Brooklyn Savings Bank,8100054,Former Savings Bank,Acquire By Merger
Adirondack National Bank & Trust Co Saranac Lake,8500117,Former Bank/Trust Company,Convert Federal
Bank of Skaneateles,8500124,Former Bank/Trust Company,Name Change To
Metropolitan National Bank of the City of NY,8000322,Former Bank/Trust Company,Convert Federal
Lincoln Trust Company,8000317,Former Bank/Trust Company,Converted To
Ninth National Bank of the City of New York,8000336,Former Bank/Trust Company,Succeeded By
Nyack Bank and Trust Company,8000180,Former Bank/Trust Company,Name Change To
Paine Webber International Banking Corporation,716002,Investment Company (Article XII),NYS Chartered
Madison Trust Company,8000318,Former Bank/Trust Company,Established
Sixth National Bank of the City of New York,8500179,Former Bank/Trust Company,Merge To State
"Banca Serfin, S.N.C.",602036,Foreign Agencies,Licensed
Riverside Businessmen Credit Union of NY City,8300261,Former Credit Union,NYS Chartered
Merchants National Bank & Trust Co. of Syracuse,170001,Trust Company,Acquire By Merger
Banca Nazionale del Lavoro,502002,Foreign Branches,Licensed
Seventh National Bank of New York (1920-1928),8500225,Former Bank/Trust Company,Convert Federal
First Bank & Trust Company of Utica (1940-1958),8000256,Former Bank/Trust Company,Convert Federal
Nassau Trust Company,8000108,Former Bank/Trust Company,Merge To State
Extebank,105010,Trust Company,Merge To Federal
Ontario County Trust Company,8000076,Former Bank/Trust Company,Convert Federal
Bay Ridge Federal Savings Bank,270028,Savings Banks,Merge To State
Manufacturers and Traders Trust Company,113003,Trust Company,Acquire By Merger
Westchester County Savings Bank,216004,Savings Banks,Name Change To
Home Trust Company of New York,8000371,Former Bank/Trust Company,Merge To State
Community Savings & Loan (Mount Vernon),203008,Savings Banks,Convert Federal
"First National Bank of Cuba, The",8500047,Former Bank/Trust Company,Name Change To
Central Union Trust Company of New York,137,Bank,Name Change To
Fidelity Trust Company of New York,5000013,Bank,Convert Federal
Merchants and Farmers National Bank of Dansville,8500049,Former Bank/Trust Company,Convert Federal
"Hokkaido Takushoku Bank, Limited, The",2270128,Foreign Representative Offices,Closed
Frontier City Savings & Loan Association,8200253,Former Savings and Loan,NYS Chartered
Metropolitan National Bank of the City of NY,8000322,Former Bank/Trust Company,Merge To State
North Side Bank of Brooklyn,112,Bank,Convert Federal
Fort Plain National Bank,8500055,Former Bank/Trust Company,Merge To State
Massena Savings and Loan Association,313003,Savings & Loans,Convert Federal
Manufacturers and Traders Trust Company,113003,Trust Company,Acquire By Merger
"International Commercial Bank of China, The",609004,Foreign Branches,Agency To Branch
"Citizens Bank, Attica, The",8000055,Former Bank/Trust Company,Name Change To
Sayville Bank and Trust Company,8000208,Former Bank/Trust Company,Merge To Federal
Westdeutsche ImmobilienBank AG,2270162,Foreign Representative Offices,Closed
Broome County Trust Company,8000413,Former Bank/Trust Company,Name Change To
Manufacturers Hanover Trust Company/Mid-Hudson,8000161,Former Bank/Trust Company,Bank To Trust Co.
Buffalo Savings & Loan Association (1925-1963),8200158,Former Savings and Loan,Liquidated
Mohawk Valley Savings & Loan Association,370001,Savings & Loans,Name Change To
Ridgewood Savings Bank,218004,Savings Banks,Purchased LID of
Nassau Trust Company,8000108,Former Bank/Trust Company,Name Change To
Banco Popular North America,5000039,Trust Company,Acquire By Merger
Home Savings Bank of the City of Albany,180,Savings Banks,Acquire By Merger
National Bank of Great Neck,8500066,Former Bank/Trust Company,Established
Oystermen's National Bank of Sayville,8500254,Former Bank/Trust Company,Convert Federal
Hillside Bank,8000388,Former Bank/Trust Company,Name Change To
Seventh Ward Bank,8500194,Former Bank/Trust Company,Name Change To
Commonwealth Bank,118,Bank,Name Change To
Chemical Bank and Trust Company,103011,Trust Company,Acquire By Merger
