Institution Name Primary,Type,Event Date,Institution Name (Secondary),Identification Number (Secondary)
"Oneida Saving, Building and Loan Association",Former Savings and Loan,18870516,"Oneida Saving, Building and Loan Association",
Domeestic Exchange National Bank of New York,Former Bank/Trust Company,19120601,Irving National Exchange Bank of New York,45.0
National Bank of Wyoming,Bank,19361231,Wyoming County Bank and Trust Company,
Texas Commerce Trust Company of New York,Limited Purpose Trust Company,19990305,"Chase Manhattan Bank, The",103011.0
Banca della Svizzera Italiana,Foreign Branches,19930406,BSI-Banca della Svizzera Italiana,
East River Savings Bank,Savings Banks,19960628,Marine Midland Bank,5800183.0
Banque Nationale de Paris,Foreign Branches,20000523,Paribas,502031.0
United National Bank of New York City,Former Bank/Trust Company,19060701,Hudson Trust Company,
State Bank of Randolph,Former Bank/Trust Company,19870401,"Norstar Bank, N.A.",170048.0
Smith Barney Trust Company,Limited Purpose Trust Company,19931103,Smith Barney Shearson Trust Company,
Long Island Bank,Former Bank/Trust Company,19800930,Long Island Trust Company,8000107.0
Fulton Bank in the City of New York,Former Bank/Trust Company,19230101,,
Bankers Trust of Jamestown,Former Bank/Trust Company,19970113,"Key Bank, National Association",5801003.0
275 Broadhollow Road Bank,Bank,20070801,New Commercial Bank of New York LLC,
Trade Bank of New York,Former Bank/Trust Company,19801201,"National Westminster Bank, USA",
Pacific Bank,Former Bank/Trust Company,19290201,Irving Trust Company,
"Watertown National Bank, The",Former Bank/Trust Company,19910601,"Key Bank of Eastern New York, N.A.",170007.0
Bank of Manhattan Trust Company,Former Bank/Trust Company,19301101,American Trust Company,8000274.0
Lincoln First Bank of Rochester,Former Bank/Trust Company,19781231,"Lincoln First Bank, N.A.",8500166.0
German Savings Bank of New York City,Savings Banks,19750501,Central Savings Bank,
Dollar Savings Bank of New York,Savings Banks,19951101,,
Hudson River Trust Company,Former Bank/Trust Company,19891101,"Key Bank of Eastern New York, N.A.",
Underwriters Bank and Trust Company,Trust Company,19301126,Union Bank of Bronx County,41.0
Chemical Bank and Trust Company,Trust Company,19981001,Morgan Stanley Trust Company,113061.0
New York Savings Bank,Savings Banks,18620101,"New York Savings Bank, The",
"Chemical Bank - Eastern, N.A.",Trust Company,19960714,"Chase Manhattan Bank, The",
"Rondout National Bank of Kingston, The",Former Bank/Trust Company,19830701,"Norstar Bank of the Hudson Valley, N.A.",
Union National Bank of Franklinville,Former Bank/Trust Company,19840401,Security Trust Company of Rochester,8000254.0
Metropolitan Savings Bank,Former Savings Bank,19420512,Manhattan Savings Institution,213.0
Jefferson Savings & Loan Association,Former Savings and Loan,20040630,HSBC Bank USA,
Nanuet Savings & Loan Association,Former Savings and Loan,19830926,,
Norstar Bank (Rochester),Former Bank/Trust Company,19590901,Arkport State Bank,8000050.0
Electric City Bank,Former Bank/Trust Company,19990329,HSBC Bank USA,
State Bank and Trust Company,Trust Company,19610908,Manufacturers Hanover Trust Company,
Barclays Bank of New York,Former Bank/Trust Company,19740531,First Westchester National Bank,8500102.0
Williams Press Employees Credit Union,Former Credit Union,19310330,J.B. Lyon Company Credit Union,
New York and London Trust Company,Trust Company,19260917,Irving Bank and Trust Company,
Marine Midland Tinker National Bank,Former Bank/Trust Company,19800201,"Marine Midland Bank, N.A.",8500023.0
Central Natl Bank of the City of NY (1926-1930),Former Bank/Trust Company,19550301,"Chase Manhattan Bank, The (1799-9/1965)",
Middle Village Credit Union,Credit Unions,19240102,Middle Village Credit Union,
Citizens Central Bank,Bank,19590901,Citizens Central Bank,
Traders Deposit Company,Former Bank/Trust Company,19650901,"Chase Manhattan Bank, N.A., The",5800033.0
First Federal Savings & Loan Association,Former Savings and Loan,19480000,Whitestown Savings & Loan Association,
"Dreyfus Trust Company (N.Y.), The",Limited Purpose Trust Company,19860522,"Dreyfus Trust Company (N.Y.), The",
"Brooklyn & NY Arcanum Blding,Loan & Savings Assoc",Former Savings and Loan,19580707,Equitable Savings & Loan Association,8200362.0
National Shoe & Leather Bank of the City of NY,Former Bank/Trust Company,19060401,Metropolitan Bank (1905-4/1906),8000319.0
Coal and Iron Bank of the City of New York,Former Bank/Trust Company,19991231,Republic Bank of New York,170040.0
Savings and Loan of Richmond Hill,Former Savings and Loan,19961231,North Fork Bank,170005.0
Bank of Westbury Trust Company,Former Bank/Trust Company,19870218,"Bank of New York, The (9/1922-10/1989)",8000241.0
Armour 120 Broadway Credit Union,Former Credit Union,19360608,Armour Tenth Avenue Credit Union,8300371.0
"Bancomer, S.N.C.",Foreign Agencies,19840515,"Bancomer, S.N.C.",
Manufacturers & Traders - Peoples Trust Company,Trust Company,19010313,"Fidelity Trust Company of Buffalo, The",
Natl Commercial Bank & Trust Company of Albany,Trust Company,18650000,Natl Commercial Bank & Trust Company of Albany,
New York and London Trust Company,Trust Company,19961201,"Putnam Trust Company, The",5800992.0
South Shore Trust Company,Former Bank/Trust Company,19571001,Franklin National Bank of Long Island,
Canadian Imperial Bank of Commerce,Foreign Branches,19110901,Canadian Bank of Commerce,
"Suffolk County Trust Company, The",Former Bank/Trust Company,20010717,Citibank N. A.,4400000.0
Lefcourt Normandie National Bank of New York,Former Bank/Trust Company,19510301,Chemical Bank and Trust Company,103011.0
Fleet Bank (6/92-6/94),Trust Company,19870918,Norstar Bank of Commerce,149.0
Chatham Bank,Former Bank/Trust Company,18650000,"Chatham National Bank of New York, The",
Marine Midland Trust Company of Central New York,Bank,19990329,HSBC Bank USA,
Hudson Valley Fuel Credit Union,Former Credit Union,19400425,Hudson Valley Fuel Credit Union,
Rome City Bank,Former Bank/Trust Company,19120000,Rome City Bank,
Euroclear Bank,Foreign Representative Offices,20001222,Euroclear Bank,
Ballston Spa Savings & Loan Association,Former Savings and Loan,19450000,,
State Bank of Randolph,Former Bank/Trust Company,18740000,State Bank of Randolph,
Schenectady Federal Savings & Loan Association,Savings Banks,19960200,Schenectady Federal Savings Bank,
Bank of New York and Fifth Avenue Bank,Former Bank/Trust Company,19760101,"Bank of New York, Albany, The",8000042.0
Market National Bank of New York,Former Bank/Trust Company,19260917,Irving Bank and Trust Company,
Marine Midland Bank - Northern,Bank,19800201,"Marine Midland Bank, N.A.",8500023.0
Farmers Loan and Trust Company,Former Bank/Trust Company,19760000,"Citibank, N.A.",
Clymer State Bank,Former Bank/Trust Company,19730101,Bankers Trust Company of Western New York,
"Suffolk County Trust Company, The",Former Bank/Trust Company,19571001,Franklin National Bank of Long Island,
Friends of Israel Credit Union,Former Credit Union,19420903,Friends of Israel Credit Union,
Industrial Bank of Central New York,Former Bank/Trust Company,19160000,Morris Plan Company of Syracuse,
Lloyds TSB Bank plc,Foreign Branches,19860101,Lloyds Bank plc,
"Merchants' Bank in the City of New York,The",Former Bank/Trust Company,18030000,"Merchants' Bank in the City of New York, The",
Banca Intesa S.p.A.,Foreign Branches,20010501,Banca Commerciale Italiana,502001.0
United International Bank,Bank,20051222,United International Bank,
Valatie Savings & Loan Association,Savings & Loans,20050114,First Niagara Bank,212002.0
"People's Trust Company of Malone, The",Former Bank/Trust Company,19800201,"Marine Midland Bank, N.A.",8500023.0
Donghwa Bank,Foreign Branches,19950929,Donghwa Bank,
Armour 120 Broadway Credit Union,Former Credit Union,19360608,Armour Harlem-Brook Avenue Credit Union,8300370.0
Astor Place Bank,Former Bank/Trust Company,19590901,Chemical Bank New York Trust Company,
Sterling Natl Bank & Trust Company of New York,Bank,19480501,Boulevard Bank - Queens,8000010.0
Bank of Gowanda,Former Bank/Trust Company,19800201,"Marine Midland Bank, N.A.",8500023.0
Schermerhorn Bank of the City of Brooklyn,Former Bank/Trust Company,19010601,Mechanics' Bank (Brooklyn),8000285.0
Security National Bank of Huntington,Bank,19030000,First Suffolk National Bank of Huntington,
Mechanics & Metals Natl Bank of the City of NY,Former Bank/Trust Company,19100201,Mechanics & Metals Natl Bank of the City of NY,
Chatham & Phenix National Bank of New York,Former Bank/Trust Company,19960714,"Chase Manhattan Bank, The",
Bowery Bank of New York,Former Bank/Trust Company,18650000,Bowery National Bank of New York,
D.S.E. Credit Union,Credit Unions,20040224,Riverside Federal Credit Union,
Lockport Exchange Trust Company,Trust Company,19260000,Lockport Exchange Trust Company,
Long Island Trust Company,Former Bank/Trust Company,19701231,Seaside Bank,8000236.0
"Meadow Brook National Bank, The",Former Bank/Trust Company,19490000,Meadow Brook National Bank of Freeport,
ABN AMRO Bank N.V.,Foreign Branches,19911119,ABN AMRO Bank N.V.,
Tompkins County Trust Company,Trust Company,19960913,First National Bank of Rochester,5800216.0
Manufacturers Hanover Trust Company,Trust Company,19180615,West Side Bank,110.0
"Banco Espirito Santo e Comercial de Lisboa, E.P.",Foreign Branches,20000921,"Banco Espirito Santo, S.A.",
"Bank of Auburn, The",Former Bank/Trust Company,19841201,Security Norstar Bank,
Hanover National Bank of the City of New York,Former Bank/Trust Company,18650000,Hanover National Bank of the City of New York,
"Genesee Country Bank, The",Former Bank/Trust Company,19781201,"Citizens Bank, Attica, The",8000055.0
Rochester Savings Bank,Savings Banks,18310421,Rochester Savings Bank,
Industrial Bank of New York,Bank,19190000,Industrial Bank of New York,
Physicians Equity Credit Union,Former Credit Union,19341004,Physicians Equity Credit Union,
"Hiroshima Bank, Ltd., The",Foreign Representative Offices,19880629,"Bank of Hiroshima, Ltd., The",
Onbank,Savings Banks,19870806,Onbank,
Manhattan Savings Institution,Savings Banks,20040630,HSBC Bank USA,
"Chase Manhattan Bank of Central New York, N.A.",Former Bank/Trust Company,19960714,Chemical Bank,103011.0
State Bank of Pearl River,Former Bank/Trust Company,19691201,"Marine Midland Bank of Southeastern N.Y., N.A.",
Railroad Federal Savings & Loan Association,Former Savings and Loan,19350720,Railroad Federal Savings & Loan Association,
Riverside Co-Operative Savings & Loan Association,Former Savings and Loan,18950409,Riverside Co-Operative Savings & Loan Association,
Jamaica National Bank of New York,Former Bank/Trust Company,19650801,Marine Midland Grace Trust Company of New York,
Manufacturers National Bank of Brooklyn,Bank,18530000,Mechanics' Bank of Williamsburgh,
New-York Chemical Manufacturing Company,Trust Company,19510301,National Safety Bank & Trust Company of New York,8500009.0
Bronx County Trust Company,Former Bank/Trust Company,20041113,"JPMorgan Chase Bank, National Association",
People's Trust Company,Former Bank/Trust Company,19180801,"Bank of Flatbush, The",8000414.0
"Hongkong and Shanghai Banking Corporation, The",Foreign Representative Offices,19900103,"Hongkong and Shanghai Banking Corp, Limited, The",
Manufacturers Hanover Trust Company,Trust Company,19470501,"Fidelity National Bank in New York, The",8500005.0
Bank of America (1812-1928),Former Bank/Trust Company,19200401,Franklin Trust Company,8000446.0
Brooklyn Trust Company,Trust Company,19960714,"Chase Manhattan Bank, The",
Oneida County Trust Company,Former Bank/Trust Company,19311114,First Citizens Bank & Trust Company of Utica,
Marine Midland National Bank of Southeastern NY,Former Bank/Trust Company,18640000,"First National Bank of Poughkeepsie, The",
Commercial Investment Trust Incorporated,Investment Company (Article XII),19871116,"CIT Group/Capital Investments, Inc.",
Port Chester Savings Bank,Savings Banks,19491230,Port Chester Savings Bank,
Seamen's Bank For Savings in the City of New York,Savings Banks,18290131,Seamen's Bank For Savings in the City of New York,
Modern Industrial Bank,Former Bank/Trust Company,19530101,,
Marine Trust Company of Western New York,Bank,19550301,Bank of Gowanda,8000112.0
"Fidelity Trust & Guaranty Co of Buffalo, The",Trust Company,19251215,Manufacturers and Traders Trust Company,
"Fidelity Trust & Guaranty Co of Buffalo, The",Trust Company,20071130,Partners Trust Municipal Bank,108004.0
"Greenpoint Bank of Brooklyn, The",Former Bank/Trust Company,19650901,"Chase Manhattan Bank, N.A., The",5800033.0
"Citizens Trust Company of Patchogue, The",Former Bank/Trust Company,19631101,Island State Bank,
Republic National Bank of New York,Trust Company,19740601,Kings Lafayette Bank,8000025.0
First National City Bank,Trust Company,20030830,Citibank (New York State),103023.0
MacQuaire Bank Limited,Foreign Representative Offices,20031128,MacQuaire Bank Limited,
Peoples Savings Bank of Yonkers,Savings Banks,18660405,Peoples Savings Bank of Yonkers,
Westchester County Savings Bank,Savings Banks,19750101,Tuckahoe Savings and Loan Association,196.0
Continental National Bank of New York,Former Bank/Trust Company,19290501,Central Hanover Bank and Trust Company,
Cohoes Savings Bank,Savings Banks,20050114,First Niagara Bank,212002.0
"Mega International Commercial Bank Co., Ltd",Foreign Branches,20060821,"Mega International Commercial Bank Co., Ltd.",
Banque Sudameris,Foreign Representative Offices,20030417,,
Long Island Loan & Trust Company,Former Bank/Trust Company,19960714,"Chase Manhattan Bank, The",
Nassau County Trust Company,Former Bank/Trust Company,19550501,Franklin National Bank of Franklin Square,5800002.0
Citizens Savings & Loan Association of New York,Former Savings and Loan,19481217,Woodside Savings & Loan Association,
Power City Bank,Former Bank/Trust Company,19990329,HSBC Bank USA,
Bingham State Bank,Former Bank/Trust Company,19840401,Security Trust Company,
Norstar Bank of Long Island (8/83-3/87),Former Bank/Trust Company,19841203,"Bank of Long Island, N.A.",8500072.0
Nordbanken,Foreign Branches,19900702,Nordbanken,
State Bank of Albany,Former Bank/Trust Company,19940701,Fleet Bank,
Canarsie State Bank,Former Bank/Trust Company,19960714,"Chase Manhattan Bank, The",
Natexis Banques Populaire,Foreign Branches,20070216,Natixis,
Livingston County Trust Company,Former Bank/Trust Company,19150000,Livingston County Trust Company,
Security Savings & Loan Association of Buffalo,Former Savings and Loan,19980623,,
Participants Trust Company,Limited Purpose Trust Company,19980831,"Depository Trust Company, The",104004.0
Hide and Leather National Bank in New York,Former Bank/Trust Company,20011110,JPMorgan Chase Bank,103011.0
Glen Cove Bank of Glen Cove,Former Bank/Trust Company,19531001,Glen Cove Nassau Union Trust Company,
Manufacturers-Citizens Trust Co.,Trust Company,19760630,Manufacturers Hanover Trust Company/Mid-Hudson,8000161.0
Chemical Bank,Trust Company,19510301,National Safety Bank & Trust Company of New York,8500009.0
"Chase Manhattan Bank of Mid-Hudson, N.A.",Former Bank/Trust Company,19960714,Chemical Bank,103011.0
Key Bank USA National Association,Former Bank/Trust Company,19970113,"Key Bank, National Association",5801003.0
"Wachovia Bank, N.A.",Registered LCB Institution,20020401,First Union National Bank,
"Chemical Bank, The (1823-1865)",Trust Company,19480401,Continental Bank & Trust Company of New York,8000016.0
"Adam, Meldrum & Anderson State Bank",Bank,19230000,"Adam, Meldrum & Anderson State Bank, The",
Hongkong and Shanghai Banking Corporation Limited,Foreign Representative Offices,19731130,,
Trust Company of Northern Westchester,Former Bank/Trust Company,19891006,"Bank of New York, The",
"Fleet Bank of New York, N.A.",Trust Company,19630401,Liberty National Bank and Trust Company,
Bank of Montreal Trust Company,Limited Purpose Trust Company,19370305,Bank of Montreal Trust Company,
Eureka Savings & Loan Association,Former Savings and Loan,19430000,Eureka Savings & Loan Association,
Marine Midland Trust Company of New York,Bank,19931231,Marine Midland Bank,5800183.0
Church Lane Savings Bank,Former Savings Bank,19600910,Lincoln Savings Bank,
Credit Local de France - Caecl SA,Foreign Branches,20000214,Dexia Credit Local de France,
Marine Midland Bank - Northern,Bank,19100812,National Bank and Loan Company of Watertown,8500177.0
"Hamilton National Bank of New York, The",Former Bank/Trust Company,20041113,"JPMorgan Chase Bank, National Association",
Sullivan County Savings & Loan Association,Former Savings and Loan,19670524,Sullivan County Federal Savings & Loan Assoc,
Bank of Belfast,Former Bank/Trust Company,19921001,Fleet Bank of New York,114025.0
National Bank and Loan Company of Watertown,Former Bank/Trust Company,19991231,HSBC Bank USA,
Bank of New Hyde Park,Former Bank/Trust Company,19550401,Meadow Brook National Bank of Freeport,8500008.0
HSBC New York Trust Company,Limited Purpose Trust Company,20041108,HSBC New York Trust Company,
Svenska Handelsbanken PLC,Foreign Branches,19951010,Svenska Handelsbanken AB,
South Park Savings & Loan Association,Former Savings and Loan,19881012,River Bank America,
Liberty National Bank and Trust Company,Trust Company,19640301,Peoples Bank of Erie County,8000118.0
Emigrant Savings Bank of Buffalo,Former Savings Bank,18690101,Mechanics Savings Bank of Buffalo,
Cutters Big Brothers Credit Union,Former Credit Union,19380428,Cutters Big Brothers Credit Union,
"Home Savings Bank, Brooklyn",Savings Banks,20070801,"Capital One, N.A.",5801214.0
"Morrisania Employees Credit Union, The",Credit Unions,19390117,Dellwood Employees Credit Union,460401.0
First Citizens Bank & Trust Company of Utica,Former Bank/Trust Company,19931231,Marine Midland Bank,5800183.0
Liberty Bank and Trust Company,Former Bank/Trust Company,19630111,First National Bank of Batavia,8500262.0
"Long Island Trust Company, N.A.",Former Bank/Trust Company,19891006,Irving Trust Company,102015.0
Lancaster Savings & Loan Association,Former Savings and Loan,19931230,,
Tompkins County Trust Company,Trust Company,18910918,Ithaca Trust Company,
"Importers & Traders Bank, The",Former Bank/Trust Company,19230601,Equitable Trust Company of New York (1871-5/1930),8000296.0
Lancaster Savings & Loan Association,Former Savings and Loan,19390411,Blackrock-Riverside Savings & Loan Association,8200006.0
"Peconic Bank, The",Trust Company,19870309,Norstar Bank of Long Island,
Norstar Bank of Upstate NY (8/84-6/88),Former Bank/Trust Company,19560901,First National Bank of Richfield Springs,8500113.0
"National Bank of Watervliet, The",Former Bank/Trust Company,19971113,Fleet Bank N.A.,5801998.0
Battery Park National Bank of New York,Former Bank/Trust Company,19620101,First National City Bank,
Marine Midland Bank - Northern,Bank,19460901,Bank of Antwerp,8000485.0
Norstar Bank,Trust Company,19870918,Norstar Bank of Commerce,149.0
Cornwall Savings Bank,Former Savings Bank,19820630,"Albany Savings Bank, FSB",
Irving Bank-Columbia Trust Co.,Trust Company,20080701,"Bank of New York Mellon, The",
Market Bank of New York,Former Bank/Trust Company,18520000,Market Bank of New York,
Lincoln National Bank & Trust Co of Syracuse,Former Bank/Trust Company,19840701,Chase Manhattan National Corporation,
Bank of East Aurora,Former Bank/Trust Company,19650901,Marine Midland Trust Company of Western New York,
Bankers Trust Company New York Limited,Limited Purpose Trust Company,19910327,Bankers Trust Company New York Limited,
Security Trust Company of Rochester,Former Bank/Trust Company,19470930,Citizens Bank & Trust Company,8000089.0
Livingston County Trust Company,Former Bank/Trust Company,19970113,"Key Bank, National Association",5801003.0
Credit Communal de Belgique S.A.,Foreign Branches,20020329,"Dexia Bank Belgium, S.A.",
Royal National Bank of New York,Former Bank/Trust Company,19630101,"Gotham Bank, The",8000243.0
"St. Lawrence County Savings Bank, The",Savings Banks,19721001,Potsdam Savings and Loan Association,190.0
Nordbanken AB,Foreign Representative Offices,20010731,,
MTB Banking Corporation,Investment Company (Article XII),19930430,MTB Bank,101007.0
Mechanics and Farmers Savings Bank of Albany,Former Savings Bank,18550412,Mechanics and Farmers Savings Bank of Albany,
Springfield Gardens National Bank of New York,Former Bank/Trust Company,19561001,Queens National Bank of New York,
"Southern National Bank of New York, The",Former Bank/Trust Company,19230207,Irving Bank-Columbia Trust Co.,
"Union Savings Bank of Patchogue, New York, The",Savings Banks,20070801,"Capital One, N.A.",5801214.0
President and Directors of the Manhattan Company,Former Bank/Trust Company,19180201,Bank of the Metropolis,8000397.0
"Syracuse Savings Institution, The",Savings Banks,19870513,,
Citizens' Trust Company of Utica,Former Bank/Trust Company,19581201,Marine Midland Trust Company of the Mohawk Valley,
Broadway National Bank & Trust Co of New York,Former Bank/Trust Company,19601101,Meadow Brook National Bank of Nassau County,8500008.0
State Bank of Honeoye Falls,Former Bank/Trust Company,19870501,Citibank (New York State),103023.0
"New York Produce Exchange National Bank, The",Former Bank/Trust Company,19550301,President and Directors of the Manhattan Company,8000257.0
"Lincoln National Bank of New York, The",Former Bank/Trust Company,19550301,President and Directors of the Manhattan Company,8000257.0
Barclays Bank of New York,Former Bank/Trust Company,19821101,"Barclays Bank of New York, N.A.",5800003.0
Trust Company of Fulton County,Former Bank/Trust Company,19891101,"Key Bank of Eastern New York, N.A.",
East New York Savings & Loan Association,Former Savings and Loan,19311231,,
"Fukuoka City Bank, Ltd., The",Foreign Branches,19900207,"Fukuoka City Bank, Ltd., The",
Mechanics and Farmers Bank of Albany,Former Bank/Trust Company,19720101,"Bank of New York, Albany, The",
New York Exchange Bank in the City of New York,Trust Company,19070201,Irving National Bank of New York,8500175.0
Deutsche Hyp Deutsche Hypothekenbank Frankfurt-Ha,Foreign Representative Offices,20001020,,
Schroder Trust Company,Trust Company,19930219,IBJ Schroder Banking Corporation,
Holy Redeemer Parish Credit Union,Former Credit Union,19441020,,
"Union National Bank of Friendship, The",Former Bank/Trust Company,19170000,"Union National Bank of Friendship, The",
Wayland Dime Savings & Loan Association,Former Savings and Loan,19830405,"Monroe Savings Bank, FSB",
UMB Bank and Trust Company,Trust Company,19940928,United Mizrahi Bank and Trust Company,
Niagara County Bank,Former Bank/Trust Company,19510428,Marine Trust Company of Western New York,
First Citizens Bank & Trust Company of Utica,Former Bank/Trust Company,19581201,Marine Midland Trust Company of the Mohawk Valley,
Emigrant Mercantile Bank,Savings Banks,20121231,Emigrant Savings Bank - Manhattan,270066.0
Recreation Rooms Settlement Credit Union,Former Credit Union,19510718,,
"Longacre National Bank of New York, The",Former Bank/Trust Company,19960714,"Chase Manhattan Bank, The",
"Banco do Estado de Sao Paulo, S.A.",Foreign Agencies,20020904,,
Marine Midland Bank - Southern,Bank,19290901,First National Bank & Trust Company of Elmira,
"Chemical Bank, The (1823-1865)",Trust Company,20010714,"Chase Bank of Texas - San Angelo, National Association",5000056.0
Banco de Venezuela S.A.I.C.A.,Foreign Agencies,19771206,"Banco de Venezuela, S.A.",
New-York Chemical Manufacturing Company,Trust Company,19290601,United States Mortgage and Trust Company,8000335.0
Marine Midland Tinker National Bank,Former Bank/Trust Company,19190000,Tinker National Bank,
Long Island National Bank of New York,Former Bank/Trust Company,19310000,National City Bank of New York,4400000.0
Chemical Bank Buffalo,Trust Company,19960714,"Chase Manhattan Bank, The",
Montrose Industrial Bank,Former Bank/Trust Company,19500101,Metropolitan Industrial Bank,
Citizens Trust Company of Adams,Former Bank/Trust Company,20040630,HSBC Bank USA,
Fidelity Trust Company,Bank,19491101,Bank of Yorktown,8000005.0
"Bank of Flatbush, The",Former Bank/Trust Company,19550301,First National City Bank of New York,
Varick Bank of New York,Former Bank/Trust Company,19260200,Coal and Iron Bank of the City of New York,
Flatbush National Bank of Brooklyn,Bank,19920619,Chemical Bank,103011.0
Belfast National Bank,Former Bank/Trust Company,19920101,"Fleet Bank of New York, N.A.",
Black Rock Mutual Home & Savings Association,Former Savings and Loan,19390411,Lancaster Savings & Loan Association,8200289.0
Intesa Sanpaolo S.p.A.,Foreign Branches,20010501,Banca Intesa Banca Commerciale Italiana S.p.A.,
Safety Building-Loan & Savings Assoc of Albany,Former Savings and Loan,18890129,Safety Building-Loan & Savings Assoc of Albany,
Edgewater Co-Operative Savings & Building Assoc,Former Savings and Loan,19380000,Edgewater Savings & Loan Association,
"Astor National Bank of New York, The",Former Bank/Trust Company,19170420,Bankers Trust Company,102027.0
Manufacturers Bank of Cohoes,Former Bank/Trust Company,19480801,National City Bank of Troy,8500129.0
Genesee Street Savings and Loan Association,Former Savings and Loan,19970301,Marine Midland Bank,5800183.0
Richmond County Federal Savings & Loan Assoc,Savings & Loans,19831210,Staten Island Savings Bank,219011.0
Manufacturers and Traders Trust Company M&T Bank,Trust Company,19920701,Endicott Trust Company,105003.0
Second National Bank of Cooperstown,Former Bank/Trust Company,19970113,"Key Bank, National Association",5801003.0
South Brooklyn Savings & Loan Association,Former Savings and Loan,19430701,Prospect Savings & Loan Association,8200198.0
First Trust Company of Wellsville,Former Bank/Trust Company,19580401,"Union National Bank of Friendship, The",8500061.0
Mercantile Loan & Warehouse Company,Trust Company,18730000,Mercantile Trust Company (1873-1911),
