Institution Name Primary,Type,Event Date,Institution Name (Secondary),Identification Number (Secondary)
"Fidelity Trust & Guaranty Co of Buffalo, The",Trust Company,19980401,Franklin First Savings Bank,5801017.0
Key Bank,Former Bank/Trust Company,19930826,NSA Bank,114041.0
Ossining Trust Company,Former Bank/Trust Company,19891006,Irving Trust Company,102015.0
Bank of New York (1784-8/1922),Former Bank/Trust Company,19220901,Bank of New York and Trust Company,
Lincoln-Alliance Bank,Former Bank/Trust Company,19781231,"Lincoln First Bank, N.A.",8500166.0
"Park Avenue Bank, The",Bank,20100312,Valley National Bank,
"First National Bank of Weedsport, The",Former Bank/Trust Company,19930826,Key Bank of New York,
Lewis Credit Union,Former Credit Union,19560509,,
Chemical Corn Exchange Bank,Trust Company,19961201,"Chase Manhattan Bank, National Association",170067.0
Glenville National Bank of Scotia,Former Bank/Trust Company,19230000,Glenville Bank,
Clymer State Bank,Former Bank/Trust Company,19920616,Key Bank of New York (6/92-8/93),
Eastern New York Credit Union,Credit Unions,19951017,Kraft Foods Federal Credit Union,5800843.0
"Peoples Bank of Johnstown, NY",Former Bank/Trust Company,19920608,Fleet Bank of New York,
Elmira Bank & Trust Company,Bank,19580901,"Citizens National Bank of Waverly, The",8500136.0
National Exchange Bank of Castleton on Hudson,Former Bank/Trust Company,19760101,"Citibank (Western), N.A.",8500108.0
"Seward Bank, The",Former Bank/Trust Company,19960714,"Chase Manhattan Bank, The",
Banco de Venezuela S.A.I.C.A.,Foreign Agencies,19881118,Banco de Venezuela S.A.I.C.A.,
Chatham & Phenix Natl Bank of the City of NY,Trust Company,19150900,"Century National Bank of New York, The",
Leather Manufacturers' National Bank of New York,Former Bank/Trust Company,19260401,Chase National Bank of the City of New York,8500003.0
Turkiye Vakiflar Bankasi T.A.O.,Foreign Representative Offices,19960730,,
American Savings Bank (1/1882-8/1954),Former Savings Bank,19540802,Irving Savings Bank,8100020.0
Home Building & Loan Assoc of Mount Vernon,Former Savings and Loan,19410000,Mount Vernon Savings & Loan Association,
Manufacturers Hanover Trust Company,Trust Company,19120628,Broadway Bank of Brooklyn,108.0
Marine Midland Bank - Southern,Bank,19531001,Workers Trust Company,8000133.0
Union Bank of Watertown,Former Bank/Trust Company,18520000,Union Bank of Watertown,
Van Norden Trust Company,Former Bank/Trust Company,19100901,Madison Trust Company,
Industrial Bank of Commerce of Albany,Trust Company,19650331,Industrial Bank of Schenectady,84.0
Utica National Bank and Trust Company,Former Bank/Trust Company,19710129,Marine Midland Bank - Central,
Marine Midland Bank - Western,Bank,18500000,"Marine Bank of Buffalo, The",
New York Life Insurance and Trust Company,Former Bank/Trust Company,19890914,Bank of Long Island,8000059.0
UFJ Trust Company of New York,Limited Purpose Trust Company,20160919,,
Bankers Trust Company of Western New York,Former Bank/Trust Company,19930826,NSA Bank,114041.0
Madison County Trust and Deposit Company,Former Bank/Trust Company,19580101,Lincoln National Bank & Trust Co of Syracuse,8500128.0
Bayside Federal Savings Bank,Savings Banks,19941130,North Fork Bank,170005.0
"First National Bank of Cuba, The",Former Bank/Trust Company,19851201,Norstar Bank (Rochester),
New-York Manufacturing Company,Former Bank/Trust Company,19610908,Manufacturers Hanover Trust Company,
"Morrisania Employees Credit Union, The",Credit Unions,19980210,,
Emanu-el Beth Am Credit Union,Former Credit Union,19890813,Emanu-El Beth Am Federal Credit Union,
"Trust Company of New York, The",Former Bank/Trust Company,20041113,"JPMorgan Chase Bank, National Association",
Pusan Bank,Foreign Representative Offices,19940818,Pusan Bank,
"Fleet Bank of New York, N.A.",Trust Company,19860303,Niagara County Savings Bank,8100017.0
"Bank of British West Africa, Ltd.",Former Foreign Agency,19120000,"Bank of British West Africa, Ltd.",
Cornhill Savings & Loan Association,Former Savings and Loan,18910207,Cornhill Building and Loan Association,
Broadway Savings Institution,Former Savings Bank,19730101,Prudential Savings Bank,
Bankers Trust Company of Western New York,Former Bank/Trust Company,19831216,"Key Bank of Western New York, N.A.",8500140.0
Wyoming County Bank and Trust Company,Trust Company,19361231,National Bank of Wyoming,156.0
Commercial Exchange National Bank in New York,Former Bank/Trust Company,19550301,First National City Bank of New York,
United Credit Union,Former Credit Union,19300509,,
Kookmin Bank,Foreign Representative Offices,19960122,Kookmin Bank,
Morris Plan Industrial Bank of Albany,Trust Company,19841001,"Bankers Trust Company of Albany, N.A.",170006.0
"Nostrand Bank, The",Former Bank/Trust Company,19260000,"Nostrand Bank, The",
Provision Salesmen's Credit Union,Former Credit Union,19391211,Provision Salesmen's Credit Union,
Queens County Bank,Former Bank/Trust Company,18990801,Corn Exchange Bank,8000017.0
Genesee Valley Union Trust Company,Bank,18971108,Union Trust Company of Rochester,
Tuckahoe Savings and Loan Association,Savings & Loans,19750101,Westchester County Savings Bank,216004.0
Buffalo Fidelity Credit Union,Former Credit Union,19451023,,
Guardian National Bank,Former Bank/Trust Company,19300120,Brooklyn Trust Company,134.0
"Brooklyn & NY Arcanum Blding,Loan & Savings Assoc",Former Savings and Loan,19851001,"Bowery Savings Bank, The",202002.0
Lloyds Bank Europe Limited,Foreign Branches,19711001,Bank of London & South America Limited,9000055.0
First Bank and Trust Company of Ithaca,Former Bank/Trust Company,19971113,Fleet Bank N.A.,5801998.0
M & T Trust Company,Trust Company,19970524,"East New York Savings Bank, The",205001.0
Mechanics Savings Bank of Elmira,Former Savings Bank,19740401,Waverly Savings & Loan Association,8200123.0
Splitska Banka dd,Foreign Representative Offices,19961231,,
"Dominion Bank, The",Foreign Branches,19550309,Bank of Toronto,35.0
Commerzbank Aktiengesellschaft,Foreign Branches,19710820,Commerzbank Aktiengesellschaft,
Seventh Ward Bank,Former Bank/Trust Company,19230101,,
United Mutual Savings Bank,Savings Banks,19951020,,
Commercial Investment Trust LTD.,Investment Company (Article XII),19860429,"CIT Group/Equipment Financing, Inc.",
Mechanics Savings Bank of Cohoes,Former Savings Bank,20050114,First Niagara Bank,212002.0
Central Savings & Loan Association (Albany),Former Savings and Loan,19990329,HSBC Bank USA,
Kyongnam Bank,Foreign Representative Offices,19940422,Kyongnam Bank,
Mizuho Trust and Banking Company (USA),Trust Company,20030306,"Mizuho Asset Trust & Banking Co., Ltd.",2270147.0
Broadway Trust Company,Former Bank/Trust Company,19230207,Columbia Trust Company,102015.0
Second National Bank of Elmira,Bank,19531001,Marine Midland Bank Trust Company of Southern NY,
M & T Trust Company,Trust Company,19480528,Ebenezer State Bank,95.0
Eleventh Ward Bank,Former Bank/Trust Company,19541015,Chemical Corn Exchange Bank,
Briggs Bank of Clyde,Former Bank/Trust Company,19930826,NSA Bank,114041.0
"Franklin Savings Bank in the City of NY, The",Savings Banks,19810424,American Savings Bank,
National Commercial Bank & Trust Company,Trust Company,18650000,Natl Commercial Bank & Trust Company of Albany,
Chancellor LGT Trust Company,Limited Purpose Trust Company,19980703,INVESCO (NY) Trust Company,
"Lincoln First Bank-Central, N.A.",Former Bank/Trust Company,19930101,"Chase Manhattan Bank, N.A., The",5800033.0
"Bank of Northern Brookhaven, The",Former Bank/Trust Company,19750119,Chemical Bank,103011.0
Lake City Building & Loan Association,Former Savings and Loan,19731231,Columbia Banking Savings & Loan Association,8200027.0
Horseheads Federal Savings & Loan Association,Former Savings and Loan,20040630,HSBC Bank USA,
Brooklyn City Savings & Loan Association,Former Savings and Loan,19350907,Brooklyn Federal Savings & Loan Association,
Raiffeisen Zentralbank Osterreich AG,Foreign Representative Offices,20170321,,
"Bank of Port Jefferson, The",Former Bank/Trust Company,19551101,First Suffolk National Bank of Huntington,74.0
"Troy Prudential Association, Inc.",Former Bank/Trust Company,19280000,"Troy Prudential Association, Inc.",
Liberty National Bank & Trust Co. of Syracuse,Former Bank/Trust Company,19920616,Key Bank of New York (6/92-8/93),
Mees Pierson N.V.,Foreign Agencies,19971229,,
Statewide Savings & Loan,Former Savings and Loan,19620101,Highland Savings & Loan Association,8200326.0
"International Bank, The",Former Bank/Trust Company,20040630,HSBC Bank USA,
Manufacturers Hanover Trust Company,Trust Company,19250529,Fifth National Bank of the City of New York,117.0
"Bank of New York Mellon, The",Trust Company,20040623,J.P. Morgan Trust Company of New York,5100006.0
Corn Exchange Bank Trust Company,Former Bank/Trust Company,19280501,"Stapleton National Bank, The",8000351.0
Oswego County National Bank,Former Bank/Trust Company,19710129,Marine Midland Bank - Central,
Bank of America (1812-1928),Former Bank/Trust Company,19280401,Bowery and East River National Bank of New York,8500215.0
Cohoes Savings Institution,Savings Banks,20010420,Hudson River Bank & Trust,208006.0
Guardian Savings & Loan Association,Former Savings and Loan,19951101,,
Bank of Commerce in New York (1839-1865),Trust Company,19290401,Bank of Commerce in New York (4/1929-5/1929),
Federation Bank and Trust Company,Former Bank/Trust Company,19670601,Franklin National Bank,5800002.0
"Citizens Bank of Penn Yan, The",Former Bank/Trust Company,19781231,"Lincoln First Bank, N.A.",8500166.0
"Marine National Bank of Buffalo, The",Bank,19550901,Citizens National Bank of Springville,8500125.0
"German-American Bank of Buffalo, NY",Former Bank/Trust Company,19620301,Bank of Orchard Park,8000264.0
Equitable Trust Company of New York (1930-1937),Trust Company,19920619,Chemical Bank,103011.0
UBS PaineWebber Trust Company,Limited Purpose Trust Company,20020131,,
Asahi Bank Trust Company of New York,Trust Company,19910411,Kyowa Saitama Bank Trust Company of New York,
First Federal S & L Assoc of Niagara County,Savings & Loans,19910531,"East New York Savings Bank, The",205001.0
Chemical National Bank of New York,Trust Company,19780929,Chemical Bank Buffalo,78.0
Shepard Savings & Loan Association,Former Savings and Loan,19200312,Shepard Savings & Loan Association,
Metropolitan Trust Company of the City of NY,Former Bank/Trust Company,18810000,Metropolitan Trust Company of the City of NY,
Kingston Trust Company,Former Bank/Trust Company,19891101,Key Bank N.A.,170007.0
Savings and Loan of Richmond Hill,Former Savings and Loan,19881031,North Side Savings Bank,214006.0
Irving National Bank of New York,Former Bank/Trust Company,19230101,Irving Bank of New York,
Jewish National Workers Alliance Federal CU,Former Credit Union,19870515,Jewish National Workers Alliance Federal CU,
"Liberty National Bank of New York, The",Former Bank/Trust Company,18910000,"Liberty National Bank of New York, The",
Marine Midland Bank,Trust Company,19990329,HSBC Bank USA,
Highland-Quassaick Nat Bnk & Trust Co of Newburgh,Former Bank/Trust Company,19871001,Norstar Bank of Upstate NY (8/84-6/88),8000267.0
Citizens National Bank of Wellsville,Former Bank/Trust Company,19800201,State Bank of Belmont,8000064.0
National Bank of Fredonia,Former Bank/Trust Company,19050000,Bank of Fredonia,
Ithaca Savings Bank,Savings Banks,19681001,"Savings Bank of Tompkins County, The",
CFCU Community Credit Union,Credit Unions,19971201,Cornell Fingerlakes Credit Union,
Chatham Bank,Former Bank/Trust Company,19960714,"Chase Manhattan Bank, The",
"Security Bank of New York, The",Former Bank/Trust Company,18880000,Fourteenth Street Bank in the City of New York,
Republic National Bank of New York,Trust Company,19991231,Republic Bank of New York,
Den Danske Bank Aktieselskab,Foreign Branches,19900521,Den Danske Bank Aktieselskab,
"First National Bank of Tully, The",Former Bank/Trust Company,19800201,"Marine Midland Bank, N.A.",8500023.0
Federation Bank of New York,Former Bank/Trust Company,19741008,European-American Bank & Trust Company,105007.0
Credit Communal de Belgique S.A.,Foreign Branches,19960301,Credit Communal de Belgique S.A.,
New York Navy Yard Savings & Loan Association,Former Savings and Loan,19210707,New York Navy Yard Savings & Loan Association,
National City Bank of Brooklyn,Former Bank/Trust Company,19190701,Irving Trust Company (11/1917-3/1920),8500186.0
First National Bank of Richfield Springs,Former Bank/Trust Company,19840801,Norstar Bank of Upstate NY (8/84-6/88),
Chemical Bank and Trust Company,Trust Company,19541015,Chemical Corn Exchange Bank,
Equitable Co-Operative Building & Loan Assoc,Former Savings and Loan,19851001,"Bowery Savings Bank, The",202002.0
Kookmin Bank,Foreign Branches,20011101,Housing and Commercial Bank,508013.0
Center Moriches Bank,Former Bank/Trust Company,19490630,"Eastport National Bank, The",8500261.0
Twelfth Ward Savings Bank,Former Savings Bank,19670630,Excelsior Empire Savings Bank,
Empire Savings Bank,Savings Banks,19951020,,
Korea Commercial Bank of New York,Bank,19990104,Hanvit America Bank,
Northern Westchester National Bank,Bank,19590501,Northern Westchester National Bank,
Terminal Trust Company,Former Bank/Trust Company,19480401,Chemical Bank and Trust Company,103011.0
"Livingston Manor Bank, The",Former Bank/Trust Company,19880624,Norstar Bank of Upstate NY,
Hanover Bank,Bank,19610908,Manufacturers Trust Company,113004.0
Fifth National Bank of the City of New York,Bank,20041113,"JPMorgan Chase Bank, National Association",
Lincoln-Alliance Bank and Trust Company,Former Bank/Trust Company,19580301,"Citizens Bank of Penn Yan, The",8000251.0
First Trust Company of Allegany County,Former Bank/Trust Company,19841201,Security Norstar Bank,
Canadian Imperial Bank of Commerce Trust Company,Trust Company,19860206,Canadian Imperial Bank of Commerce (New York),
Bank of Orchard Park,Former Bank/Trust Company,19940701,Fleet Bank,
Atlantic Avenue Credit Union,Former Credit Union,19230625,Atlantic Avenue Credit Union,
Bronxville Trust Company,Former Bank/Trust Company,19520101,First Westchester National Bank of New Rochelle,
Bank Sepah,Foreign Agencies,19960405,,
Kingsboro National Bank of Brooklyn in New York,Former Bank/Trust Company,19601101,Meadow Brook National Bank of Nassau County,8500008.0
College Point Savings Bank,Savings Banks,19920901,"Home Savings of America, FSB-NY",270027.0
"Standard Bank of South Africa Ltd., The",Former Foreign Agency,19760000,,
Fortis Bank S.A./N.V.,Foreign Branches,20130207,BNP Paribas Fortis,
Kings County Savings Bank,Former Savings Bank,19681231,Union Square Savings Bank,270014.0
East River National Bank of the City of New York,Former Bank/Trust Company,19251201,Bowery National Bank of New York,8500216.0
Mechanics National Bank of the City of New York,Former Bank/Trust Company,19040401,Leather Manufacturers' National Bank of New York,8000316.0
Bronx Borough Bank,Former Bank/Trust Company,19650901,"Chase Manhattan Bank, N.A., The",5800033.0
William Street Permanent Savings & Loan Assoc.,Former Savings and Loan,19240000,,
Goldome,Savings Banks,19821101,Goldome Bank For Savings,
Dexia Credit Local S.A.,Foreign Branches,20010404,Dexia Credit Local S.A.,
Cayuga Savings Bank,Savings Banks,18750701,Cayuga County Savings Bank,
Enterprise Savings and Loan Association,Savings & Loans,19371001,American Cooperative Savings and Loan Association,301003.0
Liberty Bank and Trust Company,Former Bank/Trust Company,19940701,Fleet Bank,
"Sixpenny Savings Bank, Rochester",Former Savings Bank,18540413,"Sixpenny Savings Bank, Rochester",
American Express Bank Ltd.,Foreign Agencies,19850528,American Express Bank Ltd.,
Third Ward Savings & Loan Association,Former Savings and Loan,19060000,Third Ward Savings & Loan Association,
State Bank of Long Island,Trust Company,20120101,Valley National Bank,5801095.0
"Bank of New York, The (9/1922-10/1989)",Former Bank/Trust Company,19890914,Bank of Long Island,8000059.0
Goodell Permanent Loan Association,Former Savings and Loan,19671229,Ellicott Permanent Savings & Loan Association,8200008.0
Columbia - Knickerbocker Trust Cc.,Trust Company,19921211,"Barclays Bank of New York, NA",5800003.0
Marine Midland Bank,Trust Company,19990227,First Commercial Bank of Philadelphia,5801035.0
Kings County Trust Company,Former Bank/Trust Company,19651101,Lafayette National Bank of Brooklyn in New York,8500146.0
Auburn Trust Company,Former Bank/Trust Company,19990329,HSBC Bank USA,
SanPaolo IMI S.p.A.,Non NYS Institutions,20030102,Banco di Napoli S.p.A.,502014.0
Local 42 Credit Union,Former Credit Union,19570520,,
Sloatsburg Savings & Loan Association,Former Savings and Loan,19280000,Ramapo Valley Savings & Loan Association,
Greenwich Savings & Loan Association,Former Savings and Loan,19950201,"Trustco Bank, N.A.",
Freehold Savings and Loan Association,Former Savings and Loan,19710701,Niagara Permanent Savings & Loan Association,8300257.0
Den Norske Bank (U.S.) Banking Corporation,Investment Company (Article XII),19750610,Nordic American Banking Corporation,
Terrace Federal Savings & Loan Association,Former Savings and Loan,19450101,Terrace Savings & Loan Association,
"Ilion Permanent Savings, Building & Loan Assoc.",Savings & Loans,19890303,Mohawk Valley Federal Savings Bank,
Mutual Investment Credit Union,Former Credit Union,19320000,,
Morris Plan Industrial Bank of Binghamton,Former Bank/Trust Company,19941205,,
Syracuse Teachers Credit Union,Former Credit Union,19610420,,
National Copper Bank of New York,Former Bank/Trust Company,19070000,National Copper Bank of New York,
Danske Bank A/S,Foreign Branches,19900614,Copenhagen Handelsbank A/S,570057.0
DVB Bank SE,Foreign Representative Offices,20090312,DVB Bank SE,
Shoe and Leather Bank of the City of New York,Former Bank/Trust Company,19960714,"Chase Manhattan Bank, The",
Columbia Trust Company,Trust Company,19961201,"Putnam Trust Company, The",5800992.0
"First National Bank of Herkimer, The",Former Bank/Trust Company,19991231,Republic Bank of New York,170040.0
City Bank of New York,Trust Company,19760101,"Citibank (Mid-Hudson), N.A.",8500267.0
"Peoples Bank of Johnstown, NY",Former Bank/Trust Company,19971113,Fleet Bank N.A.,5801998.0
Oneida National Bank & Trust Co. of Central NY,Former Bank/Trust Company,19920608,Fleet Bank of New York,
Straus National Bank & Trust Company of New York,Former Bank/Trust Company,19541015,Chemical Corn Exchange Bank,
Permanent Savings & Loan (Hoosock Falls),Former Savings and Loan,18890601,Permanent Savings & Loan (Hoosock Falls),
"Portchester Savings Bank, The",Savings Banks,19891204,Village Bank,
Oyster Bay Trust Company,Former Bank/Trust Company,18900000,Oyster Bay Bank,
Citizens' Central National Bank of New York,Former Bank/Trust Company,18650000,National Citizens Bank of the City of New York,
Bankers' Loan & Investment Company,Former Savings and Loan,19330414,,
Auburn Savings Bank,Savings Banks,19971113,Fleet Bank N.A.,5801998.0
Bowery and East River National Bank of New York,Former Bank/Trust Company,19270201,Discount National Bank of New York,8500220.0
"Key Bank of New York, N.A.",Trust Company,19910601,"Key Bank of Western New York, N.A.",8500140.0
Chelsea Bank & Trust Company,Former Bank/Trust Company,19291116,Chelsea Bank & Trust Company,
Matinecock Bank of Locust Valley,Former Bank/Trust Company,19230000,Matinecock Bank of Locust Valley,
Lincoln Savings & Loan Association of Buffalo,Former Savings and Loan,19430227,Lincoln Federal Savings & Loan Assoc of Buffalo,
"Syracuse Savings Institution, The",Savings Banks,19821015,Mechanics Savings Bank of Elmira,8100011.0
Eastern National Bank of Long Island,Bank,20041113,"JPMorgan Chase Bank, National Association",
"Chase Manhattan Bank, The (1799-9/1965)",Former Bank/Trust Company,19260801,"Greenpoint Bank of Brooklyn, The",8000387.0
"Key Bank, N.A.",Trust Company,19560501,Second National Bank of Cooperstown,8500042.0
Marine Trust Company of Buffalo,Bank,19341001,Bank of Snyder,8000453.0
Flushing and Queens County Bank,Former Bank/Trust Company,19541015,Chemical Corn Exchange Bank,
Bank of Worcester,Former Bank/Trust Company,18840000,Bank of Worcester,
Lafayette Bank and Trust Company of Suffern,Former Bank/Trust Company,19760101,Marine Midland Bank (12/75-2/80),170046.0
Commercial Trust Company (1884-1900),Trust Company,19000601,New York and London Trust Company,
Market and Fulton National Bank of New York,Former Bank/Trust Company,18871201,Fulton National Bank of the City of New York,8500197.0
"Liberty National Bank of New York, The",Former Bank/Trust Company,19960714,"Chase Manhattan Bank, The",
"Niagara Frontier Federal Employees Credit Union,",Credit Unions,19330325,Niagara Falls Postal Employees Credit Union,
Norstar Bank of Upstate NY,Trust Company,19880624,Norstar Bank of Upstate New York,
Broadway Bank,Former Bank/Trust Company,19891006,"Bank of New York, The",
Brooklyn Laundrymen's Credit Union,Former Credit Union,19860710,Municipal Credit Union,461304.0
"National City Bank of New York, The",Trust Company,18120000,City Bank of New York,
Seaboard Bank of the City of New York,Former Bank/Trust Company,19550301,President and Directors of the Manhattan Company,8000257.0
"International Bank, The",Former Bank/Trust Company,19760101,Marine Midland Bank (12/75-2/80),170046.0
J. Henry Schroder Bank & Trust Company,Trust Company,19290424,J. Henry Schroder Trust Company,
"Banco de Vizcaya, S.A.",Former Foreign Agency,19760908,"Banco de Vizcaya, S.A.",
Schroder Trust Company,Trust Company,19780101,J. Henry Schroder Bank & Trust Company,
Clymer State Bank,Former Bank/Trust Company,19100000,Clymer State Bank,
Liberty National Bank,Trust Company,19940701,Fleet Bank,
Central Natl Bank of the City of NY (1926-1930),Former Bank/Trust Company,19300601,Bank of Manhattan Trust Company,8000275.0
"German American Bank, The",Former Bank/Trust Company,19310901,Straus National Bank & Trust Company of New York,8000361.0
"National Union Bank of New York, The",Former Bank/Trust Company,19000401,National Bank of Commerce in New York,141.0
Friends Ivory & Sime Trust Company,Limited Purpose Trust Company,20040629,,
"State Bank, The",Trust Company,19920619,Chemical Bank,103011.0
Washington Minute Men Credit Union,Former Credit Union,19540630,,
Trust Company of Wyoming County,Trust Company,19361231,"North Java Company, Private Bankers",157.0
Swift Syracuse Employees Credit Union,Former Credit Union,19630725,,
Chemical Bank and Trust Company,Trust Company,19990305,Texas Commerce Trust Company of New York,120006.0
"Argentaria, Caja Postal y Banco Hipotecario, S.A.",Foreign Branches,20000601,"Banco Bilbao Vizcaya Argentaria, S.A.",
Highland National Bank of Newburg,Former Bank/Trust Company,18650000,Highland National Bank & Trust Co of Newburgh,
Commercial Trust Company (1884-1900),Trust Company,18840201,Commercial Trust Company (1884-1900),
State Bank of Randolph,Former Bank/Trust Company,19841201,Security Norstar Bank,
HSH Nordbank AG,Foreign Branches,20041108,HSH Nordbank AG,
Sixth Avenue Bank of New York,Bank,19300214,Underwriters Trust Company,102040.0
"Trust Company of New York, The",Former Bank/Trust Company,19960714,"Chase Manhattan Bank, The",
Chenango Federal Savings & Loan Association,Former Savings and Loan,19800919,Chenango Federal Savings & Loan Association,
Port Jervis Savings & Loan Association,Former Savings and Loan,19910531,"Key Bank of Western New York, N.A.",8500140.0
Bohemia Joint Stock Bank,Former Foreign Agency,19160000,,
Continental Bank & Trust Company of New York,Former Bank/Trust Company,20041113,"JPMorgan Chase Bank, National Association",
Manhattan Mortgage Company,Trust Company,19290201,Irving Trust Company,
Federation Bank of New York,Former Bank/Trust Company,20010717,Citibank N. A.,4400000.0
Krug's Westchester Credit Union,Former Credit Union,19410102,Krug's Westchester Credit Union,
Standard National Bank of the City of New York,Former Bank/Trust Company,19000701,Bowling Green Trust Company,
"Banco do Brasil,S.A.",Foreign Representative Offices,20100618,"Banco do Brasil,S.A.",
Security Trust Company of Rochester,Former Bank/Trust Company,19440529,Fairport National Bank and Trust Company,8500257.0
New York Produce Exchange Bank,Former Bank/Trust Company,19260401,Chase National Bank of the City of New York,8500003.0
U.W.W.E. Local 65 Credit Union,Former Credit Union,19400603,U.W.W.E. Local 65 Credit Union,
First-City National Bank of Southern New York,Former Bank/Trust Company,19670000,First-City National Bank of Southern New York,
Mercantile Loan & Warehouse Company,Trust Company,19110810,Bankers Trust Company,102027.0
Bank of Attica,Former Bank/Trust Company,19461101,Marine Trust Company of Buffalo,5000014.0
Chemical Bank New York Trust Company,Trust Company,19990305,Texas Commerce Trust Company of New York,120006.0
Mutual Savings & Loan & Building Assoc of Rome NY,Former Savings and Loan,18880823,Mutual Savings & Loan & Building Assoc of Rome NY,
Williamsburgh City Bank,Former Bank/Trust Company,18650000,First National Bank of Brooklyn,
Commercial Credit Union of Brooklyn,Former Credit Union,19150000,Commercial Credit Union of Brooklyn,
Alliance Bank,Former Bank/Trust Company,19960714,Chemical Bank,103011.0
"Industrial Bank of Binghamton, The",Former Bank/Trust Company,19340000,Morris Plan Industrial Bank of Binghamton,
Great Neck Trust Company,Former Bank/Trust Company,19571001,Franklin National Bank of Long Island,
National Commercial Bank & Trust Company,Trust Company,19970113,"Key Bank, National Association",5801003.0
Coal & Iron National Bank of the City of New York,Former Bank/Trust Company,19800201,"Marine Midland Bank, N.A.",8500023.0
Oppenheimer Capital Trust Company,Limited Purpose Trust Company,19990517,PIMCO Trust Company,
Banco Central of New York,Trust Company,19921006,Banco Central Hispano - USA,
Commercial National Bank of Long Island City,Former Bank/Trust Company,19230101,,
