Institution Name Primary,Type,Event Date,Institution Name (Secondary),Identification Number (Secondary)
Pennsylvania Exchange Bank,Former Bank/Trust Company,19630101,Royal National Bank of New York,8500147.0
Leonia Bank plc,Foreign Representative Offices,20010316,Sampo Bank plc,
Centerville Station Co-Operative Credit Union,Former Credit Union,19150000,Centerville Station Co-Operative Credit Union,
Citizens National Bank and Trust Company,Former Bank/Trust Company,19680201,Citizens National Bank and Trust Company,
National Bank of Great Neck,Former Bank/Trust Company,19550926,Central Bank and Trust Company,8000114.0
"Marine National Bank of Buffalo, The",Bank,19510401,Niagara County National Bank and Trust Company,8500085.0
"Kyowa Saitama Bank, LTD., The",Foreign Representative Offices,19910418,"Saitama Bank, Ltd., The",570111.0
National Bank of Middletown,Former Bank/Trust Company,19891006,Irving Trust Company,102015.0
Harlem Bank of Commerce,Former Bank/Trust Company,19290800,Mutual Trust Company (1929),8000360.0
"County Trust Company, The",Former Bank/Trust Company,19640101,First National Bank of Brewster,8500021.0
Wm. H. Seward & Co.,Former Bank/Trust Company,19710129,Marine Midland Bank - Central,
Lincoln National Bank & Trust Co of Syracuse,Former Bank/Trust Company,19580101,Madison County Trust Company,8000187.0
Fidata Trust Company New York,Trust Company,19720713,Bradford Trust Company (Limited Purpose Trust),
Bank of America National Association,Former Bank/Trust Company,19220701,Atlantic National Bank of the City of NY,8500213.0
UniCredit Bank AG,Foreign Branches,19981204,Bayerische Hypotheken-Und Wechsel-Bank AG,502035.0
Pinnacle Savings & Loan Association,Former Savings and Loan,18900224,Pinnacle Avenue Savings & Loan Association,
Carthage Savings Bank,Former Savings Bank,18980101,,
Kasa Savings & Loan Association,Former Savings and Loan,19800302,Buffalo Savings Bank,207008.0
Christiania Bank OG Kreditkasse ASA,Foreign Branches,20011221,Nordea Bank Norge ASA,
"Norstar Bank, N.A.",Trust Company,19940701,Fleet Bank,
Manhattan Savings Bank (5/42-5/90),Savings Banks,19770101,Yonkers Savings Bank,185.0
Merchants National Bank of the City of New York,Former Bank/Trust Company,20041113,"JPMorgan Chase Bank, National Association",
"Chemical Bank, The (1823-1865)",Trust Company,18230000,New-York Chemical Manufacturing Company,
Liberty Street Trust Company,Limited Purpose Trust Company,20130501,OFI Global Trust Company,
Homestead Aid Association of Utica,Former Savings and Loan,19480430,Home Savings & Loan Association (Utica),8200348.0
Sixth National Bank of the City of New York,Former Bank/Trust Company,18990301,"Astor National Bank of New York, The",8500178.0
"County Trust Company, The",Former Bank/Trust Company,19550501,"Irvington National Bank and Trust Company, The",8500079.0
American Exchange Irving Trust Co.,Trust Company,19531113,Irving Safe Deposit Company,
Oneida Federal Savings & Loan Association,Former Savings and Loan,19820630,"Albany Savings Bank, FSB",
First Chartered Savings & Loan Association,Former Savings and Loan,19830926,,
Mutual Savings Bank of Brooklyn,Former Savings Bank,18670424,Mutual Savings Bank of Brooklyn,
"Oneida Savings & Loan Association of Oneida, NY",Former Savings and Loan,19820630,"Albany Savings Bank, FSB",
Liberty Bank and Trust Company,Former Bank/Trust Company,19611001,Exchange Bank,8000181.0
"American Savings Bank, FSB",Savings Banks,19810424,American Savings Bank (10/64-4/81),8100020.0
Bank of Yorktown,Former Bank/Trust Company,19991231,Republic Bank of New York,170040.0
BancBoston Trust Company of New York,Limited Purpose Trust Company,19891228,BancBoston Trust Company of New York,
New York and London Trust Company,Trust Company,19531113,Irving Safe Deposit Company,
"Thomas Cook Travellers Cheques, Ltd.",Former Foreign Agency,19320000,"Cook, Thomas & Son (Bankers), Limited",
Seoul Bank,Foreign Agencies,19771206,Bank of Seoul and Trust Company,
"National City Bank of New York, The",Trust Company,18650000,National City Bank of New York,
Seventh National Bank of New York (1888-4/1903),Former Bank/Trust Company,18330000,Seventh Ward Bank,
Market Bank of New York,Former Bank/Trust Company,19180301,Irving Trust Company (11/1917-3/1920),8500186.0
"South Shore Bank of Staten Island, The",Former Bank/Trust Company,19600901,Bankers Trust Company,102027.0
Manhattan Mortgage Company,Trust Company,19261211,American Exchange Irving Trust Co.,
"County Trust Company, The",Former Bank/Trust Company,19650101,Peoples Bank of Rockland County,8000120.0
First Citizens Bank & Trust Company of Utica,Former Bank/Trust Company,19581201,Marine Midland Trust Company of the Mohawk Valley,
Dollar-Dry Dock Savings Bank of New York,Savings Banks,19860724,Dollar Dry Dock Savings Bank,
Nassau County Trust Company,Former Bank/Trust Company,19571001,Franklin National Bank of Long Island,
"Bowery Savings Bank, The",Savings Banks,19920420,"Home Savings of America, Bowery Division, SSB",
International Trust Company (1927-9/1931),Former Bank/Trust Company,19280201,Terminal Trust Company,8000356.0
Central Savings & Loan Association (Albany),Former Savings and Loan,19991231,HSBC Bank USA,
HSBC Bank USA,Trust Company,19991231,HSBC Bank USA,
Cosmopolitan Bank,Former Bank/Trust Company,19280801,"Bank of United States, The",8000418.0
Bank of East Aurora,Former Bank/Trust Company,19510428,Marine Trust Company of Western New York,
State Bank of Rushford,Former Bank/Trust Company,19920701,Manufacturers and Traders Trust Company,113003.0
Knickerbocker Savings Institution,Former Savings Bank,18510408,Knickerbocker Savings Institution,
Huguenot Trust Company of New Rochelle,Former Bank/Trust Company,19930101,"Chase Manhattan Bank, N.A., The",5800033.0
Mechanics & Metals Natl Bank of the City of NY,Former Bank/Trust Company,18100000,Mechanics' Bank of the City of New York,
Liberty Bank and Trust Company,Former Bank/Trust Company,19620301,Bank of Orchard Park,8000264.0
Natl Bank of Niagara & Trust Co of Niagara Falls,Former Bank/Trust Company,19990329,HSBC Bank USA,
First National City Bank,Trust Company,19630101,First National City Trust Company,8000417.0
Knickerbocker Trust Company,Trust Company,19140801,Columbia Trust Company,
Columbia - Knickerbocker Trust Cc.,Trust Company,19891006,"Bank of New York, The (9/1922-10/1989)",8000241.0
Svenska Handelsbanken AB,Foreign Branches,19870508,Svenska Handelsbanken,
Local 1199 Credit Union,Credit Unions,19860102,Local 1199 Credit Union,
Huntington Station Bank,Former Bank/Trust Company,19561001,Bank of Huntington and Trust Company,8000129.0
New York Private Bank & Trust,Savings Banks,19790323,Prudential Savings Bank,8100018.0
Jamaica National Bank of New York,Former Bank/Trust Company,19931231,Marine Midland Bank,5800183.0
Liberty National Bank and Trust Company,Trust Company,19630401,Liberty National Bank and Trust Company,
Clymer State Bank,Former Bank/Trust Company,19100000,Clymer State Bank,
"Rochester Community Savings Bank, The",Savings Banks,19830630,"Rochester Community Savings Bank, The",
MSBA Employees Federal Credit Union,Former Credit Union,19790629,MSBA Employees Federal Credit Union,
Mechanics National Bank of the City of New York,Former Bank/Trust Company,19200601,New York Produce Exchange National Bank,8000327.0
Brotherhood Ideal Credit Union,Credit Unions,19350313,Brotherhood Ideal Credit Union,
"Northfield Savings Bank, FSB",Former Savings Bank,18870201,Northfield Building-Loan & Savings Association,
Hudson River Trust Company,Former Bank/Trust Company,19970113,"Key Bank, National Association",5801003.0
"Syracuse Trust Company, The",Bank,19581201,Camillus Bank,8000075.0
"First National Bank of Poughkeepsie, The",Former Bank/Trust Company,19470224,Vassar Bank,8000052.0
Bank of Buffalo,Former Bank/Trust Company,19590401,Bank of Buffalo,
HSI Bank,Bank,19860508,Hill Samuel International Banking Corp.,
Trust Company of Northern Westchester,Former Bank/Trust Company,19411220,"Bank of Westchester, The",
"Genesee Country Bank, The",Former Bank/Trust Company,19781201,"Citizens Bank, Attica, The",8000055.0
Williams Press Employees Credit Union,Former Credit Union,19760201,,
Industrial Bank of Commerce,Bank,19940701,Fleet Bank,
Watervliet Teachers Credit Union,Former Credit Union,19441125,,
Scajaquada Savings and Loan Association,Former Savings and Loan,19190000,,
Albany County Savings Bank,Savings Banks,18740000,Albany County Savings Bank,
"Wallkill National Bank, The",Former Bank/Trust Company,19970113,"Key Bank, National Association",5801003.0
Battery Park National Bank of New York,Former Bank/Trust Company,19230801,Bank of America (1812-1928),8500212.0
Jefferson Savings Bank,Savings Banks,19830630,"Rochester Community Savings Bank, The",
"Bank of United States, The",Former Bank/Trust Company,19290301,"Colonial Bank, The",8000425.0
Den Norske Creditbank,Foreign Branches,19900824,Bergen Bank A/S,504010.0
"Chase Manhattan Bank of Central New York, N.A.",Former Bank/Trust Company,20041113,"JPMorgan Chase Bank, National Association",
Oneida County Trust Company,Former Bank/Trust Company,19991231,Republic Bank of New York,170040.0
Union Square Savings Bank,Savings Banks,18480412,Institution For Savings of Merchants' Clerks,
NMB Postbank Groep N.V.,Foreign Branches,19911231,Internationale Nederlanden Bank N.V.,
Industry Permanent Dime Savings & Loan Assoc.,Former Savings and Loan,19290000,Industry Savings & Loan Association,
"Chartered Bank of India, Australia, and China",Former Foreign Agency,19570000,"Chartered Bank, The",
Tuckahoe Home Building & Loan Association,Savings & Loans,19400000,Tuckahoe Savings and Loan Association,
Mechanics and Farmers Savings Bank of Albany,Former Savings Bank,18550412,Mechanics and Farmers Savings Bank of Albany,
Bushwick National Bank of New York,Former Bank/Trust Company,19310630,,
People's Trust Company,Former Bank/Trust Company,19220701,Homestead Bank of Brooklyn,8000451.0
Metropolitan Bank (4/1906-9/1921),Former Bank/Trust Company,19211101,Chase National Bank of the City of New York,8500003.0
Utica National Bank and Trust Company,Former Bank/Trust Company,20040630,HSBC Bank USA,
Madison County Trust Company,Former Bank/Trust Company,19590401,Lincoln National Bank & Trust Co of Central NY,
Sumitomo Mitsui Banking Corporation,Foreign Branches,20010401,"Sakura Bank, Limited, The",513010.0
Central Natl Bank of the City of NY (1864-1904),Former Bank/Trust Company,19040301,National Citizens Bank of the City of New York,8000333.0
Ritter Employees Credit Union,Former Credit Union,19830518,,
Central Natl Bank of the City of NY (1864-1904),Former Bank/Trust Company,19200501,Chemical National Bank of New York,103011.0
First National Bank & Trust Company of Freeport,Former Bank/Trust Company,19601101,Colonial Trust Company,8000015.0
Chancellor Trust Company,Limited Purpose Trust Company,19970113,Chancellor LGT Trust Company,
Huntington Savings & Loan Association,Former Savings and Loan,19350814,Huntington Federal Savings & Loan Association,8700001.0
Metropolitan Bank (1905-4/1906),Former Bank/Trust Company,19960714,"Chase Manhattan Bank, The",
Corn Exchange Bank Trust Company,Former Bank/Trust Company,18990301,Hudson River Bank of the City of New York,8000347.0
Niagara County National Bank and Trust Company,Former Bank/Trust Company,18640000,Niagara County National Bank & Trust Company,
First National Bank of Jamaica,Former Bank/Trust Company,19920619,Chemical Bank,103011.0
UMAN Credit Union,Former Credit Union,19570221,,
"Banco di Santo Spirito, S.P.A.",Foreign Branches,20020626,Capitalia S.p.A.,
Shoe and Leather Bank,Former Bank/Trust Company,19960714,"Chase Manhattan Bank, The",
Beacon Savings & Loan Association,Former Savings and Loan,19710331,Beacon Federal Savings & Loan Association,
Flushing and Queens County Bank,Former Bank/Trust Company,19541015,Chemical Bank and Trust Company,103011.0
Importers and Traders Bank of New York,Former Bank/Trust Company,19550301,President and Directors of the Manhattan Company,8000257.0
Rockland County Trust Company,Former Bank/Trust Company,19580901,Marine Midland Trust Company of Rockland County,
Empire State Credit Union,Credit Unions,20150603,Rockland Employees Federal Credit Union,
Bank of Commerce,Bank,19920601,Fleet Bank (6/92-6/94),
Patchogue Bank and Trust Company,Former Bank/Trust Company,19971113,Fleet Bank N.A.,5801998.0
Prospect Home Building & Loan Association,Former Savings and Loan,19851001,"Bowery Savings Bank, The",202002.0
Bankers Trust of Jamestown,Former Bank/Trust Company,19030000,Bank of Jamestown,
Riverhead Savings Bank,Savings Banks,19920612,"Roslyn Savings Bank, The",218010.0
Bank Ekspor Impor Indonesia,Foreign Agencies,19990422,,
New York National Irving Bank,Former Bank/Trust Company,19200401,Irving National Bank,45.0
Cooperatieve Rabobank U.A.,Foreign Branches,20160105,Cooperatieve Rabobank U.A.,
Irving Savings Bank,Former Savings Bank,19540802,American Savings Bank (1/1882-8/1954),8100128.0
Brooklyn Trust Company,Trust Company,19920619,Chemical Bank,103011.0
Hastings-on-Hudson Building Co-Op Savings & Loan,Former Savings and Loan,19370000,Hastings-on-Hudson Savings & Loan Association,
Ithaca Trust Company,Trust Company,19360721,First National Bank of Trumansburg N.Y.,153.0
"Chemical Bank, The (1823-1865)",Trust Company,19780929,"Chemical Bank - Eastern, N.A.",79.0
Bank of Great Neck (1906 - 2/1953),Former Bank/Trust Company,19891006,"Bank of New York, The",
Chemung Canal Trust Company,Trust Company,20090529,Bank of Canton,5801257.0
American Trust Company (2/1950-4/1966),Trust Company,19500201,American Trust Company (2/1950-4/1966),
Second National Bank of Elmira,Bank,19991231,Republic Bank of New York,170040.0
South Shore Trust Company,Former Bank/Trust Company,20010717,Citibank N. A.,4400000.0
"Pacific National Bank of New York, The",Former Bank/Trust Company,19250801,American Exchange National Bank,47.0
Goshen Co-Operative Savings & Loan Association,Savings & Loans,19951027,"Middletown Savings Bank, FSB",
New York Exchange Bank in the City of New York,Trust Company,19230207,Columbia Trust Company,102015.0
Tanners' Bank,Former Bank/Trust Company,19950201,"Trustco Bank, N.A.",
Skandinaviska Enskilda Banken Corporation,Investment Company (Article XII),19820723,Skandinaviska Enskilda Banken Corporation,
Lloyds Bank International Limited,Foreign Branches,19711001,Lloyds & Bolsa International Bank Limited,
Fairport Saving & Loan Association,Savings & Loans,19390301,Fairport Saving & Loan Association,
Emigrant Bank,Savings Banks,20121231,Emigrant Savings Bank - Long Island,270065.0
Hanover National Bank of the City of New York,Former Bank/Trust Company,19290000,Hanover Bank of the City of New York,
Banca Popolare di Vicenza S.C.p.A.,Foreign Representative Offices,20161028,,
Bank of Manlius,Former Bank/Trust Company,19991231,HSBC Bank USA,
Dunkirk Savings & Loan Association,Former Savings and Loan,19720331,Niagara Permanent Savings & Loan Association,8300257.0
Guardian Savings & Loan Association,Former Savings and Loan,19951101,,
ICICI Bank Limited,Foreign Representative Offices,20020320,ICICI Bank Limited,
New Commercial Bank of New York LLC,Bank,20041230,New Commercial Bank of New York LLC,
Chatham & Phenix National Bank of New York,Former Bank/Trust Company,18510000,Chatham Bank,
Banco Mercantil de Sao Paulo S.A. Finasa,Foreign Branches,19981124,Banco Mercantil Finasa S.A. Sao Paulo,
Morris Plan Industrial Bank of Syracuse,Former Bank/Trust Company,19840701,Chase Manhattan National Corporation,
"International Bank, The",Former Bank/Trust Company,19800201,"Marine Midland Bank, N.A.",8500023.0
Mohawk Valley Savings & Loan Association,Savings & Loans,19790730,Mohawk Valley Savings & Loan Association,
Nathan Schweitzer Company Credit Union,Former Credit Union,19341030,Nathan Schweitzer Company Credit Union,
Mechanics Savings Bank of Fishkill- on- Hudson,Former Savings Bank,19741231,Heritage Savings Bank,8100123.0
Peoples State Bank of Baldwin,Former Bank/Trust Company,19670501,National Bank of North America,
Lincoln-Alliance Bank,Former Bank/Trust Company,19450701,Lincoln Rochester Trust Company,
"Fuji Bank, Limited, The",Foreign Branches,19851001,,
Glen National Bank of Watkins Glen,Former Bank/Trust Company,19920101,"Fleet Bank of New York, N.A.",
"AIG Finance Holdings, Inc.",Investment Company (Article XII),20110623,,
Railroad Employees' Credit Union,Former Credit Union,19291211,Railroad Employees' Credit Union,
Modern Industrial Bank,Former Bank/Trust Company,19650301,Bank of North America (10/58-5/67),
Irving National Exchange Bank of New York,Trust Company,19200401,New York National Irving Bank,8500186.0
Manhattan Savings Bank (5/42-5/90),Savings Banks,19900502,Manhattan Savings Bank,
"Chase Manhattan Bank, The",Trust Company,19770331,Chemical Bank Hudson Valley N.A.,76.0
Hanover Bank,Bank,19180301,Union Trust Company of New York,8000295.0
Commonwealth Savings & Loan Association,Former Savings and Loan,19350000,,
"Banco Mexicano, S.A.",Foreign Agencies,19930203,"Banco Mexicano, S.A.",
Mechanics and Farmers Bank of Albany,Former Bank/Trust Company,19840101,Schenectady Trust Company,120009.0
National Bank of Orange and Ulster Counties,Former Bank/Trust Company,19830701,"Norstar Bank of the Hudson Valley, N.A.",
New York Produce Exchange Bank,Former Bank/Trust Company,20041113,"JPMorgan Chase Bank, National Association",
New Commercial Bank of New York,Bank,19930517,,
Copenhagen National Bank,Former Bank/Trust Company,19990329,HSBC Bank USA,
Mechanics' Bank of the City of New York,Former Bank/Trust Company,19100201,Mechanics & Metals Natl Bank of the City of NY,
Canaseraga State Bank,Former Bank/Trust Company,19870401,"Norstar Bank, N.A.",170048.0
Hempstead Bank,Former Bank/Trust Company,19830701,Peninsula National Bank,8500037.0
Taipeibank,Foreign Agencies,20090731,,
Republic National Bank of New York,Trust Company,19991231,Republic Bank of New York,
Security Building and Loan Association,Former Savings and Loan,18900801,Security Building and Loan Association,
White Plains Savings & Loan Association,Former Savings and Loan,19161204,White Plains Savings & Loan Association,
"Continental Bank of New York, The",Former Bank/Trust Company,19311201,Industrial National Bank of New York,8000358.0
"Chiyoda Bank, LTD., The",Foreign Branches,19530714,"Mitsubishi Bank, Limited, The",
CIC-Union Europeenne International et Cie,Foreign Branches,19920603,,
"Bank of Long Island, The (1902-1/1920)",Former Bank/Trust Company,19030101,"Flushing Bank, The (1888-1/1903)",8000385.0
Internationale Nederlanden Bank N.V.,Foreign Branches,19931101,,
Bowling Green Trust Company,Former Bank/Trust Company,19550301,"Chase Manhattan Bank, The (1799-9/1965)",
Metropolitan Savings Bank (Bklyn),Former Savings Bank,19690901,Metropolitan Savings Bank (Bklyn),
"Port Morris Bank, The",Former Bank/Trust Company,19920619,Chemical Bank,103011.0
"Windsor National Bank, The",Former Bank/Trust Company,19991231,HSBC Bank USA,
Farmers Fire Insurance and Loan Company,Former Bank/Trust Company,18360000,Farmers Loan and Trust Company,
Morton Trust Company (1900-1910),Trust Company,19100126,Guaranty Trust Company of New York,113026.0
Deutsche Hyp Deutsche Hypothekenbank Frankfurt-Ha,Foreign Representative Offices,20000816,Deutsche Hyp Deutsche Hypothekenbank Frankfurt-Hamburg AG,
Lincoln Rochester Trust Company,Former Bank/Trust Company,19930101,"Chase Manhattan Bank, N.A., The",5800033.0
Fleet Bank,Trust Company,19911001,Norstar Bank of Central N.Y.,114035.0
Hudson Trust Company,Former Bank/Trust Company,19891006,Irving Trust Company,102015.0
Broadway Bank of Brooklyn,Bank,19150910,Manufacturers Trust Company,
"Bank of Tokyo Trust Company, The",Trust Company,19550915,"Bank of Tokyo Trust Company, The",
Oneonta Savings & Loan Association,Former Savings and Loan,19810311,Oneonta Federal Savings & Loan Association,
Citizens Central Bank,Bank,19541201,"Silver Springs National Bank, The",8500123.0
State Bank and Trust Company,Trust Company,19960714,"Chase Manhattan Bank, The",
Nanuet National Bank,Former Bank/Trust Company,19890817,"Bank of New York, The (9/1922-10/1989)",8000241.0
Genesee Valley Union Trust Company,Bank,19700101,Marine Midland Bank - Rochester,
"Bank For Savings of Ossining, The",Savings Banks,19080101,"Bank For Savings of Ossining, The",
Security Building and Loan Association,Former Savings and Loan,19350813,Dime Building & Loan Association (Oswego),8200252.0
Community State Bank,Trust Company,19650331,Industrial Bank of Schenectady,84.0
"Broadalbin Bank, The",Former Bank/Trust Company,19691001,"First Trust Company of Albany, N.A.",
Norstar Bank of Central N.Y.,Savings Banks,19971113,Fleet Bank N.A.,5801998.0
Bryant Park Bank,Bank,19960714,"Chase Manhattan Bank, The",
Fidelity Trust Company,Bank,19700101,Marine Midland Bank - New York,
"Dominion Bank, The",Foreign Branches,19190228,"Dominion Bank, The",
Market Bank of New York,Former Bank/Trust Company,18650401,Market National Bank of New York,
Polish-American Cooperative Savings & Loan Assoc.,Savings & Loans,19380803,Atlas Savings and Loan Association,
Peoples Trust Company of Bklyn N.A. of New York,Former Bank/Trust Company,19260601,National City Bank of New York,4400000.0
"First National Bank of Harrisville, The",Former Bank/Trust Company,19710910,St. Lawrence County National Bank,8500032.0
Fiduciary Investment Corporation,Investment Company (Article XII),20160624,,
"Watertown National Bank, The",Former Bank/Trust Company,19801101,"Key Bank of Northern New York, N.A.",
Mechanics' Bank of the City of New York,Former Bank/Trust Company,19100201,National Copper Bank of New York,8000324.0
Young Men's Montifiore Association CU,Former Credit Union,19340925,Young Men's Montifiore Association CU,
"Hiram Maxfield State Bank, The",Former Bank/Trust Company,19840401,Security Trust Company,
Mercantile Loan & Warehouse Company,Trust Company,18680000,Mercantile Loan and Warehouse Company,
Greenwich National Bank of the City of New York,Former Bank/Trust Company,19290501,Central Hanover Bank and Trust Company,
Marine Midland Grace Trust Company of New York,Bank,19991231,HSBC Bank USA,
Newark New York Savings & Loan Association,Former Savings and Loan,19241026,,
Saratoga National Bank of Saratoga Springs,Former Bank/Trust Company,19971113,Fleet Bank N.A.,5801998.0
"Mitsui Bank, LTD., The",Foreign Branches,19770527,,
Marine Midland Bank - Northern,Bank,19471001,Copenhagen National Bank,8500043.0
"Chase Manhattan Bank, The",Trust Company,19780929,Chemical Bank of Binghamton,77.0
International Germanic Trust Company,Former Bank/Trust Company,19480401,Chemical Bank and Trust Company,103011.0
Empire State Bank (1888-12/1896),Former Bank/Trust Company,18990301,Corn Exchange Bank,8000017.0
Trade Bank of New York,Former Bank/Trust Company,19390000,Trade Bank and Trust Company,
"Banco Dominico Hispano, S.A.",Foreign Representative Offices,19880414,"Banco Dominico Hispano, S.A.",
"Key Bank of Eastern New York, NA",Trust Company,19630401,National Commercial Bank and Trust Company,
"Union Savings Bank of Long Island, The",Savings Banks,19980328,North Fork Bank,170005.0
Railroad Federal Savings & Loan Association,Former Savings and Loan,19350720,Railroad Federal Savings & Loan Association,
Fidelity-International Trust Company,Bank,19800201,"Marine Midland Bank, N.A.",8500023.0
National Bank of Yorkville in New York,Former Bank/Trust Company,19760101,Marine Midland Bank (12/75-2/80),170046.0
Security Trust Company of Rochester,Former Bank/Trust Company,19840401,First Bank and Trust Company of Ithaca,8000131.0
Watertown Bank and Loan Company,Former Bank/Trust Company,18650000,National Bank and Loan Company of Watertown,
Prudential Fed Savings & Loan of West Brighton,Former Savings and Loan,19160522,Prudential Savings & Loan Association,
"Taiyo Bank, LTD.",Former Foreign Agency,19900401,"Mitsui Taiyo Kobe Bank, Ltd, The",
Transport 5th Avenue Coach Credit Union,Former Credit Union,19450404,,
Grocers Credit Union,Former Credit Union,19570321,,
"Industrial National Bank of New York, The",Former Bank/Trust Company,20041113,"JPMorgan Chase Bank, National Association",
District 1199 Credit Union,Credit Unions,19460401,Local 1199 Credit Union,
Fort Plain National Bank,Former Bank/Trust Company,19971113,Fleet Bank N.A.,5801998.0
South Bay Bank,Former Bank/Trust Company,19551101,Security National Bank of Huntington,
United States Savings Bank,Former Savings Bank,19880909,Dollar Dry Dock Bank,
First Federal Savings & Loan Assoc of Syracuse,Former Savings and Loan,19910531,"Key Bank of Western New York, N.A.",8500140.0
"University Bank, Alfred",Former Bank/Trust Company,18940000,"University Bank, Alfred",
State Trust Company of North Tonawanda,Former Bank/Trust Company,19260701,State Bank of North Tonawanda,
"Long Island Trust Company, N.A.",Former Bank/Trust Company,19701030,Bank of Westbury Trust Company,8000235.0
First Federal Savings & Loan Assoc of Syracuse,Former Savings and Loan,19870819,,
New York and London Trust Company,Trust Company,19891006,"Bank of New York, The",
"Chemical Bank, The (1823-1865)",Trust Company,20011110,Morgan Guaranty Trust Company of New York,113026.0
Jamaica Savings Bank,Former Savings Bank,19570328,Rockaway Savings Bank,8100153.0
Pierce-Arrow Finance Corporation,Investment Company (Article XII),19230917,Pierce-Arrow Finance Corporation,
Capital National Bank & Trust Company of New York,Former Bank/Trust Company,19280301,United Capitol National Bank & Trust Co of NY,
"Sullivan County Trust Company, The",Former Bank/Trust Company,19230000,"Sullivan County Trust Company, The",
R.S.F. Credit Union,Former Credit Union,19390928,R.S.F. Credit Union,
Key Bank of Central New York,Former Bank/Trust Company,19580201,National Bank and Trust Company of Skaneateles,8500124.0
Third Ward Savings & Loan Association,Former Savings and Loan,19830628,"Northfield Savings Bank, FSB",1170004.0
Penn Yan Savings Bank,Former Savings Bank,18560101,,
