Institution Name Primary,Type,Event Date,Institution Name (Secondary),Identification Number (Secondary)
President and Directors of the Manhattan Company,Former Bank/Trust Company,19220701,"First National Bank of Ozone Park, The",8500202.0
"Trust Company of New York, The",Former Bank/Trust Company,19960714,"Chase Manhattan Bank, The",
New York Municipal Bank,Bank,20050729,New York Commercial Bank,
Continental Trust Company of the City of New York,Former Bank/Trust Company,18900000,Continental Trust Company of the City of New York,
Varick Bank of New York,Former Bank/Trust Company,19800201,"Marine Midland Bank, N.A.",8500023.0
"Herkimer County Trust Company, The",Trust Company,20071130,Manufacturers and Traders Trust Company,113003.0
Dexia Credit Local,Foreign Branches,19901105,Credit Local de France - CAECL SA,
National Bank of Westchester,Former Bank/Trust Company,19840701,Chase Manhattan National Corporation,
Republic Bank For Savings,Savings Banks,18510409,Williamsburg Savings Bank,
Farmers National Bank of Adams,Former Bank/Trust Company,19800201,"Marine Midland Bank, N.A.",8500023.0
Natl Commercial Bank & Trust Company of Albany,Trust Company,19640131,Bank of Worcester,8000509.0
Commercial State Bank & Trust Company of New York,Former Bank/Trust Company,19670501,"Meadow Brook National Bank, The",8500008.0
"Goldome, FSB",Savings Banks,19330211,American Savings Bank of Buffalo,8100147.0
"Wallkill National Bank, The",Former Bank/Trust Company,19930826,Key Bank of New York,
Pacific National Bank in New York,Former Bank/Trust Company,19261211,Irving Bank and Trust Company,102015.0
First Federal Savings & Loan Assoc of Suffern,Former Savings and Loan,19600201,First Federal Savings & Loan Assoc of Suffern,
Bank of Huntington and Trust Company,Former Bank/Trust Company,19621201,Meadow Brook National Bank,8500008.0
Sixth Avenue Bank of New York,Bank,20010605,,
Commercial Investment Trust LTD.,Investment Company (Article XII),19421230,C.I.T. Financial Corporation,
"Banque et Caisse d'Epargne de l'Etat, Luxembourg",Foreign Representative Offices,20050531,,
Tully Credit Union,Former Credit Union,19350000,,
Seventh Ward Bank,Former Bank/Trust Company,18650000,Seventh Ward National Bank of New York,
Chelsea Credit Union,Former Credit Union,19341231,,
South Australian Asset Management Corporation,Foreign Agencies,19881007,State Bank of South Australia,
Morris Plan Industrial Bank of Binghamton,Former Bank/Trust Company,19440201,"Industrial Bank of Binghamton, The",
Swiss Credit Bank,Foreign Branches,19970114,Credit Suisse First Boston,
Lawyers Trust Company (12/1935-9/1950),Trust Company,19351201,Lawyers Trust Company (12/1935-9/1950),
Banco de Bilbao,Former Foreign Agency,19650730,Banco de Bilbao,
Banca Commerciale Italiana Trust Co.,Trust Company,19390203,Manufacturers Trust Company,113004.0
Jackson Heights Savings & Loan Association,Former Savings and Loan,19750701,State Savings & Loan Assoc of Jackson Heights,
Bank of New York and Fifth Avenue Bank,Former Bank/Trust Company,19890914,Bank of Long Island,8000059.0
Hamburgische Landesbank - Girozentrale,Foreign Representative Offices,20030530,Landesbank Schleswig-Holstein Girozentrale,570327.0
Northern Westchester Bank,Former Bank/Trust Company,19180000,Northern Westchester Bank,
"Northfield Savings Bank, FSB",Former Savings Bank,19380630,Northfield Savings & Loan Association,
Banca Cattolica Del Veneto,Former For Rep Office,20000508,,
Peoples Bank of Rockland County,Former Bank/Trust Company,19760101,"Bank of New York, The (9/1922-10/1989)",8000241.0
Security Trust Company of Rochester,Former Bank/Trust Company,19840401,"State Bank of Seneca Falls, N.Y.",8000215.0
Seventh National Bank of New York (1888-4/1903),Former Bank/Trust Company,19290201,Irving Trust Company,
Columbia Trust Company,Trust Company,19120605,Knickerbocker Trust Company,44.0
Banco Central Hispano - USA,Trust Company,19301126,Union Bank of Bronx County,41.0
United States Savings Bank,Former Savings Bank,19920212,Emigrant Savings Bank,205007.0
Durr Packing Employees Credit Union,Former Credit Union,19410905,Durr Packing Employees Credit Union,
Ramapo Trust Company,Former Bank/Trust Company,19700201,County National Bank,8500151.0
Fulton Savings Bank (Brooklyn),Former Savings Bank,18670419,Germania Savings Bank,
Korea Long Term Credit Bank,Foreign Branches,20000225,,
Generale Investment Banking Corporation,Investment Company (Article XII),19860806,Generale Investment Banking Corporation,
UAW Chevrolet River Road Credit Union,Credit Unions,19780717,Riverside Credit Union,
Scandinavian Trust Company,Former Bank/Trust Company,19170000,Scandinavian Trust Company,
Dexia Project & Public Finance International Bank,Foreign Branches,20000103,Dexia Project & Public Finance International Bank,
Stapleton National Bank,Former Bank/Trust Company,19590901,Chemical Bank New York Trust Company,
Niagara Savings & Loan Association of Tonawanda,Former Savings and Loan,19760401,Middleport Savings & Loan Association,8200079.0
Bank of New York and Trust Company,Former Bank/Trust Company,19380701,Bank of New York,
Banca Monte dei Paschi di Siena S.p.A.,Foreign Branches,19830204,Monte Dei Paschi di Siena,
Schroder Trust Company,Trust Company,20020331,"Industrial Bank of Japan Trust Company, The",170023.0
"University Bank, Alfred",Former Bank/Trust Company,19801101,Key Corp,1070013.0
"Saugerties National Bank and Trust Company, The",Former Bank/Trust Company,19960714,"Chase Manhattan Bank, The",
Troy Co-Operative Savings & Loan Association,Former Savings and Loan,18971025,Troy Co-Operative Savings & Loan association,
Pacific Trust Company,Trust Company,19270000,Pacific Trust Company,
Manufacturers-Citizens Trust Co.,Trust Company,19851231,"Manufacturers Hanover, National Association",140.0
"LeRoy National Bank, The",Former Bank/Trust Company,19840401,Security Trust Company of Rochester,8000254.0
New York Exchange Bank in the City of New York,Trust Company,19891006,"Bank of New York, The",
Nassau Trust Company,Former Bank/Trust Company,19870918,Norstar Bank,
"Community Savings Bank of Rochester, The",Savings Banks,19830630,Rochester Savings Bank,207.0
Springfield Gardens National Bank of New York,Former Bank/Trust Company,19561001,Queens National Bank of New York,
Cornwall National Bank,Former Bank/Trust Company,19110000,Cornwall National Bank,
Madison State Bank,Former Bank/Trust Company,19230000,Madison State Bank,
"UniCredit Banca di Roma, S.p.A.",Foreign Branches,20081105,,
Nordic Banking Corporation,Investment Company (Article XII),19920630,,
"Citizens Trust Company of Patchogue, The",Former Bank/Trust Company,19810901,Forty Seven West Main Street Bank,8000183.0
Security Trust Company of Rochester,Former Bank/Trust Company,19701030,"Cohocton State Bank, The",8000084.0
Bank of Yorktown,Former Bank/Trust Company,19990329,HSBC Bank USA,
Western National Bank of the City of New York,Former Bank/Trust Company,18970000,United States National Bank of the City of N.Y.,8500182.0
Clymer State Bank,Former Bank/Trust Company,19920616,Key Bank of New York (6/92-8/93),
South Brooklyn Savings Bank,Savings Banks,19750602,Independence Savings Bank,
Dollar Savings Bank of New York,Savings Banks,19860724,Dollar Dry Dock Savings Bank,
Municipal Bank,Former Bank/Trust Company,19241201,"West End Bank of Brooklyn, The",8000443.0
Home Building & Loan Assoc of Mount Vernon,Former Savings and Loan,19410000,Mount Vernon Savings & Loan Association,
Citizens National Bank of Wellsville,Former Bank/Trust Company,19691201,Olean Trust Company,8000186.0
"Bankers Trust Company of Albany, N.A.",Trust Company,19260000,First Trust Company of Albany,
Lafayette National Bank of Brooklyn in New York,Former Bank/Trust Company,19991231,HSBC Bank USA,
East Brooklyn Savings Bank,Former Savings Bank,19801231,Spring Valley Savings & Loan Association,8200030.0
Tompkins County Trust Company,Trust Company,19350528,Tompkins County National Bank,152.0
Silver Creek Co-Operative Savings & Loan Assoc.,Former Savings and Loan,19590515,Jamestown Savings and Loan Association,174.0
"Banco Bilbao Vizcaya Argentaria, S.A.",Foreign Branches,19881001,"Banco Bilbao Vizcaya, S.A.",
Independent Credit Union,Credit Unions,19880718,Parchester Federal Credit Union,4.0
Banco Popular de Puerto Rico,Trust Company,19460911,Banco de Ponce,
"Home Savings Bank, Brooklyn",Savings Banks,20050222,North Fork Bank,170005.0
Norstar Bank,Trust Company,19870309,Norstar Bank of Long Island,
Exchange Bank,Former Bank/Trust Company,19820901,Liberty National Bank,
"Key Bank of New York, N.A.",Trust Company,19891101,"Key Bank of Eastern New York, N.A.",
New Rochelle Trust Company,Former Bank/Trust Company,19521101,Huguenot Trust Company of New Rochelle,8000170.0
Elmira Bank & Trust Company,Bank,18530000,Elmira Bank,
Armour Jamaica Credit Union,Former Credit Union,19631216,,
Yorkville Bank,Bank,20041113,"JPMorgan Chase Bank, National Association",
Empire State Savings Bank,Former Savings Bank,19020101,,
Home Savings Bank of the City of Albany,Savings Banks,19710101,Home Savings Bank of Upstate New York,
Chemical National Bank of New York,Trust Company,19480401,Continental Bank & Trust Company of New York,8000016.0
Emerson National Bank of Warrensburgh,Former Bank/Trust Company,19880624,Norstar Bank of Upstate NY,
Progress Brotherhood Credit Union,Former Credit Union,19260125,Progress Brotherhood Credit Union,
New York Community Bank,Savings Banks,20010731,Richmond County Savings Bank,218002.0
Shoe and Leather Bank of the City of New York,Former Bank/Trust Company,20041113,"JPMorgan Chase Bank, National Association",
First New York Bank For Business,Bank,19890424,First New York Bank For Business,
Tompkins County National Bank of Ithaca,Trust Company,19350528,Ithaca Trust Company,120003.0
North Fork Bank,Trust Company,18580407,Southold Savings Bank,
Highland-Quassaick Nat Bnk & Trust Co of Newburgh,Former Bank/Trust Company,19920608,Fleet Bank of New York,
American Exchange-Pacific National Bank,Bank,19250801,Pacific National Bank in New York,8500193.0
National Broadway Bank of New York,Former Bank/Trust Company,19230207,Columbia Trust Company,102015.0
"Mitsui Bank, LTD., The",Foreign Branches,19560822,"Mitsui Bank, Ltd., The",
East New York Savings & Loan Association,Former Savings and Loan,18920920,East New York Savings & Loan Association,
"Brown Brothers Harriman Trust Company, LLC",Limited Purpose Trust Company,20000406,"Brown Brothers Harriman Trust Company, LLC",
Franklin National Bank,Bank,19741008,European-American Bank & Trust Company,105007.0
Corn Exchange Bank Trust Company,Former Bank/Trust Company,19140101,Washington Trust Company of the City of New York,8000353.0
First National Bank of Ithaca,Former Bank/Trust Company,19851201,Norstar Bank (Rochester),
Matteawan Savings Bank of Beacon,Former Savings Bank,19350410,Mechanics Savings Bank of Beacon,8100061.0
HSI Bank,Bank,19860318,HSI Bank,
First National Bank of Allegany,Former Bank/Trust Company,19621201,First National Bank of Olean,140.0
Elmira Savings & Loan FA,Savings & Loans,19230000,Elmira Savings & Loan Association,
"American Savings Bank, FSB",Savings Banks,19820924,United Mutual Savings Bank,270014.0
Dollar Savings Bank of New York,Savings Banks,19920221,Emigrant Savings Bank,205007.0
Commercial Trust Company (1884-1900),Trust Company,19920612,Riverhead Savings Bank,218005.0
Bank of Attica,Former Bank/Trust Company,19650901,Marine Midland Trust Company of Western New York,
"Industrial Bank of Binghamton, The",Former Bank/Trust Company,19841001,First American Bank of New York,106043.0
First Federal Savings & Loan Assoc of Kenmore,Former Savings and Loan,19350912,First Federal Savings & Loan Assoc of Kenmore,
European American Bank,Trust Company,19741008,Franklin National Bank,5800002.0
East Hampton National Bank,Former Bank/Trust Company,19891006,Irving Trust Company,102015.0
"Hyakujushi Bank, Ltd.",Foreign Representative Offices,19860405,"Hyakujushi Bank, Ltd., The",
Bankers Trust of Binghamton,Former Bank/Trust Company,19710301,Bankers Trust of Binghamton,
"Fordham National Bank in New York, The",Former Bank/Trust Company,19550301,"Chase Manhattan Bank, The (1799-9/1965)",
Grace National Bank of New York,Former Bank/Trust Company,19800201,"Marine Midland Bank, N.A.",8500023.0
Standard Chartered Bank PLC,Foreign Branches,19850101,Standard Chartered Bank,
Market National Bank of New York,Former Bank/Trust Company,19891006,"Bank of New York, The",
"Citibank (Suffolk), N.A.",Former Bank/Trust Company,19760101,"Citibank, N.A.",4400000.0
Farmers National Bank of Adams,Former Bank/Trust Company,20040630,HSBC Bank USA,
Port Morris Credit Union,Former Credit Union,19470819,,
Valley Bank of New York,Former Bank/Trust Company,19891006,"Bank of New York, The",
Dold Employees Credit Union of Buffalo,Former Credit Union,19451123,,
Central Bank of Kenmore,Former Bank/Trust Company,19760101,"Bank of New York, The (9/1922-10/1989)",8000241.0
Commercial National Bank of New York (1924),Former Bank/Trust Company,19240501,East River National Bank of the City of New York,8500215.0
"Union Savings Bank of Long Island, The",Savings Banks,19660902,"Union Savings Bank of Long Island, The",
Genesee Federal Savings & Loan Association,Former Savings and Loan,19830926,"Goldome, FSB",
Walden Savings Bank,Savings Banks,20070401,Walden Federal Savings Bank,
Progressive Slutzker Credit Union,Former Credit Union,19380807,Progressive Slutzker Credit Union,
National Commercial Bank & Trust Company,Trust Company,19471201,Rensselaer County Bank and Trust Company,8000194.0
"Komercni Banka, A.S. Prague, Czech Republic",Foreign Representative Offices,19990811,,
Richmond County Building & Mutual Loan Assoc,Savings & Loans,19831210,Richmond County Savings & Loan Association,
Irving Bank-Columbia Trust Co.,Trust Company,20040623,J.P. Morgan Trust Company of New York,5100006.0
"Chartered Bank, The",Former Foreign Agency,19820928,Standard Chartered Bank PLC,
Schenectady Savings & Loan Association,Savings Banks,19380000,Schenectady Savings & Loan Association,
"Germania Building, Saving & Loan Institution",Former Savings and Loan,19730630,Atlantic Liberty Savings & Loan Association,
Westchester Federal Savings Bank,Former Savings and Loan,19990329,HSBC Bank USA,
Mount Morris Bank,Former Bank/Trust Company,19960714,"Chase Manhattan Bank, The",
"Central Bank of Rochester, The",Trust Company,19810901,Citizens Central Bank,72.0
Citizens Bank of Arcade,Bank,19710716,,
Home Savings Bank of Upstate New York,Savings Banks,19710701,Permanent Savings & Loan (Hoosock Falls),8200095.0
"Saudi European Bank, S.A.",Foreign Agencies,19900716,Societe de Banque Privee,
Center Moriches Bank,Former Bank/Trust Company,19020000,Center Moriches Bank,
Albany Savings Bank,Former Savings Bank,19741031,First Savings & Loan Association of Troy,8200049.0
Albany County Savings Bank,Savings Banks,19910930,Trustco Bank New York,120009.0
Commercial National Bank of Long Island City,Former Bank/Trust Company,19200401,Irving National Bank,45.0
Chemical Bank of Binghamton,Bank,20041113,"JPMorgan Chase Bank, National Association",
Midland Bank plc,Foreign Branches,19990329,HSBC Bank plc,
Bank of Gouverneur,Former Bank/Trust Company,19720317,St. Lawrence County National Bank,8500032.0
Ogdensburg Trust Company,Former Bank/Trust Company,19850301,Norstar Bank of Upstate NY (8/84-6/88),8000267.0
Niagara County National Bank and Trust Company,Former Bank/Trust Company,19800201,"Marine Midland Bank, N.A.",8500023.0
"Massena Banking and Trust Company, The",Former Bank/Trust Company,19880101,"Key Bank of Central N.Y., N.A.",8500171.0
Natl Bank of Niagara & Trust Co of Niagara Falls,Former Bank/Trust Company,19290830,Niagara Falls Trust Company,8000460.0
Food Dealers Credit Union,Former Credit Union,19200116,Food Dealers Credit Union,
First National Bank and Trust Co of Ellenville,Former Bank/Trust Company,19880624,Norstar Bank of Upstate NY,
Mercantile National Bank of the City of New York,Former Bank/Trust Company,19230207,Columbia Trust Company,102015.0
First National Bank of East Islip,Former Bank/Trust Company,19841203,Norstar Bank of Long Island (8/83-3/87),8000262.0
"Security Bank of New York, The",Former Bank/Trust Company,19610908,Manufacturers Hanover Trust Company,
Metropolitan Commercial Bank,Bank,20131231,Metropolitan Commercial Bank,
Bank For Savings in the City of New York,Former Savings Bank,19870819,Goldome,
New Commercial Bank of New York,Bank,19880624,Commercial Bank of New York,
Longacre Bank,Former Bank/Trust Company,19280301,United Capitol National Bank & Trust Co of NY,
"Fleet Bank of New York, N.A.",Trust Company,19180401,Liberty Bank of Buffalo,
People's Credit Union,Former Credit Union,19300103,People's Credit Union,
Banco de Credito S.A.,Foreign Representative Offices,20000421,,
Italian American Trust Company,Former Bank/Trust Company,19200401,Irving National Bank,45.0
Dobbs Ferry Bank,Former Bank/Trust Company,19551001,"County Trust Company, The",8000239.0
Bowery and East River National Bank of New York,Former Bank/Trust Company,19311101,National City Bank of New York,4400000.0
Seventh Ward Bank,Former Bank/Trust Company,18330000,Seventh Ward Bank,
Lockport Savings & Loan Association,Former Savings and Loan,19661230,Niagara Permanent Savings & Loan Association,8300257.0
Unibanco-Uniao de Bancos Brasileiros S.A.,Foreign Representative Offices,19990120,,
"Marine Midland Bank of Southeastern N.Y., N.A.",Former Bank/Trust Company,19800201,"Marine Midland Bank, N.A.",8500023.0
Standard National Bank of the City of New York,Former Bank/Trust Company,18950000,Standard National Bank of the City of New York,
Model Savings and Loan Association,Savings & Loans,19460515,East Brooklyn Savings and Loan Association,316001.0
Nyack Building Co-Operative Savings & Loan Assoc,Former Savings and Loan,19910531,"Key Bank of Western New York, N.A.",8500140.0
Richmond Hill Savings Bank,Savings Banks,19961231,North Fork Bank,170005.0
Banque de L'Indochine et de Suez,Foreign Branches,19820831,Banque Indosuez,
"Importers & Traders Bank, The",Former Bank/Trust Company,19550301,President and Directors of the Manhattan Company,8000257.0
First National Bank of Allegany,Former Bank/Trust Company,19920619,Chemical Bank,103011.0
Bank of Genesee,Trust Company,19281301,Genesee Trust Company,
Nassau Trust Company,Former Bank/Trust Company,18920000,Glen Cove Bank of Glen Cove,
Metropolitan Bank (4/1906-9/1921),Former Bank/Trust Company,18650000,National Shoe & Leather Bank of the City of NY,
Hanover Bank (1851-1865),Former Bank/Trust Company,19290501,Central Union Trust Company of New York,137.0
Brooklyn Navy Yard Employees Credit Union,Former Credit Union,19651130,,
Security Trust Company,Former Bank/Trust Company,19560201,"State Bank of Shortsville, The",8000216.0
Banca Popolare di Vicenza S.C.p.A.,Foreign Representative Offices,20111011,Banca Popolare di Vicenza S.C.p.A.,
"Colonial Trust Company, The (1896-4/1907)",Former Bank/Trust Company,19070401,Trust Company of America (5/1905-2/1912),8000299.0
City Savings Bank of Albany,Savings Banks,19220101,City Savings Bank of Albany,
Merchants Exchange Bank in the City of New York,Former Bank/Trust Company,19311101,National City Bank of New York,4400000.0
Deutsche Verkhersbank,Foreign Representative Offices,19990805,Deutsche Verkhersbank,
2939 Niagara Street Credit Union,Credit Unions,19420414,UAW Chevrolet River Road Credit Union,
Oneida County Trust Company,Former Bank/Trust Company,19160000,Oneida County Trust Company,
Atlantic National Bank of the City of New York,Former Bank/Trust Company,19760000,"Citibank, N.A.",
Bank of Manhattan Trust Company,Former Bank/Trust Company,19550301,"Chase Manhattan Bank, The (1799-9/1965)",
Local 1199 Credit Union,Credit Unions,19460401,Local 1199 Credit Union,
Guardian National Bank,Former Bank/Trust Company,19501013,Manufacturers Trust Company,113004.0
Williamsburg Savings Bank,Savings Banks,19991231,Republic Bank of New York,
C.I.T. Financial Corporation,Investment Company (Article XII),19230917,Pierce-Arrow Finance Corporation,
Madison County Trust Company,Former Bank/Trust Company,19130000,Madison County Trust and Deposit Company,
Polish Co-Operative Savings & Loan Assocaiation,Former Savings and Loan,19090329,Polish Co-Operative Savings & Loan Assocaiation,
Irving Bank of New York,Trust Company,19070201,Irving National Bank of New York,8500175.0
Norstar Bank of Upstate NY,Trust Company,19971113,Fleet Bank N.A.,5801998.0
Security Savings Bank (New York City),Former Savings Bank,18760101,,
Parchester Federal Credit Union,Credit Unions,19880718,Independent Credit Union,460903.0
Manhattan Savings Bank (5/42-5/90),Savings Banks,19991231,HSBC Bank USA,
Home Savings & Loan Association,Former Savings and Loan,19810301,Columbia Banking FS & LA,
Portigon AG,Foreign Branches,20020923,WestLB AG,
Citizens Trust Company of Adams,Former Bank/Trust Company,20040630,HSBC Bank USA,
Chemical Bank and Trust Company,Trust Company,19590901,Chemical Bank New York Trust Company,
Deutsche Bank Trust Company Americas,Trust Company,19761029,Bankers Trust of Suffolk National Organization,66.0
Seaside Bank,Former Bank/Trust Company,19891006,Irving Trust Company,102015.0
"Bank of Hiroshima, LTD., The",Foreign Representative Offices,19880801,"Hiroshima Bank, Ltd., The",
Banca Intesa Banca Commerciale Italiana S.p.A.,Foreign Branches,20010501,Banca Intesa Banca Commerciale Italiana S.p.A.,
Excelsior Savings Bank,Savings Banks,19810424,American Savings Bank,
Bank of Tokyo - Mitsubishi UFJ Trust Company,Trust Company,20120426,"Union Bank of California, N.A.",7200004.0
Marine Midland Tinker National Bank,Former Bank/Trust Company,19760101,Marine Midland Bank (12/75-2/80),170046.0
Empire National Bank,Former Bank/Trust Company,19640101,County National Bank,
"New York Bank For Savings, The",Savings Banks,19781202,First Chartered Savings & Loan Association,8200044.0
Marine Midland Bank - Southern,Bank,19531001,Marine Midland Bank Trust Company of Southern NY,
Matinecock Bank,Former Bank/Trust Company,19690801,Hempstead Bank,8000262.0
Continental Bank New York Trust Company,Limited Purpose Trust Company,19921008,Continental Bank New York Trust Company,
Wyoming County Bank and Trust Company,Trust Company,20051203,Five Star Bank,119001.0
Jamestown Savings and Loan Association,Savings Banks,19590515,Silver Creek Savings & Loan Association,8200150.0
Jeff Bank,Bank,20121221,Jeff Bank,
Bronx County Trust Company,Former Bank/Trust Company,19550301,President and Directors of the Manhattan Company,8000257.0
Garfield National Bank of the City of New York,Former Bank/Trust Company,19960714,"Chase Manhattan Bank, The",
Compagnie Financiere de CIC et l'Union Europeenne,Foreign Branches,19920603,Compagnie Financiere de Credit Industriel & Commer.,570056.0
Chemical Corn Exchange Bank,Trust Company,19640201,First National Bank of Mount Vernon,8500095.0
Columbia Building & Loan Association,Former Savings and Loan,19731231,Security Building Savings & Loan Association,8200105.0
"First Data Financial Holdings, L.L.C.",Investment Company (Article XII),20060928,"Western Union Financial Holdings, L.L.C.",
Chautauqua National Bank & Trust Co. of Jamestown,Former Bank/Trust Company,19991231,Republic Bank of New York,170040.0
Bankers Trust Company of Rochester,Former Bank/Trust Company,19830401,Key Bank,
Shell Eastern Head Office Credit Union,Former Credit Union,19650316,,
Building & Loan Association of Catskill,Savings Banks,19740514,,
DePfa Bank AG,Foreign Representative Offices,20080314,,
Fillmore Savings & Loan Association,Former Savings and Loan,19910531,Manufacturers and Traders Trust Company,113003.0
Unitas Bank Ltd.,Foreign Branches,19920908,,
Ithaca Savings Bank,Savings Banks,19801230,"Citizens Savings Bank, F.S.B.",
Nederlandsche Middenstandsbank N.V.,Foreign Branches,19780908,Nederlandsche Middenstandsbank N.v.,
"Washington Bank, The",Former Bank/Trust Company,19891006,"Bank of New York, The",
Bronx Borough Bank,Former Bank/Trust Company,19280501,"Bronx Bank of the City of New York, The",8000403.0
"Argentaria, Caja Postal y Banco Hipotecario, S.A.",Foreign Branches,19950612,"Banco Exterior de Espana, S.A.",
District Bank Limited,Foreign Branches,19700101,District Bank Limited,
Fidelity-International Trust Company,Bank,19931231,Marine Midland Bank,5800183.0
BIL Trust Company of New York,Trust Company,19891006,Bank In Liechtenstein Trust Company,
Security Norstar Bank,Former Bank/Trust Company,19840401,"Genesee Country Bank, The",8000142.0
Capital National Bank & Trust Company of New York,Former Bank/Trust Company,19220000,Capital National Bank & Trust Company of New York,
"Marine Midland Bank of Southeastern N.Y., N.A.",Former Bank/Trust Company,19991231,Republic Bank of New York,170040.0
Commercial National Bank of Long Island City,Former Bank/Trust Company,19290201,Irving Trust Company,
Equity Federal Savings & Loan Assoc of Rochester,Former Savings and Loan,19350321,Equity Federal Savings & Loan Assoc. of Rochester,
"City Bank of Syracuse, The",Former Bank/Trust Company,19790330,Key Bank of Central New York,
Citibank N.A.,Trust Company,18970501,Third National Bank of the City of New York,8500228.0
National Copper Bank of New York,Former Bank/Trust Company,19100201,Mechanics National Bank of the City of New York,8000320.0
Security Trust Company of Rochester,Former Bank/Trust Company,19920101,"Fleet Bank of New York, N.A.",
First Trust Company of Allegany County,Former Bank/Trust Company,19580401,"Union National Bank of Friendship, The",8500061.0
"Nippon Fudosan Bank, Limited, The",Foreign Representative Offices,20020930,,
"Luzerne-Hadley Bank, The",Former Bank/Trust Company,19880624,Norstar Bank of Callicoon,114025.0
"First Trust Company of Albany, N.A.",Trust Company,19260000,First Trust Company of Albany,
American Bank & Trust Company,Trust Company,19760915,Bank Leumi Trust Company of New York,170011.0
