Grant Year,Grantee,City,County,Phone,Program,Category,Project Title,Grant Amount
2013,"City Lore, Inc.",New York,New York,212-529-1955,Individual Artists,Film & Media / New Tech Prod.,Kewulay Kamara - In Search of Finah Misa Kule,24300
2006,Weekend of Chamber Music ,New York,New York,917-826-8244,Music,Professional Performances," Spring, Summer, Fall Concerts",8000
2015,"The Studio Museum in Harlem, Inc.",New York,New York,212-864-4500,Museum,General Support,General Operating Support,51000
2004,Sweet Jane Productions Inc.  ,Brooklyn,Brooklyn,773-547-8530,Theatre,Professional Performances,Death of Nations: Part 1-4,6000
2017,"Visual Studies Workshop, Inc.",Rochester,Monroe,585-442-8676,Electronic Media & Film,Exhibitions & Installations,Afterimage Online,15000
2009,Trustees of Union College,Schenectady,Schenectady,518-388-6984,Presenting,Presentation,Union College Concert Series - 14-16 performances,7900
2003,Russian American Cultural Center,New York,New York,646-831-0554,Visual Arts,EXHIBITIONS AND INSTALLATIONS,The Artists Career Development Program,2500
2014,Pawling Concert Series Inc,Pawling,Dutchess,845-855-3100,Presenting - Multi & Interdisciplinary Arts,Project Support - Presentation,Pawling Concert Series,3500
2008,Ethel's Foundation for the Arts,New York,New York,914-841-7405,Individual Artists,Composer Commissions,Phil Kline - SPACE,10000
2006,The Jazz Gallery,New York,New York,212-861-5617,Presenting,Presentation,Artists Fees & Expenses- Minimum 20 Jazz Concerts,10300
2015,Genesee Valley Council on the Arts,Mount Morris,Livingston,585-243-6785,State & Local Partnership,Regrants,"DEC Arts Regrants: Livingston ($13,700 Admin/$31,800)",45500
2019,JOSEPHINE HERRICK PROJECT,New York,New York,212-213-4946,Special Arts Services,Project Support,Photography Programming for At-risk Youth,8214
2006,Cider Mill Playhouse Inc,Endicott,Broome,607-748-7363,Theatre,General Operating Support,General Operating Expenses,9000
2005,Community Arts Network of Oneonta ,Oneonta,Otsego,781-883-4338,Folk Arts,Presentation,Folk Arts of the Upper Catskills,7800
2013,Voices UnBroken,Bronx,Bronx,347-759-3932,Literature,General Support,Voices UnBroken Programming,10000
2019,"Graycliff Conservancy, Inc.",Derby,Erie,716-947-9217,Architecture + Design,General Support,General Operating Support,17000
2020,"iLAND, Inc.",New York,New York,212-375-8283,Dance,Professional Performances,Choreographies of Disaster,5000
2011,New York Theatre Experience Inc.,New York,New York,917-375-5518,Literature,Book Publication,Book Publication Plus Online Enhancements,2571
2011,Openhousenewyork inc.,New York,New York,212-991-6470,Architecture Planning & Design,Institutional Development,Executive Director Salary,6626
2005,Seaport Museum New York,New York,New York,212-748-8766,Arts In Education,Project-based Implementation,Discover Your City's History,5000
2011,Something Special Big Band,Plainview,Nassau,516-681-1789,Music,Professional Performances,Concert Series,4154
2014,"The Hotel Savant Theatre Company, Inc.",New York,New York,646-221-4021,Theatre,Professional Performances,Funeral Games,3000
2004,"Mirror Theatre, Ltd.",New York,New York,646-688-4365,Individual Artists,Commissions,Ihsan Abdul Rahim - MRC Theatre Commission/ Ihsan Bracy's IBO LANDING ,5000
2018,New Museum of Contemporary Art,New York,New York,212-219-1222,Museum,General Support,General Operating Support,35400
2004,Ballet Hispanico of New York Inc,New York,New York,212-362-6710,Arts In Education,S-W Impr Sustain/Dissem: Yr 2,Ballet Hispanico PS 166 Schoolwide Residency,13000
2017,"The Diller-Quaile School of Music, Inc.",New York,New York,212-369-1484,Music,Community Music Schools,Diller-Quaile Outreach Programs,7500
2008,"The Negro Ensemble Company, Inc.",New York,New York,212-582-5860,Theatre,Professional Performances,Theatre Professional Performances,7500
2017,"The Vangeline Theater, Inc.",Brooklyn,New York,917-749-9062,Special Arts Services,Instruction and Training,The Dream a Dream Project,5000
2007,Historical Society of Saratoga Springs,Saratoga Springs,Saratoga,518-584-6920,Museum,General Operating Support,General Operating Expenses,7875
2016,"Camera News, Inc.",New York,New York,212-947-9277,Individual Artists,Film & Media / New Tech Prod.,Stephanie Ching - After Spring ,25000
2018,"Pick Up Performance Co., Inc.",New York,New York,917-653-2116,Dance,General Support,David Gordon Archiveography,25000
2006,"Smith Center for the Arts, Inc.",Geneva,Ontario,315-781-5483,Presenting,Presentation,Minimum 17 performances of 12 events -  2005/06 Performing Arts Season,18500
2018,"Rhinebeck Writers Retreat, Inc.",Staatsburg,Dutchess,917-881-8438,Theatre,Services to the Field,Musical theatre writers' residencies,5000
2017,"The Phoenix Concerts, Inc.",Rhinebeck,New York,347-684-1641,Music,Project Support,The Phoenix Concerts ,3000
2003,Mid Island Y Jewish Comm Cntr,Plainview,Nassau,516-822-3535,Literature,PUBLIC PROGRAMS,Artistic Fees and Promotion for Poetry Reading Series,3000
2007,Smithsonian Institution,New York,New York,212-849-8311,Architecture Planning & Design,Exhibitions,Design for the Other 90%: The Relentless Design of,15000
2005,"City Lore, Inc.",New York,New York,212-529-1955,Individual Artists,Film & Media / New Tech Prod.,Jonathan Fein - Objects and Memory,10300
2010,"bright hill press, inc.",Treadwell,Delaware,607-829-5055,Literature,Services to the Field,New York State Literary Web Site,13500
2003,New York Foundation for the Arts,BROOKLYN,Brooklyn,212-366-6900,Individual Artists,COMMISSIONS,Mirra & Brockman^Richard Bank - 5 O'clock,4000
2015,Roberson Museum and Science Center,Binghamton,Broome,607-772-0660,Museum,General Support,General Operating Support,17000
2003,Chinese American Arts Council,New York,New York,212-431-9740,Folk Arts,PRESENTATION,2 Presentations Of Traditional Chinese Theater,6900
2009,American Chamber Ensemble,Farmingdale,Nassau,516-586-3433,Music,Professional Performances,American Chamber Ensemble Concert Series,8300
2003,Writers & Books Inc,Rochester,Monroe,585-473-2590,Literature,SPECIAL PROJECTS,WORDPLAY  A Festival for Young Readers,1500
2006,"Franklin Furnace Archive, Inc.",Brooklyn,Brooklyn,718-687-5800,Arts In Education,ESP Project-based Impl,"Sequential Art for Kids with PS 52, Sheepshead Bay, Brooklyn",4000
2008,Independent Feature Project,Brooklyn,Brooklyn,212-465-8200,Individual Artists,Film & Media / New Tech Prod.,Paul Devlin - Blast,25000
2009,Museum of the City of New York,New York,New York,917-492-3325,Museum,General Operating Support,General Operating Expenses,60000
2012,Maysles Institute,New York,New York,212-582-6843,Arts Education,Community-Based Learning,"""On Our Side"" Youth Documentary Education Program",4600
2005,Center for Exploratory & Perceptual Arts,Buffalo,Erie,716-856-2717,Electronic Media & Film,Exhibition,Public Art Installation Series,5000
2003,"King Manor Association of L.I., Inc.",Jamaica,Queens,718-206-0545,Museum,MUSEUM EDUC & INTERPRETATION,Long Range Interpretive Plan  **RECONSIDERATION**,2500
2017,"Catskill Mountain Foundation, Inc.",Hunter,Greene,518-263-2066,Arts Education,K-12: In-School Programs,CMF 2017 Summer Performing Arts Program,8000
2018,"Harvestworks, Inc.",New York,New York,212-431-1130,Electronic Media & Film,Exhibitions & Installations,Art and Technology Exhibitions at Harvestworks,10000
2009,The Skaneateles Festival. Inc.,Skaneateles,Onondaga,315-685-7418,Music,General Operating Support,General Operating Expenses,13200
2012,Lower East Side Tenement Museum,New York,New York,646-518-3008,Museum,General Oper Support,General Operating Expenses,37530
2009,Cattaraugus County Arts Council,Olean,Cattaraugus,716-372-7455,State & Local Partnership,Regrants,"DEC regrants for Cattaraugus & Allegany Counties. Regrant: $39,400.  Administration: $15,600.",52000
2003,Education Through Music Inc.,New York,New York,212-972-4788,Arts In Education,GENERAL OPERATING SUPPORT,General Operating Expenses,13500
2003,The New School,New York,New York,212-229-8947,Music,PROFESSIONAL PERFORMANCES,Jazz at 6:30,5000
2015,"DIEU DONNE PAPERMILL, INC.",Brooklyn,New York,212-226-0573,Visual Arts,General Support,Dieu DonnÃ© Residency and Exhibition Programs,40000
2013,"Visual AIDS for the Arts, Inc.",New York,New York,212-627-9855,Visual Arts,Services to the Field,"Broadsides, artist editions for HIV/AIDS awareness",7520
2005,"Rattapallax, Incorporated",New York,New York,646-416-4702,Literature,Literary Magazine Publication,Rattapallax Magazine,1700
2004,Central NY Community Arts Council,Utica,Oneida,315-724-1113,Arts In Education,Services to the Field,Participatory Action Research,20000
2004,Society for Pres Weeksville Hist,Brooklyn,Brooklyn,718-756-5250,Arts In Education,Project-based Planning,The Weeksville School Partnership Pilot Program,3000
2010,"The Mud/Bone Collective, Inc.",Brooklyn,Brooklyn,646-283-4288,Theatre,General Operating Support,General Operating Expenses,10200
2011,Banjo Burke Memorial Fund,Greenwood,Steuben,607-225-9928,Folk Arts,Presentation,Banjo Burke Festival,7418
2013,"St. Luke's Chamber Ensemble, Inc.",New York,New York,212-594-6100,Music,General Support,General Operating Expenses,33770
2018,Trustees of Hamilton College,Clinton,Oneida,315-859-4678,Presenting,Project Support - Presentation,Hamilton College Performing Arts Series,10000
2010,Association of Hispanic Arts,New York,New York,212-976-1242,State & Local Partnership,Services to the Field,AHA Learning Center,10000
2011,"International Film Seminars, Inc",Brooklyn,New York,212-448-0457,Electronic Media & Film,General Operating Support,General Operating Expenses,18692
2010,Rejoicensemble Inc,Brooklyn,Brooklyn,646-354-8216,Individual Artists,Composer Commissions,M. Roger Holland - The M. Roger Holland Commission,6000
2017,Greenwich House Inc.,New York,New York,212-991-0003,Music,Community Music Schools,Greenwich House Community Music School,7500
2008,"The Rajkumari Cultural Center, Inc.",Richmond Hill,Queens,646-240-9917,Folk Arts,Presentation,Kitchrie Annual Festival ,10000
2019,Greater Hudson Heritage Network,Elmsford,Westchester,914-592-6726,Museum,General Support,General Operating Support,41000
2013,"Prospect Theater Company, Inc.",New York,New York,646-286-7564,Theatre,Professional Performances,Mainstage Theatre Season,7520
2019,THE EYEBEAM ATELIER,Brooklyn,Brooklyn,347-378-9163,Individual Artists,Film & Media / New Tech Prod.,Winslow Porter - Breathe: Cinematic Virtual Reality Experience,25000
2013,Crown Heights Jewish Community Council Inc,Brooklyn,Brooklyn,718-774-9149,Special Arts Services,Exhibitions,Seven Exhibitions,4750
2018,"Church Street School for Music and Art, Inc.",New York,New York,212-571-7290,Music,Community Music Schools,Music and Art Programs,6000
2010,"DISCALCED, INC",Brooklyn,Brooklyn,718-624-8400,Dance,General Operating Support,General Operating Expenses,56000
2014,"National Black Theatre Workshop, Inc.",New York,New York,212-926-1049,Special Arts Services,Professional Performances,NBT Performances,27000
2016,Women Make Movies,New York,New York,212-925-0606,Individual Artists,Film & Media / New Tech Prod.,Margaret Maisie Crow - Saving Jackson,25000
2019,"The Collapsable Giraffe, Inc.",New York,New York,917-374-7079,Theatre,Professional Performances,New Performance Works,5000
2019,"Universal Temple of the Arts, Inc.",Staten Island,Staten Isl,718-273-5610,Arts Education,Community-Based Learning,UTA's Community Arts Workshops,7000
2006,"Multicultural Music Group, Inc.",Bronx,Bronx,646-314-6024,Arts In Education,General Program Support,General Program Support,14100
2008,Forest Park Trust,Woodhaven,Queens,718-235-0815,Folk Arts,Presentation,Engaging Community through Folk Arts in Highland Park,5000
2003,"Smack Mellon Studios, Inc.",Brooklyn,Brooklyn,718-834-8761,Individual Artists,FILM & MEDIA / NEW TECH PROD.,Mellissa Dubbin & Aaron Davidson - Retrospective Lie Detector (Harmonica Bug),3500
2007,"ArtPeace, Inc.",Rochester,Monroe,585-530-2060,Arts In Education,ESP School-Wide Arts Impl,"Interdisciplinary arts integration in Watkins Glen CSD, k-12 grades-year #1",20000
2019,Center for Contemporary Opera,New York,New York,646-481-8110,Music,General Support,Season Productions,10000
2016,White Pine Inc,Buffalo,Erie,716-573-8202,Literature,Book & Literary Mag Pubs,World of Voices,16000
2011,"Coming Together Festival of Dance and Music, Inc.",New Paltz,Ulster,845-256-9300,Arts Education,K-12: Implementation,Building  Community through Dance,16615
2008,Frederick Douglass Creative Arts,New York,New York,212-864-3375,Electronic Media & Film,General Program Support,FDCAC Screen Writing Workshops,11600
2015,Genesee Country Museum,Mumford,Monroe,585-294-8252,Folk Arts,Project Support - Presentation,Old Time Fiddlers' Fair,6000
2005,Community Arts Partnership of Tompkins County,Ithaca,Tompkins,607-273-5072,State & Local Partnership,General Operating Support,General Operating Expenses,23400
2005,Delaware Co Historical Assn,Delhi,Delaware,607-746-3849,Museum,Museum Educ & Interpretation,History Lecture Series,5000
2016,Storyville Center for the Spoken Word,New York,New York,646-762-2618,Arts Education,Community-Based Learning,The Moth Community Program ,8500
2010,New York Shakespeare Festival,New York,New York,212-539-8742,Theatre,General Operating Support,General Operating Expenses,98000
2018,Young Men's and Young Women's Hebrew Association,New York,New York,212-699-7240,Dance,Rehearsal Space & Residencies,92Y Harkness Dance Center Rehearsal Space Subsidy,10000
2015,Ballet Artists of WNY Inc,Buffalo,Erie,716-447-0401,Dance,Professional Performances,Dancers' Salaries; 2015 NY Performance Season,5000
2014,The Arts Connection Inc.,New York,New York,212-302-7433,Theatre,Services to the Field,$5 Tickets to Theatre Events for Teens,8240
2016,American Museum of Natural History,New York,New York,212-769-3550,Facilities,Capital Equipment (Facilities),Akeley Gallery Energy Efficient Lighting Upgrades,49500
2010,"Collaborative Arts Project 21, Inc.",New York,New York,212-807-0202,Theatre,Professional Performances,Professional Season 2009-10,3700
2019,"Lakes To Locks Passage, Inc.",Crown Point,Essex,518-597-9660,Regional Economic Development,Impact Programming,Lock by Lock: Why the World Needs to Know About the Champlain Canal,49500
2005,"Learning Through an Expanded Arts Program, Inc",New York,New York,212-769-4160,Arts In Education,S-W Impr Sustain/Dissem: Yr 2,Leap/CS 6 Partnership,12700
2018,Historical Society of Saratoga Springs,Saratoga Springs,Saratoga,518-584-6920,Museum,General Support,General Operating Support,9000
2009,"Manhattan Class Company, Inc.",New York,New York,212-727-7722,Theatre,General Operating Support,General Operating Expenses,20000
2013,"Arts & Business Council, Inc.",New York,New York,212-223-2787,State & Local Partnership,Services to the Field,"Arts Professional,Leadership & Volunteer Developmt",43000
2005,Stony Brook Foundation Inc.,Stony Brook,Suffolk,631-324-4929,Museum,General Program Support,Pollack Krasner House and Studio,7500
2014,"Adirondack Theatre Festival, Inc.",Glens Falls,Warren,518-798-7479,Individual Artists,Theatre Artist Commissions,Bill Bowers - Bill Bowers Commission,10000
2010,World Music Institute,Brooklyn,New York,212-545-7536,Folk Arts,General Operating Support,General Operating Expenses,50730
2017,Fashion Institute of Technology Foundation,New York,New York,212-217-4107,Museum,Project Support,"Paris Refashioned, 1957-1968",12500
2006,Steven Myron Holl Foundation,New York,New York,212-629-7262,Architecture Planning & Design,Publication,32BNY,10000
2006,"Smack Mellon Studios, Inc.",Brooklyn,Brooklyn,718-834-8761,Electronic Media & Film,Workspace Facilities,Electronic Media & Film Studios,5000
2005,El Puente De Williamsburg,Brooklyn,Brooklyn,718-387-0404,Arts In Education,S-W Impr Implementation: Yr 3,School-wide Integrated Arts Project,40000
2012,"The Civilians, Inc.",Brooklyn,Brooklyn,718-230-3330,Theatre,General Oper Support,General Operating Expenses,7520
2016,Apex Art Curatorial Program,New York,New York,212-431-5270,Visual Arts,Exhibitions & Installations,Exhibition Planning,7000
2011,Young Men's and Young Women's Hebrew Association,New York,New York,212-699-7240,Presenting,General Program Support,Tisch concert series and Harkness Dance Festival-100 performances,18494
2010,"The Long Island Philharmonic, Inc.",Melville,Suffolk,631-293-2223,Music,General Operating Support,General Operating Expenses,59235
2018,"Maverick Concerts, Inc.",Woodstock,Ulster,201-654-5266,Presenting,General Support,Maverick Concerts Summer Music Festival,12000
2007,"Lower Manhattan Cultural Council, Inc.",NEW YORK,New York,212-219-9401,Individual Artists,Film & Media / New Tech Prod.,Masako Tsumura - Fire Under the Snow,12500
2007,"Hester Street Collaborative, Inc.",New York,New York,917-265-8591,Architecture Planning & Design,Design and Planning Studies,Design for Sara Delano Roosevelt Park in CB 3,15000
2003,Paul Robeson Performing Arts Company,Syracuse,Onondaga,315-469-5319,Special Arts Services,GENERAL OPERATING SUPPORT,General Operating Expenses,36000
2003,"Albany Symphony Orchestra, Inc.",Albany,Albany,518-465-4755,Music,GENERAL OPERATING SUPPORT,General Operating Expenses,45000
2019,Palace Performing Arts Center Inc,Albany,Albany,518-465-3335,Regional Economic Development,Facilities (Large),Palace Theatre Renovation and Revitalization Project,360000
2003,New York Treble Singers,New York,New York,212-496-0094,Music,PROFESSIONAL PERFORMANCES,Artists Fees,6300
2006,Storefront for Art and Architecture,New York,New York,212-431-5795,Architecture Planning & Design,Independent Projects,Gisela Baurmann - Baurmann: Quetsch,10750
2004,VISIONINTOART,New York,New York,917-544-1482,Individual Artists,Commissions,Paola Prestini - Music by Paola Prestini for VisionIntoArt's Season,1800
2019,Eva Dean Dance Company,Brooklyn,Brooklyn,718-857-8368,Dance,Rehearsal Space & Residencies,Subsidized Dance Rehearsal Rental Program; 1500 hours/80 companies (1800 hours x $5 per hour),7500
2008,Visual Arts Rsrch & Rsrc Ctr,New York,New York,212-307-7420,Special Arts Services,General Operating Support,General Operating Expenses,65000
2013,Light Work Visual Studies Inc.,Syracuse,Onondaga,315-443-1300,Electronic Media & Film,Exhibitions & Installations,Urban Video Project,18000
2009,Right Down Broadway Productions Ltd.,New York,New York,212-665-3707,Theatre,Professional Performances,Right Down Broadway Productions Mainstage Season,2500
2020,Pegasus Early Music,Rochester,Monroe,585-703-3990,Music,General Support,Pegasus Early Music 2016 Season General Support,22000
2007,"Welltone New Music, Inc.",New York,New York,212-691-6858,Music,Professional Performances,Cutting Edge Concerts 2007,3000
2008,Museum for African Art^The,New York,New York,212-444-9795,Museum,Exhibitions,Dogon Hip!,10000
2003,Asian American Arts Alliance,Brooklyn,Brooklyn,212-941-9208,Folk Arts,PRESENTATION,"Dev. folk arts component, trad msc,danc at Asian Pacific Am Herit Fest",4000
2012,"Theater for the New City Foundation, Inc.",New York,New York,212-254-1109,Theatre,General Oper Support,General Operating Expenses,14240
2016,Delaware Valley Arts Alliance,Narrowsburg,Sullivan,845-252-7576,State & Local Partnership,General Support,Arts Council Services for Sullivan County,18000
2019,University of Rochester,Rochester,Monroe,585-276-8940,Special Arts Services,Project Support,"ROCmusic Collaborative - Tuition Funds for Musical Instruction, Grades 1-12",12500
2013,Long Island University,Brookville,Nassau,516-299-2523,Presenting,General Support,Tilles Center for the Performing Arts Presenting,25000
2008,New York Foundation for the Arts,BROOKLYN,Brooklyn,212-366-6900,Individual Artists,Film & Media / New Tech Prod.,Jenny/Clove Rogers/Galilee - Wickets,20000
2017,Women Make Movies,New York,New York,212-925-0606,Individual Artists,Film & Media / New Tech Prod.,Rachel Elizabet Seed - A Photographic Memory,20000
2009,"Irish Classical Theatre Company, Inc.",Buffalo,Erie,716-853-1380,Theatre,General Operating Support,General Operating Expenses,16700
2017,Rochester Museum & Science Center,Rochester,Monroe,585-697-1975,Regional Economic Development,New Initiatives - Implementation,1838 Rochester Diorama,41500
2008,Arts Council of Rockland,Garnerville,Rockland,917-533-4161,State & Local Partnership,Regrants,"Community Arts Grants. Regrant Amount: $28,000.  Administrative Amount: $12,000.",40000
2007,"Artsgenesis, Inc",New York,New York,212-741-1414,Arts In Education,ESP School-Wide Arts Impl,"School wide partnership with PS/IS#66, Brooklyn",30000
2016,7 Loaves Inc.,New York,New York,917-721-6385,Folk Arts,Project Support - Presentation,Traditional Czech Puppet Plays,6000
2020,"Martha Graham Center of Contemporary Dance, Inc.",New York,New York,212-229-9200,Dance,Rehearsal Space & Residencies,Provision of Low Cost Rehearsal Hours,10000
2005,Fence Magazine Inc.,Albany,Albany,518-567-7006,Literature,Book Publication,Fence Books Printing and Marketing,2500
2007,Gregg Smith Singers Inc,Yonkers,Westchester,914-376-1767,Music,Professional Performances,GSS Concerts,15750
2008,"African Cultural Center of Buffalo, Inc.",Buffalo,Erie,716-884-2013,Special Arts Services,General Program Support,Theatre/Dance,76000
2005,Partners for Arts Education,Syracuse,Onondaga,315-234-9911,Arts In Education,Services to the Field,CNY Regional Leadership Network Technical Support,10000
2003,Trust for Public Land,New York,New York,212-677-7171,Architecture Planning & Design,GENERAL OPERATING SUPPORT,General Operating Expenses,12200
2013,"Martha Graham Center of Contemporary Dance, Inc.",New York,New York,212-229-9200,Dance,Rehearsal Space,"Provision of 1,000 Low Cost Rehearsal Hours to 20 Dance Artists",10000
2010,Preservation League of New York State,Albany,Albany,518-462-5658,Architecture Planning & Design,Services to the Field,Preservation Colleagues Program,12202
2017,OLD SONGS INC,Voorheesville,Albany,518-765-2815,Regional Economic Development,Workforce Investment,Workforce Investment,27500
2010,Baryshnikov Arts Center Inc.,New York,New York,646-731-3206,Dance,Rehearsal Space,"Rehearsal Space Subsidy: 1,000 hrs. ($10/hr) for 50-60 nonprofit dance cos./artists",12834
2019,Women's Studio Workshop,Rosendale,Ulster,845-658-9133,Arts Education,K-12: In-School Programs,Hands-On Art,19000
2019,"Lotus Fine Arts Productions, Inc.",New York,New York,212-627-1076,Arts Education,K-12: In-School Programs,World Dance Passport at 2 NYC Public Schools,12000
2011,Albany Institute of History & Art,Albany,Albany,518-463-4478,Architecture Planning & Design,Exhibitions,Graphic Design - Get The Message! Exhibition Proj.,21758
2015,"The New Group, Inc.",New York,New York,212-244-3380,Theatre,General Support,The New Group-General Support,5000
2019,Northern Manhattan Arts Alliance,New York,New York,212-567-4394,State & Local Partnership,Services to the Field,NoMAA Technical Assistance Program,7500
2011,"The Center for Book Arts, Inc.",New York,New York,212-481-0295,State & Local Partnership,Services to the Field,Professional Workshops for Artists & Services,6626
2011,"High Meadow Arts, Inc.",Rosendale,Ulster,845-389-5889,Arts Education,K-12: Implementation,Performing Arts across the School Community @ at High Meadow School in Stone Ridge,20769
2008,Women Make Movies,New York,New York,212-925-0606,Individual Artists,Film & Media / New Tech Prod.,Sharon La Cruise - In The Shadow of Little Rock:The Life of Daisy B,10000
2013,"Earlville Opera House, Inc.",Earlville,Chenango,315-691-3550,Presenting,General Support,General Operating Expenses,13530
2010,"Sonnet Repertory Theatre, Inc.",New York,New York,917-204-6384,Theatre,Professional Performances,Mainstage Season and Collabrative Series,4450
2010,Margaret Woodbury Strong Museum,Rochester,Monroe,585-410-6376,Museum,General Operating Support,General Operating Expenses,44500
2012,Historic Saranac Lake,Saranac Lake,Franklin,518-891-4606,Arts Education,K-12: In-School Programs,Cure Cottage Storybook Project,5000
2010,Lake Placid Association of Music Drama and Art,Lake Placid,Essex,518-523-2512,Electronic Media & Film,Exhibitions,Screenings ,5924
2010,Blueberry Pond Arts Center,Ossining,Westchester,212-989-5372,Theatre,New Theatre Advancement,Main Stage Season,4000
2006,Rochester Lesbian and Gay Film and Video Festival,Rochester,Monroe,585-301-5163,Electronic Media & Film,Exhibitions,ImageOut: Rochester Lesbian/Gay Film/Video Festiva,7800
2009,"Early Stages Program, Inc.",New York,New York,212-242-1744,Arts In Education,ESP School-Wide Arts Impl,"Talking Drums and Storytelling at M.S. 145, Year 1",20000
2008,"The Performance Zone, inc.",New York,New York,212-691-6969,Music,Professional Performances,REBEL Ensemble for Baroque Music  - REBEL Ensemble for Baroque Music / Musica Antiqua,9000
2013,"BRIC Arts | Media | Bklyn, Inc.",Brooklyn,New York,718-683-5561,State & Local Partnership,General Support,General Support,44000
2012,"The Schoolhouse Theater Foundation, Inc.",Croton Falls,Westchester,914-277-8477,Theatre,Professional Performances,The Schoolhouse Theater Mainstage Season,5910
2006,"Schola Cantorum of Syracuse, Inc.",Syracuse,Onondaga,315-471-3036,Music,General Operating Support,General Operating Expenses,2700
2018,"Alliance of Resident Theatres/New York, Inc.",New York,New York,212-244-6667,Regional Economic Development,Workforce Readiness - FOCUS 1: Arts Career Development Fellowships for Underrepresented Communities,Workforce Training and Development Expansion,68640
2017,"Earsay, Inc",Sunnyside,Queens,718-791-4324,Arts Education,K-12: In-School Programs,EarSay Youth Voices/International High SchoolLAGCC,14000
2014,"Chinese Music Ensemble of New York, Inc.",New York,New York,646-886-7888,Music,Project Support,Traditional Chinese Music Performances,15000
2013,Staten Island Instituteof Art and Science,Staten Island,Staten Isl,718-483-7114,Museum,General Support,General Operating Expenses: Staten Island Museum ,11290
