Grant Year,Grantee,Address,State,ZIP,County,Phone,Program,Category,Project Title
2010,"Boscobel Restoration, Inc.",1601 Route 9D,NY,10524,Putnam,845-265-3638,Museum,Exhibitions,Home on the Hudson
2003,Crandall Public Library,251 Glen St,NY,12801-3593,Warren,518-792-6508,Folk Arts,REGIONAL & CNTY FOLK ARTS PRG,Folk Arts Program Support
2017,Rochester Museum & Science Center,657 East Avenue,NY,14607-2177,Monroe,585-697-1975,Folk Arts,Project Support,Celebrating Haudenosaunee Culture
2008,"Friends of Chamber Music, Inc.",285 Pawling Avenue,NY,12180,Rensselaer,518-235-4936,Presenting,Presentation,Presenting Expenses & Artists Fees for 6 Concerts
2005,Brooklyn Ctr for Urban Environ,168 7th Street,NY,11215,Brooklyn,718-788-8500,Architecture Planning & Design,General Operating Support,General Operating Expenses
2006,Women Make Movies,"115 W 29th Street, Suite 1200",NY,10001,New York,212-925-0606,Electronic Media & Film,General Operating Support,General Operating Expenses
2003,"Amigos del Museo del Barrio, Inc.",1230 Fifth Ave,NY,10029-4401,New York,212-660-7118,Folk Arts,PRESENTATION,Day of the Dead Festival Featuring Folk Artists
2009,"Just Buffalo Literary Center, Inc.",468 Washington St. #2,NY,14203,Erie,716-861-9985,Literature,Services to the Field,LitTAP
2010,Friends of Bristol Valley Playhouse Foundation,"PO Box 218, 117 South Main Street, 2nd floor",NY,14512-0218,Ontario,585-374-9032,Theatre,General Operating Support,General Operating Expenses
2005,Rejoicensemble Inc,"1333 President Street, C-3, %Joycelyn Bryan",NY,11213,Brooklyn,646-354-8216,Music,Professional Performances,BRONYA
2012,New York City Players,"400 W 43rd St, #30D",NY,10036,New York,718-622-0330,Theatre,Professional Performances,Public Performance of new NYCP work
2007,Genesee Valley Council on the Arts,4 Murray Hill Drive,NY,14510-1122,Livingston,585-243-6785,State & Local Partnership,General Operating Support,General Operating Expenses
2017,The History Center in Tompkins County,110 N. Tioga Street,NY,14850-4387,Tompkins,607-273-8284,Regional Economic Development,Planning,Tompkins County Heritage Education Center
2020,Nesin Cultural Arts Inc,"PO Box 249, 24 Lawrence Ave",NY,12701,Sullivan,845-798-9006,Arts Education,General Support,Integrated Arts
2019,"Spaceworks NYC, Inc",540 President Street # 2E,NY,11215,Brooklyn,718-408-8755,Regional Economic Development,Facilities Improvement - Mid-Size Capital Projects,Governors Island Building 301 Equipment
2020,"The Historic Districts Council, Inc.",232 East 11th Street,NY,10003-7301,New York,212-614-9107,Architecture + Design,Project Support,Educational Programs for Historic Neighborhoods
2003,"Elders Share the Arts, Inc. (ESTA)",138 S. Oxford St.,NY,11217-1604,New York,718-398-3870,Arts In Education,ESP IMPLEMENTATION: Lvl 4 Yr 1,ESP Level IV with Metropolitan Corp. Academy
2015,"IGiullari di Piazza, Inc.","1047 Amsterdam Avenue, Cathedral of St John the Divine",NY,10025,New York,646-322-4637,Special Arts Services,Project Support,Touring Performances of Italian Folk Music & Dance
2011,"Issue Project Room, Inc.","22 Boerum Place, Ground Floor",NY,11201,Brooklyn,718-330-0313,Individual Artists,Composer Commissions,Tristan Perich - Tristan Perich: Drift Multiply
2009,Harness Racing Museum & Hall of Fame,240 Main Street,NY,10924,Orange,845-294-6330,Museum,Collections Care & Research,Roosevelt Raceway Collection - Phase II
2009,"Independent Media Arts Preservation, Inc.","c/o Lehman College, 250 Bedford Park Boulevard West, Lief Library 201",NY,10468-1589,New York,718-960-7776,Electronic Media & Film,General Program Support,Independent Media Arts Preservation
2015,Architectural League of New York,"594 Broadway, Suite 607",NY,10012,New York,212-753-1722,Architecture + Design,Independent Projects,Phyllis Ross - Ross: The Design Works of Bedford Stuyvesant
2015,Iroquois Indian Museum,"PO Box 7, 324 Caverns Road",NY,12092-0007,Schoharie,518-296-8949,Museum,General Support,General Operating Support
2014,"Roulette Intermedium, Inc.","30 Third Avenue, Suite #208",NY,11217,Brooklyn,917-267-0377,Individual Artists,Film & Media / New Tech Prod.,Mary Griffin - Mediation
2005,Friends of Good Msc Olean Area,PO Box 222,NY,14760,Cattaraugus,716-373-7004,Presenting,Presentation,Artists Fees & Presenting Expenses-5 Performances
2005,"Geneseo Migrant Center, Inc.",P.O. Box 38,NY,14530,Livingston,585-658-7960,Literature,Public Programs,CAMPS Literature
2012,"League of Composers, Inc.",24 Waverly Place RM 268,NY,10003,New York,347-559-5376,Music,Professional Performances,New York Concert Series
2015,"Schola Cantorum of Syracuse, Inc.",P.O. BOX  35189,NY,13235,Onondaga,315-471-3036,Music,Project Support,Schola Cantorum of Syracuse season
2015,Orpheus Chamber Orchestra,"490 Riverside Drive, 11th Floor",NY,10027-5788,New York,212-896-1713,Music,General Support,New York Performance Season
2019,Brooklyn Arts Council,"20 Jay Street, Suite 616",NY,11201,Brooklyn,718-625-0080,State & Local Partnership,General Support,Brooklyn Arts Council (BAC) FY19 - GOS Support
2012,"School of American Ballet, Inc.","70 Lincoln Center Plaza, 5th Floor",NY,10023-6592,New York,212-769-6615,Special Arts Services,Instruction and Training,Scholarships for PreProfessional Minority Students
2018,BCT Brooklyn Childrens Theatre INC,"540 President Street, Suite 1D",NY,11215,Brooklyn,646-675-0325,Arts Education,Community-Based Learning,After-School Musical Theatre
2013,"The Collapsable Giraffe, Inc.",155 Bank St,NY,10014,New York,917-374-7079,Theatre,Professional Performances,New Experimental Performances
2017,American Opera Projects Inc,138 South Oxford Street,NY,11217,Brooklyn,718-398-4024,Individual Artists,Composer Commissions,Sheila Silver - A Thousand Splendid Suns
2010,"Irish Classical Theatre Company, Inc.",625 Main Street,NY,14203-1407,Erie,716-853-1380,Theatre,General Operating Support,General Operating Expenses
2006,The Nancy Meehan Dance Company,463 West St   A1111,NY,10014,New York,212-929-2143,Dance,Rehearsal Space,Reconsideration:Subsidized Rehearsal Space Rental
2013,Newburgh Performing Arts Academy,62 Grand Street,NY,12550,Orange,845-561-4936,Special Arts Services,Instruction and Training,Instruction and Training
2008,New York Council of Nonprofits Inc.,272 Broadway Ave,NY,12204,Albany,518-434-9194,State & Local Partnership,Services to the Field,Reconsideration:Entrepreneurial Development
2010,Bronx River Art Center Inc,1087 East Tremont Ave,NY,10460,Bronx,718-589-5819,Visual Arts,Exhibitions & Installations,Contemporary Art Exhibitions
2015,"Clubbed Thumb, Inc.","440 Lafayette St, 4th Floor",NY,10003,New York,212-260-0153,Theatre,General Support,Seasonal Support
2006,"Career Transition for Dancers, Inc.","165 West 46th Street , Suite 701",NY,10036-2501,New York,212-764-0172,Dance,Services to the Field,Career Counseling Program for Prof. NY Dancers
2017,Capital Repertory Company,432 State Street - Administration ,NY,12305,Albany,518-382-3884,Regional Economic Development,Implementation,On the Go - Touring Educational Theatre
2020,"The Brooklyn Rail, Inc.","253 36th Street, Unit 20",NY,11232,Brooklyn,718-349-8427,Regional Economic Development,Workforce Investment,Workforce Expansion
2007,A Gathering of the Tribes Inc,"Steve Cannon 745 E. 6th St , Apt.1A",NY,10009,New York,212-777-2038,Literature,Literary Magazine Publication,Tribes Magazine Issues 13 & 14
2012,Phoenix Theatre Ensemble,"200 E. 10th Street, #180",NY,10003,New York,212-465-3446,Theatre,Professional Performances,Phoenix Theatre Ensemble
2007,Red Bull Theater Inc,191 Seventh Ave Suite 2S,NY,10011,New York,212-343-7394,Theatre,New Theatre Advancement,Mainstage Production Season
2015,Council on the Arts & Humanities for Staten Island,P.O. Box 50197,NY,10305,Staten Isl,718-447-3329,State & Local Partnership,General Support,Council on the Arts for Staten Island-General Support
2005,SCO Family of Services,443 - 39th Street,NY,11232,Brooklyn,718-438-9500,Arts In Education,Project-based Planning,Interdisciplinary Arts Partnership with MS 821
2014,Dorian Woodwind Quintet Fndn,P.O Box 231417,NY,10023,New York,646-242-9870,Music,Project Support,Dorian Quintet 12-13 season
2008,Heart of Brooklyn Cultural Institutions Inc.,789 Washington Avenue,NY,11238,Brooklyn,718-638-7700,Architecture Planning & Design,Design and Planning Studies,Heart of Brooklyn Wayfinding System
2004,"ArtsWestchester, Inc.","31 Mamaroneck Avenue, 3rd Floor",NY,10601,Westchester,914-428-4220,State & Local Partnership,General Operating Support,General Operating Expenses
2020,Western New York Book Arts Collaborative Inc.,468 Washington St.,NY,14203,Erie,716-348-1430,Arts Education,Community-Based Learning,Printing Partners
2018,"Magic Box Productions, Inc.","444 Bedford Road, Ste. 203",NY,10570,Westchester,914-747-0256,Regional Economic Development,Workforce Readiness - FOCUS 1: Arts Career Development Fellowships for Underrepresented Communities,Workforce Training and Development Expansion
2017,Apex Art Curatorial Program,291 Church St,NY,10013-2403,New York,212-431-5270,Visual Arts,Exhibitions & Installations,Exhibition Planning
2005,J Mandle Performance,"232 3rd Street , Studio E3B West",NY,11215-2715,Brooklyn,917-319-5897,Individual Artists,Commissions,Julia Mandle - A Long Division
2005,"Career Transition for Dancers, Inc.","165 West 46th Street , Suite 701",NY,10036-2501,New York,212-764-0172,Dance,Services to the Field,Career Counseling Program for Prof. NY Dancers
2004,Theodore Roosevelt Inaugural Site Foundation,641 Delaware Avenue,NY,14202,Erie,716-884-0095,Museum,Collections Care & Research,Creating a Complete Computerized Catalog
2020,"Instituto Arte Teatral Internacional, Inc.","64 E. 4th Street, 2nd Floor",NY,10003,New York,212-505-6757,Special Arts Services,General Support,General Support
2006,Cattaraugus County Arts Council,POB 406,NY,14760,Cattaraugus,716-372-7455,State & Local Partnership,General Operating Support,General Operating Expenses
2015,"Theatre Communications Group, Inc.","520 Eighth Avenue, 24th Floor",NY,10018-4156,New York,212-609-5930,Theatre,General Support,General Operating Support
2015,"Waterwell Productions, Inc.","330 W 42nd St, Ste 2301",NY,10036,New York,212-202-5675,Arts Education,K-12: In-School Programs,Performance Projects at PPAS
2007,Afrikan Poetry Theatre Inc,"176-03 Jamaica Avenue, -",NY,11432-5503,Queens,917-868-0759,Literature,Public Programs,Writers Workshops - Writers Fees & Promotion
2007,"Alleyway Theatre, Inc.",1 Curtain Up Alley,NY,14202-1911,Erie,716-852-2600,Theatre,Professional Performances,Pandora's Box Theatre Company
2016,Alfred University,One Saxon Drive,NY,14802-1205,Allegany,607-871-2026,Electronic Media & Film,Workspace,Artist in Residence Program
2010,Battery Dance Corporation,"380 Broadway , 5th Floor",NY,10013-3518,New York,212-219-3910,Stimulus,Stimulus,Subsidized Rehearsal Space - Program Manager
2005,Los Pleneros De La 21,"Julia de Burgos Latino Cultural Center, 1680 Lexington Ave Rm 209",NY,10029,New York,212-427-5221,Folk Arts,General Operating Support,Reconsideration:General Operating Expenses
2013,Sixteen As One Music,888 C Eigth Avenue #160,NY,10019,New York,212-245-8690,Music,General Support,General Operating Expenses
2004,"Composers Collaborative, Inc.",210 Riverside Dr Apt 11G,NY,10025-6883,New York,212-920-0726,Music,Professional Performances,Dynamic Duos
2015,"Madison Square Park Conservancy, Inc.","11 Madison Avenue, 15th Floor",NY,10010,New York,212-786-5727,Presenting - Multi & Interdisc Arts,Project Support - Presentation,Mad. Sq. Music: Oval Lawn Series and Studio Series
2016,Bronx House Inc,990 Pelham Parkway South,NY,10461,Bronx,718-792-1800,Music,Community Music Schools,General Operating Support
2003,"Yara Arts Group, Inc.","306 E 11th St, # 3B",NY,10003-7462,New York,212-777-7675,Folk Arts,PRESENTATION,Buryat Performances
2014,Ethel's Foundation for the Arts,"132 E. 43rd Street, #213",NY,10017-4019,New York,914-841-7405,Music,General Support,ETHEL - General Operating Support
2004,Arts Council of Rockland,"55 West Railroad Ave, Box 275",NY,10923,Rockland,917-533-4161,State & Local Partnership,General Operating Support,General Operating Expenses
2006,Community Arts Partnership of Tompkins County,110 N. Tioga Street,NY,14850-4331,Tompkins,607-273-5072,Arts In Education,Regrants,Tompkins County Local Capacity Building
2005,"Brooklyn Jewish Film Festival, inc.^The",99 Berkley Place,NY,11217,Brooklyn,718-230-0505,Electronic Media & Film,Exhibition,"The Brooklyn Jewish Film Festival,Inc."
2007,Arts Council for Wyoming County,"P.O. Box 249, 31 S. Main Street",NY,14530-0249,Wyoming,585-237-3517,Folk Arts,Presentation,Traditional Arts of the Attica Rodeo
2020,The Flux Factory,39-31 29th Street,NY,11101,Queens,347-379-5821,Electronic Media & Film,Exhibitions & Installations,Multimedia Group Exhibitions
2007,"Spanish Theatre Repertory Company, Ltd",138 East 27th Street,NY,10016,New York,212-225-9934,Dance,Professional Performances,Reconsideration:Artistic Fees: Pilar Rioja in 30 Performances @ Gramercy Arts Theatre
2014,Uptown Dance Academy,"1425 Amsterdam Ave Suite 5G, 1425 Amsterdam Ave Suite 5G",NY,10027,New York,917-202-1601,Special Arts Services,Instruction and Training,Transformation Academy
2019,New York Foundation for the Arts,20 JAY ST STE 740,NY,11201-8352,Brooklyn,212-366-6900,Literature,Book & Literary Mag Pubs,CIRCUMFERENCE - Circumference
2017,Voices UnBroken,"1414 Metropolitan Avenue, 2nd Floor",NY,10462,Bronx,347-759-3932,Literature,General Support,Voices UnBroken Workshops
2017,"Smack Mellon Studios, Inc.",92 Plymouth Street,NY,11201,Brooklyn,718-834-8761,Facilities,Capital Projects (Facilities),ADA Bathrooms
2006,Sixteen As One Music,888 C Eigth Avenue #160,NY,10019,New York,212-245-8690,Music,General Operating Support,General Operating Expenses
2006,An Claidheamh Soluis Inc.,553 W 51st Street,NY,10019-5004,New York,212-757-3318,Theatre,Professional Performances,Artists' fees for mainstage theatre season
2010,Cultural Council of Cortland County,"PO Box 5133, 110 Tompkins Street",NY,13045,Cortland,607-753-1188,State & Local Partnership,Information Services,Publication of printed and online newsletters
2019,"CNY Arts, Inc.","421 Montgomery St, 11th Floor",NY,13202-2964,Onondaga,315-435-2125,State & Local Partnership,General Support,General Operating Support
2015,"PUBLIC ART FUND, INC.","One East 53rd Street, 12th Floor",NY,10022-4230,New York,212-223-7810,Visual Arts,Project Support,Public Art Fund Talks 
2018,"The Wooster Group, Inc.","PO Box 654, Canal Street Station",NY,10013-0654,New York,212-966-9796,Theatre,General Support,The Wooster Group General Operating
2014,Chemung County Historical Society,415 EAST WATER ST,NY,14901-3410,Chemung,607-734-4167,Museum,General Support,General Operating Support
2011,"Flushing Council on Culture and the Arts, Inc.",137-35 Northern Blvd,NY,11354-4120,Queens,718-463-7700,State & Local Partnership,General Operating Support,General Operating Expenses
2006,Museum Association of New York,265 River St,NY,12180-3215,Rensselaer,518-273-3400,Museum,General Operating Support,General Operating Expenses
2011,"Sylvan Winds, Inc.","P.O.Box 1284, Cathedral Station",NY,10025,New York,212-662-0433,Music,Professional Performances,NYC Concert Series & Touring in NY State
2012,New York Gilbert & Sullivan Players Inc,225 West 99th St.,NY,10025,New York,212-769-1000,Music,General Oper Support,2011-2012 NY Season
2004,The History Center in Tompkins County,110 N. Tioga Street,NY,14850-4387,Tompkins,607-273-8284,Museum,General Operating Support,General Operating Expenses
2007,Brooklyn Arts Council,"20 Jay Street, Suite 616",NY,11201,Brooklyn,718-625-0080,Folk Arts,Regional & Cnty Folk Arts Prg,Brooklyn Folk Arts Programs
2019,"Dancewave, Inc.",182 4th Avenue,NY,11217,Brooklyn,718-522-4696,Dance,Rehearsal Space & Residencies,Provision of low cost rehearsal hours (1000/75 companies @ $5 per hour)
2012,Society for Pres Weeksville Hist,158 Buffalo Avenue ,NY,11213-2420,Brooklyn,718-756-5250,Arts Education,Community-Based Learning,Artist Residencies for High School Students
2006,Marquis Studios Ltd,"20 Jay Street, Suite 826",NY,11201,New York,718-694-9400,Arts In Education,ESP School-Wide Arts Impl,"Partnership with PS #170, Bronx-Early Childhood school"
2014,Young Jean Lee's Theater Company Inc,376 Bergen Street 4R,NY,11217,Brooklyn,9173850834,Theatre,Professional Performances,STRAIGHT WHITE MEN
2016,"Lake George Arts Project, Inc.",1 Amherst Street,NY,12845-1427,Warren,518-668-2616,Visual Arts,Exhibitions & Installations,Courthouse Gallery Exhibitions
2010,National Book Foundation Inc.,"90 Broad Street, Suite 604",NY,10004-3329,New York,212-685-0261,Literature,General Program Support,BookUpNYC
2013,S.E.M Ensemble Inc.,25 Columbia Place,NY,11201-4503,Brooklyn,718-488-7659,Music,General Support,General Operating Expenses
2003,Rockland Conservatory of Music,45 S. Main Street,NY,10965,Rockland,845-356-1522,Special Arts Services,INSTR/TRAIN. PRE-PROF.,Scholarship Program for Students of Color
2018,White Pine Inc,P.O. Box 236,NY,14201-0236,Erie,716-573-8202,Literature,Book & Literary Mag Pubs,World of Voices
2018,"Yara Arts Group, Inc.","306 E 11th St, # 3B",NY,10003-7462,New York,212-777-7675,Theatre,Professional Performances,Yara's New Theatre Piece
2013,"NEW YORK POPS, INC.","39 Broadway, Suite 1150",NY,10006,New York,212-765-7677,Arts Education,K-12: In-School Programs,Musical Mentors
2019,Gamelan Kusuma Laras,"141 E 3rd St., Apt 8B ",NY,10009-7304,New York,212-982-1332,Folk Arts,Project Support,Gamelan Concert/KlenÃ¨ngan
2012,"Madison Square Park Conservancy, Inc.","11 Madison Avenue, 15th Floor",NY,10010,New York,212-786-5727,Presenting,Presentation,Mad. Square Music: Oval Lawn Series and the Studio Series
2019,Jack Arts Inc.,"c/o Alec Duffy, 53 Putnam Ave.",NY,11238,New York,646-734-8985,Special Arts Services,Project Support,Artists 'n' Residents
2011,Cattaraugus County Arts Council,POB 406,NY,14760,Cattaraugus,716-372-7455,State & Local Partnership,Regrants,"DEC in Cattaraugus, Allegany & Chautauqua Counties.Administration:$20,430; Regrant: $46,921."
2004,Momenta Art Inc.,"220 Highland Boulevard, 3-O",NY,11207,Brooklyn,718-552-2892,Electronic Media & Film,Exhibition,New Media Program
2005,"Foundation for the Open Eye, Inc.","PO Box 959, 960 Main Street",NY,12455,Delaware,845-586-1689,Arts In Education,ESP IMPLEMENTATION: Lvl 2,Empire State Partnership with Margaretville Central School
2010,Rensselaer Polytechnic Institute,110 8th Street,NY,12180-3590,Rensselaer,518-276-6281,Presenting,Presentation,EMPAC Inaugural Season
2014,Terranova Theatre Collective Inc.,"401 West 24 Street, #8",NY,10011,New York,917-603-0793,Theatre,Professional Performances,terraNOVA Collective's 2014 Season
2007,Children's Museum-Nat Hist/Science,311 Main Street,NY,13501,Oneida,315-724-6129,Folk Arts,Presentation,Family Folk Art Festival
2008,"Manhattan Art Program, inc.","800 6th Avenue, Suite 11C",NY,10001,New York,212-686-2202,Individual Artists,Film & Media / New Tech Prod.,Terry Berkowitz - Ties that Bind
2011,"The Jewish Community Center in Manhattan, Inc.",334 Amsterdam Avenue,NY,10023,New York,646-505-5718,Electronic Media & Film,Exhibitions,Screenings: JCC Film Series
2011,Buffalo Media Resources,617 Main Street,NY,14203,Erie,716-884-7172,Electronic Media & Film,General Operating Support,General Operating Expenses
2014,El Puente De Williamsburg,211 South 4th Street,NY,11211-5605,Brooklyn,718-387-0404,Special Arts Services,General Support,El Puente Arts
2013,"Musica de Camara, Inc.","1215 Fifth Ave, Ste 1B",NY,10029-1215,New York,718-987-4297,Music,General Support,MDC Genral Operating Support
2015,Hudson Opera House Inc.,327 Warren Street,NY,12534-2413,Columbia,518-822-1438,Presenting - Multi & Interdisc Arts,Project Support - Presentation,HOH Presentations 2012-13
2020,The Play Production Company Inc,"321 West 44th Street, Ste. 802",NY,10036,New York,212-398-2977,Individual Artists,Theatre Artist Commissions,Lee Evans - Commission for Lee Sunday Evans
2005,New York Foundation for the Arts,20 JAY ST STE 740,NY,11201-8352,Brooklyn,212-366-6900,Individual Artists,Film & Media / New Tech Prod.,Sharon Greytak - Corner At America
2017,"Visual Studies Workshop, Inc.",31 Prince St,NY,14607-1499,Monroe,585-442-8676,Visual Arts,Exhibitions & Installations,"VSW Photography, Book and Moving Image Exhibitions"
2004,"Harvestworks, Inc.","596 Broadway, Rm 602",NY,10012,New York,212-431-1130,Electronic Media & Film,General Operating Support,GOS
2005,"The Feminist Press, Inc.","365 Fifth Avenue, Suite 5406",NY,10016-4334,New York,212-817-7916,Literature,Book Publication,Women Writers of the Islamic World
2004,New York Hall of Science,47-01 111th Street,NY,11368-2950,Queens,718-595-9190,Museum,General Operating Support,GOS
2017,The Harlem Chamber Players Inc,191 Claremont Avenue #25,NY,10027,New York,917-744-6948,Music,Project Support,The Harlem Chamber Players 2013 - 2014 Season
2004,Ethel's Foundation for the Arts,"132 E. 43rd Street, #213",NY,10017-4019,New York,914-841-7405,Music,Professional Performances,New York Performances 2003/04
2019,The Writers Room,"The Writers Room, 740 Broadway, 12th Floor",NY,10003,New York,212-254-6995,Regional Economic Development,Facilities (Mid-Size),Writers Room Reconfiguration
2006,Arts Horizons Inc,"289 St Nicholas Avenue, Lower Level",NY,10027,New York,212-268-7219,Arts In Education,General Program Support,General Program Support
2006,Ballet Hispanico of New York Inc,167 West 89th Street,NY,10024-1901,New York,212-362-6710,Arts In Education,ESP School-Wide Arts Impl,PS 98 School-wide Dance Residency Implementation
2019,"CONTEMPORANEOUS, INC.",P.O. Box 275,NY,10023,New York,510-333-2543,Music,General Support, General Support for Contemporaneous 2019
2019,OPPORTUNITY MUSIC PROJECT FOUNDATION INC,"4 west 43rd Street, Suite 621",NY,10036,New York,917-741-3190,Arts Education,Community-Based Learning,Private Lesson and Orchestra Program
2004,Historic Ithaca Inc,212 Center Street,NY,14850,Tompkins,607-273-6633,Architecture Planning & Design,General Operating Support,General Operating Expenses
2015,Falconworks Artists Group,PO BOX 310283,NY,11231-0283,Brooklyn,718-395-3218,Special Arts Services,Project Support,Red Hook Theater
2008,St Lawrence County Arts Council,"2 Park St, Basement Suite, PO Box 252",NY,13676,St Lawrence,315-265-6860,State & Local Partnership,Information Services,Arts Directory & Newsletter
2013,Wingspan Arts Inc.,"630 Ninth Avenue, Suite 602,  ",NY,10036,New York,212-586-2330,Arts Education,Community-Based Learning,Summer Theatre Conservatory
2005,"League of Composers, Inc.",24 Waverly Place RM 268,NY,10003,New York,347-559-5376,Music,Professional Performances,League of Composers/ ISCM New York Concert Series
2009,DIA CENTER FOR THE ARTS (D/B/A DIA ART FOUNDATION),535 W 22nd Street-4th Floor,NY,10011-1108,New York,212-293-5506,Electronic Media & Film,Exhibitions,Artists' Web Projects
2016,Anti-Social Music,500C Grand Street Unit GE,NY,10002,New York,646-489-8791,Music,Project Support,New York Series
2011,Buffalo Media Resources,617 Main Street,NY,14203,Erie,716-884-7172,Individual Artists,Film & Media / New Tech Prod.,Geoffrey Alan Rhodes - 52 Card Cinema
2010,"Take Wing And Soar Productions, Inc.","45 Tiemann Place, Suite 3G",NY,10027,New York,212-696-6575,Theatre,Professional Performances,Take Wing And Soar 7th Annual Theatre Season
2010,National Foundation for Jewish Culture,PO BOX 489,NY,10011,New York,212-629-0500,Literature,Literary Magazine Publication,Habitus: A Diaspora Journal - Habitus: A Diaspora Journal
2019,Abingdon Theatre Company,"c/o Lucille Lortel Theatre Foundation, 322 8th Avenue, 21st Floor",NY,10001,New York,212-868-2055,Theatre,General Support,Abingdon Theatre Company General Operating Support
2010,An Claidheamh Soluis Inc.,553 W 51st Street,NY,10019-5004,New York,212-757-3318,Folk Arts,Presentation,New York City Irish Dance Festival
2003,"ABC No Rio, Inc.","107 Suffolk Street, #305",NY,10002,New York,212-254-3697,Literature,PUBLIC PROGRAMS,"Artist Fees, Promotion, Administration"
2017,Greater Hudson Heritage Network,2199 Saw Mill River Rd,NY,10523-3812,Westchester,914-592-6726,Museum,General Support,General Operating Support
2005,"Manhattan Theatre Club, Inc.","311 West 43rd Street, 8th Floor  ",NY,10036-6413,New York,212-399-3000,Theatre,General Operating Support,General Operating Expenses
2010,Central NY Community Arts Council,261 Genesee St,NY,13501-3408,Oneida,315-724-1113,Arts Education,ESP School-Wide Arts Impl,Arts in Education-Mt. Markham: Arts Implementation Yr 1
2014,Long Island Children's Museum,11 Davis Ave,NY,11530-6745,Nassau,516-224-5811,Presenting - Multi & Interdisciplinary Arts,Project Support - Presentation,Monthly Family Performance Series
2007,Mohawk Valley Center for the Arts,401-403 Canal Place,NY,13365-2008,Herkimer,315-823-0808,State & Local Partnership,Workshops,"Workshops, and Classes"
2007,"Theatre Development Fund, Inc.","520 Eighth Avenue, Suite 801",NY,10018,New York,212-912-9770,Dance,Services to the Field,Dance Subsidy and Dance Voucher Program
2005,Mind-Builders Creative Arts Center,3415 Olinville Avenue,NY,10467-5612,Bronx,718-652-6256,Folk Arts,General Program Support,Community Folk Culture Program
2006,Delaware Co Historical Assn,46549 State Highway 10,NY,13753,Delaware,607-746-3849,Museum,Exhibitions,History of Delaware County Exhibit
2016,"Community Design Center Rochester, Inc","1115 East Main Street Unit 61, Door #3B",NY,14609,New York,585-271-0520,Architecture + Design,General Support,General Support
2008,"Sunset Park School of Music, Inc.","4520 Fourth Ave, Box MH9",NY,11220-1152,Brooklyn,917-825-3478,Music,Community Music Schools,Community Music School Instruction & Performance
2003,Music Before 1800 Inc.,"Corpus Christi Church, 529 W 121st St",NY,10027-5901,New York,212-666-0675,Music,PROFESSIONAL PERFORMANCES,Rehearsal & Performance Fees; Admin & Production Expenses
