Grant Year,Grantee,City,County,Phone,Program,Category,Project Title,Grant Amount
2016,"Yangtze Repertory Theatre of America, Inc.",New York,New York,203-606-6298,Theatre,Professional Performances,Midnight Murder (Working Title),10000
2019,Home for Contemporary Theatre and Art,New York,New York,212-647-0202,Presenting,Project Support - Presentation,HERE Presents,30000
2016,Music Conservatory of Westchester,White Plains,Westchester,914-761-3900,Music,Community Music Schools,Community Music School,7500
2008,Brecht Forum^The,New York,New York,212-242-4201,Presenting,Presentation,Neues Kabarett Music Series,5000
2005,The Arts Connection Inc.,New York,New York,212-302-7433,Arts In Education,S-W Impr Implementation: Yr 1,Empire State Partnership with PS 38,20000
2010,Wells College,Aurora,Cayuga,315-364-3208,Literature,Public Programs,Visiting Writers Support,3300
2019,Center for Traditional Music and Dance,New York,New York,212-571-1555,Folk Arts,Project Support,Ukrainian Village Voices,10000
2018,The Bronx Museum of the Arts,Bronx,Bronx,718-681-6000,Arts Education,Community-Based Learning,Teen Council,19000
2007,"3-Legged Dog, Inc.",New York,New York,212-645-0374,Electronic Media & Film,Workspace Facilities,3LD ART & TECHNOLOGY CENTER RESIDENTS,6825
2012,"Arts Engine, Inc.",New York,New York,646-230-6368,Electronic Media & Film,General Oper Support,General Operating Expenses,10930
2004,"David Hochstein Memorial Music School, Inc.",Rochester,Monroe,585-454-4403,Special Arts Services,Professional Performances,Artists Fees Expenses for Borinquen Dance Theatre,12240
2017,"Chinese Theatre Works, Inc",Long Island City,Queens,917-723-3548,Folk Arts,Project Support,Hidden Treasure: Chinese Opera & traditional arts,15000
2017,Brooklyn Public Library,Brooklyn,Brooklyn,718-230-2087,Literature,General Support,BPL 2016 Literary Programs,12500
2007,Greater Hudson Heritage Network,Elmsford,Westchester,914-592-6726,Museum,General Operating Support,General Operating Expenses,15750
2010,"Essex County Arts Council, Inc",Westport,Essex,518-962-8778,Folk Arts,Presentation,Champlain Valley Heritage Network - Lake Champlain Celebrates 400 Yrs w/ Folk Artists,12000
2019,Dell'Arte Opera Ensemble,New York,New York,917-597-8524,Music,Services to the Field,Repertoire Development Project,5000
2007,"African Cultural Center of Buffalo, Inc.",Buffalo,Erie,716-884-2013,Special Arts Services,General Program Support,Theatre/Dance,60000
2013,Center for Creative Education,Kingston,Ulster,845-338-7664,Special Arts Services,Instruction and Training,Professional Training in Dance and Music,5000
2019,New York Foundation for the Arts,BROOKLYN,Brooklyn,212-366-6900,Dance,Professional Performances,"Christopher Williams  - Christopher Williams, Artists' Sals., NY Perf Season - Marginalia: Narcissus",5000
2003,Greater Jamaica Development Corp.,Jamaica,Queens,718-291-0282,Architecture Planning & Design,ADAPTIVE USE STUDIES,Consultants fees: First Reformed Church Project,20000
2020,Nine Mile Art Corp,Lafayette,Onondaga,315-243-6865,Literature,Book & Literary Mag Pubs,Nine Mile Magazine,2500
2017,Buffalo Media Resources,Buffalo,Erie,716-884-7172,Arts Education,Community-Based Learning,Media Art Workshops series for youth,19000
2020,"Pascal Rioult Dance Theatre, Inc.",Astoria,New York,212-398-5901,Arts Education,Pre-K-12: In-School Programs,FY20 DanceREACH in-school education program,4000
2009,Muae Publishing,New York,New York,917-971-8883,Literature,Book Publication,Book Publishing and Promotion,11000
2018,"Art Sweats, Inc.",New York,New York,212-677-2503,Dance,General Support,2016 Season Support,12000
2016,Young Men's and Young Women's Hebrew Association,New York,New York,212-699-7240,Literature,Public Programs,92Y Unterberg Poetry Center Main Reading Series,20000
2007,"DISCALCED, INC",Brooklyn,Brooklyn,718-624-8400,Dance,General Operating Support,General Operating Expenses,46200
2003,"Schoharie County Arts Council, Inc.",Cobleskill,Schoharie,518-234-7610,Folk Arts,REGIONAL & CNTY FOLK ARTS PRG,Staff Folklorist and Regional Folk Arts Program **PER CAPITA**,2500
2013,"Camera News, Inc.",New York,New York,212-947-9277,Individual Artists,Film & Media / New Tech Prod.,Rico Speight - Re-Discovering Fanon,18800
2004,Queens Council of the Arts,Astoria,New York,347-505-3018,Arts In Education,Regrants,Regrant LCB for Queens County/ NYC,30000
2013,Women's Studio Workshop,Rosendale,Ulster,845-658-9133,Arts Education,K-12: In-School Programs,Hands-On Art,20000
2005,Home for Contemporary Theatre and Art,New York,New York,212-647-0202,Individual Artists,Commissions,Suzi Takahashi - Waving Hello,5000
2012,Adirondack Lakes Center for the Arts,Blue Mountain Lake,Hamilton,518-352-7715,State & Local Partnership,General Oper Support,Adk. Lakes Center for the Arts Operating Support,31000
2008,"Catskill Mountain Foundation, Inc.",Hunter,Greene,518-263-2066,State & Local Partnership,Workshops,Sugar Maples Workshops,8000
2007,"Coming Together Festival of Dance and Music, Inc.",New Paltz,Ulster,845-256-9300,Dance,General Operating Support,General Operating Expenses,10500
2010,"Congress for Jewish Culture, Inc.",New York City,New York,212-505-8040,Literature,Literary Magazine Publication,Di Zukunft [The Future],2500
2019,"Musica de Camara, Inc.",New York,New York,718-987-4297,Music,General Support,Musica de Camara General Operating Expenses,5000
2019,Lake George Opera Festival Association Inc,Saratoga Springs,Saratoga,518-584-6018,Music,General Support,General Operating Expenses,60000
2018,"The Playwrights Realm, Inc.",New York,New York,212-255-3089,Theatre,Professional Performances,The Playwrights Realm Production Season,10000
2012,CONSCIENTIOUS MUSICAL REVUES,New York,Staten Isl,800-624-4016,Special Arts Services,Professional Performances,Golden Treasures Concert Series,3000
2010,Architectural League of New York,New York,New York,212-753-1722,Architecture Planning & Design,Independent Projects,Susannah Drake - Drake: The Ecology of Waterfront Architecture (includes $750 for Architectural League),10613
2013,Edward Hopper Landmark Preservation Foundation,Nyack,Rockland,845-358-0774,State & Local Partnership,General Support,General Operating Support,8000
2003,Buffalo Ensemble Theatre,Buffalo,Erie,716-648-2274,Theatre,GENERAL OPERATING SUPPORT,General Operating Expenses,5000
2006,"Center for the Arts at Ithaca, Inc.",Ithaca,Tompkins,607-273-8588,Theatre,General Operating Support,General Operating Expenses,15000
2011,Writers & Books Inc,Rochester,Monroe,585-473-2590,Arts Education,Community-Based Learning,Literary Learning for a Lifetime,12461
2008,Lark Theatre Company Inc,New York,New York,212-246-2676,Theatre,General Operating Support,General Operating Expenses,10000
2013,Women's Studio Workshop,Rosendale,Ulster,845-658-9133,Visual Arts,General Support,General Support,44000
2003,Brooklyn Children's Museum Corporation,Brooklyn,Brooklyn,718-735-4400,Museum,MUSEUM EDUC & INTERPRETATION,Collections Central Public Programs,5000
2008,"Bindlestiff Family Variety Arts, Inc.",Brooklyn,Brooklyn,347-404-0422,Theatre,New Theatre Advancement,Vaudeville in the Catskills,4000
2005,"ROCHESTER CHAPTER of YOUNG AUDIENCES, INC",Rochester,Monroe,585-530-2060,Arts In Education,General Program Support,Project E.S.T.E.E.M. and ESPecial Connections,29200
2010,"Spanish Dance Arts Company, Inc.",New York,New York,212-736-4499,Dance,Long Term Residencies in NYS,Artists' Salaries/Admin. Expenses:3 wk. Long-term Residency@ Kaatsbaan;2 perfs.,19830
2017,Western New York Chamber Orchestra,Fredonia,Chautauqua,716-673-5622,Music,Project Support,WNYCO CLassics Series 2016-2017,10000
2004,Albany Institute of History & Art,Albany,Albany,518-463-4478,Arts In Education,Project-based Planning,Visual Thinking Strategies,3000
2004,Historic Cherry Hill,Albany,Albany,518-434-4791,Museum,General Operating Support,General Operating Expenses,21000
2008,"Artists Space, Inc.",New York,New York,2122263970,Electronic Media & Film,General Program Support,Video Installations & Screenings,10000
2010,Sand Lake Center for the Arts - Circle Thtr Playrs,"Averill Park, NY ",Rensselaer,518-674-2007,Presenting,Presentation,Squire Jacob Concert Series,3000
2018,"The Symphony Space, Inc.",New York,New York,212-864-1414,Literature,Public Programs,Symphony Space Literary Initiatives,28000
2013,Reel Stories Teen Filmmaking Inc.,Brooklyn,Brooklyn,718-768-9000,Arts Education,K-12: In-School Programs,Reel Works In Schools,10000
2009,Arts in Orange,Port Jervis,Orange,845-956-0005,State & Local Partnership,Information Services,Quartely Cultural Arts Newspaper,6600
2004,Minisink Valley Historical Society,Port Jervis,Orange,845-856-2375,State & Local Partnership,Information Services,Arts Community Grants of Orange County - Quarterly Arts Newspaper,5000
2010,The Farmers' Museum,Cooperstown,Otsego,607-547-1412,Museum,General Operating Support,General Operating Expenses,25000
2007,Friends & Enemies of New Music,New York,New York,212-749-1324,Music,Professional Performances,Friends & Enemies of New Music Concert Season,4725
2005,"Alliance for the Arts, Inc.",New York,New York,212-947-6340,State & Local Partnership,General Operating Support,General Operating Expenses,14900
2013,The Jewish Museum,New York,New York,212-423-3334,Museum,General Support,General Operating Expenses,50340
2009,Garth Fagan Dance,Rochester,Monroe,585-454-3260,Special Arts Services,Instruction and Training,Scholarship Program for Students of Color,28100
2010,Irish Repertory Theatre Co Inc,New York,New York,212-255-0270,Theatre,General Operating Support,General Operating Expenses,16600
2006,National Trust for Historic Preservation in the US,Tarrytown,Westchester,914-303-6836,Museum,Collections Care & Research,Textile and Costume Cataloging ,5000
2008,Albany Public Library,Albany,Albany,518-427-4346,Architecture Planning & Design,Adaptive Use Studies,Delaware Branch Library,20000
2004,Urban Arts Partnership,New York,New York,212-966-5881,Arts In Education,ESP IMPLEMENTATION: Lvl 2,Partnership with West Side Collaborative M.S.,7650
2013,New York Folklore Society,Schenectady,Schenectady,518-346-7008,Arts Education,Community-Based Learning,Community Cultural Documentation of Schenectady,7900
2012,"Avant Media Performance, Inc.",Brooklyn,Brooklyn,212-372-3326,Music,Professional Performances,2012 Avant Music Festival,2500
2012,Council of Literary Magazines and Presses,New York,New York,212-741-9110,Literature,Services to the Field,NYS TA Program for Literary Publishers (NYTAP),22390
2015,"Time & Space Limited Theatre Co., Inc.",Hudson,Columbia,518-822-8448,Electronic Media & Film,Screenings,TSL Movie Series,5000
2008,Roxbury Arts Group Inc.,Roxbury,Delaware,607-326-7908,State & Local Partnership,General Operating Support,General Operating Expenses,39900
2007,"The Center for Book Arts, Inc.",New York,New York,212-481-0295,Literature,Public Programs,Broadsides Reading Series - Writers Fees & Promotion,1575
2005,Genesee Valley Council on the Arts,Mount Morris,Livingston,585-243-6785,Decentralization,Regrants,Community Arts Grants,42600
2004,BRONX ARTS ENSEMBLE INC,Bronx,Bronx,718-601-7399,Arts In Education,S-W Impr Implementation: Yr 3,Reading through the Arts PS 156,13000
2016,"Paul Taylor Dance Foundation, Inc.",New York,New York,646-214-5811,Dance,General Support,General Operating Support,68000
2007,"HUDSON VALLEY SHAKESPEARE FESTIVAL, INC",Cold Spring,Putnam,845-809-5750,Theatre,General Operating Support,General Operating Expenses,11655
2019,Adirondack Lakes Center for the Arts,Blue Mountain Lake,Hamilton,518-352-7715,Theatre,Professional Performances,Adirondack Lakes Summer Theatre festival ,10000
2006,"Spanish Theatre Repertory Company, Ltd",New York,New York,212-225-9934,Capital Projects,Capital Equipment Purchase,Purchase of Automated Lighting Instruments,50000
2004,"New Community Cinema Club, Inc.",Huntington,Suffolk,631-423-7610,Electronic Media & Film,General Operating Support,General Operating Expenses,45900
2019,Children's Museum of the East End,Bridgehampton,Suffolk,631-537-8250,Regional Economic Development,Facilities (Large),Childrens Museum of the East End Riverside Expansion,302400
2012,Mount Gulian Society,Beacon,Dutchess,845-831-8172,Museum,Project Support,"School Program: The James F. Brown Story, Phase 3",5420
2014,Circus Amok Inc,Brooklyn,Brooklyn,347-743-7880,Individual Artists,Theatre Artist Commissions,Gregory Corbino - Gregory Corbino to design Circus Amok production,5400
2017,Community Arts Partnership of Tompkins County,Ithaca,Tompkins,607-273-5072,State & Local Partnership,Regrants,"Decentralization Grants ($25,920 Admin/$60,480 Regrants)",86400
2012,Burchfield Penney Art Center,Buffalo,Erie,716-878-5565,Electronic Media & Film,General Exhibition,Eyes of the Skin: Art of the Senses,4000
2012,George Eastman Museum,Rochester,Monroe,585-327-4937,Museum,General Oper Support,Eastman House Operating Support,64000
2003,Dancing Crane Inc.,Brooklyn,Brooklyn,914-522-3888,Music,PROFESSIONAL PERFORMANCES,3 Concerts of trad. Folk Songs & City Songs of Georgia **PER CAPITA**,2500
2008,Gardner's Pick of the Crop Inc,Silver Creek,Chautauqua,716-934-0515,Dance,General Operating Support,General Operating Expenses,12300
2012,"The Center for Urban Pedagogy, Inc.",Brooklyn,Brooklyn,718-596-7721,Arts Education,Community-Based Learning,Urban Investigations at AUP and UASCJ,8100
2005,Rockland Center for the Arts,West Nyack,Rockland,845-358-0877,Visual Arts,Exhibitions & Installations,Exhibition Season at Rockland Center for the Arts,4000
2008,Polish American Folk Dance Company,Brooklyn,Brooklyn,212-662-0553,Special Arts Services,Professional Performances,Touring Community Performances,9200
2020,"Fourth Arts Block, Inc.",New York,New York,917-587-6889,State & Local Partnership,General Support,Lower East Side Cultural Programs,10000
2005,White Pine Inc,Buffalo,Erie,716-573-8202,Literature,Translation,Echoing Song,1500
2003,Elaine Kaufman Cultural Center,New York,New York,212-501-3357,Arts In Education,ESP IMPLEMENTATION: Lvl 3 Yr 1,Kaufman Center Partnership with Manhattan School for Children,25000
2019,"THE FLEA THEATER, INC",New York,New York,212-226-0051,Facilities,Capital Equipment (Facilities),Projection Equipment for The Flea,49500
2009,Asia Society,New York,New York,212-327-9235,Presenting,Presentation,Artist Fees and Expenses-15 Performances,14000
2016,Parents Promoting Dance,Syracuse,Onondaga,315-412-9885,Special Arts Services,General Support,DTS Capacity Building Initiative,20000
2006,Hamptons International Film Festival,East Hampton,Suffolk,631-324-4600,Electronic Media & Film,Workspace Facilities,Kid's Day at HIFF,2500
2012,Desipina Productions Inc.,Brooklyn,Brooklyn,718-986-7828,Theatre,New Theatre Advancement,Desipina Performance Season,3050
2003,"Society of the Educational Arts, Inc.",New York,New York,212-529-1545,Theatre,PROFESSIONAL PERFORMANCES,SEA @ Los Kabayitos Puppet & Children's Theater SEAson 2001-2004,7875
2013,"The Performance Zone, inc.",New York,New York,212-691-6969,State & Local Partnership,General Support,General Support,31000
2009,Asia Society,New York,New York,212-327-9235,Museum,General Program Support,Asia Society Museum,28000
2012,The Farmers' Museum,Cooperstown,Otsego,607-547-1412,Folk Arts,Presentation,Folk Traditions of Central New York,3800
2014,Historic Hudson Valley,Pocantico Hills,Westchester,914-366-6954,Museum,General Support,General Support for Historic Hudson Valley ,42000
2007,"Canticorum Virtuosi, Inc.",Brooklyn ,New York,914-582-3915,Music,General Operating Support,General Operating Expenses,9450
2006,Oysterponds Historical Society,Orient,Suffolk,631-323-2480,Museum,General Operating Support,General Operating Expenses,9200
2004,Lake George Opera Festival Association Inc,Saratoga Springs,Saratoga,518-584-6018,Music,General Operating Support,General Operating Expenses,27000
2017,Abingdon Theatre Company,New York,New York,212-868-2055,Theatre,General Support,Abingdon Theatre Company General Operating Support,15000
2011,"TOPAZ ARTS, Inc.",Woodside,Queens,718-505-0440,Dance,Services to the Field,TOPAZ ARTS Technical Services,4154
2012,Syracuse Society for New Music,Syracuse,Onondaga,315-446-5733,Music,General Oper Support,40th season of new music concerts,8000
2019,"The Western Wind Vocal Ensemble, Inc",New York,New York,212-873-2848,Music,General Support,General Operating Support ,13000
2003,"Chinese Theatre Works, Inc",Long Island City,Queens,917-723-3548,Arts In Education,ESP IMPLEMENTATION: Lvl 2,I.S. 230 Residency,6000
2011,Bronx Dance Theatre,Bronx,Bronx,718-364-2725,Special Arts Services,General Operating Support,General Operating Expenses,28186
2011,Arts Council for Wyoming County,Perry,Wyoming,585-237-3517,State & Local Partnership,Regrants,"Decentralization Grant Program. Administration: $9,360.  Regrant:$21,497",30857
2008,"THE CAPOEIRA FOUNDATION, INC",New York,New York,212-382-0555,Folk Arts,Presentation,Annual Batizado,6400
2013,"The Historic Districts Council, Inc.",New York,New York,212-614-9107,Architecture + Design,General Support,General Operating Expenses,14330
2003,Pember Library & Museum,Granville,Washington,518-642-1515,Museum,GENERAL PROGRAM SUPPORT,Pember Museum,9900
2017,"Geva Theatre Center, Inc.",Rochester,Monroe,585-420-2036,Theatre,General Support,Geva Theatre Center General Operating Support,35000
2020,The Laundromat Project Inc,New York,New York,718-218-4694,Regional Economic Development,Workforce Investment,Workforce Expansion,15000
2010,"American Documentary, POV",Brooklyn,New York,212-989-8121,Electronic Media & Film,General Operating Support,General Operating Expenses,60000
2005,"Geva Theatre Center, Inc.",Rochester,Monroe,585-420-2036,Arts In Education,Project-based Implementation,Dance*Drama*Discover: Learning in 3D,10000
2013,Lighthouse International,New York,New York,347-453-5688,Music,Community Music Schools,Youth and Adult Comprehensive Music Programs,7500
2011,"Groundswell Community Mural Project, Inc.",Brooklyn,Brooklyn,718-254-9782,Arts Education,K-12: Implementation,Rikers Island Academy ,9989
2014,Center for Arts Education Inc.,New York,New York,212-239-7816,Arts Education,General Support,General Support Educating in and through the arts,24700
2007,Azure Ensemble^The,New York,New York,646-734-9577,Music,Professional Performances,Concert Season,2500
2017,"Learning Through an Expanded Arts Program, Inc",New York,New York,212-769-4160,Regional Economic Development,Implementation,22X,45000
2020,"Rosie's Theater Kids, Inc.",New York,New York,646-434-2781,Arts Education,Pre-K-12: In-School Programs,PS Broadway,8000
2018,"Musical Associates of Central New York, Inc.",Syracuse,Onondaga,315-299-5598,Regional Economic Development,Arts and Cultural Impact - FOCUS 2: Women's Suffrage Commemoration,Celebrating the Centennial of the Suffrage Movement,65000
2004,Staten Island Historical Society,Staten Island,Staten Isl,718-351-1611,Museum,General Operating Support,General Operating Expenses,16300
2018,Theater Mitu Inc.,Brooklyn,New York,646-543-6488,Individual Artists,Composer Commissions,Ada Westfall Cochran - Ada Westfall Cochran: REMNANT,10000
2010,"TRANSART & Cultural Services, Inc.",West Park,Ulster,845-384-6350,Special Arts Services,General Program Support,On-going core programs,22250
2007,"The Rajkumari Cultural Center, Inc.",Richmond Hill,Queens,646-240-9917,State & Local Partnership,Workshops,Indo-Caribbean Multi-Arts Workshops ,5250
2012,"Art Resources Transfer, Inc.",New York,New York,212-255-2919,Literature,Services to the Field,The Poulin Project Literary Book Redistribution in NYS,7520
2013,"Ensemble 212, Inc.",New York,New York,646-244-5601,Music,Professional Performances,2010-11 Concert Season,4480
2003,"Chinese Music Ensemble of New York, Inc.",New York,New York,646-886-7888,Folk Arts,PRESENTATION,Lecture Demonstration of Traditional Chinese Music,8100
2008,"Quintet of the Americas, Inc.",Douglaston,Queens,718-230-5189,Music,General Operating Support,General Operating Expenses,10000
2013,Genesee-Orleans Regional Arts Council,Batavia,Genesee,585-343-9313,State & Local Partnership,Regrants,"DEC Arts Regrant: Genesee & Orleans ($20,700 Admin/$48,300 Regrants)",69000
2008,Ifetayo Cultural Arts Academy,Brooklyn,Brooklyn,718-856-1123,Arts In Education,ESP School-Wide Arts Planning,Ifetayo Arts in Education at P.S. 139,10000
2014,Wave Farm,Acra,Greene,518-622-2598,Individual Artists,Film & Media / New Tech Prod.,Tali Hinkis-Lapidus - iParade,22450
2014,"New Federal Theatre, Inc.",New York,New York,212-353-1176,Theatre,General Support,General Operating Support,31200
2008,Dance Continuum Inc.,New York,New York,212-219-0005,Dance,General Operating Support,General Operating Expenses,17300
2014,Lower Adirondack Regional Arts Council (LARAC),Glens Falls,Warren,518-798-1144,State & Local Partnership,Regrants,"DEC Arts Regrant: Warren & Washington ($30,000 Admin/$69,000 Regrants)",99000
2018,Vineyard Theatre and Workshop Center Inc.,New York,New York,212-353-3366,Theatre,General Support,Vineyard Theatre's 2016-2017 Season,19000
2020,The New Stage Theatre Company,New York,New York,917-297-0469,Individual Artists,Theatre Artist Commissions,Federico Restrepo - Individual Artists: Federico Restrepo,8000
2007,SoundArt Foundation Inc,Stottville,Columbia,518-828-0131,Music,Professional Performances,DownTown Ensemble Performances,2100
2010,Bronx House Inc,Bronx,Bronx,718-792-1800,Music,Community Music Schools,General Operating Support,7404
2017,"Arts Center and Theatre of Schenectady, Inc.",Schenectady,Schenectady,518-382-3884,Presenting,General Support,General Operations ,30000
2013,"Downtown Music at Grace, Inc.",White Plains,Westchester,914-949-0384,Presenting,Presentation,Performing Arts Series,3760
2005,"National Dance Institute, Inc.",New York,New York,212-226-0083,Capital Projects,Capital Equipment Purchase,Rehearsal and Performance Hardware,14000
2010,Soho Think Tank Inc,New York,New York,212-675-6447,Presenting,Presentation,Soho Think Tank Presents and ICE FACTORY Festival-minimum of 24 performances,5000
2012,"Friends of the High Line, Inc.",New York,New York,212-206-9922,Visual Arts,Exhibitions & Installations,High Line Art,7520
2020,"INTA, Inc.",New York,New York,646-239-8591,Dance,Professional Performances,Eiko Otake at Skirball,10000
2011,Council of Literary Magazines and Presses,New York,New York,212-741-9110,Literature,Regrants,"Regrants for NYS Small Publishers $14,900 ;Admin:$3500",18198
2009,"Naked Angels, Ltd.",New York,New York,917-385-1693,Theatre,Professional Performances,The Gospel According to Adam,5000
2005,Arm of the Sea Productions Inc.,Malden-on-Hudson,Ulster,845-246-7873,Theatre,General Operating Support,General Operating Expenses,5200
2009,National Book Foundation Inc.,New York,New York,212-685-0261,Literature,General Program Support,Reading & Writing Programs for Underserved People ,8000
2009,ArteEast. Inc.,Brooklyn,Brooklyn,917-270-4520,Electronic Media & Film,Exhibitions,CinemaEast 2008,10800
2008,"Alhambra, Inc.",New York,New York,347-294-7499,Music,Professional Performances,Sephardic Music Programs - Family & Adult,3500
2004,Katonah Museum of Art,Katonah,Westchester,914-232-9555,Museum,General Program Support,General Program Support,15000
2004,Adirondack Lakes Center for the Arts,Blue Mountain Lake,Hamilton,518-352-7715,Presenting,Presentation,Artists fees  & expenses for 6 performances,8500
2009,Queens Theatre in the Park,Queens,Queens,347-472-3702,Theatre,Professional Performances,Professional Theatre Productions/Performances,13700
2015,African Film Festival,New York,New York,212-352-1720,Electronic Media & Film,Film Festivals and Screenings,"African Film Festival, Inc.",15000
2003,Tioga County Council of the Arts,Owego,Tioga,607-687-0785,Folk Arts,PRESENTATION,Round and Square Dance Series,4450
2004,"Alliance for the Arts, Inc.",New York,New York,212-947-6340,Electronic Media & Film,Preservation,Preservation of AIDS Activist Video,6000
2018,"Racing Thoughts, Inc.",New York,New York,212-226-5109,Dance,Professional Performances,Jane Comfort & Co. 40th Anniversary Retrospective,10000
2016,American Museum of Natural History,New York,New York,212-769-3550,Electronic Media & Film,Film Festivals and Screenings,Margaret Mead Film Festival,11000
2008,"Lake George Arts Project, Inc.",Lake George,Warren,518-668-2616,State & Local Partnership,Administrative Salary Support,administrative support,8100
2008,"Camera News, Inc.",New York,New York,212-947-9277,Electronic Media & Film,General Operating Support,General Operating Expenses,42400
2006,"Dova, Inc.",New York,New York,212-279-3344,Dance,General Operating Support,Reconsideration:General Operating Expenses,5000
2010,The House Foundation for the Arts,New York,New York,212-904-1330,Theatre,General Operating Support,General Operating Expenses,16900
2019,"Metropolitan Opera Association, Inc.",New York,New York,212-870-7396,Music,General Support,The Metropolitan Opera,100000
2013,Museum of Chinese in the Americas,New York,New York,917-484-4143,Special Arts Services,Project Support,Access Arts @ MOCA,20000
2010,Independent Feature Project,Brooklyn,Brooklyn,212-465-8200,Individual Artists,Film & Media / New Tech Prod.,Sabine Kertscher - Telling It Like It Is,12000
2005,George Eastman Museum,Rochester,Monroe,585-327-4937,Electronic Media & Film,Exhibition,Reconsideration:Film Program at the Dryden Theatre,2500
2005,Fence Magazine Inc.,Albany,Albany,518-567-7006,Literature,Literary Magazine Publication,Publication of two issues of Fence,5300
2008,New York City Opera Inc,New York,New York,646-981-1890,Arts In Education,ESP School-Wide Arts Impl,"Partnership with West Side Collaborative Middle School, Year 3",20000
2008,Music Conservatory of Westchester,White Plains,Westchester,914-761-3900,Music,Community Music Schools,Comprehensive Music Education & Community Programs,11300
