Grant Year,Grantee,City,County,Phone,Program,Category,Project Title,Grant Amount
2011,Binghamton Philharmonic Inc.,Binghamton,Broome,607-722-6717,Music,General Operating Support,General Operating Expenses,20769
2016,Smithsonian Institution,New York,New York,212-849-8311,Museum,General Support,"Cooper-Hewitt, National Design Museum General Support",38000
2015,Lighthouse International,New York,New York,347-453-5688,Music,Community Music Schools,Youth and Adult Comprehensive Music Programs,7500
2012,Center for Contemporary Opera,New York,New York,646-481-8110,Music,Professional Performances,"Operating Support, Center for Contemporary Opera",7520
2012,"Arts Mid-Hudson, Inc.",Poughkeepsie,Dutchess,845-454-3222,State & Local Partnership,General Oper Support,General Operating Expenses,29000
2012,"Pascal Rioult Dance Theatre, Inc.",Astoria,New York,212-398-5901,Arts Education,K-12: In-School Programs,6 DanceREACH Residencies,8300
2019,Rochester Institute of Technology,Rochester,Monroe,585-475-7984,Folk Arts,Project Support,"Home Cooking: Newcomer Foodways in Rochester, NY",23000
2013,Irondale Productions Inc.,Brooklyn,Brooklyn,718-488-9233,Individual Artists,Composer Commissions,Walter Thompson - Walter Thompson for Tueurs en SÃ©rie ,5000
2010,"West Kortright Centre, Inc.",East Meredith,Delaware,607-278-5454,Presenting,General Operating Support,General Operating Expenses,20000
2004,Long Island Film Festival Inc,Hauppauge,Suffolk,631-669-2717,Electronic Media & Film,Exhibition,Long Island Film Festival,4200
2010,Meteor Films Inc.,New York,New York,212-675-3924,Individual Artists,Film & Media / New Tech Prod.,Richard Hankin - YOU MUST REMEMBER THIS,8000
2006,"Boys & Girls Club of Newburgh, Inc.",Newburgh,Orange,845-561-4936,Special Arts Services,Instruction and Training,Glenn Hines Visual and Performing Arts Institute,11000
2003,"Black Dimensions in Art, Inc",Albany,Schenectady,518-209-5911,Special Arts Services,EXHIBITIONS,African American Artists of the Capital Region and Beyond,6000
2009,Adirondack Historical Association,Blue Mountain Lake,Hamilton,518-352-7311,Museum,General Operating Support,General Operating Expenses,40000
2003,Council on the Arts & Humanities for Staten Island,Staten Island,Staten Isl,718-447-3329,Decentralization,INSTITUTIONAL DEVELOPMENT,DEC Program towards Development,4000
2005,"The Feminist Press, Inc.",New York,New York,212-817-7916,Literature,Book Publication,Women Writers of the Islamic World,17000
2014,Phoenix Theatre Ensemble,New York,New York,212-465-3446,Theatre,Professional Performances,Phoenix Theatre Ensemble,2864
2011,Lake Placid Association of Music Drama and Art,Lake Placid,Essex,518-523-2512,Presenting,General Program Support,Presentation Series - 70 performances,14340
2008,Big Orbit Gallery Inc,Buffalo,Erie,716-560-1968,Electronic Media & Film,Exhibitions,Two New Media Exhibitions,10000
2008,Friends & Enemies of New Music,New York,New York,212-749-1324,Music,Professional Performances,Friends & Enemies of New Music Concert Season,8000
2018,Utica College,Utica,Oneida,315-223-2464,Literature,Public Programs,Writers' Fees and Promotional Expenses Jackson Lunch Hour Series,2500
2009,VISIONINTOART,New York,New York,917-544-1482,Music,General Operating Support,General Operating Expenses,6000
2007,National Academy of Design,New York,New York,2123694880,Museum,General Program Support,General Program Support,13545
2009,"DEEP Arts, Inc.",Rochester,Monroe,585-752-3174,Theatre,General Operating Support,General Operating Expenses,7800
2007,"Lotus Fine Arts Productions, Inc.",New York,New York,212-627-1076,Folk Arts,Presentation,World in the City: Asian Dialogue in Song & Dance,4850
2018,Center for Exploratory & Perceptual Arts,Buffalo,Erie,716-856-2717,Arts Education,Community-Based Learning,Community Based Art Education,20000
2011,American Folk Art Museum,New York,New York,212-265-1040,Museum,General Operating Support,General Operating Expenses,22154
2007,Everson Museum of Art,Syracuse,Onondaga,315-474-6064,Museum,General Operating Support,General Operating Expenses,46095
2003,"Yara Arts Group, Inc.",New York,New York,212-777-7675,Theatre,PROFESSIONAL PERFORMANCES,Development of Original Musical,7500
2004,Mohawk Valley Center for the Arts,Little Falls,Herkimer,315-823-0808,State & Local Partnership,Workshops,"Workshops/Seminars,Assured Access,Admin.Support",7000
2004,New York Gilbert & Sullivan Players Inc,New York,New York,212-769-1000,Music,General Operating Support,General Operating Expenses,12600
2018,Council on the Arts & Humanities for Staten Island,Staten Island,Staten Isl,718-447-3329,Folk Arts,Regional & Cnty Folk Arts Prg,Staten Island Folklife ,42000
2003,Staten Island Historical Society,Staten Island,Staten Isl,718-351-1611,Museum,GENERAL OPERATING SUPPORT,General Operating Expenses,18500
2009,Young Audiences New York,New York,New York,212-319-9269,Arts In Education,ESP School-Wide Arts Impl,"YANY ESP Partnership with PS 205 in the Bronx, Year 5",20000
2012,New York Gilbert & Sullivan Players Inc,New York,New York,212-769-1000,Music,General Oper Support,2011-2012 NY Season,10000
2004,Renaissance Chinese Opera Soc,New York,New York,212-619-7470,Folk Arts,Presentation,Chinese Opera Presentation,6000
2011,"Earlville Opera House, Inc.",Earlville,Chenango,315-691-3550,Visual Arts,Exhibitions & Installations,EOH Art Galleries,10681
2012,"Fractured Atlas, Inc.",New York,New York,212-277-8020,Theatre,Professional Performances,Banana Bag & Bodice - Banana Bag & Bodice,3000
2003,Luzerne Music Center,Lake Luzerne,Warren,518-696-2771,Music,PROFESSIONAL PERFORMANCES,Artists Fees Chamber Music Series of 8 Concerts,5600
2011,"Musica de Camara, Inc.",New York,New York,718-987-4297,Music,Professional Performances,Concerts at Traditional and Community Venues,7022
2004,Pearl Theatre Company Inc,New York,New York,212-505-3401,Theatre,General Operating Support,General Operating Expenses,8000
2020,PEN American Center Inc.,New York,New York,646-981-0687,Literature,General Support,General Operating Support,13500
2008,SCO Family of Services,Brooklyn,Brooklyn,718-438-9500,Arts In Education,ESP Project-based Impl,Interdisciplinary Arts Partnership with MS 136,12000
2016,MAPP International Productions Inc.,New York,New York,212-473-2288,Individual Artists,Composer Commissions,Dan Moses Schreier - Composer Commission for Dan Moses Schreier,10000
2005,"The Little Orchestra Society/Orpheon, Inc.",New York,New York,212-971-9500,Music,General Operating Support,General Operating Expenses,8000
2018,EPIC Theatre Center Inc.,New York,New York,212-239-1770,Theatre,General Support,Epic Theatre Ensemble's 2018 Season,5000
2003,Elaine Kaufman Cultural Center,New York,New York,212-501-3357,Presenting,PRESENTATION,Artists Fees and Expenses - Minimum 28 Performances,22500
2004,Alternative Literary Programs,Voorheesville,Albany,800-862-2861,Arts In Education,General Program Support,Upstate Language Arts Revelations,35000
2020,Trustees of Union College,Schenectady,Schenectady,518-388-6984,Presenting,Project Support - Presentation,Union College Concert Series 15-concert Season,15000
2019,Center for Contemporary Opera,New York,New York,646-481-8110,Music,General Support,Season Productions,10000
2015,The Flux Factory,Long Island City,Queens,347-379-5821,Visual Arts,General Support,Flux Factory Operating Support,17000
2006,"Theatre Development Fund, Inc.",New York,New York,212-912-9770,Dance,Services to the Field,Dance Subsidy and Dance Voucher Program,11000
2012,Women Make Movies,New York,New York,212-925-0606,Individual Artists,Film & Media / New Tech Prod.,Leslie Harris - I Love Cinema,17500
2015,Western New York Book Arts Collaborative Inc.,Buffalo,Erie,716-348-1430,Visual Arts,Exhibitions & Installations,12x14: Artists in Residence at WNYBAC,10000
2008,"Learning Through an Expanded Arts Program, Inc",New York,New York,212-769-4160,Arts In Education,General Program Support,Exemplary Partnerships,9900
2011,"WaxFactory, Inc.",New York,New York,646-741-2200,Theatre,Professional Performances,WaxFactory's new theatre works,4154
2008,Hundred Grand Dance Foundation,New York,New York,212-925-6573,Dance,Professional Performances,"Artists' Salaries, 4 Performances @ the Clemente Soto Velez  Cultural Center",8500
2011,"Magic Box Productions, Inc.",Pleasantville,Westchester,914-747-0256,Arts Education,K-12: Implementation,Dance in Focus With PS 84 and NYCC,14934
2014,"Lower Manhattan Cultural Council, Inc.",NEW YORK,New York,212-219-9401,Presenting - Multi & Interdisciplinary Arts,Project Support - Presentation,The River To River Festival,20000
2008,"New Phoenix Theatre, Inc.",Buffalo,Erie,716-853-1334,Individual Artists,Composer Commissions,Paul Kozlowksi - Theme 1,5000
2003,New York Festival of Song,New York,New York,646-230-8382,Music,GENERAL OPERATING SUPPORT,General Operating Expenses,11700
2020,"Alpha Omega 1-7 Theatrical Dance Company, Inc.",New York,New York,212-749-0095,Special Arts Services,General Support,General Operating Support,15000
2010,New York Chinese Cultural Center,New York,New York,212-334-3764,Dance,Professional Performances,Artists' Salaries: 2 NYC perfs./ fall 09,7000
2008,Music Conservatory of Westchester,White Plains,Westchester,914-761-3900,Music,Professional Performances,Community Performances: Recital Hall Series,11300
2004,"Camera News, Inc.",New York,New York,212-947-9277,Electronic Media & Film,Exhibition,New York International Latino Film Festival - New York International Latino Film Festival,4000
2020,New York Foundation for the Arts,BROOKLYN,Brooklyn,212-366-6900,Individual Artists,Film & Media / New Tech Prod.,Xiying Yang - The Sunken Garden,13600
2015,"ArtsWestchester, Inc.",White Plains,Westchester,914-428-4220,Presenting - Multi & Interdisc Arts,Project Support - Presentation,Crossing Borders Performance Series,5000
2011,Sweet Jane Productions Inc.  ,Brooklyn,Brooklyn,773-547-8530,Theatre,Professional Performances,Mainstage Theatre Season,6527
2018,"Adirondack Theatre Festival, Inc.",Glens Falls,Warren,518-798-7479,Theatre,General Support,ATF General Operating Support,14000
2012,Society for Pres Weeksville Hist,Brooklyn,Brooklyn,718-756-5250,Arts Education,Community-Based Learning,Artist Residencies for High School Students,5900
2014,"St. Luke's Chamber Ensemble, Inc.",New York,New York,212-594-6100,Arts Education,K-12: In-School Programs,OSL School Partnership Program,10700
2015,Seventh Art Corporation of Ithaca^The,Ithaca,Tompkins,607-398-0263,Electronic Media & Film,General Support,Cinemapolis General Operating Support,5000
2015,Adirondack Architectural Heritage,Keeseville,Clinton,518-834-9328,Architecture + Design,General Support,AARCH General Operating Support,36000
2014,Red Bull Theater Inc,New York City,New York,212-343-7394,Literature,Public Programs,Writers' Fees and Promtional Expenses for Red Bull Theater's Revelation Readings - 10th Year,3200
2008,"Paul Taylor Dance Foundation, Inc.",New York,New York,646-214-5811,Dance,Partnership Projects,American Masterpieces Grant,30000
2008,Dancing Crane Inc.,Brooklyn,Brooklyn,914-522-3888,Music,Professional Performances,Traditional Music of Georgia,6900
2018,Greenwich Village Society for Historic Pres,New York,New York,212-475-9585,Architecture + Design,Project Support,"Education and Public Programs: Lectures, Tours, Kids Ed",14000
2012,Allied Productions Inc,New York,New York,917-774-7989,Electronic Media & Film,General Exhibition,SCREENINGS:Le Petit Versailles Outdoor Film Series,4000
2005,"The Symphony Space, Inc.",New York,New York,212-864-1414,Electronic Media & Film,Exhibition,Films at the Thalia,9800
2018,"Roulette Intermedium, Inc.",Brooklyn,Brooklyn,917-267-0377,Music,General Support,The Concert Series of  New and Adventurous Music,35000
2008,"Ether Sea Projects, Inc",Brooklyn,Brooklyn,718-288-5530,Literature,Book Publication,Single-author book publication,2500
2011,"Bronx Council on the Arts, Inc.",Bronx,Bronx,718-931-9500,Arts Education,Regrants,"Arts Education Regrants. Admin: $ 6,900; Regrant: $ 15,946.",22846
2007,New York Folklore Society,Schenectady,Schenectady,518-346-7008,Folk Arts,Regrants,Folk Arts Professional Internships,5000
2014,"DIEU DONNE PAPERMILL, INC.",Brooklyn,New York,212-226-0573,Visual Arts,General Support,Dieu DonnÃ© Residency and Exhibition Programs,40000
2003,DIA CENTER FOR THE ARTS (D/B/A DIA ART FOUNDATION),New York,New York,212-293-5506,Electronic Media & Film,SERVICES TO THE FIELD,Artist web projects/ Exhib,9000
2005,"The Hudson Valley Writers' Center, Inc.",Sleepy Hollow,Westchester,914-332-5953,Literature,General Operating Support,General Operating Expenses,12700
2012,Scenic Hudson Inc,Poughkeepsie,Dutchess,845-473-4440,Architecture Planning & Design,General Prog Support,Scenic Hudson Planning and Design Initiatives,15000
2014,"BOA Editions, Ltd.",Rochester,Monroe,585-546-3410,Literature,General Support,"BOA Editions, Ltd. General Support",20900
2007,"Bindlestiff Family Variety Arts, Inc.",Brooklyn,Brooklyn,347-404-0422,Theatre,New Theatre Advancement,Bindlestiff brings Vaudeville back to the Catskill,2500
2010,The Universal Theater Alliance,Brooklyn,New York,212-260-2833,Theatre,Professional Performances,The Bone Wars,6600
2006,New York Shakespeare Festival,New York,New York,212-539-8742,Special Arts Services,Instruction and Training,Shakespeare Lab Program Tuition Assistance,20000
2014,Reg Lenna Center For The Arts,Jamestown,Chautauqua,716-664-2465,Visual Arts,Exhibitions & Installations,"3rd On 3rd Gallery, 2013-2014",5000
2013,"Harlem School of the Arts, Inc.",New York,New York,212-926-4100,Special Arts Services,Project Support,HSA Celebrity Series,10000
2011,Women Make Movies,New York,New York,212-925-0606,Individual Artists,Film & Media / New Tech Prod.,Diana Whitten - Vessel,22747
2005,Dancing in the Streets Inc,New York,New York,212-625-3505,Architecture Planning & Design,Workshops,Resonating Frequencies '05,5000
2016,"Fractured Atlas, Inc.",New York,New York,212-277-8020,Theatre,Professional Performances,Sinking Ship Productions - Sinking Ship Productions New Work Program,7500
2004,"Labyrinth, Inc",New York,New York,212-513-1014,Theatre,Professional Performances,The Fairy Tale Project,7500
2016,Friends of Materials for the Arts,Long Island City,Queens,718-729-2029,Arts Education,K-12: In-School Programs,Mixed-Media Arts and Music Residency,10000
2011,Community Arts Partnership of Tompkins County,Ithaca,Tompkins,607-273-5072,Literature,Public Programs,Regional Literary Celebration Writers' Fees & Promotion,2472
2011,INACTIVE Pone Ensemble for New Music,New Paltz,Ulster,845-255-0609,Music,Professional Performances,Pone Ensemble for New Music Concert Series,3857
2009,Putnam Arts Council,Mahopac,Putnam,845-803-8622,State & Local Partnership,General Operating Support,General Operating Expenses,30000
2005,"Harvestworks, Inc.",New York,New York,212-431-1130,Electronic Media & Film,Services to the Field,New Technologies: The Intersection of Music and Sound Art ,7000
2005,Queens Symphony Orchestra Inc,Flushing,Queens,917-273-6232,Music,General Operating Support,Reconsideration:General Operating Expenses,2500
2011,Frederick Douglass Creative Arts,New York,New York,212-864-3375,Special Arts Services,General Program Support,"Six workshops in acting, directing and playwriting; 12 Staged Readings",8308
2006,Art Resources for Teachers & Students,New York,New York,212-962-8231,Arts In Education,ESP Project-based Impl,Partnership with P.S. 124(Manhattan),5000
2009,The Historical Society of Rockland County,New City,Rockland,845-634-9629,Museum,General Operating Support,General Operating Expenses,10000
2014,"Arts Guild of Old Forge, Inc.",Old Forge,Herkimer,315-369-6411,State & Local Partnership,Workshops,Multi-Disciplinary Workshop Program,6400
2004,"Bloomingdale School of Music, Inc.",New York,New York,212-663-6021,Music,Community Programs/Outreach,General School Support,10000
2009,inCollaboration Incorporated,LIC,Queens,718-391-0354,Arts In Education,ESP School-Wide Arts Planning,Creating an ESP program with MS 223X,11000
2017,Genesee-Orleans Regional Arts Council,Batavia,Genesee,585-343-9313,State & Local Partnership,General Support,Genesee-Orleans Reg Arts Cncl-General Support,25000
2005,Manhattan Ensemble Theater,New York,New York,212-243-6161,Theatre,New Theatre Advancement,Production Season,3300
2014,Polish American Folk Dance Company,Brooklyn,Brooklyn,212-662-0553,Special Arts Services,Professional Performances,Polish Folk Dances Touring Community Performances,7000
2004,Council on the Arts & Humanities for Staten Island,Staten Island,Staten Isl,718-447-3329,Decentralization,Regrants,Staten Island Decentralization Program ,64800
2011,Akwesasne Library & Museum Cultural Center Inc.,Hogansburg,Franklin,518-358-2240,Special Arts Services,Instruction and Training,Akwesasne Museum Traditional Arts Classes,12560
2006,Los Pleneros De La 21,New York,New York,212-427-5221,Folk Arts,General Operating Support,General Operating Expenses,32500
2018,"great small works, inc.",New York,New York,917-319-8104,Special Arts Services,Project Support,Aftselakhis Spectacle Committee,15750
2009,Das Puppenspiel Puppet Theatre,Westfield,Chautauqua,716-326-2611,Theatre,General Operating Support,General Operating Expenses,14700
2016,"The Lit Fund, Inc.",Astoria,Queens,917-626-1369,Regional Economic Development,Workforce Investment,Executive Director Position,32000
2013,"Downtown Community Television Center, Inc.",New York,New York,646-484-4633,Arts Education,Community-Based Learning,DCTV's PRO-TV free media arts training for youth,18000
2017,Van Alen Inst: Projects in Public Architechture,New York,New York,212-924-7000,Architecture + Design,Independent Projects,Ellen Neises - Neises: Levee Lab Prototype,10750
2009,Theater Breaking Through Barriers Corp.,New York,New York,212-243-4337,Theatre,General Operating Support,General Operating Expenses,11800
2005,Long Island Baroque Ensemble,Greenport,Suffolk,917-406-3194,Music,General Operating Support,General Operating Expenses,16500
2020,Buffalo Erie County Public Library,Buffalo,Erie,716-858-8050,Literature,Public Programs,Reading Park Writers Series,6500
2014,The Dance Ring Inc.,New York,New York,917-653-2116,Special Arts Services,Instruction and Training,LIFT Dance Training Program,15000
2015,"Indo-American Arts Council, Inc",New York,New York,212-951-7395,Electronic Media & Film,Film Festivals and Screenings,New York Indian FIlm Festival (NYIFF),11000
2017,"Lake George Arts Project, Inc.",Lake George,Warren,518-668-2616,Visual Arts,Exhibitions & Installations,Courthouse Gallery Exhibitions,5000
2016,LEAGUE OF PROFESSIONAL THEATRE WOMEN,New York,New York,646-342-2060,Theatre,Services to the Field,PROF DEV & ADVOCACY FOR WOMEN THEATRE ARTISTS,7200
2003,Ukrainian Museum,New York,New York,212-228-0110,Museum,GENERAL OPERATING SUPPORT,General Operating Expenses,14700
2011,Playwrights Horizons Inc.,New York,New York,212-564-1235,Theatre,General Operating Support,General Operating Expenses,49450
2018,American Museum of the Moving Image,Astoria,Queens,718-777-6827,Museum,General Support,General Operating Support,44000
2014,Albany Institute of History & Art,Albany,Albany,518-463-4478,Arts Education,K-12: In-School Programs,Book Arts in Troy and Albany,16600
2003,Theatre for a New Audience,New York,New York,212-229-2819,Theatre,GENERAL OPERATING SUPPORT,General Operating Expenses,18000
2011,Genesee-Orleans Regional Arts Council,Batavia,Genesee,585-343-9313,State & Local Partnership,Regrants,"Decentralization Regrant Funds.  Administration: $16,830; Regrant: $38,653.",55483
2007,Sharon Springs Citizens Cncl Arts,Sharon Springs,Schoharie,518-234-2782,Presenting,Presentation,SSCCA Music and Theater Festivals-  6 performances,3650
2007,"The Symphony Space, Inc.",New York,New York,212-864-1414,Music,General Program Support,Music Programs at Symphony Space,19000
2010,Council of Literary Magazines and Presses,New York,New York,212-741-9110,Stabilization,Stabilization,Stabilization Grant,4300
2009,"Look & Listen, Inc.",Brooklyn,Brooklyn,561-212-4650,Music,Professional Performances,Look & Listen Festival,3300
2006,Friends of the Mozartina^The,Tarrytown,Westchester,914-631-3390,Music,Professional Performances,2006 Chamber Music Series,2500
2018,Elaine Kaufman Cultural Center,New York,New York,212-501-3357,Presenting,Project Support - Presentation,Presentations in Merkin Concert Hall,9500
2004,Women's Project & Productions Inc,New York,New York,212-765-1706,Theatre,General Operating Support,General Operating Expenses,12800
2010,George Eastman Museum,Rochester,Monroe,585-327-4937,Capital Projects,Capital Grants,Storm Window Replacement,39956
2004,"SONORA HOUSE, INC.",New York,New York,212-561-0283,Arts In Education,Project-based Implementation,Musical Infusion - New Music  in Classes at PS27,6000
2006,Landmark West,New York,New York,212-496-8110,Architecture Planning & Design,Publication,LANDMARK WEST! Newsletter,10000
2015,Buffalo Fine Arts Academy,Buffalo,Erie,716-270-8237,Museum,General Support,General Operating Support,64000
2007,George Eastman Museum,Rochester,Monroe,585-327-4937,Digitization,Digitization Projects,Accessibility of Negative Archives,50000
2017,"Sylvan Winds, Inc.",New York,New York,212-662-0433,Music,Project Support,Sylvan Winds NYC Concert Series ,12000
2018,Foundation for Independent Artists Inc.,New York,New York,212-278-8111,Dance,Professional Performances,"Foundation for Independent Artists, Inc. - Dance Heginbotham's New York Performance Season",10000
2011,"So Percussion, Inc.",Brooklyn,Brooklyn,410-375-0007,Music,Professional Performances,2010/2011 Concert Season,7418
2019,"Seventh Regiment Armory Conservancy, Inc.",New York,New York,212-933-5804,Regional Economic Development,Workforce Readiness,Workforce Readiness Expansion of Armory Youth Corps Program,75000
2008,Deep Listening Institute Ltd.,Kingston,Ulster,845-338-5984,Music,General Operating Support,General Operating Expenses,12000
2004,"Harlem Theatre Company, Inc.",New York,New York,212-281-0130,Theatre,Services to the Field,Subsidized Rehearsal Space for Arts Groups,3000
2015,VISIONINTOART,New York,New York,917-544-1482,Music,General Support,General Operating Support,13000
2011,"Parallel Exit, Inc.",Brooklyn,Brooklyn,917-407-7537,Theatre,New Theatre Advancement,A new piece by Parallel Exit,2868
2012,"Flushing Council on Culture and the Arts, Inc.",Flushing,Queens,718-463-7700,State & Local Partnership,General Oper Support,General Operating Support,36000
2017,Make Music New York Inc.,Astoria,Queens,646-320-7710,Music,Services to the Field,Make Music New York,5000
2013,Locrian Chamber Players,Ossining,Westchester,914-923-5511,Music,General Support,Locrian Chamber Players 2011-2012 Season,5000
2004,"TOPAZ ARTS, Inc.",Woodside,Queens,718-505-0440,Dance,Rehearsal Space,"Provision Of Low-Cost Reh Space(1,200 hrs to 30 Dnc Cos.)",3000
2010,"Dynamic Forms, Inc.",New York,New York,212-375-9214,Arts Education,Services to the Field,Teaching Artist Training Institute Collaboration ,11000
2009,Buffalo Fine Arts Academy,Buffalo,Erie,716-270-8237,Literature,Public Programs,Nickel City Poetry Slam Series,4900
2004,Stony Brook Foundation Inc.,Stony Brook,Suffolk,631-324-4929,Museum,Museum Educ & Interpretation,Museum and classroom art workshops,5000
2018,New York Folklore Society,Schenectady,Schenectady,518-346-7008,Folk Arts,Regrants,The American Folklore Society in Buffalo,25000
2016,Genesee-Orleans Regional Arts Council,Batavia,Genesee,585-343-9313,Folk Arts,Regional & Cnty Folk Arts Prg,Regional Traditional Arts Program,38000
2013,"Alvin Ailey Dance Foundation, Inc.",New York,New York,212-405-9035,Dance,Rehearsal Space,"Ailey Studio Rehearsal Subsidy: 1,200 hours ($10/hr.) for 50 nonprofit dance companies/artists",9050
2014,The New Stage Theatre Company,New York,New York,917-297-0469,Individual Artists,Theatre Artist Commissions,Federico Restrepo - Federico Restrepo: Cosmicomics,7500
2008,NATIONAL GUILD FOR COMMUNITY ARTS EDUCATION,New York,New York,212-268-3337,State & Local Partnership,Services to the Field,Professional Development for New York Members,4600
2020,Colgate University,Hamilton,Madison,315-228-7457,Electronic Media & Film,Film Festivals and Screenings,Alternative Cinema,6000
2012,Rush Philanthropic Arts Foundation,New York,New York,646-779-1140,Arts Education,K-12: In-School Programs,Rush Education programs,8800
2012,"Westhampton Beach Performing Arts Center, Inc.",Westhampton Beach,Suffolk,631-288-2350,Presenting,Presentation,Minimum 30 Performances. for Youth & Families,4840
2007,Walter Elwood Museum of the Mohawk Valley,Amsterdam,Montgomery,518-843-5151,Museum,Exhibitions,Discovery: A Family Learning Exhibition,18500
2003,Music Outreach-Lrning Thru Msc,New York,New York,212-316-2000,Special Arts Services,PROFESSIONAL PERFORMANCES,A Series of Free Orchestral Concerts for Young People,20000
2008,NYS Rhythm & Blues Festival,Syracuse,Onondaga,315-952-1259,Presenting,Presentation,"New York State Blues Week In Syracuse, NY",16000
2009,Metro Justice of Rochester Inc,Rochester,Monroe,585-325-2560,Electronic Media & Film,General Program Support,T V Dinner,11400
2004,Place in History,Brooklyn,Brooklyn,917-981-5481,Architecture Planning & Design,Exhibition,LIC Grounded: Public Art in Context,10000
2012,Wave Farm,Acra,Greene,518-622-2598,Electronic Media & Film,Regrants,Distribution for New York State Artists,54100
2016,"Beth Morrison Projects, Inc.",Brooklyn,New York,646-682-7181,Theatre,Services to the Field,PROTOTYPE: OPERA | THEATRE | NOW,5000
2003,Staten Island Instituteof Art and Science,Staten Island,Staten Isl,718-483-7114,Museum,COLLECTIONS MANAGEMENT,Online Catalogue of the Permanent Collection,7000
2015,Queens Symphony Orchestra Inc,Flushing,Queens,917-273-6232,Music,General Support,General Operating Support,25000
2019,"Road Less Traveled Productions, Ltd.",Buffalo,Erie,716-352-5877,Regional Economic Development,Facilities (Mid-Size),Capital Equipment,100000
