Grant Year,Grantee,City,County,Phone,Program,Category,Project Title,Grant Amount
2011,"Town Hall Foundation, Inc.",New York,New York,212-997-1003,Presenting,Presentation,Town Hall Presenting Season Artist Fees & Expenses,6231
2005,Inoue Chamber Ensemble Inc,New York,New York,212-864-6459,Special Arts Services,Professional Performances,Two Community Concerts,2500
2016,Association of Independents in Radio Inc,New York,New York,510-604-4858,Electronic Media & Film,"Workspace, Art & Technology",Full Spectrum Storymaking Intensive,10000
2016,Hundred Grand Dance Foundation,New York,New York,212-925-6573,Dance,Professional Performances,Artist Salaries; NYC Performance Season,7000
2012,"Ugly Duckling Presse, Ltd.",Brooklyn,Brooklyn,218-259-6081,Literature,Translation,Keith Gessen - The Poems and Essays of Kirill Medvedev,2500
2005,The Jewish Heritage Writing Project Inc.,New York,New York,212-925-9067,Literature,General Operating Support,General Operating Expenses,6500
2011,"Tonawandas' Council on the Arts, Inc.",North Tonawanda,Niagara,716-694-4400,State & Local Partnership,Regrants,"Arts Niagara Decentralization Regrant. Administration:$ 10,500; Regrant:$ 24,412.",34912
2007,Central NY Community Arts Council,Utica,Oneida,315-724-1113,State & Local Partnership,General Operating Support,General Operating Expenses,47670
2016,Saratoga International Theater Institute,New York,New York,212-868-0860,Theatre,General Support,General Operating Support,8312
2015,"Yara Arts Group, Inc.",New York,New York,212-777-7675,Literature,Translation,Virlana Tkacz - Taras Shevchenko's Poetry,3480
2016,The Jazz Gallery,New York,New York,212-861-5617,Presenting - Multi & Interdisc Arts,General Support,Directions in 21st Century Jazz,25000
2005,"The Ellen Sinopoli Dance Company, Inc.",Troy,Rensselaer,518-408-1341,Dance,General Operating Support,General Operating Expenses,8300
2007,"NIGHTBOAT BOOKS, INC.",Brooklyn,Brooklyn,718-930-1062,Literature,Book Publication,Radical Love: Collected Novels by Fanny Howe,2500
2018,Lake Placid Association of Music Drama and Art,Lake Placid,Essex,518-523-2512,State & Local Partnership,General Support,General Operating Support,50000
2010,"National Black Theatre Workshop, Inc.",New York,New York,212-926-1049,Special Arts Services,Professional Performances,NBT Performances,35000
2012,"THE CAPOEIRA FOUNDATION, INC",New York,New York,212-382-0555,Arts Education,K-12: In-School Programs,DanceBrazil in NYC Public Schools,7500
2005,Swiss Institute,New York,New York,212-925-2035,Visual Arts,Special Projects,SI New York Emerging Artist Project,3000
2004,Ulster Performing Arts Center,Kingston,Ulster,845-331-1613,Presenting,Presentation,Artists fees and presenting costs - Minimum 7 performances,3800
2018,"Jewish Community Center of Greater Rochester, Inc.",Rochester,Monroe,585-461-2000,Theatre,Professional Performances,CenterStage Theatre,6000
2011,"Loco-Motion Dance Theatre for Children, Inc.",Brooklyn,New York,212-995-9027,Arts Education,Community-Based Learning,Dance Scholarship Fund,8308
2009,"Dynamic Forms, Inc.",New York,New York,212-375-9214,Arts In Education,ESP School-Wide Arts Impl,"PS 142 Partnerships in Literacy through Dance, Year 3",40000
2018,"ArtsWestchester, Inc.",White Plains,Westchester,914-428-4220,State & Local Partnership,Regrants,"Arts Alive Rockland and Westchester Decentralization Regrant ($45,000 Admin; $105,000 Regrants)",150000
2013,"One Year Lease, Incorporated",Brooklyn,New York,646-247-6226,Theatre,Professional Performances,New Theatre Advancement,3000
2008,Music Associates of New York,Bay Terrace,Queens,516-538-2554,Music,General Operating Support,General Operating Expenses,4600
2004,Brooklyn Economic Development,Brooklyn,Brooklyn,718-368-6790,Electronic Media & Film,Exhibition,Williamsburg Brooklyn Film Festival (WBFF) - 7th Williamsburg Brooklyn Film Festival,6500
2004,Center for Exploratory & Perceptual Arts,Buffalo,Erie,716-856-2717,Visual Arts,General Operating Support,General Operating Expenses,45000
2005,Cornell University,Ithaca,Tompkins,607-255-6306,Museum,Exhibition,Taboo and the Power of Transgression in Contemporary Indonesian Art,12000
2013,"Woodstock Artists Association, Inc.",Woodstock,Ulster,8456792940,Museum,Project Support,Public Programs:Education and Lecture Series,9489
2012,"Treehouse Shakers, Inc.",New York,New York,212-715-1914,Theatre,Professional Performances,New York Performance Season,3000
2008,Theatre for a New Audience,New York,New York,212-229-2819,Arts In Education,ESP Project-based Impl,"World Theatre Project @ New Voices Academy, Sunset Park, Brooklyn",7000
2003,"Ballet Tech Foundation, Inc.",New York,New York,212-777-7710,Dance,GENERAL OPERATING SUPPORT,General Operating Expenses,9000
2009,"Franklin Furnace Archive, Inc.",Brooklyn,Brooklyn,718-687-5800,Visual Arts,General Operating Support,General Operating Expenses,49300
2013,Friends of Materials for the Arts,Long Island City,Queens,718-729-2029,Arts Education,K-12: In-School Programs,Mixed-Media Puppet Residency,10000
2008,New York New Music Ensemble,New York,New York,919-830-5908,Music,General Operating Support,General Operating Expenses,6200
2011,Association of Independents in Radio Inc,New York,New York,510-604-4858,Electronic Media & Film,Workspace Facilities,Creative Sound Assemblage (V),6626
2015,"The Western Wind Vocal Ensemble, Inc",New York,New York,212-873-2848,Music,General Support,General Operating Support for The Western Wind ,13000
2018,"Asian American Writers Workshop, Inc.",New York,New York,212-494-0061,Special Arts Services,Project Support,AAWW Community Programs,12500
2006,old fort niagara association inc.,Youngstown,Niagara,716-745-7611,Museum,General Operating Support,General Operating Expenses,14600
2008,Salvadori Center Ltd.,New York,New York,212-870-3970,Arts In Education,ESP School-Wide Arts Planning,"Muscota New School,  School #314, Washington Heights, Manhattan/Salvadori Partnership",15000
2005,Association Adv Crea Musicians NYC,New York,New York,212-594-7121,Music,General Operating Support,General Operating Expenses,9000
2005,Jacob Burns Film Center,Pleasantville,Westchester,914-773-7663,Architecture Planning & Design,Adaptive Use Studies,Feasability Study for JBFC Education Center ,20000
2013,China Institute in America,New York,New York,212-744-8181,Museum,Project Support,Exhibition: New China: Contemporary Porcelain from Jingdezhen,10000
2011,Brooklyn Friends of Chmbr Msc,Brooklyn,Brooklyn,718-855-3053,Music,General Operating Support,General Operating Expenses,8308
2005,"Performing Arts Journal, Inc.",New York,New York,212-675-6730,Theatre,Services to the Field,Publication of 3 issues/yr. of PAJ,6800
2012,Crandall Public Library,Glens Falls,Warren,518-792-6508,Literature,Public Programs,Crandall Public Library Writers Series Writers Fees and Promotion,3310
2007,Meet the Composer Inc,New York,New York,212-645-6949,Music,General Operating Support,General Operating Expenses,87150
2008,"New York Multi-Arts Center Consortium, Inc.",Saratoga Springs,Saratoga,518-584-4132,State & Local Partnership,Services to the Field,Professional and Technical Assistance,18000
2020,Soho Repertory Theatre Inc,New York,New York,212-941-8632,Regional Economic Development,Workforce Investment,Workforce Expansion,49650
2013,Blessed Unrest Theatre Inc,New York,New York,212-713-0163,Theatre,Professional Performances,Blessed Unrest's Performance Season,3000
2019,"Arts Center and Theatre of Schenectady, Inc.",Schenectady,Schenectady,518-382-3884,Arts Education,K-12: In-School Programs,MediaWorks ,17000
2012,Socrates Sculpture Park Inc,Long Island City,Queens,718-956-1819,Arts Education,K-12: In-School Programs,New Visions Collaboration - Arts In Education,7000
2019,"Ugly Duckling Presse, Ltd.",Brooklyn,Brooklyn,218-259-6081,Literature,Literary Translation,Cole Heinowitz: Translation of Alejandra Pizarnik,4000
2012,"Society of the Educational Arts, Inc.",New York,New York,212-529-1545,Theatre,Professional Performances,Teatro SEA's Mainstage Season,8240
2016,"MOUNT TREMPER ARTS, INC",Mount Tremper,Ulster,845-688-9893,Presenting - Multi & Interdisc Arts,Project Support - Presentation,Summer Festival 2014,10000
2012,"Groundswell Community Mural Project, Inc.",Brooklyn,Brooklyn,718-254-9782,Special Arts Services,Instruction and Training,Groundswell Pre-Professional Training Program,5000
2012,El Puente De Williamsburg,Brooklyn,Brooklyn,718-387-0404,Special Arts Services,Regrants,Professional Development ,19054
2013,Marquis Studios Ltd,Brooklyn,New York,718-694-9400,Arts Education,General Support,pARTnership Program,25000
2006,Museum of Arts and Design,New York,New York,212-299-7784,Architecture Planning & Design,Workshops,2006 Design Conference,12500
2008,Storefront for Art and Architecture,New York,New York,212-431-5795,Architecture Planning & Design,Independent Projects,Catherine Ingraham - Ingraham: Property and Architecture in America,10750
2007,NY BUDDHIST CHURCH / SOH DAIKO,New York,New York,609-346-7641,Folk Arts,Presentation,Lecture/Demo/Public Workshop/Performances,4200
2010,Hanford Mills Museum at East Meredith,East Meredith,Delaware,607-278-5744,Folk Arts,Presentation,"Documentation, Presentation of Artisans Practicing Mechanical and Agricultural Processes",11107
2006,"New Art Publications, Inc.",Brooklyn,New York,718-636-9100,Visual Arts,Services to the Field,ARTISTS ON ARTISTS,8300
2017,Luzerne Music Center,Lake Luzerne,Warren,518-696-2771,Music,Project Support,Enhancing Musical Opportunities and Appreciation,10000
2009,Soho Think Tank Inc,New York,New York,212-675-6447,Theatre,General Operating Support,General Operating Expenses,9800
2003,Jamestown Concert Association,Jamestown,Chautauqua,716-763-7625,Presenting,PRESENTATION,Artists fees and presenting costs - 5 performances+residencies,4500
2016,"Society of the Educational Arts, Inc.",New York,New York,212-529-1545,Regional Economic Development,"Arts, Culture and Heritage New Initiatives - Planning",Theater (plus) ArtsFestival: 12 shows & 12 micro festivals in support of new arts cluster synergies,49500
2006,Asian American Arts Centre Inc,New York,New York,212-233-2154,Folk Arts,Presentation,AAAC presents Folk Arts,7000
2013,Albany Institute of History & Art,Albany,Albany,518-463-4478,Arts Education,K-12: In-School Programs,Book Arts in Troy,10000
2020,"The New 42nd Street, Inc.",New York,New York,646-233-3083,Regional Economic Development,Workforce Fellowship,Workforce Training and Development Programs,60000
2016,The Orchestra Association of Northern New York,Potsdam,St Lawrence,315-267-3251,Music,General Support,Orchestra of Northern NY Admin & Outreach 2015,19000
2011,"Multicultural Music Group, Inc.",Bronx,Bronx,646-314-6024,Arts Education,General Program Support,Comprehensive Arts Program,12461
2018,Alfred University,Alfred,Allegany,607-871-2026,Visual Arts,Workspace,Experimental Project Residency: Visual Arts,20000
2005,"Arts & Business Council, Inc.",New York,New York,212-223-2787,State & Local Partnership,Services to the Field,Business Volunteers for the Arts,16400
2019,"The Performance Zone, inc.",New York,New York,212-691-6969,Individual Artists,Theatre Artist Commissions,Yanira Castro - Last Audience,9000
2005,"Arts & Business Council, Inc.",New York,New York,212-223-2787,State & Local Partnership,Services to the Field,Multicultural Arts Management Internship Program,2900
2015,"New York State Old Tyme Fiddler's Association, Inc",Redfield,Lewis,315-232-4681,Folk Arts,Project Support,Concert Series and Fiddler's Picnic,11500
2012,"Circle in the Square Theatre School, Inc.",New York,New York,212-307-0388,Arts Education,K-12: In-School Programs,Playmaking Residency at Public School No. 11,7300
2011,"The Shadow Box Theatre, Inc.",New York,New York,212-724-0677,Special Arts Services,General Program Support,Season: Resident & Community Touring Performances,21758
2019,The Jazz Drama Program,New York,New York,917-818-1759,Arts Education,Community-Based Learning,Jazz Power Initiative Uptown,9000
2015,Home for Contemporary Theatre and Art,New York,New York,212-647-0202,Individual Artists,Theatre Artist Commissions,Reid Farrington - Casablancabox,10000
2020,"Cortland Repertory Theatre, Inc.",Cortland,Cortland,607-753-6161,Theatre,General Support,Cortland Repertory Theatre,13750
2020,Friends of Materials for the Arts,Long Island City,Queens,718-729-2029,Arts Education,Pre-K-12: In-School Programs,MixedMedia Arts and Music Residency,21000
2011,"Counter)induction, LTD",Riverdale,Bronx,267-307-3366,Music,Professional Performances,2010-2011 Concert Season,6231
2009,White Pine Inc,Buffalo,Erie,716-573-8202,Literature,Book Publication,World of Voices Publication,19700
2006,DIA CENTER FOR THE ARTS (D/B/A DIA ART FOUNDATION),New York,New York,212-293-5506,Museum,Museum Educ & Interpretation,Dia:Beacon Gallery Talks ,8500
2006,Akwesasne Library & Museum Cultural Center Inc.,Hogansburg,Franklin,518-358-2240,Museum,Collections Care & Research,Akwesasne Mohawk Basketry for the Next Seven Generations,5000
2020,Dance Entropy Inc.,Long Island City,Queens,718-956-3037,Dance,General Support,Dance Entropy General Operating,5000
2015,Lower Adirondack Regional Arts Council (LARAC),Glens Falls,Warren,518-798-1144,State & Local Partnership,General Support,General Operating Support,38000
2014,New York Public Library,New York,New York,212-930-0858,Theatre,Services to the Field,Theatre on Film and Tape Archive,22210
2012,Bronx Dance Theatre,Bronx,Bronx,718-364-2725,Special Arts Services,General Oper Support,General Operating Expenses,25530
2008,"Ballet Tech Foundation, Inc.",New York,New York,212-777-7710,Arts In Education,ESP Project-based Impl,The Ballet Tech School ,8000
2009,"The Metropolitan Opera Guild, Inc.",New York,New York,212-769-7014,Arts In Education,Services to the Field,ESP Professional Development Program,140000
2008,"Quintet of the Americas, Inc.",Douglaston,Queens,718-230-5189,Music,General Operating Support,General Operating Expenses,10000
2012,"Vampire Cowboys, Inc.",Brooklyn,Brooklyn,718-907-3469,Theatre,Professional Performances,GEEK,5000
2008,Highlights in Jazz,New York,New York,404-626-8139,Music,General Operating Support,General Operating Expenses,6600
2011,"New Art Publications, Inc.",Brooklyn,New York,718-636-9100,Literature,Literary Magazine Publication,BOMB's Literary Interviews and First Proof,6626
2012,"Ansonia Music Outreach Organization, Inc.",New York,New York,212-567-3554,Music,Professional Performances,Access to Music,5640
2004,Rochester Historical Society,Rochester,Monroe,585-428-8470,Museum,Institutional Development,Continue a new Collections staff position,8000
2010,"Albany Center Galleries, Inc.",Albany,Albany,518-462-4775,Visual Arts,Exhibitions & Installations,Ongoing Exhibitions and Public Outreach,8000
2012,Lower Adirondack Regional Arts Council (LARAC),Glens Falls,Warren,518-798-1144,State & Local Partnership,General Oper Support,General Operating Support,38000
2012,Center for Traditional Music and Dance,New York,New York,212-571-1555,Arts Education,Community-Based Learning,Institute for Chinese Traditional Arts,5800
2009,"Reverie Productions, Inc.",Brooklyn,Brooklyn,917-902-3063,Theatre,Professional Performances,Production Season,6900
2008,Henry Street Settlement,New York,New York,212-766-9200,Visual Arts,Workspace Facilities,Artists in Residence/Workspace Program,11600
2013,The Faux-Real Theatre Company,Brooklyn,Brooklyn,917-687-4998,Theatre,Professional Performances,New Theatre Advancement,3000
2011,New York University,New York,New York,212-998-2121,Museum,Project Support,John Storrs: Machine-Age Modernist,18890
2007,Rattlestick Productions Inc,New York,New York,212-627-2556,Theatre,Stabilization,Cash Reserve Fund,15000
2016,"Latin American Workshop, Inc.^The",New York,New York,212-665-9460,Arts Education,K-12: In-School Programs,Cantando y Aprendiendo (Singing and Learning),4500
2003,Home for Contemporary Theatre and Art,New York,New York,212-647-0202,Individual Artists,COMMISSIONS,"Kevin Augustine - ""Animal,"" Kevin Augustine's latest one-man show",5000
2017,"Opening Act, Inc.",BROOKLYN,New York,646-922-8365,Arts Education,K-12: In-School Programs,Opening Act After-School Theater Program Expansion,19000
2020,"AFRO LATIN JAZZ ALLIANCE OF NEW YORK, INC.",New York,New York,212-368-8400,Arts Education,Pre-K-12: In-School Programs,Afro Latin Jazz Academy of Music Residency Program,8000
2003,Iroquois Indian Museum,Howes Cave,Schoharie,518-296-8949,Museum,GENERAL OPERATING SUPPORT,General Operating Expenses,7000
2003,"Chenango County Council of the Arts, Inc.",Norwich,Chenango,607-336-2787,Presenting,PRESENTATION,Artists fees and presenting costs - Minimum 8 performances,5000
2016,Phoenicia Festival of the Voice Foundation,Phoenicia ,Ulster,845-551-8601,Music,General Support,The Phoenicia Festival of the Voice 2016,13000
2008,Skidmore College,Saratoga Springs,Saratoga,518-580-8052,Music,Professional Performances,Skidmore Jazz Institute,6900
2020,New York University School of Medicine,New York,New York,212-263-3973,Literature,Book & Literary Mag Pubs,Bellevue Literary Review,8700
2010,Now Ensemble Inc,New York,New York,917-941-1603,Music,Professional Performances,NOW Ensemble Operating,5000
2005,"North American Cultural Laboratory, Inc.",Highland Lake,Sullivan,646-226-2364,Presenting,Presentation,The Catskill Festival of New Theatre - 14 performances over 7 week-ends,8000
2018,Fort Ticonderoga Association,Ticonderoga,Essex,518-585-2821,Regional Economic Development,Facilities,Fort Ticonderoga Association Pavilion Restoration,2445000
2006,Experimental Television Center,Owego,Tioga,607-687-4341,Electronic Media & Film,General Operating Support,General Operating Expenses,40000
2011,Scotia Glenville Pipe Band ,Schenectady,Schenectady,518-374-6034,Folk Arts,Folk Art Apprenticeships,Donald Lindsay - Piobaireachd Apprenticeship with Donald Lindsay,4747
2008,Exhibition Alliance^The,Hamilton,Madison,315-824-2510,Museum,General Operating Support,General Operating Expenses,41300
2009,New York Shakespeare Festival,New York,New York,212-539-8742,Theatre,General Operating Support,General Operating Expenses,96200
2013,"National Dance Institute, Inc.",New York,New York,212-226-0083,Arts Education,General Support,Bringing Dance to Thousands of NYC School Children,25000
2011,"Center for Performance Research, Inc.",Brooklyn,Brooklyn,718-349-1210,Dance,Rehearsal Space,"Subsidized Rehearsal Space: 1,000 hrs ($6/hr sm studio; $10/hr lrg studio) for 150 dnc cos/artists",6626
2009,Locust Street Neighborhood Art Classes,Buffalo,Erie,716-213-8319,Special Arts Services,General Operating Support,General Operating Expenses,35000
2003,WSLU-FM,Canton,St Lawrence,315-229-5356,Literature,PUBLIC PROGRAMS,Readers and Writers on the Air,14500
2011,New York Folklore Society,Schenectady,Schenectady,518-346-7008,Folk Arts,General Operating Support,General Operating Expenses,62208
2011,"Theater Three Productions, Inc.",Port Jefferson,Suffolk,631-928-1130,Theatre,Professional Performances,Professional Performances,8011
2007,Council of Literary Magazines and Presses,New York,New York,212-741-9110,Literature,Services to the Field,NYS TA Program for Literary Publishers (NYTAP),43050
2013,"Media Alliance, Inc.",Troy,Rensselaer,518-207-6264,Electronic Media & Film,Workspace,Hudson Mohawk Independent Media Center - Be The Media workshops,8000
2004,Museum of Chinese in the Americas,New York,New York,917-484-4143,Special Arts Services,General Program Support,"Expenses for Artists' series, outreach presentations/exhibitions",19890
2011,"Amigos del Museo del Barrio, Inc.",New York,New York,212-660-7118,Presenting,Presentation,El Museo's Summer Nights Free Concert Series,3857
2017,Parrish Art Museum,Water Mill,Suffolk,631-283-2118,Museum,General Support,General Operating Expenses,32000
2010,"Visual AIDS for the Arts, Inc.",New York,New York,212-627-9855,Stabilization,Stabilization,FY10 Stabilization,10000
2005,American Indian Artists Inc (Amerinda),New York,New York,212-598-0968,State & Local Partnership,General Operating Support,General Operating Expenses,18000
2019,"International African Arts Festival, Inc.",Brooklyn,Brooklyn,718-502-9870,Presenting,General Support,International African Arts Festival,12828
2011,"Earlville Opera House, Inc.",Earlville,Chenango,315-691-3550,State & Local Partnership,Workshops,EOH Arts Education,4549
2020,"Either/Or, Inc.",New York,New York,917-853-8511,Music,Project Support,Either/OR New York Concert Season,5000
2017,New York State Early Music Association,Ithaca,Tompkins,607-301-0604,Music,General Support,NYS Baroque General Operating Support FY2017,11000
2015,"The Center for Book Arts, Inc.",New York,New York,212-481-0295,Visual Arts,General Support,Visual Arts Programs,40000
2020,"Elevator Repair Service Theater, Inc.",New York,New York,212-254-3137,Theatre,General Support,Elevator Repair Service GOS ,22000
2012,"New Federal Theatre, Inc.",New York,New York,212-353-1176,Literature,Public Programs,NFT GURFEIN FD/NTOZAKE SHANGE READING SERIES,2500
2016,FRENCH INSTITUTE ALLIANCE FRANCAISE,New York,New York,646-388-6680,Electronic Media & Film,Screenings,Cinema Programming 2013/2014,15000
2009,Bard College,Annandale-on-Hudson,Dutchess,845-758-7434,Literature,Literary Magazine Publication,Conjunctions FY09,10200
2013,"Collaborative Arts Project 21, Inc.",New York,New York,212-807-0202,Theatre,Professional Performances,Professional Season,3000
2017,"CSC Repertory, Ltd.",New York,New York,212-677-4210,Theatre,General Support,General Operating Support,25000
2007,H.T. Dance Company Inc/Chen Dance Center,New York,New York,212-349-0126,Special Arts Services,General Operating Support,General Operating Expenses,63000
2007,New York Treble Singers,New York,New York,212-496-0094,Music,Professional Performances,New York: Diversity and Ethnicity,5670
2006,"Guild Hall of East Hampton, inc.",East Hampton,Suffolk,631-324-0806,Presenting,Presentation,Kidfest Series--6 Performances,2500
2018,Iroquois Indian Museum,Howes Cave,Schoharie,518-296-8949,Folk Arts,Project Support,"A Song, A Dance and A Story to be Told",15000
2003,Cattaraugus County Arts Council,Olean,Cattaraugus,716-372-7455,State & Local Partnership,GENERAL OPERATING SUPPORT,General Operating Expenses,19000
2009,Colgate University,Hamilton,Madison,315-228-7457,Arts In Education,ESP School-Wide Arts Impl,"Colgate / Hamilton Central School Partnership, Year 1",22000
2017,Elaine Summers Experimental Intermedia Foundation,New York,New York,212-431-5127,Electronic Media & Film,Screenings,Screen Composition 10 - Solo 3,3000
2019,"Joyce Theater Foundation, Inc.",New York,New York,212-691-9740,Presenting,Project Support - Presentation,The JoyceÂs Dance Presentation Program,70000
2005,Association of Teaching Artists,BROOKLYN,Brooklyn,9179940757,Arts In Education,Project-based Implementation,The Communication Project,10700
2003,Hartwick College,Oneonta,Otsego,607-431-4061,Museum,EXHIBITION,Native Son: The Photographs of Carleton E. Watkins **RECONSIDERATION**,2500
2013,Luzerne Music Center,Lake Luzerne,Warren,518-696-2771,Music,Professional Performances,Luzerne Chamber Music Festival & Faculty Series,9050
2016,Arena Players Repertory Threatre Company,Centerport,Suffolk,516-293-0674,Theatre,Professional Performances,"A Season of Plays (Dramas, Childrens, etc)",5910
2015,"Camera News, Inc.",New York,New York,212-947-9277,Individual Artists,Film & Media / New Tech Prod.,Abigail Child - EMMAÂS PARTY,17500
2015,"Rochester Philharmonic Orchestra, Inc.",Rochester,Monroe,585-454-7311,Music,General Support,General Operating Support,134360
2004,Independent Feature Project,Brooklyn,Brooklyn,212-465-8200,Electronic Media & Film,General Operating Support,General Operating Expenses Reconsideration,2500
2017,Rochester Contemporary Art Center,Rochester,Monroe,585-461-2222,Visual Arts,General Support,General Support 2013-2014 Season,10000
2004,"Hubbard Hall Projects, Inc",Cambridge,Washington,518-677-2495,Theatre,New Theatre Advancement,The Theatre Company at Hubbard Hall,4300
2013,"Yangtze Repertory Theatre of America, Inc.",New York,New York,203-606-6298,Special Arts Services,General Support,Dance/Exhibit/Concerts,14240
2007,"Jewish Community Center of Greater Rochester, Inc.",Rochester,Monroe,585-461-2000,Electronic Media & Film,Exhibitions,Rochester Jewish Film Festival,3500
2005,Inoue Chamber Ensemble Inc,New York,New York,212-864-6459,Music,Professional Performances,Eastern Trends in New Music,2500
2005,Nonprofit Finance Fund,New York,New York,212-457-4727,State & Local Partnership,Services to the Field,Nonprofit Business Analysis and Workshops,18000
2013,Rochester Lesbian and Gay Film and Video Festival,Rochester,Monroe,585-301-5163,Electronic Media & Film,Exhibitions,Festivals: ImageOut: The Rochester Lesbian & Gay Film & Video Festival,9050
2016,"Streb, Inc.",Brooklyn,Brooklyn,718-384-6491,Individual Artists,Dance Commissions,Fabio Tavares - Choreography Commission,10000
2018,Buffalo Media Resources,Buffalo,Erie,716-884-7172,Individual Artists,Film & Media / New Tech Prod.,Max Bernstein - The Space Between Sea and Land,25000
2007,Museum for African Art^The,New York,New York,212-444-9795,Museum,General Program Support,Museum for African Art,21500
2008,Whitney Museum of American Art,New York,New York,212-570-3608,Museum,General Operating Support,General Operating Expenses,98000
2008,Putnam Arts Council,Mahopac,Putnam,845-803-8622,State & Local Partnership,Regrants,"Decentralization. Regrants: $20,300. Administration: $8700.",29000
2008,Eva Dean Dance Company,Brooklyn,Brooklyn,718-857-8368,Dance,Rehearsal Space,"Prov. of Free & Low Cost Reh. Space (1,500 Hrs. to 60 Dance Artists)",6000
2014,Queens Theatre in the Park,Queens,Queens,347-472-3702,Theatre,Professional Performances,Queens Theatre Immigrant Voices Project,9600
2018,"The Publick Musick, Inc.",Rochester,Monroe,585-244-5835,Music,Project Support,Period-instrument concerts in and around Rochester,8000
