Grant Year,Grantee,City,County,Phone,Program,Category,Project Title,Grant Amount
2019,"Archipelago Books, Inc.",Brooklyn,Brooklyn,917-439-6184,Literature,Literary Translation,"Karen Emmerich - Good Will Come From the Sea, trans. by K. Emmerich",5000
2009,Vital Theatre Company,New York,New York,212-579-0528,Theatre,Professional Performances,Vital Theatre Company,4900
2019,Downtown Music Productions,New York,New York,212-477-1594,Music,Project Support,East Village Concert Series,5000
2020,Broadway Dance Lab Inc,New York,New York,646-325-5389,Dance,Services to the Field,DLNY Programming in 2020,5000
2013,Mercantile Library Association of NYC,Brooklyn,Brooklyn,212-755-6710,Literature,General Support,General Operating Support,15000
2007,Women Make Movies,New York,New York,212-925-0606,Individual Artists,Film & Media / New Tech Prod.,Julie Bridgham - The Sari Soldiers,10000
2017,Young Audiences New York,New York,New York,212-319-9269,Arts Education,General Support,Young Audiences New York,16500
2016,C4: The Choral Composer/Conductor Collective,New York,New York,646-598-8116,Music,Project Support,C4 10th Anniversary Concert Series,9000
2004,The History Center in Tompkins County,Ithaca,Tompkins,607-273-8284,Museum,General Operating Support,General Operating Expenses,15000
2010,Dorian Woodwind Quintet Fndn,New York,New York,646-242-9870,Music,General Program Support,Dorian quintet general support,4000
2012,NEW YORK PUBLIC RADIO (WNYC RADIO / WQXR RADIO),New York,New York,646-829-4467,Arts Education,K-12: In-School Programs,The Sound,10000
2011,"Making Books Sing, Inc.",New York,New York,212-573-8791,Arts Education,K-12: Implementation,Literature at Play at Public School 315,20769
2004,"PUBLIC ART FUND, INC.",New York,New York,212-223-7810,Visual Arts,General Operating Support,General Operating Expenses,45050
2017,"Art Studio of WNY, Inc.",Buffalo,Erie,716-833-4450,Facilities,Design Studies (Facilities),BAS Design Study,9680
2009,"DISCALCED, INC",Brooklyn,Brooklyn,718-624-8400,Dance,General Operating Support,General Operating Expenses,58800
2019,"The Performance Zone, inc.",New York,New York,212-691-6969,Music,Project Support,REBEL - REBEL Ensemble for Baroque Music,8000
2010,Cooperstown Chamber Music Festival Inc.,Cooperstown,Otsego,917-868-4276,Music,Professional Performances,2009 Festival,7404
2019,The Hyde Collection Trust,Glens Falls,Warren,518-792-1761,Museum,General Support,General Operating Support,22000
2003,Iroquois Indian Museum,Howes Cave,Schoharie,518-296-8949,Museum,GENERAL OPERATING SUPPORT,General Operating Expenses  **RECONSIDERATION**,3000
2003,Museum of Chinese in the Americas,New York,New York,917-484-4143,Museum,COLLECTIONS MANAGEMENT,Old Chinatown Collections Project  **RECONSIDERATION**,3000
2017,Ascension Music Chorus & Orchestra Inc,New York,New York,212-358-1469,Regional Economic Development,Workforce Investment,VoA Workforce Development Marketing Communications,49500
2013,"Earlville Opera House, Inc.",Earlville,Chenango,315-691-3550,State & Local Partnership,Workshops,EOH Arts Education,6000
2012,American Composers Orchestra,New York,New York,212-977-8495,Presenting,Presentation,Sounds of a New Century,15000
2013,"Lotus Fine Arts Productions, Inc.",New York,New York,212-627-1076,Dance,Rehearsal Space,"Subsidized Rehearsal Space: Provision of 1,000 Hrs. at $10/Hr. to 70 Dance Artists/Choreographers",2600
2007,Everson Museum of Art,Syracuse,Onondaga,315-474-6064,Museum,General Operating Support,General Operating Expenses,46095
2015,Bronx Opera Company Inc,Bronx,Bronx,646-281-9963,Music,General Support,"full opera productions, in English",20000
2009,Arts Society of Kingston,Kingston,Ulster,845-338-0333,State & Local Partnership,Information Services,Regional monthly arts guide publication,10000
2016,"ROCHESTER CHAPTER of YOUNG AUDIENCES, INC",Rochester,Monroe,585-530-2060,Arts Education,General Support,Building Young Audiences of Rochester and Beyond,5000
2019,"Martha Graham Center of Contemporary Dance, Inc.",New York,New York,212-229-9200,Individual Artists,Dance Commissions,Pam Tanowitz - New Commission by Pam Tanowitz by Martha ,10000
2019,Wave Farm,Acra,Greene,518-622-2598,Electronic Media & Film,General Support,Wave Farm General Support,28350
2016,Sculpture Center Inc,Long Island City,Queens,718-361-1750,Visual Arts,General Support,General Operating Support,39000
2009,Afrikan Poetry Theatre Inc,Jamaica,Queens,917-868-0759,Stabilization,Stabilization,Stabilization,25000
2018,"Media Alliance, Inc.",Troy,Rensselaer,518-207-6264,Presenting,Project Support - Presentation,Upstate Freedom Sounds,15000
2004,Light Work Visual Studies Inc.,Syracuse,Onondaga,315-443-1300,Visual Arts,General Operating Support,General Operating Expenses,63750
2006,Asia Society,New York,New York,212-327-9235,Museum,General Program Support,Asia Society Museum,20000
2009,Deep Listening Institute Ltd.,Kingston,Ulster,845-338-5984,Music,Services to the Field,Virtual Residencies,5000
2003,Elaine Kaufman Cultural Center,New York,New York,212-501-3357,Music,COMMUNITY OUTREACH PROJECTS,Lucy Moses School's Core Music Program,10000
2018,Hoff-Barthelson Music School,Scarsdale,Westchester,914-723-1169,Music,Community Music Schools,Music Instruction:  Educational Activities,7500
2008,"Argento New Music Project, Inc.",New York,New York,949-422-6061,Music,Professional Performances,3-concert Season at Casa Italiana NYC,5000
2011,Columbia Land Conservancy Inc,Chatham,Columbia,518-392-5252,Architecture Planning & Design,General Operating Support,General Operating Expenses,20176
2016,"Signature Theatre Company, Inc.",New York,New York,646-388-8136,Individual Artists,Theatre Artist Commissions,Quiara Hudes - Quiara Alegria Hudes: Playwright Commission,10000
2004,CROWD Magazine,New York,New York,718-852-7169,Literature,Literary Magazine Publication,CROWD Magazine,2500
2005,Asian American Arts Alliance,Brooklyn,Brooklyn,212-941-9208,Special Arts Services,Services to the Field,Eye on Asian American ARTS -Visibility Project,12000
2015,"College Community Services, Inc.",Brooklyn,Brooklyn,718-951-4600,Presenting - Multi & Interdisc Arts,Project Support - Presentation,Support for 22 Brooklyn Center FY15 performances ,5000
2020,"Historic House Trust of New York City, Inc.",New York,New York,212-360-8203,Architecture + Design,General Support,General Operating Support,15500
2012,New York Deaf Theatre Ltd,Brooklyn,Brooklyn,917-214-5795,Theatre,General Oper Support,Theater with American Sign Language and Visual Art,5000
2009,THE BARROW GROUP INC,New York,New York,212-760-2615,Theatre,General Operating Support,General Operating Expenses,8000
2008,"Cave Canem Foundation, Inc.",Brooklyn,Brooklyn,718-858-0000,Literature,Public Programs,Reconsideration:Cave Canem in the City,2800
2012,WOODSTOCK FILM FESTIVAL INC,Woodstock,Ulster,845-679-4265,Electronic Media & Film,General Oper Support,General Operating Expenses,9000
2016,Upstate Films Limited,Rhinebeck,Dutchess,845-876-4546,Electronic Media & Film,General Support,"Upstate Films, Rhinebeck & Woodstock, NY",20000
2019,SYRACUSE COMMUNITY CHOIR INC.,Syracuse,Onondaga,315-428-8151,Special Arts Services,Project Support,Syracuse Community Choir Inclusion Support Program,10000
2009,Maysles Institute,New York,New York,212-582-6843,Individual Artists,Film & Media / New Tech Prod.,Albert Maysles - Handheld and From the Heart,6000
2019,"Art Studio of WNY, Inc.",Buffalo,Erie,716-833-4450,Special Arts Services,Instruction and Training,Jump Start Program,8000
2020,"Riverside Opera Company, INC",Staten Island,Staten Isl,212-729-4792,Music,Project Support,Opera Outreach,5000
2008,Storefront for Art and Architecture,New York,New York,212-431-5795,Architecture Planning & Design,Independent Projects,Eric Bunge - Bunge: Light and Heat in Architecture,10750
2017,"The Collapsable Giraffe, Inc.",New York,New York,917-374-7079,Individual Artists,Theatre Artist Commissions,Daniel Fish - Daniel Fish - 7 Deadly Sins,8000
2017,Western New York Book Arts Collaborative Inc.,Buffalo,Erie,716-348-1430,Facilities,Capital Projects (Facilities),WNYBAC Facilities Project,24500
2019,Friends of Bristol Valley Playhouse Foundation,Naples,Ontario,585-374-9032,Arts Education,Community-Based Learning,BVT for Kids,4000
2012,"Harvestworks, Inc.",New York,New York,212-431-1130,Individual Artists,Film & Media / New Tech Prod.,Kathy Brew - BEAUTY BEHIND BARS,22500
2008,FRENCH INSTITUTE ALLIANCE FRANCAISE,New York,New York,646-388-6680,Electronic Media & Film,General Program Support,FIAF's French Film Program,12000
2007,"Prospect Theater Company, Inc.",New York,New York,646-286-7564,Theatre,Professional Performances,Prospect 2006-07 Season,5000
2013,The Peccadillo Theater Company,New York,New York,212-633-6533,Theatre,General Support,New York Performance Season,10000
2011,Van Alen Inst: Projects in Public Architechture,New York,New York,212-924-7000,Architecture Planning & Design,Independent Projects,Felicity Scott - Scott: Cartographies of Drift  (includes $750 for Van Alen),10632
2005,"Hubbard Hall Projects, Inc",Cambridge,Washington,518-677-2495,State & Local Partnership,General Operating Support,General Operating Expenses,28000
2005,"Theatre Development Fund, Inc.",New York,New York,212-912-9770,Arts In Education,Project-based Implementation,Residency Arts Project,7500
2003,Carousel Society of the Niagara Frontier,North Tonawanda,Niagara,716-693-1885,Museum,GENERAL OPERATING SUPPORT,General Operating Expenses,14000
2007,Anti-Social Music,New York,New York,646-489-8791,Music,Professional Performances,ASM 2006-2007 New York Series,3150
2006,"Alliance for the Arts, Inc.",New York,New York,212-947-6340,Electronic Media & Film,Services to the Field,Archive of New York State Filmmakers with HIV/AIDS,5000
2005,"Educational Video Center, Inc.",New York,New York,212-465-9366,Electronic Media & Film,Workspace Facilities,Youth Organizers TV (YO-TV) Workshop,5000
2008,"Associated Solo Artists, Inc",Chester,Orange,845-469-7254,Arts In Education,ESP Project-based Impl,The Four Freedoms - Peekskill Middle School,5000
2015,Putnam Arts Council,Mahopac,Putnam,845-803-8622,State & Local Partnership,General Support,General Operating Support,20000
2012,THE STANDBY PROGRAM,Flushing,New York,212-206-7858,Individual Artists,Film & Media / New Tech Prod.,Hillevi Loven - Radical Love,13800
2013,"Foundation for the Open Eye, Inc.",Margaretville,Delaware,845-586-1689,Theatre,Professional Performances,Plays for Diverse Audience in Rural Catskills,5460
2008,New York Shakespeare Festival,New York,New York,212-539-8742,Presenting,Presentation,Reconsideration:Under the Radar,2500
2009,"Time & Space Limited Theatre Co., Inc.",Hudson,Columbia,518-822-8448,Presenting,Presentation,Five performing groups - 7 performances,5400
2018,Brooklyn Institute of Arts and Sciences,Brooklyn,Brooklyn,718-638-5000,Arts Education,Community-Based Learning,Gallery/Studio Program,3700
2011,World Music Institute,Brooklyn,New York,212-545-7536,Presenting,Presentation,Artists Fees & Expenses - Minimum 5 concerts,16615
2014,"Manna House Workshops, Inc.",New York,New York,212-722-8223,Music,Project Support,MEEE Concert Series,4000
2006,Columbia Univ NYC^Trustees of,New York,New York,212-854-6851,Literature,Literary Magazine Publication,Semi-Annual Columbia Journal,3000
2005,"Exploring The Metropolis, Inc.",Jamaica,Queens,646-753-2260,Music,Services to the Field,NYC Music Places Website ,3000
2013,YESHIVA UNIVERSITY,New York,New York,212-294-8337,Museum,General Support,General Program Support,8000
2007,Buffalo Olmsted Parks Conservancy Inc.,Buffalo,Erie,716-838-1249,Architecture Planning & Design,General Operating Support,General Operating Expenses,10395
2007,Wayne County Multicultural Arts Project,Lyons,Wayne,315-398-9500,Special Arts Services,General Program Support,Celebrating Cultures,11000
2006,"Making Books Sing, Inc.",New York,New York,212-573-8791,Arts In Education,ESP School-Wide Arts Impl,"Making Books Sing at Public School 255, Gravesend, Brooklyn",35000
2008,"Early Stages Program, Inc.",New York,New York,212-242-1744,Arts In Education,ESP School-Wide Arts Planning,"Storytelling based partnership with CIS#145, Bronx",12500
2014,Theatre for a New Audience,New York,New York,212-229-2819,Arts Education,K-12: In-School Programs,World Theatre Project at PS235 Lenox School,10000
2020,El Mundo Del Flamenco Inc,New York,New York,917-667-2695,Folk Arts,Project Support,A Night in Andalucia,5000
2010,Gertrude Stein Repertory Tht,New York,New York,212-725-0436,Theatre,Services to the Field," The DPI Residency, Artist Support",6911
2017,Munson-Williams-Proctor Arts Institute,Utica,Oneida,315-797-0000,Museum,General Support,MWPAI Museum of Art,36000
2019,Swiss Institute,New York,New York,212-925-2035,Visual Arts,General Support,SI General Support,20000
2007,"Second Stage Theatre, Inc.",New York,New York,212-787-8302,Capital Projects,Capital Equipment Purchase,Set and Stage Rigging Package,20000
2015,"The Hudson Review, Inc",New York,New York,212-650-0020,Literature,Literary Magazine Publication,New Writers Issue,3000
2005,New York Public Library,New York,New York,212-930-0858,Theatre,Services to the Field,Theatre Videotape Documentation,29200
2008,"Flushing Council on Culture and the Arts, Inc.",Flushing,Queens,718-463-7700,State & Local Partnership,General Operating Support,General Operating Expenses,45000
2006,Paul Robeson Performing Arts Company,Syracuse,Onondaga,315-469-5319,Special Arts Services,General Operating Support,General Operating Expenses,34000
2016,"Casita Maria, Inc.",Bronx,Bronx,475-208-3985,Regional Economic Development,"Arts, Culture and Heritage New Initiatives - Implementation",BLITZ a Partnership with Arturo OFarrill,54000
2012,Jose Limon Dance Foundation Inc,New York,New York,212-777-3353,Dance,Long Term Residencies in NYS,Artists' sals./admin.costs: 3-wk. Long-term Residency @SUNY Brockport /1 perf.,30000
2015,Hoff-Barthelson Music School,Scarsdale,Westchester,914-723-1169,Music,Community Music Schools,Music Instruction: Educational Activities,7500
2015,"La MaMa Experimental Theatre Club, Inc.",New York,New York,212-254-6468,Theatre,General Support,La MaMa-General Support,44000
2016,The Harlem Chamber Players Inc,New York,New York,917-744-6948,Individual Artists,Composer Commissions,"Jeff Scott - Commission of ""A Hug for Harlem""",7500
2005,Cinema 10 Inc.,Potsdam,St Lawrence,315-267-3312,Electronic Media & Film,Exhibition,Exhibition of 20 films,4500
2013,Dancing Crane Inc.,Brooklyn,Brooklyn,914-522-3888,Special Arts Services,Project Support,Georgian Theater and Children's Dance Program,10000
2006,Heckscher Museum,Huntington,Suffolk,631-351-3005,Architecture Planning & Design,Design and Planning Studies,Historic Preservation of the Dove/Torr Cottage ,20000
2019,"Fresh Squeezed Opera Company, Inc.",New York,New York,919-272-7645,Music,Project Support,Bound,5000
2010,Saratoga Performing Arts Ctr,Saratoga Springs,Saratoga,518-584-9330,Presenting,General Operating Support,General Operating Expenses,45000
2016,7 Loaves Inc.,New York,New York,917-721-6385,Individual Artists,Composer Commissions,James Lewis - DvorÃ¡k in America,5000
2008,"Rattapallax, Incorporated",New York,New York,646-416-4702,Literature,Public Programs,Poetic Lecture Series,5000
2009,Community-Word Project Inc.,New York,New York,212-962-3820,Arts In Education,Services to the Field,Teaching Artist Training and Internship Program,7000
2012,"Actors Company Theatre, Inc",New York,New York,212-645-8228,Theatre,Professional Performances,TACT Mainstage/Artists' Fees,3580
2019,ARS Nova Theater I Inc.,New York,New York,212-489-9800,Regional Economic Development,Facilities Improvement - Mid-Size Capital Projects,Ars Nova at Greenwich House,225000
2014,"Foundation for the Open Eye, Inc.",Margaretville,Delaware,845-586-1689,Arts Education,K-12: In-School Programs,Arts Education Partnership with MCS and RCS,12000
2007,Association Adv Crea Musicians NYC,New York,New York,212-594-7121,Music,General Operating Support,General Operating Expenses,9450
2006,Henry Street Settlement,New York,New York,212-766-9200,Theatre,Professional Performances,Henry Street Settlement Theater Program,8000
2008,Henry Street Settlement,New York,New York,212-766-9200,Theatre,Professional Performances,Reconsideration:Abrons Arts Center Theater Program,5000
2013,New York Folklore Society,Schenectady,Schenectady,518-346-7008,Folk Arts,General Support,General Operating Expenses,56340
2011,Theatre of Youth Company Inc.,Buffalo,Erie,716-884-4400,Theatre,General Operating Support,General Operating Expenses,17011
2003,"DreamYard Project, Inc.",Bronx,Bronx,718-588-8007,Arts In Education,SERVICES TO THE FIELD,DreamYard / District 10 Arts Initiative,20000
2017,Five Myles Inc.,Brooklyn,Brooklyn,347-534-6776,Visual Arts,Exhibitions & Installations,The 2017 FiveMyles exhibition program,12000
2010,Historic Saranac Lake,Saranac Lake,Franklin,518-891-4606,Architecture Planning & Design,General Operating Support,General Operating Expenses,7200
2020,Museum of Contemporary African Diasporan Arts,Brooklyn,Brooklyn,718-230-0492,Electronic Media & Film,Film Festivals and Screenings,KidFlix Annual Film Festival,13000
2007,Friends of Bristol Valley Playhouse Foundation,Naples,Ontario,585-374-9032,Presenting,Presentation,Artists fees and presenting costs -Minimum 6 performances,3045
2009,Touchstone Center for Children,New York,New York,212-831-7717,Arts In Education,General Program Support,The Other Side of Knowing,11500
2009,"Kitchen Theatre Company, Inc.",Ithaca,Tompkins,607-272-0403,Theatre,General Operating Support,General Operating Expenses,10800
2008,The Hyde Collection Trust,Glens Falls,Warren,518-792-1761,Museum,General Operating Support,General Operating Expenses,30000
2010,"King Manor Association of L.I., Inc.",Jamaica,Queens,718-206-0545,Museum,General Operating Support,General Operating Expenses,10000
2005,Dances & Drums of Africa Inc,Brooklyn,Brooklyn,718-467-7127,Dance,Professional Performances,"Artists' Salaries: 2 performances: Prospect Park Picnic House, Brooklyn; Symphony Space",7500
2014,"DEEP Arts, Inc.",Rochester,Monroe,585-752-3174,Theatre,General Support,General Support,12000
2019,Cayuga Museum of History and Art,Auburn,Cayuga,315-253-8051,Museum,General Support,General Operating Support,7000
2020,"Garnerville Arts Project, Inc.",Garnerville,Rockland,845-947-7108,State & Local Partnership,General Support,General Operating Support for GARNER Arts Center,25000
2009,Urban Arts Partnership,New York,New York,212-966-5881,Arts In Education,ESP School-Wide Arts Impl,"Shaping The Vision at M.S. 131, Year 3",40000
2014,Jacob Burns Film Center,Pleasantville,Westchester,914-773-7663,Individual Artists,Film & Media / New Tech Prod.,Ivy Meeropol - Untitled Indian Point Film,25000
2016,"The 52nd Street Project, Inc.",New York,New York,212-333-5252,Theatre,General Support,General Operating Expenses,8060
2012,Arts Horizons Inc,New York,New York,212-268-7219,Arts Education,General Oper Support,Arts Horizons - General Operating Support ,10300
2012,"Phelps Art Center, Inc.",Phelps,Ontario,315-548-2095,Arts Education,Regrants,Arts in Education for 4 Counties--Regrant= $15610 & Admin= $6690 ,22300
2018,Soc-3rd St Msc School Settlment,New York,New York,212-777-3240,Special Arts Services,Instruction and Training,Need-Based Scholarships for Music and Dance Study,15000
2015,"City Lore, Inc.",New York,New York,212-529-1955,Folk Arts,Regrants,New York State Digital Initiative,18500
2013,"Starcherone Books, Inc.",Buffalo,Erie,716-880-6772,Literature,Book Publication,Publication of 2012 Titles,4000
2012,"CNY Arts, Inc.",Syracuse,Onondaga,315-435-2125,State & Local Partnership,Services to the Field,Technical Assistance for Arts Organization,37530
2013,Fenimore Art Museum ,Cooperstown,Otsego,607-547-1412,Museum,General Support,Fenimore Art Museum,15050
2010,CAVE Organization Inc,Brooklyn,New York,347-838-4677,Presenting,Presentation,CAVE Performance Season-minimum of 10 performances,2500
2012,"New York Live Arts, Inc.",New York,New York,212-691-6500,Dance,Rehearsal Space,"Subsidized Rehearsal Space:1,000 hours at $10/hr. for 50-60 nonprofit dance cos./artists",10000
2004,Council on the Arts & Humanities for Staten Island,Staten Island,Staten Isl,718-447-3329,Decentralization,Regrants,Staten Island Decentralization Program ,64800
2013,Fence Magazine Inc.,Albany,Albany,518-567-7006,Literature,Literary Magazine Publication,Publishing two issues of Fence,5000
2012,"Syracuse Opera Company, Inc.",Syracuse,Onondaga,315-475-5915,Music,General Oper Support,General Operating Expenses,63870
2005,Global Action Project,New York,New York,212-594-9577,Electronic Media & Film,Workspace Facilities,Voices and Visions: Documentary Project for Refugee Youth,3700
2011,Delaware Valley Arts Alliance,Narrowsburg,Sullivan,845-252-7576,Visual Arts,Exhibitions & Installations,DVAA Exhibition Program,9989
2003,The Jewish Heritage Writing Project Inc.,New York,New York,212-925-9067,Literature,GENERAL PROGRAM SUPPORT,Literary Events & Editorial Activities,6300
2007,Creative Outlet Dance Theatre of Brooklyn,Brooklyn,Brooklyn,917-446-8909,Special Arts Services,Instruction and Training,Performing Arts Program,7500
2005,Solomon R. Guggenheim Foundation,New York,New York,212-423-3775,Electronic Media & Film,General Program Support,Program Operating Support for Film Series,19000
2013,"The Performance Zone, inc.",New York,New York,212-691-6969,Dance,Professional Performances,Faye Driscoll - Faye Driscoll: Dancers' Salaries; NYC Performance Season,5000
2005,"The Symphony Space, Inc.",New York,New York,212-864-1414,Music,General Program Support,Music Programs,16700
2010,Lake Placid Association of Music Drama and Art,Lake Placid,Essex,518-523-2512,Presenting,General Program Support,Presentation Series - 70 performances,17266
2006,"Ugly Duckling Presse, Ltd.",Brooklyn,Brooklyn,218-259-6081,Literature,Book Publication,Eastern European Poetry Series,2500
2012,"Kitchen Theatre Company, Inc.",Ithaca,Tompkins,607-272-0403,Theatre,General Oper Support,General Operating Expenses,8060
2014,"Yara Arts Group, Inc.",New York,New York,212-777-7675,Theatre,Professional Performances,Yara's New Theatre Piece,5000
2004,"Alpha Omega 1-7 Theatrical Dance Company, Inc.",New York,New York,212-749-0095,Special Arts Services,Instr/Train - Pre-Professional,Youth Training Programs,2500
2009,St. Bonaventure University,St. Bonaventure,Cattaraugus,716-375-7666,Museum,Collections Care & Research,"Research, Cataloging and Digitizing Permanent Collection Records",10000
2004,"Stageworks on the Hudson, Inc.",Hudson,Columbia,518-828-7843,Arts In Education,Project-based Implementation,StageWorks TASK/Questar III BOCES IEP Arts in Education Collaboration,7650
2020,A Blade of Grass Fund,Brooklyn,New York,6469449914,Visual Arts,Project Support,A Blade of Grass Public Programs,11000
2015,"Gotham Early Music Scene, Inc.",New York,New York,212-866-0468,Music,Regrants,Devel. & Tech Assistance - Needs Assessment,15000
2008,Smithsonian Institution,New York,New York,212-849-8311,Museum,Exhibitions,An Infinity of Nations,20000
2010,New York Public Library,New York,New York,212-930-0858,Electronic Media & Film,General Program Support,Donnell Media Center Public Programs,21805
2015,Genesee-Orleans Regional Arts Council,Batavia,Genesee,585-343-9313,State & Local Partnership,General Support,Genesee-Orleans Reg Arts Cncl-General Support,25000
2006,"Mill Street Loft, Inc.",Poughkeepsie,Dutchess,845-471-7477,Arts In Education,ESP Project-based Impl,"The Art of Story with Ostrander Elementary School, Walkill",6900
2016,Hudson Opera House Inc.,Hudson,Columbia,518-822-1438,State & Local Partnership,General Support,Programs at Hudson Opera House,45000
2017,"Polyhymnia Music Foundation, Inc.",New York,New York,917-838-4636,Music,Project Support,Series of Three Concerts of Early Choral Music,4500
2015,Ensemble for the Romantic Century,New York,New York,212-288-8020,Music,Professional Performances,Monsters: The Divided Self,5000
2010,The Metropolitan Museum of Art,New York,New York,212-650-2104,Museum,General Operating Support,General Operating Expenses,200000
2005,Schenectady Symphony Orchestra Assn Inc.,Schenectady,Schenectady,518-382-3884,Music,General Operating Support,General Operating Expenses,7900
2009,"The Center for Urban Pedagogy, Inc.",Brooklyn,Brooklyn,718-596-7721,Arts In Education,ESP School-Wide Arts Impl,"Arts Integration at the Academy of Urban Planning, Year 2",15000
2020,Preservation League of New York State,Albany,Albany,518-462-5658,Architecture + Design,Regrants,Preserve New York Grant Program ,194824
2014,Culture Project Inc.,New York,New York,212-925-1806,Theatre,General Support,General Operating Support for Culture Project,5000
2006,Opera of the Hamptons,Southampton,Suffolk,718-836-3653,Music,Professional Performances,Festival 2004,2600
2005,Storm King Art Center,New Windsor,Orange,845-534-3115,Museum,General Operating Support,General Operating Expenses,13500
2003,Film/Video Arts Inc,New York,New York,212-941-8787,Individual Artists,FILM & MEDIA / NEW TECH PROD.,Esther Robinson - The Danny Williams Story (working title),8000
2016,"Yarn Wire, Inc.",Ridgewood,Queens,718-501-2654,Music,General Support,Yarn/Wire's 2015-2016 Concert Season,12000
2008,"Media Alliance, Inc.",Troy,Rensselaer,518-207-6264,Electronic Media & Film,Workspace Facilities,Hudson Mohawk Independent Media Center -  Hudson Mohawk Independent Media Center,6000
2007,New York University,New York,New York,212-998-2121,Museum,Exhibitions,Moving Pictures: American Art and Early Film,15000
2017,"Just Buffalo Literary Center, Inc.",Buffalo,Erie,716-861-9985,Literature,General Support,Just Buffalo Literary Center GOS,28000
2004,THE STANDBY PROGRAM,Flushing,New York,212-206-7858,Electronic Media & Film,Services to the Field,Felix Journal,4000
2006,"Epiphany Theater Company, Inc.",New York,New York,646-638-0252,Theatre,Services to the Field,Rehearsal Space,4000
