Grant Year,Grantee,Address,State,ZIP,County,Phone,Program,Category,Project Title
2014,"Art Studio of WNY, Inc.","2495 Main Street , Suite 500",NY,14214-2152,Erie,716-833-4450,Visual Arts,Exhibitions & Installations,Buffalo Arts Studio Exhibition Program 2012-2013
2019,Change for Kids Inc,"110 East 23rd Street, 5th Floor",NY,10010,New York,212-213-8061,Arts Education,K-12: In-School Programs,Early Childhood Music Education Program
2019,Arts for Art,"107 Suffolk Street, #300",NY,10002,New York,212-254-5420,Music,General Support,General Operating
2010,Arts Horizons Inc,"289 St Nicholas Avenue, Lower Level",NY,10027,New York,212-268-7219,Arts Education,ESP School-Wide Arts Planning,Commongraphies w/Harlem Day Charter School 
2008,WSLU-FM,"Romoda Drive, St Lawrence University",NY,13617-1475,St Lawrence,315-229-5356,Literature,Public Programs,Readers & Writers on the Air FY08
2008,New York University School of Medicine,"NYU School of Medicine, 550 First Avenue",NY,10016,New York,212-263-3973,Literature,Literary Magazine Publication,Funding for 3 issues of Bellevue Literary Review FY2008
2018,"IGiullari di Piazza, Inc.","1047 Amsterdam Avenue, Cathedral of St John the Divine",NY,10025,New York,646-322-4637,Folk Arts,Folk Art Apprenticeships,Alessandra Belloni - South Italian percussion & dance
2012,Terranova Theatre Collective Inc.,"401 West 24 Street, #8",NY,10011,New York,917-603-0793,Theatre,Professional Performances,FY12 Season
2009,New York Foundation for the Arts,20 JAY ST STE 740,NY,11201-8352,Brooklyn,212-366-6900,Individual Artists,Film & Media / New Tech Prod.,Tomoko Oguchi - The Magic Stamp
2014,Theater Et Al Inc,5-49 49th Avenue,NY,11101,Queens,718-482-7069,Theatre,Professional Performances,The Long Scream
2005,Jupiter Symphony of New York Inc,155 W 68th St #319,NY,10023-5808,New York,212-799-1259,Music,Professional Performances,Chamber Music Series in New York City
2017,"Seagle Music Colony, Inc.","999 Charley Hill Road, PO Box 366",NY,12870,Essex,518-532-7875,Music,General Support,General Operating Support
2012,Society for Pres Weeksville Hist,158 Buffalo Avenue ,NY,11213-2420,Brooklyn,718-756-5250,Museum,General Oper Support,General Operating Expenses
2011,Music From Japan Inc.,"7 E 20th Street,  6F",NY,10003-1106,New York,212-674-4587,Music,General Operating Support,General Operating Expenses
2004,Partners for Arts Education,"501 West Fayette Street , Delavan Studio 221",NY,13204,Onondaga,315-234-9911,Arts In Education,General Program Support,Arts Education Network
2006,Town of Gardiner^The,PO Box 1,NY,12525,Ulster,845-255-8252,Architecture Planning & Design,Design and Planning Studies,Gardiner Hamlet Pedestrian Network
2006,Silver Bay Assoc-YMCA,87 Silver Bay Road,NY,12874-9708,Warren,518-543-8833,Architecture Planning & Design,Design and Planning Studies,Auditorium Conservation and Improvement
2017,DIA CENTER FOR THE ARTS (D/B/A DIA ART FOUNDATION),535 W 22nd Street-4th Floor,NY,10011-1108,New York,212-293-5506,Electronic Media & Film,Exhibitions & Installations,ArtistsÂ Web Projects
2018,"The Depot Theatre, Inc.","PO Box 414, 6705 Main St",NY,12993-0414,Essex,518-962-4449,Theatre,General Support,The Depot Theatre
2005,Locrian Chamber Players,111 Old Albany Post Rd.,NY,10562,Westchester,914-923-5511,Music,Professional Performances,Artist Fees for 2002-2003 Season
2015,"The Feminist Press, Inc.","365 Fifth Avenue, Suite 5406",NY,10016-4334,New York,212-817-7916,Literature,General Support,General Support
2013,"High Meadow Arts, Inc.",1020 Creek Locks Road,NY,12472,Ulster,845-389-5889,Arts Education,General Support,Ulster County Arts for All
2020,Friends of Materials for the Arts,"33-00 Northern Boulevard, Third Floor",NY,11101,Queens,718-729-2029,Arts Education,Pre-K-12: In-School Programs,MixedMedia Arts and Music Residency
2015,"Pelham Art Center, Inc.",155 Fifth Avenue,NY,10803-1503,Westchester,914-738-2525,Folk Arts,Project Support,Folk Arts Series
2008,"New York Bandura Ensemble, Inc.","43 St. Mark's Place, #3A",NY,10003,New York,917-612-9421,Special Arts Services,Professional Performances,Bandura Community Performances
2011,International Keyboard Institute and Festival,"229 West 97 Street, Suite 1B",NY,10025,New York,212-665-2446,Music,Professional Performances,Masters Series
2005,"Harvestworks, Inc.","596 Broadway, Rm 602",NY,10012,New York,212-431-1130,Music,New Music Technology,Residencies in New Music Technology
2005,Antique Boat Museum,750 Mary St,NY,13624-1119,Jefferson,315-686-4104,Arts In Education,S-W Impr Implementation: Yr 1,Community Connections
2003,Bardavon 1869 Opera House Inc.,35 Market Street,NY,12601-3240,Dutchess,845-473-5288,Capital Aid,CAPITAL AID GRANT,Emergency Exits Replacement Project
2014,The Strand Center for the Arts,23 Brinkerhoff Street,NY,12901,Clinton,518-563-1604,State & Local Partnership,Regrants,"Decentralization in Northern NY for Clinton, Essex and Franklin Counties $24,300 Admin/$56,700 Regra"
2007,"Friends of Music in Middletown, Inc.",POB 364,NY,13123,Oneida,315-761-1138,Presenting,Presentation,The Mansion Series - 28 performances
2005,"Alliance of Resident Theatres/New York, Inc.","520 Eighth Avenue, Suite 319",NY,10018,New York,212-244-6667,Theatre,Services to the Field,Reconsideration:NYSCA Theatre Technical Assistance Fund
2006,Bardavon 1869 Opera House Inc.,35 Market Street,NY,12601-3240,Dutchess,845-473-5288,Arts In Education,ESP Project-based Impl,Young Playwrights Festival Program with Poughkeepsie Middle School
2016,"Pan Asian Repertory Theatre, Inc.","520 Eighth Avenue, Suite 314, 3rd Flr.",NY,10018,New York,212-868-4030,Special Arts Services,Project Support,Expanded Theatre Forms / Performance & Development
2018,"National Black Theatre Workshop, Inc.","2031-33 National Black Theatre Way, 2031-33 Fifth Avenue",NY,10035-1503,New York,212-926-1049,Theatre,General Support,General Theatre Operating Support
2011,"Fractured Atlas, Inc.","248 West 35th Street, 10th Floor",NY,10001,New York,212-277-8020,Theatre,Professional Performances,Banana Bag & Bodice - Space//Space - Banana Bag & Bodice
2008,"CEC Stuyvesant Cove, Inc.","37 West 26th Street, Suite 209",NY,10010,New York,212-505-6050,Presenting,Presentation,Reconsideration:Solar Powered Dance Festival
2016,"Auburn Public Theater, Inc","8 Exchange Street, PO Box 771",NY,13021,Cayuga,315-253-6669,Presenting - Multi & Interdisc Arts,Project Support - Presentation,Auburn Public Theater Music Series
2003,Sound Portraits Productions,"80 Hanson Place, 2nd Floor",NY,11217,New York,646-723-7020,Individual Artists,FILM & MEDIA / NEW TECH PROD.,David Isay - The Voices Of The Forgotten Ones
2019,The Talking Band Inc.,"PO Box 293 , Prince Street Station",NY,10012-0293,New York,646-660-0150,Theatre,General Support,General Operating Support for The Talking Band
2007,Horizon Concerts Inc,"420 Lexington Ave, , Suite 300",NY,10170,New York,917-566-7926,Music,General Operating Support,General Operating Expenses
2004,Staten Island Instituteof Art and Science,"1000 Richmond Terrace, Building A",NY,10301,Staten Isl,718-483-7114,Visual Arts,Exhibitions & Installations,Artists/Ideas Exhibition Series
2017,Cornell University,"Office of Sponsored Programs, 373 Pine Tree Road",NY,14850,Tompkins,607-255-6306,Electronic Media & Film,Screenings,Cornell Cinema Screenings Support
2014,Asia Society,725 Park Avenue,NY,10021-5088,New York,212-327-9235,Museum,General Support,General Support for the Asia Society Museum 
2009,"Geneseo Migrant Center, Inc.",P.O. Box 38,NY,14530,Livingston,585-658-7960,Special Arts Services,Instruction and Training,CAMPS [Creative Artists Migrant Program Services]
2018,"Fractured Atlas, Inc.","248 West 35th Street, 10th Floor",NY,10001,New York,212-277-8020,Literature,Book & Literary Mag Pubs,Shade Mountain Press - Shade Mountain Press
2005,Art in General,"20 Jay Street, Suite 210A",NY,11201,New York,212-219-0473,Arts In Education,Project-based Implementation,In-School Contemporary Arts Program
2009,"ArtPeace, Inc.","277 North Goodman Street, Suite H209",NY,14607,Monroe,585-530-2060,Arts In Education,ESP School-Wide Arts Impl,"ArtPeace@East:  Legacy of Learning II, East H.S. Year 1"
2014,"Fractured Atlas, Inc.","248 West 35th Street, 10th Floor",NY,10001,New York,212-277-8020,Literature,Literary Magazine Publication,LUNGFULL! Magazine - LUNGFULL!magazine 
2018,"THE NEW YORK KOREAN PERFORMING ARTS CENTER, INC.","142 West 49th Street, Suite# 210",NY,10019,New York,212-921-9344,Folk Arts,Project Support,Ritual Ceremonies: Healing through Ssitgim
2015,UnionDocs Inc,322 Union Avenue,NY,11211,New York,917-544-2278,Electronic Media & Film,General Support,UnionDocs General Operations
2010,Music Conservatory of Westchester,216 Central Avenue,NY,10606,Westchester,914-761-3900,Music,Professional Performances,Community Performances:  Recital Hall Series
2010,"St. Luke's Chamber Ensemble, Inc.","450 West 37th Street, Suite 502",NY,10018,New York,212-594-6100,Music,General Operating Support,General Operating Expenses
2005,National Video Resources Inc,"73 Spring St, Ste. 403",NY,10012-4004,New York,212-274-8080,Electronic Media & Film,General Program Support,General Program Support
2006,Roxbury Arts Group Inc.,"PO Box 93, 5025 Vega Mountain Road",NY,12474-0093,Delaware,607-326-7908,Decentralization,Regrants,Commuity Arts Funding
2011,Visual Arts Rsrch & Rsrc Ctr,120 East 125 Street,NY,10035,New York,212-307-7420,Arts Education,Community-Based Learning,Center Saturdays
2017,"Chinese Theatre Works, Inc","37-18 Northern Boulevard, Suite 105",NY,11101,Queens,917-723-3548,Special Arts Services,General Support,Community performances (touring) and workshops
2003,Pequod Press Inc,"817 West End Ave.,Ste 4A",NY,10025-5318,New York,718-289-5416,Literature,LITERARY MAGAZINE PUBLICATION,"Pequod Magazine,Publication and Promotion"
2006,Foundation for Independent Artists Inc.,"75 Broad Street, Suite 304",NY,10004,New York,212-278-8111,Dance,Professional Performances,nicholasleichterdance - nicholasleichterdance: Dancers' Salaries; 2 Perfs. at the Kaatsbaan International Center for Dance
2008,"Shen Wei Dance Arts, Inc.","219 West 19th Street, 2nd Floor",NY,10011,New York,212-962-1113,Dance,Professional Performances,"Artists' Salaries; 3 Performances at the New York State Theater, Lincoln Center Festival"
2008,Center for Creative Education,"15 Railroad Avenue, PO Box 5000",NY,12401,Ulster,845-338-7664,Architecture Planning & Design,Design and Planning Studies,Carnegie Center for Creative Arts and Technology
2017,"Rochester Philharmonic Orchestra, Inc.","255 East Avenue, Suite LL02",NY,14604-2570,Monroe,585-454-7311,Arts Education,Community-Based Learning,Master classes & music instruction for urban youth
2007,Bardavon 1869 Opera House Inc.,35 Market Street,NY,12601-3240,Dutchess,845-473-5288,Music,Professional Performances,Hudson Valley Philharmonic 
2019,"Arts Services Initiative of Western NY, Inc.","2495 Main Street, Suite 422",NY,14214,Erie,716-833-3004,State & Local Partnership,Regrants,"DEC Arts Regrant: Erie and Niagara (Admin $52,500; Regrants $122,500)"
2019,Jezebel Productions,PO Box 1348,NY,10113-1348,New York,212-691-8838,Individual Artists,Film & Media / New Tech Prod.,Andrea Weiss - The Great Experiment
2011,"Fiji Theater Company, Inc.","47 Great Jones St, 6th Floor",NY,10012-1118,New York,212-529-1557,Theatre,General Operating Support,General Operating Expenses
2020,Everybody Dance Now!,115 Broadway,NY,10006,New York,,Arts Education,Community-Based Learning,Everybody Dance Now New York
2008,"Joyce Theater Foundation, Inc.",175 Eighth Avenue,NY,10011,New York,212-691-9740,Presenting,Presentation,"Dance Presentation Program, 101 dance presentations"
2020,New York Hall of Science,47-01 111th Street,NY,11368-2950,Queens,718-595-9190,Museum,General Support,General Operating Support
2010,"Art Omi, Inc.",1405 County Route 22,NY,12075,Columbia,518-392-4747,Music,Services to the Field,Music Omi
2015,"The Western Wind Vocal Ensemble, Inc",225 West 99th Street,NY,10025,New York,212-873-2848,Music,General Support,General Operating Support for The Western Wind 
2011,"Lower Manhattan Cultural Council, Inc.",125 MAIDEN LN 2ND FL,NY,10038,New York,212-219-9401,Electronic Media & Film,General Program Support,New Lower Manhattan and its Digital Futures
2015,"Dance Service New York City, Inc.","218 East 18th Street, Garden Floor",NY,10003,New York,212-966-4452,Dance,Regrants,Disabilities Study and NYC Dance Research
2009,"New York Live Arts, Inc.",219 West 19th Street,NY,10011-4001,New York,212-691-6500,Dance,Rehearsal Space,"Provision of 1,000 hours of Subsidized Rehearsal Space (@ $10/hour), to at least 60 Dance Artists"
2008,"Alvin Ailey Dance Foundation, Inc.","The Joan Weill Center for Dance , 405 West 55th Street",NY,10019-4402,New York,212-405-9035,Dance,Rehearsal Space,"The Ailey Studios Rental Subsidy Program: 1,000 hrs at $10/hr. for nonprofit dance cos./artists"
2005,THE STANDBY PROGRAM,14362 Sanford Avenue,NY,11355,New York,212-206-7858,Electronic Media & Film,Services to the Field,Felix Journal
2005,Arts Council in Buffalo & Erie County,700 Main St 1st Fl,NY,14202-1962,Erie,716-875-2707,Arts In Education,Regrants,AIE Partnership Program
2019,Women Make Movies,"115 W 29th Street, Suite 1200",NY,10001,New York,212-925-0606,Individual Artists,Film & Media / New Tech Prod.,Mariam Ghani - What We Left Unfinished
2020,Theater Mitu Inc.,"580 Sackett St, Unit A, Ground Floor",NY,11217,New York,646-543-6488,Theatre,General Support,General Operating 2020
2020,New York New Music Ensemble,"780 Riverside Dr. , 8C",NY,10032,New York,919-830-5908,Music,Project Support,20192020 Season
2007,"Lower Manhattan Cultural Council, Inc.",125 MAIDEN LN 2ND FL,NY,10038,New York,212-219-9401,Individual Artists,Film & Media / New Tech Prod.,Joe Berlinger - Crude
2012,Genesee Country Museum,"PO Box 310, 1410 Flint Hill Road",NY,14511-0310,Monroe,585-294-8252,Museum,General Oper Support,General Operating Expenses
2016,"American Symphony Orchestra, Inc.","263 West 38th Street, 10th Floor",NY,10018,New York,646-237-5031,Music,General Support,American Symphony Orchestra - General Operating
2009,Roundabout Theatre Company Inc.,"231 W 39th St, Suite 1200",NY,10018-3109,New York,212-719-9393,Arts In Education,ESP School-Wide Arts Impl,"ESP School-Wide Impl - Bronx Theatre HS, Year 3"
2005,Maelstrom Percussion Ensemble,5150 Bank Street,NY,14031-0272,Erie,716-759-6713,Music,General Operating Support,General Operating Expenses
2008,"Media Alliance, Inc.",PO Box 35 / 3361 6th Avenue,NY,12181-3590,Rensselaer,518-207-6264,Electronic Media & Film,Exhibitions,The Sanctuary For Independent Media
2019,"Ugly Duckling Presse, Ltd.","The Old American Can Factory, 232 Third Street, E303",NY,11215,Brooklyn,218-259-6081,Regional Economic Development,Workforce Readiness,Workforce Readiness: Ugly Duckling Presse Apprenticeship Program
2017,Cinema 10 Inc.,"c/o Holly Chambers, 12 Riverside Drive",NY,13676,St Lawrence,315-267-3312,Electronic Media & Film,Screenings,Cinema 10 Film Series
2017,"Double Entendre Music Ensemble, Inc.","1150 Park Avenue, #7F",NY,10128,New York,212-740-1222,Music,Project Support,Double Entendre On the Town
2019,BOUNDLESS THEATRE COMPANY INC.,"41-21 42nd Street, Apt 6D",NY,11104,Queens,347-724-3640,Theatre,Professional Performances,Mainstage Production
2019,Artpark & Company,450 S. 4th Street,NY,14092,Niagara,716-754-9000,Presenting,General Support,Artpark Presenting Season
2012,The Flux Factory,39-31 29th Street,NY,11101,Queens,347-379-5821,Electronic Media & Film,Workspace Facilities,2012 Flux Electronic Media Artists-in-Residence
2014,BUILDERS ASSOCIATION,"140 2nd Avenue , Suite 502",NY,10003,New York,646-269-2030,Theatre,General Support,"Project Development, General Operating Support"
2010,S U Theatre Corporation,820 E Genesee Street,NY,13210-1508,Onondaga,315-443-3931,Theatre,General Operating Support,General Operating Expenses
2003,"Catskill Conservatory, Inc",PO Box 295,NY,13820-0295,Otsego,607-436-3419,Music,PROFESSIONAL PERFORMANCES,General Operating Expenses
2009,"Dova, Inc.","260 West Broadway, Suite 4",NY,10013,New York,212-279-3344,Dance,General Operating Support,General Operating Expenses
2012,City Parks Foundation,"830 Fifth Avenue, The Arsenal",NY,10065,New York,212-360-8171,Literature,Public Programs,SummerStage Word Series Writers' Fees and Promotion
2003,"Hallwalls, Inc.",341 Delaware Ave.,NY,14202-1803,Erie,716-854-1694,Arts In Education,SERVICES TO THE FIELD,The Coalition of Arts Providers For Children
2014,"Huntington Arts Council, Inc.",213 Main St,NY,11743-6900,Suffolk,631-271-8423,State & Local Partnership,General Support,Huntington Arts Council-General Support
2017,"Unison Learning Center, Inc.",68 Mountain Rest Road,NY,12561-9742,Ulster,845-255-1559,State & Local Partnership,General Support,"Gallery, workshops, professional staff development"
2017,Mabou Mines Development Foundation,"150 First Avenue, Second Floor",NY,10009,New York,212-473-0559,Individual Artists,Composer Commissions,"Eve Beglarian - Vicksburg Project, title tbd"
2007,Landmark West,45 West 67th Street,NY,10023-6257,New York,212-496-8110,Architecture Planning & Design,Publication,LANDMARK WEST! newsletter
2005,Harlem Textile Works Ltd.,"P.O. Box 1090, College Station",NY,10030,New York,212-234-5257,State & Local Partnership,Workshops,General Audience Workshops
2014,NY Jazz Initiative Inc,"105 West 86th Street, #231",NY,10024,New York,212-663-1785,Individual Artists,Composer Commissions,Carlo Torres De Rosa - El Soneo
2014,La Troupe Makandal Inc.,621 Rutland Rd  Apt 4C,NY,11203-1716,Brooklyn,718-953-6638,Folk Arts,Project Support,The Frisner Augustin Memorial Drum Festival
2007,Soc-3rd St Msc School Settlment,235 East 11th Street,NY,10003-7398,New York,212-777-3240,Special Arts Services,Instruction and Training,Scholarships for music and dance students of color
2007,"Pan Asian Repertory Theatre, Inc.","520 Eighth Avenue, Suite 314, 3rd Flr.",NY,10018,New York,212-868-4030,Special Arts Services,General Program Support,Theatre Workshops and Performances for Community Youths and Young Adults
2014,"Lotus Fine Arts Productions, Inc.","310 Riverside Dr, Room 210",NY,10025,New York,212-627-1076,Folk Arts,Project Support,World in the City (WITC): Odissi Dance Comparison
2008,"Alleyway Theatre, Inc.",1 Curtain Up Alley,NY,14202-1911,Erie,716-852-2600,Theatre,Professional Performances,Theatre Plus (Pandora's Box)
2011,Essex County Historical Society,"7590 Court St , PO Box 428",NY,12932-0428,Essex,518-873-6466,Arts Education,K-12: Planning and Piloting,Essex County School Arts Planning Project
2004,Orpheus Chamber Orchestra,"490 Riverside Drive, 11th Floor",NY,10027-5788,New York,212-896-1713,Individual Artists,Commissions,Joan Tower - New Work by Joan Tower
2003,"Kenan Center, Inc",433 Locust St,NY,14094,Niagara,716-433-2617,Presenting,PRESENTATION,Artists fees and presenting costs - 14 performances
2007,"Yara Arts Group, Inc.","306 E 11th St, # 3B",NY,10003-7462,New York,212-777-7675,Folk Arts,Presentation,Yara's Traditional Music Series
2014,WAMC,318 Central Avenue,NY,12206-2522,Albany,518-465-5233,Electronic Media & Film,Screenings,Independent Film on the Air!
2020,"Trestle Gallery, Inc.","850 Third Avenue, Suite 411",NY,11232,New York,917-587-8600,Visual Arts,Exhibitions & Installations,Trestle Gallery Programs
2004,Minisink Valley Historical Society,"P.O. Box 659, 131 Main Street",NY,12771,Orange,845-856-2375,State & Local Partnership,Information Services,Arts Community Grants of Orange County - Quarterly Arts Newspaper
2006,CANAJOHARIE LIBRARY AND ART GALLERY,2 Erie Blvd,NY,13317-1198,Montgomery,518-673-2314,Museum,Exhibitions,ArkellÂs Inspiration:  A Collection of Fine Art for the People and the Marketing of Beech-Nut
2010,"Theatre Development Fund, Inc.","520 Eighth Avenue, Suite 801",NY,10018,New York,212-912-9770,Dance,Services to the Field,Dance Ticket Subsidy and Voucher Program
2019,Salem Art Works Inc.,19 Cary Lane,NY,12865,Washington,518-854-7674,Arts Education,Community-Based Learning,Art Explorations / Art 201
2006,"Garrison Art Center, Inc.","PO Box 4, 23 Depot Square on Garrison's Landing",NY,10524-0004,Putnam,845-424-3960,State & Local Partnership,General Operating Support,General Operating Expenses
2012,"The New York Landmarks Conservancy, Inc.","One Whitehall Street, 21st Floor",NY,10004,New York,212-995-5260,Architecture Planning & Design,General Oper Support,General Operating Expenses
2015,Participant Inc.,"253 East Houston Street, ground floor",NY,10002,New York,212-254-4334,Visual Arts,Exhibitions & Installations,PARTICIPANT INC exhibitions
2012,"Chinese Theatre Works, Inc","37-18 Northern Boulevard, Suite 105",NY,11101,Queens,917-723-3548,Theatre,Professional Performances,Mainstage theatre activity
2008,Construction Company Theatre/Dance Associates,10 E 18th St  #3,NY,10003-1928,New York,212-924-7882,Music,Professional Performances,Presentation of New Music Concerts
2018,Nuyorican Poets Cafe Inc.,"236 E 3rd St, PO Box 20794",NY,10009-7437,New York,917-841-4420,Special Arts Services,Instruction and Training,THE NUYORICAN POETS CAFEÂS POETIC OUTREACH PROJECT
2006,Steven Myron Holl Foundation,"450 West 31st Street, 11th Floor",NY,10001,New York,212-629-7262,Architecture Planning & Design,Publication,32BNY
2007,Classical Theatre of Harlem,8 West 126th Street,NY,10027,New York,646-838-3868,Theatre,Stabilization,Classical Theatre of Harlem stabilzation request
2005,Teatro Experimental Blue Amigo,"P.O. Box 572, Coney Island Station",NY,11224-0572,Brooklyn,718-896-4702,Special Arts Services,Professional Performances,Main Stage Series Project
2005,The Strand Center for the Arts,23 Brinkerhoff Street,NY,12901,Clinton,518-563-1604,State & Local Partnership,Administrative Salaries,Administrative Salaries
2012,Light Work Visual Studies Inc.,316 Waverly Ave,NY,13244-3010,Onondaga,315-443-1300,Electronic Media & Film,Workspace Facilities,Workspace: Digital Imaging Lab
2014,Arts & Cultural Council for Greater Rochester,31 Prince Street,NY,14607,Monroe,585-244-1854,State & Local Partnership,General Support,General Operating Support 
2008,New York Foundation for the Arts,20 JAY ST STE 740,NY,11201-8352,Brooklyn,212-366-6900,State & Local Partnership,General Operating Support,General Operating Expenses
2010,Reg Lenna Center For The Arts,116 East Third St,NY,14701-5402,Chautauqua,716-664-2465,Capital Projects,Capital Grants,Reg Studio Theater Renovation
2015,"Gotham Early Music Scene, Inc.","340 Riverside Drive, Suite 1-A",NY,10025-3431,New York,212-866-0468,Music,Regrants,Devel. & Tech Assistance - Needs Assessment
2004,"Dova, Inc.","260 West Broadway, Suite 4",NY,10013,New York,212-279-3344,Dance,General Operating Support,General Operating Expenses
2014,Cool Culture Inc,"80 Hanson Place, Suite 605",NY,11217,Brooklyn,718-230-4186,Museum,Project Support,Services to the Field: The Laboratory for New Audiences
2012,"Instituto Arte Teatral Internacional, Inc.","64 E. 4th Street, 2nd Floor",NY,10003,New York,212-505-6757,Individual Artists,Theatre Artist Commissions,Tere Martinez - New Play Commission 
2012,Light Work Visual Studies Inc.,316 Waverly Ave,NY,13244-3010,Onondaga,315-443-1300,Visual Arts,General Oper Support,General Operating Expenses
2005,"The Studio Museum in Harlem, Inc.",144 W 125th Street,NY,10027-4498,New York,212-864-4500,Special Arts Services,General Program Support,Artists-in-Residence Program & Community Programs 
2013,"Lubovitch Dance Foundation, Inc.",229 West 42nd St. Fl 8,NY,10036-7201,New York,212-221-7909,Dance,General Support,General Operating Expenses
2020,New York Foundation for the Arts,20 JAY ST STE 740,NY,11201-8352,Brooklyn,212-366-6900,State & Local Partnership,Partnerships,NYSCA/NYFA Professional Development Partnership Program
2007,Teachers and Writers Collaborative,540 President Street 3rd Floor,NY,11215,Brooklyn,212-691-6590,Arts In Education,ESP School-Wide Arts Impl,"Art Strands: Writing Across the Curriculum with PS156K, Brooklyn"
2005,Int'l Agency Minority Artists,"ACP. Jr. State Office Building, 163  West  125 St., Suite 903",NY,10027-4404,New York,212-749-5298,State & Local Partnership,General Operating Support,General Operating Expenses
2005,"Trisha Brown Company, Inc.","315 West 39th Street, Studio 908",NY,10018,New York,212-977-5365,Dance,General Operating Support,General Operating Expenses
2008,Saratoga Film Forum,320 Broadway,NY,12866-0894,Saratoga,518-584-3456,Electronic Media & Film,General Operating Support,General Operating Expenses
2004,"Sunset Park School of Music, Inc.","4520 Fourth Ave, Box MH9",NY,11220-1152,Brooklyn,917-825-3478,Music,Community Programs/Outreach,Community Music School  Instruction & Performance
2013,"The Metropolitan Opera Guild, Inc.","70 Lincoln Center Plaza, 6th Floor",NY,10023-6593,New York,212-769-7014,Arts Education,General Support,Met Opera Guild Arts Education Operating Support
2015,"Collaborationtown, A Theatre Company, Inc.","529 Fifth Street, 1R",NY,11215,Brooklyn,617-671-8417,Theatre,Professional Performances,The Rise and Fall of the Trilobite Kingdom
2007,"Elevator Repair Service Theater, Inc.","47 Great Jones Street, 3rd Floor",NY,10012,New York,212-254-3137,Theatre,Professional Performances,ERS 06-07 Season
2016,Socrates Sculpture Park Inc,"PO Box 6259, 32-01 Vernon Blvd ",NY,11106-0259,Queens,718-956-1819,Visual Arts,General Support,General Operating Expenses
2016,Women Make Movies,"115 W 29th Street, Suite 1200",NY,10001,New York,212-925-0606,Individual Artists,Film & Media / New Tech Prod.,Cecilia Aldarondo - MEMORIES OF A PENITENT HEART 
2004,Doing Art Together Inc,"127 West 127th Street, Suite 304",NY,10027,New York,212-245-8132,Arts In Education,General Program Support,General Program Support
2015,New York Public Library,"445 Fifth Avenue, Fourth Floor",NY,10016,New York,212-930-0858,Dance,Services to the Field,"Documentation/Access: 8 Dance Performances, 4 Oral"
