Grant Year,Grantee,Address,State,ZIP,County,Phone,Program,Category,Project Title
2009,SHAKESPEARE IN DELAWARE PARK INC,PO BOX 716,NY,14205-0716,Erie,716-856-4533,Theatre,General Operating Support,General Operating Expenses
2019,"National Dance Institute, Inc.",217 West 147th Street,NY,10039,New York,212-226-0083,Arts Education,General Support,NDI: Inspiring Children Through the Arts
2008,"St. Ann's Warehouse, Inc.","45 Water Street,  ",NY,11201,Brooklyn,718-834-8794,Presenting,Presentation,Artist Fees and Presenting Costs
2009,"Bowery Arts and Science, Ltd","310 Bowery, 2nd Floor",NY,10012,New York,413-230-0740,Literature,Book Publication,Cypher Books - Cypher Books Spoken-word poetry books
2011,Adirondack Architectural Heritage,1745 Main Street,NY,12944-3743,Clinton,518-834-9328,Architecture Planning & Design,General Operating Support,General Operating Expenses
2017,"Camera Club of New York, Inc.",126 Baxter St,NY,10013,New York,212-260-9927,Visual Arts,Workspace,Darkroom Residency Program
2016,Los Pleneros De La 21,"Julia de Burgos Latino Cultural Center, 1680 Lexington Ave Rm 209",NY,10029,New York,212-427-5221,Special Arts Services,Instruction and Training,The Bomba & Plena Community Workshops
2003,New York Folklore Society,129 Jay Street,NY,12305,Schenectady,518-346-7008,Folk Arts,GENERAL OPERATING SUPPORT,General Operating Expenses
2019,"On Site Opera, Inc.","45 Sutton Place South, #9E",NY,10022,New York,917-968-6267,Individual Artists,Composer Commissions,John Glover - Composer Commission: John Glover
2009,Azure Ensemble^The,"c/o Susan Glaser, Steinhardt School, NYU, 35 W. 4th St., Suite 777",NY,10012,New York,646-734-9577,Music,Professional Performances,Concert Season
2011,"Judith Shakespeare Company, Inc.",367 Windsor Highway  #409,NY,12553,New York,845-569-1849,Theatre,Professional Performances,Mainstage Theatre Season
2016,American Modern Ensemble,400 West 43rd Street Suite 39S,NY,10036,New York,212-217-0119,Music,General Support,AME's 2013-2014 Season
2006,"Creation Production Company, Inc.",127 Greene St,NY,10012-5401,New York,212-674-5593,Theatre,Professional Performances,Development and production of a new theatre piece
2014,"Theatre Development Fund, Inc.","520 Eighth Avenue, Suite 801",NY,10018,New York,212-912-9770,Theatre,Regrants,TAP Plus
2003,The Sea Cliff Chambers Players Inc.,"135 Crossways Park Drive, P. O. Box 9017",NY,11797,Nassau,877-444-4488,Music,PROFESSIONAL PERFORMANCES,Chamber Music Programs Throughout Nassau County **PER CAPITA**
2016,"Center for the Arts at Ithaca, Inc.",PO Box 205,NY,14851-0205,Tompkins,607-273-8588,Theatre,General Support,Hangar Theatre General Operating Support
2019,ANCRAM OPERA HOUSE THEATER INC,1330 County Route 7,NY,12502,Columbia,917-535-5436,Theatre,Professional Performances,Develop and premiere of two new theater works
2013,Anti-Social Music,500C Grand Street Unit GE,NY,10002,New York,646-489-8791,Music,Project Support,NY Series 2012-2013 Season
2012,Arts in Orange,31 Jersey Avenue,NY,12771,Orange,845-956-0005,State & Local Partnership,Workshops,Professional  Development Workshops
2008,TRI-CITIES OPERA CO INC,315 Clinton St,NY,13905-2084,Broome,607-729-3444,Music,General Operating Support,General Operating Expenses
2003,Trustees of Hamilton College,198 College Hill Rd,NY,13323-1218,Oneida,315-859-4678,Presenting,PRESENTATION,Artists fees and presenting costs - Minimum10 performances+Residencies
2020,"Groundswell Community Mural Project, Inc.",540 President St. Ste 1A,NY,11215,Brooklyn,718-254-9782,Arts Education,General Support,Public Art Education Programs
2012,"National Music Theater Network, Inc","36 West 44th Street, Suite 1010A",NY,10036,New York,212-664-0979,Theatre,Services to the Field,The New York Musical Theatre Festival (NYMF)
2009,"Harvestworks, Inc.","596 Broadway, Rm 602",NY,10012,New York,212-431-1130,Individual Artists,Composer Commissions,Ikue Mori - Ikue Mori
2019,String Orchestra of New York City,251 Seaman Ave. #1F,NY,10034,New York,646-270-1771,Music,Project Support,SONYC concert season
2005,Friends Bay Shore-Brightwaters Library,One South Country Road,NY,11718-1517,Suffolk,631-665-4350,Presenting,Presentation,Artists fees and presenting costs - 5 performances
2003,Hatch-Billops Collection Inc,491 Broadway 7fl,NY,10012-4412,New York,212-966-3231,Special Arts Services,GENERAL PROGRAM SUPPORT,"Artists Fees, Research Assistant, Artist & Influence Journal"
2016,"Catskill Symphony Orchestra, Inc.",PO Box 14,NY,13820-0014,Otsego,607-436-2670,Music,General Support,Operating Support for Annual Series
2016,"Pendragon, Inc.",15 Brandy Brook Ave,NY,12983-2055,Essex,518-891-1854,Theatre,General Support,Home and Touring Production Season
2018,"Alarm Will Sound, Inc.","51 Wooster Street, , 4th floor",NY,10013,New York,773-234-2846,Individual Artists,Composer Commissions,Mary Kouyoumdjian - Mary KouyoumdjianÂs ÂPaper PianosÂ 
2013,WNET,825 8th Avenue,NY,10019,New York,212-560-3193,Architecture + Design,Project Support,Public Program: Treasures of NY: Stanford White
2008,American Opera Projects Inc,138 South Oxford Street,NY,11217,Brooklyn,718-398-4024,Stabilization,Stabilization,Stabilization Program
2008,Skidmore College,815 North Broadway,NY,12866-1632,Saratoga,518-580-8052,Music,Professional Performances,Skidmore Jazz Institute
2017,"DEEP Arts, Inc.",41 French Rd,NY,14618,Monroe,585-752-3174,Arts Education,K-12: In-School Programs,Rochester ChildrenÂs Theatre Sweet House Project
2009,Cattaraugus County Arts Council,POB 406,NY,14760,Cattaraugus,716-372-7455,State & Local Partnership,Regrants,"DEC regrants for Cattaraugus & Allegany Counties. Regrant: $39,400.  Administration: $15,600."
2018,"Children of Promise, NYC",54 MacDonough Street,NY,11216,Brooklyn,718-483-9290,Special Arts Services,Project Support,Art from the Heart
2008,Salvadori Center Ltd.,"475 Riverside Drive, Suite 1272",NY,10115-0031,New York,212-870-3970,Arts In Education,ESP School-Wide Arts Planning,"Muscota New School,  School #314, Washington Heights, Manhattan/Salvadori Partnership"
2020,Blessed Unrest Theatre Inc,"530 West 45th Street, #4G",NY,10036,New York,212-713-0163,Theatre,Professional Performances,New York Performance Season
2004,Fiction Inc,94 Bowery Apt 5,NY,10013-4727,New York,212-966-3659,Literature,Literary Magazine Publication,Fiction magazine 2 issues per year
2017,"Hallwalls, Inc.",341 Delaware Ave.,NY,14202-1803,Erie,716-854-1694,Visual Arts,General Support,General Support for Visual & Media Arts
2006,Henry Street Settlement,466 Grand Street,NY,10002,New York,212-766-9200,Theatre,Professional Performances,Henry Street Settlement Theater Program
2010,"African Cultural Center of Buffalo, Inc.",350 Masten Ave,NY,14209-1706,Erie,716-884-2013,Special Arts Services,General Program Support,Theatre/Dance
2003,Three Village Historical Soc,93 North Country Rd,NY,11733-0076,Suffolk,631-751-3730,Museum,MUSEUM EDUC & INTERPRETATION,Brookhaven 1655: Local History on the World Wide Web-consultant only
2014,Japan Society Inc,333 E 47th Street,NY,10017-2313,New York,212-715-1207,Presenting - Multi & Interdisciplinary Arts,Project Support - Presentation,"Artists' Fees, Production Expenses for FY2011-2012"
2015,Design Trust for Public Space,"40 Worth Street, Suite 603",NY,10013,New York,212-695-2432,Architecture + Design,General Support,General Operating Support
2005,Partners for Arts Education,"501 West Fayette Street , Delavan Studio 221",NY,13204,Onondaga,315-234-9911,Arts In Education,Regrants,School Arts Partnership Technical Assistance Progr
2009,"CNY Arts, Inc.","421 Montgomery St, 11th Floor",NY,13202-2964,Onondaga,315-435-2125,State & Local Partnership,General Operating Support,General Operating Expenses
2015,Long Island Traditions,382 Main St,NY,11050-5136,Nassau,516-767-8803,Folk Arts,General Support,Long Island Traditions general support
2019,"Pan Asian Repertory Theatre, Inc.","520 Eighth Avenue, Suite 314, 3rd Flr.",NY,10018,New York,212-868-4030,Regional Economic Development,Workforce Investment,Staff Expansion: General Manager
2004,"Snug Harbor Cultural Center, Inc.",1000 Richmond Terrace,NY,10301-1199,Staten Isl,718-425-3505,Presenting,Presentation,Summer Sunday Concert Series- 10 free outdoor concerts
2006,Brooklyn Economic Development,"2001 Oriental Boulevard-Kingsborough Com. College, Room T-4162 ",NY,11235,Brooklyn,718-368-6790,Electronic Media & Film,Exhibitions,9th Williamsburg Brooklyn Film Festival
2010,Something Special Big Band,7 Opal Dr,NY,11803,Nassau,516-681-1789,Music,Professional Performances,concert/show series
2011,Theatre District Association of Western New^The,"PO Box 504 Ellicott Station, c/o TDA",NY,14205,Erie,716-884-4400,Theatre,Services to the Field,Theatre Alliance of Buffalo
2018,Long Island University,"University Center, 700 Northern Blvd",NY,11548-1326,Nassau,516-299-2523,Presenting,General Support,2017 Presenting Season
2008,Saratoga Springs Preservation Foundation Inc.,"PO Box 442 , 112 Spring Street, Suite 203",NY,12866-0442,Saratoga,518-587-5030,Architecture Planning & Design,General Operating Support,General Operating Expenses
2007,Brooklyn Arts Council,"20 Jay Street, Suite 616",NY,11201,Brooklyn,718-625-0080,Electronic Media & Film,Exhibitions,BAC International Film and Video Festival
2010,Southeast Museum Association,67 Main St,NY,10509-1416,Putnam,845-279-7500,Museum,General Operating Support,General Operating Expenses
2010,Friends of the Neuberger Museum of Arts Inc.,"SUNY Purchase, 735 Anderson Hill Road",NY,10577-1400,Westchester,914-251-6105,Individual Artists,Film & Media / New Tech Prod.,Brooke Singer - Superfund 365
2008,"International Arts Relations, Inc.","PO Box 756 (mailing), 500 W. 52nd Street (office)",NY,10108-0756,New York,212-695-6134,Special Arts Services,Instruction and Training,Artistic Development for Latino Theatre Arts;NewWorks Lab and Playwrights-in Residence Lab
2003,"DocuClub, Inc.","39 W. 19th Street, #604",NY,10011,New York,212-582-3055,Electronic Media & Film,SERVICES TO THE FIELD,DocuClub in New York
2010,Buffalo Olmsted Parks Conservancy Inc.,"84 Parkside Ave, Parkside Lodge",NY,14214-2653,Erie,716-838-1249,Architecture Planning & Design,Independent Projects,Sergio Lopez-Pineiro - Lopez-Pineiro: OlmstedÂs Blank Snow (includes $750 for Buffalo Olmsted Conservancy)
2019,New York Hall of Science,47-01 111th Street,NY,11368-2950,Queens,718-595-9190,Facilities,Capital Equipment (Facilities),Theater Renovation - Induction Loop
2010,Midori Foundation Inc.,"352 7th Avenue, Ste. 301",NY,10001,New York,212-767-1300,Arts Education,ESP Project-based Impl,First Adventures in Sound at PS 91Q
2009,Apex Art Curatorial Program,291 Church St,NY,10013-2403,New York,212-431-5270,Visual Arts,Exhibitions & Installations,Apexart Ongoing Exhibitions
2006,Community Arts Partnership of Tompkins County,110 N. Tioga Street,NY,14850-4331,Tompkins,607-273-5072,State & Local Partnership,General Operating Support,General Operating Expenses
2005,Hospital Audiences Inc. (HAI),"33-02 Skillman Avenue, 1st Floor",NY,11101,Queens,212-575-7677,Presenting,Presentation,Artists Fees & Expenses-10 Performances
2006,EPIC Theatre Center Inc.,"410-412 West 42nd Street, 40",NY,10036,New York,212-239-1770,Individual Artists,Theatre Artist Commissions,Kate Fodor - Commissioning a New Play from Kate Fodor
2016,The Flux Factory,39-31 29th Street,NY,11101,Queens,347-379-5821,Visual Arts,General Support,Flux Factory Operating Support
2010,Museum of Biblical Art,1865 Broadway,NY,10023,New York,212-408-1236,Museum,Museum Educ & Interpretation,Words and Pictures: Storytelling Through Art
2016,RIVERTOWN ARTS COUNCIL (D/B/A RIVERARTS),"PO Box 60, 414 Warburton Ave",NY,10706,Westchester,914-412-5103,State & Local Partnership,General Support,Rivertowns Arts Council General Support
2008,"Lower Manhattan Cultural Council, Inc.",125 MAIDEN LN 2ND FL,NY,10038,New York,212-219-9401,Electronic Media & Film,General Program Support,New Lower Manhattan and its Digital Futures
2014,Reg Lenna Center For The Arts,116 East Third St,NY,14701-5402,Chautauqua,716-664-2465,Arts Education,K-12: In-School Programs,Expressive Media In Schools 
2011,"Trisha Brown Company, Inc.","315 West 39th Street, Studio 908",NY,10018,New York,212-977-5365,Dance,General Operating Support,General Operating Expenses
2017,"Bronx Council on the Arts, Inc.",2700 East Tremont Ave.,NY,10461-1403,Bronx,718-931-9500,State & Local Partnership,Regrants,"DEC Arts Regrant: Bronx ($43,165 Admin; $100,715 Regrants)"
2005,"Amigos del Museo del Barrio, Inc.",1230 Fifth Ave,NY,10029-4401,New York,212-660-7118,Museum,General Operating Support,General Operating Expenses
2018,"DISCALCED, INC",3 Lafayette Avenue,NY,11217,Brooklyn,718-624-8400,Regional Economic Development,Facilities,Mark Morris Dance Center Renovations
2017,"Hallwalls, Inc.",341 Delaware Ave.,NY,14202-1803,Erie,716-854-1694,Music,Project Support,Jazz & New Music Concerts
2003,Experimental Television Center,180 Front Street,NY,13827-1521,Tioga,607-687-4341,Individual Artists,FILM & MEDIA / NEW TECH PROD.,Jeanne Liotta - DREAMS OF AN ASTRONOMER
2010,"League of Composers, Inc.",24 Waverly Place RM 268,NY,10003,New York,347-559-5376,Music,Professional Performances,League/ISCM Concert Series
2019,"Magic Box Productions, Inc.","444 Bedford Road, Ste. 203",NY,10570,Westchester,914-747-0256,Arts Education,General Support,Media Arts Education Support
2018,"Labyrinth, Inc",38 Commerce Street,NY,10014,New York,212-513-1014,Theatre,General Support,Labyrinth-General Support
2016,Arthur Aviles Typical Theatre,2474 Westchester Avenue,NY,10461,Bronx,718-918-2110,Dance,Rehearsal Space & Residencies,Rehearsal Space Subsidy
2003,"Pamphlet Architecture, Ltd.",37 East 7th Street,NY,10003-8027,New York,212-995-9620,Architecture Planning & Design,PUBLICATION,Young Architects 4: Material Process
2017,Genesee Valley Council on the Arts,4 Murray Hill Drive,NY,14510-1122,Livingston,585-243-6785,State & Local Partnership,Regrants,"Genesee Valley Arts Decentralization Grants ($45,750Admin/$106,750)"
2009,Great Neck Center for Visual & Performing Arts,113 Middle Neck Road,NY,11021-1219,Nassau,516-829-2570,State & Local Partnership,Administrative Salary Support,Gallery Adm: Develop & Coordinate Activities
2016,The Niagara Arts & Cultural Center Inc.,1201 Pine Avenue,NY,14301,Niagara,716-282-7530,Regional Economic Development,Workforce Investment,NACC Workforce Investment
2003,Buffalo Olmsted Parks Conservancy Inc.,"84 Parkside Ave, Parkside Lodge",NY,14214-2653,Erie,716-838-1249,Architecture Planning & Design,PUBLICATION,"Olmsted Park and Parkway System in Buffalo, NY"
2020,The Arts Center of the Capital Region,265 River Street,NY,12180-4496,Rensselaer,518-273-0552,Facilities,Capital Equipment (Facilities),Theatre Upgrade
2017,Roberson Museum and Science Center,30 Front St,NY,13905-4779,Broome,607-772-0660,Regional Economic Development,Planning,(Re)Defining the Binghamton Visitor Center at Roberson
2007,Electronic Music Foundation,150 West End Avenue Ste 20k,NY,10023,New York,212-873-3569,Music,Services to the Field,Arts Electric
2010,Lake George Opera Festival Association Inc,"19 Roosevelt Drive, Suite 215",NY,12866,Saratoga,518-584-6018,Music,General Operating Support,General Operating Expenses
2006,"Downtown Community Television Center, Inc.",87 Lafayette Street,NY,10013-4410,New York,646-484-4633,Individual Artists,Film & Media / New Tech Prod.,Roger Bourdeau - Laffoley's Odyssey
2018,"Streb, Inc.",51 North 1st Street,NY,11249,Brooklyn,718-384-6491,Individual Artists,Dance Commissions,Fabio Tavares - STREB Extreme Action Company Collective Commission
2003,42nd Street Workshop,"312 West 36th Street, 4th Floor",NY,10018,New York,646-270-2500,Architecture Planning & Design,ADAPTIVE USE STUDIES,Adaptive Use Studies
2004,"Lower Manhattan Cultural Council, Inc.",125 MAIDEN LN 2ND FL,NY,10038,New York,212-219-9401,State & Local Partnership,General Operating Support,General Operating Expenses
2005,NYS Theatre Education Association,105 Cord Lane,NY,11756,New York,516-735-6063,Theatre,Services to the Field,Annual Statewide High School Student Theatre Conference
2010,"ArtsWestchester, Inc.","31 Mamaroneck Avenue, 3rd Floor",NY,10601,Westchester,914-428-4220,State & Local Partnership,General Operating Support,General Operating Expenses
2014,The InterSchool Orchestras of New York,"121 West 27th St., Suite 902",NY,10001,New York,212-410-0370,Arts Education,General Support,ISO's 2012/2013 Performance Season
2013,"City Lore, Inc.",56 E. First Street,NY,10003-9345,New York,212-529-1955,Individual Artists,Film & Media / New Tech Prod.,Kewulay Kamara - In Search of Finah Misa Kule
2018,The York Theatre Company,619 Lexington Avenue ,NY,10022-4613,New York,212-935-5824,Theatre,General Support,Mainstage Season
2005,Greenwich Village Society for Historic Pres,232 East 11th Street,NY,10003,New York,212-475-9585,Architecture Planning & Design,Institutional Development,Underwriting of Executive Director's Salary
2006,New York State Early Music Association,333 The Parkway,NY,14850,Tompkins,607-301-0604,Music,General Operating Support,General Operating Expenses
2010,"Lake George Arts Project, Inc.",1 Amherst Street,NY,12845-1427,Warren,518-668-2616,Presenting,Presentation,Concert Series and Jazz Festival - 15 performances
2016,"Musica de Camara, Inc.","1215 Fifth Ave, Ste 1B",NY,10029-1215,New York,718-987-4297,Music,General Support,Musica de Camara General Operating Expenses
2003,Irondale Productions Inc.,85 South Oxford Street,NY,11217,Brooklyn,718-488-9233,Theatre,GENERAL OPERATING SUPPORT,General Operating Expenses
2007,"Shen Wei Dance Arts, Inc.","219 West 19th Street, 2nd Floor",NY,10011,New York,212-962-1113,Dance,Professional Performances,Artists' Salaries for 8 Performances at The Joyce
2016,"Bluseed Studios, Inc.",24 Cedar St.,NY,12983,Franklin,518-891-3799,State & Local Partnership,General Support,Sustaining BluSeed Studios' Growth and Development
2015,"Groundswell Community Mural Project, Inc.",540 President St. Ste 1A,NY,11215,Brooklyn,718-254-9782,Arts Education,General Support,Public Art Education Programs
2015,"New York Live Arts, Inc.",219 West 19th Street,NY,10011-4001,New York,212-691-6500,Dance,Rehearsal Space & Residencies,"Subsidized Rehearsal Space:1,000 hours at $10/hr. for 50-60 nonprofit dance cos./artists"
2011,Elaine Kaufman Cultural Center,129 West 67th Street,NY,10023-5976,New York,212-501-3357,Presenting,Presentation,Kaufman Center (KC) Presentations in Merkin Hall
2019,Percussia,37-22 85th Street #1 ,NY,11372,Queens,718-813-6171,Music,Project Support,Concert Series
2005,The Jewish Museum,1109 Fifth Avenue,NY,10128-0118,New York,212-423-3334,Museum,General Operating Support,Reconsideration:General Operating Expenses
2010,"Madison Square Park Conservancy, Inc.","11 Madison Avenue, 15th Floor",NY,10010,New York,212-786-5727,Presenting,Presentation,Mad. Sq. Music & Mad. Sq. Studio-minimum of 10 presentations
2010,Voices UnBroken,"1414 Metropolitan Avenue, 2nd Floor",NY,10462,Bronx,347-759-3932,Literature,Public Programs,Voices UnBroken Workshops Artists' Fees and Promotion
2010,The Hamilton Hill Art Center,409 Schenectady St,NY,12307-1712,Schenectady,518-346-1262,Special Arts Services,General Operating Support,General Operating Expenses
2011,Capital Repertory Company,432 State Street - Administration ,NY,12305,Albany,518-382-3884,Theatre,General Operating Support,General Operating Expenses
2005,Japan Society Inc,333 E 47th Street,NY,10017-2313,New York,212-715-1207,Electronic Media & Film,Exhibition,The Japan Society Film Center - Film Programs
2007,Adirondack Lakes Center for the Arts,"PO Box 205, 3446 State Route 28",NY,12812-0205,Hamilton,518-352-7715,State & Local Partnership,Regrants,"Decentralization Program for Hamilton County.Regrant Amount: $16,050. Administration Amount: $6420."
2011,Adirondack Historical Association,"9097 State Route 30, P. O. Box 99",NY,12812-0099,Hamilton,518-352-7311,Museum,General Operating Support,General Operating Expenses
2012,Vital Theatre Company,"2162 Broadway, 4th Floor",NY,10024-6620,New York,212-579-0528,Arts Education,K-12: In-School Programs,Vital Voices: PAGE TO STAGE
2008,Community Arts Network of Oneonta ,"Wilber Mansion, 11 Ford Ave.",NY,13820-2556,Otsego,781-883-4338,Arts In Education,Regrants,"Creative Partnership Grant (Regrant amt. $14,300, Admin. $7,700, Roundtable $2,200)"
2013,"Columbia County Historical Society, Inc.","PO Box 311, 5 Albany Avenue",NY,12106-0311,Columbia,518-758-9265,Museum,Project Support,Salary Support: Museum Educator
2016,Everson Museum of Art,401 Harrison St,NY,13202-3019,Onondaga,315-474-6064,Regional Economic Development,"Arts, Culture and Heritage New Initiatives - Implementation",Helen Levitt Exhibition Programming
2010,A Gathering of the Tribes Inc,"Steve Cannon 745 E. 6th St , Apt.1A",NY,10009,New York,212-777-2038,Literature,Book Publication,"Tribes new works by individual, emerging authors"
2003,Genesee Country Museum,"PO Box 310, 1410 Flint Hill Road",NY,14511-0310,Monroe,585-294-8252,Folk Arts,PRESENTATION,Old-Time Fiddlers'Fair:Rising Generation Tent
2011,Smithsonian Institution,2 E 91st St,NY,10128-9990,New York,212-849-8311,Museum,General Program Support,National Museum of the American Indian-George Gustav Heye Center
2006,Fenimore Art Museum ,"5798 State Highway 80, Lake Road, PO Box 800",NY,13326,Otsego,607-547-1412,Museum,General Operating Support,Fenimore Art Museum: General Operating Expenses
2015,Queens Museum of Art,"New York City Building, Flushing Meadows Corona Park",NY,11368-3398,Queens,718-592-9700,Museum,General Support,General Operating Support
2010,Queens Council of the Arts,28-18 Steinway Street,NY,11103,New York,347-505-3018,Stimulus,Stimulus,Artist Empowerment Initiative Outreach Coordinator
2013,"Brooklyn Arts Exchange, Inc.",421 5th Ave ,NY,11215-3315,Brooklyn,718-832-0018,Arts Education,K-12: In-School Programs,BAX Elementary Consortium
2003,TheatreTweed Inc,"332 Bleecker Street, Box G-36",NY,10014-2822,New York,212-777-0536,Theatre,PROFESSIONAL PERFORMANCES,General Operating Expenses
2013,The Jewish Museum,1109 Fifth Avenue,NY,10128-0118,New York,212-423-3334,Museum,General Support,General Operating Expenses
2012,"Catskill Symphony Orchestra, Inc.",PO Box 14,NY,13820-0014,Otsego,607-436-2670,Music,General Oper Support,General Operating Expenses
2008,"Signature Theatre Company, Inc.",480 West 42nd Street,NY,10036,New York,646-388-8136,Theatre,General Operating Support,General Operating Expenses
2006,"Composers Collaborative, Inc.",210 Riverside Dr Apt 11G,NY,10025-6883,New York,212-920-0726,Literature,Public Programs,Non Sequitur Festival
2014,New Amsterdam Presents,"417 Myrtle Avenue #101, c/o Sandbox Shipping",NY,11205,Brooklyn,864-569-5158,Music,General Support,2012-2013 Concert Season
2018,New Perspectives Theatre Company,"456 West 37th Street, Ground Floor",NY,10018,New York,212-630-9945,Theatre,Professional Performances,2017 PUBLIC PERFORMANCE PROGRAM
2011,"Calpulli Mexican Dance Company, Inc.",2512 77th St.,NY,11370,Queens,917-693-8265,Special Arts Services,Professional Performances,Fandangos in the Park
2011,George Eastman Museum,900 East Avenue,NY,14607-2298,Monroe,585-327-4937,Museum,General Operating Support,General Operating Expenses
2012,"New York Scandia Symphony, Inc.","909 Third Avenue, #583",NY,10150,New York,828-505-3997,Music,General Oper Support,General Operating Expenses
2008,Pierpont Morgan Library,225 Madison Avenue,NY,10016-3405,New York,212-590-0324,Museum,General Program Support,General Program Support - Morgan Museum
2008,Home for Contemporary Theatre and Art,145 6th Ave,NY,10013-1548,New York,212-647-0202,Individual Artists,Theatre Artist Commissions,Taylor Mac - The Lily's Revenge
2010,"Four Way Books, Inc","PO Box 535, Village Station",NY,10014,New York,212-965-0019,Literature,Book Publication,Four Way Books Literary Publishing 
2017,Council of Literary Magazines and Presses,"154 Christopher Street, Suite 3C",NY,10014-2839,New York,212-741-9110,Regional Economic Development,Workforce Investment,CLMP REDC Application
2018,Midori Foundation Inc.,"352 7th Avenue, Ste. 301",NY,10001,New York,212-767-1300,Arts Education,K-12: In-School Programs,12 Notes Program
2005,AARON DAVIS HALL (HARLEM STAGE),150 Convent Ave at West 135th Street,NY,10031,New York,212-281-9240,State & Local Partnership,Services to the Field,Aaron Davis Hall's Partnership Program
2017,"Musica de Camara, Inc.","1215 Fifth Ave, Ste 1B",NY,10029-1215,New York,718-987-4297,Music,General Support,Musica de Camara General Operating Expenses
2015,The Poetry Project LTD,"St Mark's Church, 131 E 10th St",NY,10003-7504,New York,212-674-0910,Literature,General Support,General Operating Support
2017,"ArtsWestchester, Inc.","31 Mamaroneck Avenue, 3rd Floor",NY,10601,Westchester,914-428-4220,Presenting,Project Support - Presentation,Jazz Fest
2006,Crown Heights Jewish Community Council Inc,375 Kingston Ave,NY,11213,Brooklyn,718-774-9149,Special Arts Services,Exhibitions,Exhibitions 
2008,Eva Dean Dance Company,"725 Union Street , Suite B",NY,11215,Brooklyn,718-857-8368,Dance,Rehearsal Space,"Prov. of Free & Low Cost Reh. Space (1,500 Hrs. to 60 Dance Artists)"
2012,"Art Sweats, Inc.","David Dorfman Dance  Box 1227, Peter Stuyvesant Station",NY,10009,New York,212-677-2503,Dance,General Oper Support,General Operating Expenses
2010,"Smack Mellon Studios, Inc.",92 Plymouth Street,NY,11201,Brooklyn,718-834-8761,Electronic Media & Film,General Program Support,Electronic Media & Film Studies Exhibitions
2003,Big Dance Theater Inc.,303 Clinton Street,NY,11231,Brooklyn,202-621-3043,Theatre,PROFESSIONAL PERFORMANCES,"Dance/Theater Adaptation of Franz Kafka's ""The Country Doctor"""
2003,Friends of Bristol Valley Playhouse Foundation,"PO Box 218, 117 South Main Street, 2nd floor",NY,14512-0218,Ontario,585-374-9032,Theatre,GENERAL OPERATING SUPPORT,General Operating Expenses
