Grant Year,Grantee,City,County,Phone,Program,Category,Project Title,Grant Amount
2004,"Foundation for the Open Eye, Inc.",Margaretville,Delaware,845-586-1689,Theatre,Professional Performances,A Season of New Plays and Classics for Multi-generational Audiences,2800
2007,Fiction Inc,New York,New York,212-966-3659,Literature,Literary Magazine Publication,Fiction Magazine 2 issues per year,7050
2009,Smithsonian Institution,New York,New York,212-849-8311,Museum,Museum Educ & Interpretation,Identity by Design Artist Presentations,10000
2014,"Firelight Media, Inc.",New York,New York,212-222-1068,Electronic Media & Film,General Support,Firelight Media General Support,22000
2019,"New York City Center, Inc.",New York,New York,212-763-1207,Dance,Rehearsal Space & Residencies,"1,000 Subsidized Rehearsal Hours for Dance Artists",12000
2003,Hospital Audiences Inc. (HAI),Long Island City,Queens,212-575-7677,Presenting,PRESENTATION,Artists Fees & Expenses-10 Performances,10000
2017,George Eastman Museum,Rochester,Monroe,585-327-4937,Electronic Media & Film,Screenings,Dryden Theatre Film Program,20000
2013,"Fourth Arts Block, Inc.",New York,New York,917-587-6889,Dance,Rehearsal Space,"Dance Block: Provision of 2,500 Low-Cost Rehearsal Hours to 100 Dance Artists/Companies",5000
2008,"Alvin Ailey Dance Foundation, Inc.",New York,New York,212-405-9035,Dance,Rehearsal Space,"The Ailey Studios Rental Subsidy Program: 1,000 hrs at $10/hr. for nonprofit dance cos./artists",12000
2008,"The Cherry Lane Alternative, Inc.",New York,New York,212-989-2020,Theatre,Professional Performances,The Mentor Project,9000
2016,New York Foundation for the Arts,BROOKLYN,Brooklyn,212-366-6900,Literature,Public Programs,Writing On It All - Writing On It All,6000
2016,Great Neck Center for Visual & Performing Arts,Great Neck,Nassau,516-829-2570,State & Local Partnership,General Support,GCAC General Operating Support,15000
2004,Rejoicensemble Inc,Brooklyn,Brooklyn,646-354-8216,Individual Artists,Commissions,David Hurd - David Hurd Commission,3000
2020,Fashion Institute of Technology Foundation,New York,New York,212-217-4107,Architecture + Design,Independent Projects,Amy Sperber - Sperber: Open Source Fashion Avatars: A Digital Dress Form Database for Diverse Bodies,10750
2017,Western New York Book Arts Collaborative Inc.,Buffalo,Erie,716-348-1430,Facilities,Capital Projects (Facilities),WNYBAC Facilities Project,24500
2006,"Signature Theatre Company, Inc.",New York,New York,646-388-8136,Theatre,General Operating Support,General Operating Expenses,12500
2009,Mass Transit Street Theater,Bronx,Bronx,203-589-9546,Theatre,Professional Performances,Main stage performances,4900
2020,Saratoga Performing Arts Ctr,Saratoga Springs,Saratoga,518-584-9330,Presenting,General Support,General Operating Support,49500
2008,Hip Hop Theater Festival,New York,New York,718-497-4282,Stabilization,Stabilization,Cash Reserve for Stabilization,20000
2006,Buffalo Fine Arts Academy,Buffalo,Erie,716-270-8237,Arts In Education,ESP School-Wide Arts Impl,Contemporary Art and Culture with Buffalo Academy of Visual/Performing Arts,40000
2005,"Multicultural Music Group, Inc.",Bronx,Bronx,646-314-6024,Arts In Education,General Operating Support,General Operating Expenses,14100
2005,"Art Resources Transfer, Inc.",New York,New York,212-255-2919,Literature,Services to the Field,Distribution to Underserved Communities Library Program/Poulin Project,5800
2008,Arts Council for Chautauqua County,Jamestown,Chautauqua,716-664-2465,State & Local Partnership,General Operating Support,General Operating Expenses,39300
2003,Heckscher Museum,Huntington,Suffolk,631-351-3005,Museum,GENERAL OPERATING SUPPORT,General Operating Expenses  **PER CAPITA**,5000
2011,"ROCHESTER CHAPTER of YOUNG AUDIENCES, INC",Rochester,Monroe,585-530-2060,Arts Education,K-12: Implementation,Broad Strokes: YAR NCSD Partnership,8308
2019,Trustees of Hamilton College,Clinton,Oneida,315-859-4678,Presenting,Project Support - Presentation,Hamilton College Performing Arts Series,10000
2005,"Earlville Opera House, Inc.",Earlville,Chenango,315-691-3550,Presenting,General Operating Support,General Operating Expenses,12500
2009,"Schola Cantorum of Syracuse, Inc.",Syracuse,Onondaga,315-471-3036,Music,General Operating Support,General Operating Expenses,4100
2010,"The Metropolitan Opera Guild, Inc.",New York,New York,212-769-7014,Arts Education,ESP Dissemination,"Ridge St, Rye Brook Imp to PS 10K, PS 152K & PS95Q, Year 4",22250
2013,Brooklyn Arts Council,Brooklyn,Brooklyn,718-625-0080,State & Local Partnership,General Support,General Operating Expenses,57770
2007,"Artsgenesis, Inc",New York,New York,212-741-1414,Arts In Education,ESP School-Wide Arts Impl,"School wide partnership with PS/IS#66, Brooklyn",30000
2013,"Geva Theatre Center, Inc.",Rochester,Monroe,585-420-2036,Literature,Public Programs,What's Next Literary Programs Writers' Fees and Promo,3940
2013,The House Foundation for the Arts,New York,New York,212-904-1330,Theatre,General Support,Meredith Monk:  General Operating Support,12000
2003,Hungarian Theatre & Art Assn,East Elmhurst,New York,646-228-0050,Special Arts Services,PROFESSIONAL PERFORMANCES,Artists Fees and Expenses for Theatre Productions,8100
2003,LEAGUE OF PROFESSIONAL THEATRE WOMEN,New York,New York,646-342-2060,Theatre,SERVICES TO THE FIELD,Support of League Programs,3000
2020,Tech Kids Unlimited Inc,Brooklyn,Brooklyn,917-334-7880,Special Arts Services,Project Support,Digital Arts Workshops for Youth with Autism ,15000
2012,Soho Repertory Theatre Inc,New York,New York,212-941-8632,Individual Artists,Theatre Artist Commissions,Annie Baker - Annie Baker,7500
2017,Berkshire School of Contemporary Art,Troy,Rensselaer,518-813-6193,Visual Arts,Workspace,Upstate Artists Residency ,5000
2017,Ontario County Historical Society,Canandaigua,Ontario,716-394-4975,Museum,General Support,Museum General Support,13000
2016,Community Music School Of Buffalo,Buffalo,Erie,716-884-4887,Music,Community Music Schools,Scholarship funds for music lessons,5000
2003,Ukrainian Museum,New York,New York,212-228-0110,Special Arts Services,INSTRUCTION/TRAINING-TRAD ARTS,Ukrainian Folk Crafts Program,8500
2016,"The Chatham Film Club, Inc.",Chatham,Columbia,518-392-3445,Electronic Media & Film,Film Festivals and Screenings,FilmColumbia Festival,10000
2009,"Center for the Arts of Homer, Inc.",Homer,Cortland,607-749-4900,Presenting,Presentation,Fall & Spring Concert Series-minimum of 15 concerts,7800
2011,"Theatre Communications Group, Inc.",New York,New York,212-609-5930,Theatre,General Operating Support,General Operating Expenses,31549
2018,"Torn Space Theater, Inc.",Buffalo,Erie,716-812-5733,Regional Economic Development,Arts and Cultural Impact - FOCUS 3: Art in Public Places,Torn Space Theater Performance Festival,60000
2005,Rochester Historical Society,Rochester,Monroe,585-428-8470,Capital Projects,Capital Grant, Front Facade Restoration,13300
2020,Rubin Museum of Art,New York,New York,212-620-5000,Museum,General Support,General Operating Support,41000
2020,"SPELLBOUND THEATRE, INC.",Brooklyn,Brooklyn,347-464-8542,Theatre,Professional Performances,Theatre for the Very Young,5500
2011,Delaware Valley Arts Alliance,Narrowsburg,Sullivan,845-252-7576,Visual Arts,Exhibitions & Installations,DVAA Exhibition Program,9989
2013,Tannery Pond Concerts Corporation,Chatham,Columbia,518-755-0392,Presenting,Presentation,Chamber Music Series in Columbia County,7500
2011,Akwesasne Library & Museum Cultural Center Inc.,Hogansburg,Franklin,518-358-2240,Museum,General Program Support,Akwesasne Museum ,6626
2004,"Ugly Duckling Presse, Ltd.",Brooklyn,Brooklyn,218-259-6081,Literature,Literary Magazine Publication,6x6 poetry magazine 3 issues per year,1500
2006,"Big Tree Productions, Inc.",New York,New York,240-447-2585,Dance,Professional Performances,Artists' Salaries; 8 Performances at DTW,7500
2012,"West Kortright Centre, Inc.",East Meredith,Delaware,607-278-5454,State & Local Partnership,Workshops,Workshop Series,8500
2010,"Harvestworks, Inc.",New York,New York,212-431-1130,Individual Artists,Film & Media / New Tech Prod.,Julia Heyward - ÂPoints of ViewÂ,12000
2019,Pioneer Works Art Foundation,Brooklyn,Brooklyn,718-596-3001,Electronic Media & Film,"Workspace, Art & Technology",Pioneer Works Technology Labs,15000
2011,Staten Island Instituteof Art and Science,Staten Island,Staten Isl,718-483-7114,Museum,General Oper. Support,General Operating Expenses: Staten Island Museum ,12461
2011,Locrian Chamber Players,Ossining,Westchester,914-923-5511,Music,General Operating Support,General Operating Expenses,3363
2013,"Gotham Arts Exchange, Inc.",New York,New York,718-513-9569,Dance,Professional Performances,Pam Tanowitz Dance - Pam Tanowitz Dance - NYC Performance Season,5000
2009,"Arts Engine, Inc.",New York,New York,646-230-6368,Individual Artists,Film & Media / New Tech Prod.,Marcelo Bukin - Dreaming Nicaragua,12500
2020,"American Documentary, POV",Brooklyn,New York,212-989-8121,Electronic Media & Film,General Support,General Operating Support - American Documentary,28500
2013,Historic Saranac Lake,Saranac Lake,Franklin,518-891-4606,Arts Education,K-12: In-School Programs,Cure Cottage Drama Project,2500
2020,Broadway Dance Lab Inc,New York,New York,646-325-5389,Dance,Services to the Field,DLNY Programming in 2020,5000
2014,"UBW, INC.",Brooklyn,Brooklyn,718-398-7414,Individual Artists,Dance Commissions,Nora Chipaumire - Commissioning Fee for Nora Chipaumire ,10000
2016,"Rivertown Film Society, Inc.",Nyack,Rockland,845-353-2568,Electronic Media & Film,Screenings,Rivertown Film Society,10000
2003,Friends of the Arts Inc,Locust Valley,Nassau,516-922-0061,Presenting,GENERAL OPERATING SUPPORT,General Operating Expenses,40600
2017,Russian American Cultural Center,New York,New York,646-831-0554,Electronic Media & Film,Film Festivals and Screenings,Art Film and Diaspora Film Festivals,7000
2012,Hudson Opera House Inc.,Hudson,Columbia,518-822-1438,State & Local Partnership,General Oper Support,General Operating Expenses,37530
2012,"Americas Society, Inc.",New York,New York,212-277-8320,Literature,Public Programs,Americas Society Literature Series,5000
2005,Int'l Agency Minority Artists,New York,New York,212-749-5298,Electronic Media & Film,General Program Support,GPS,7400
2012,"St. Ann's Warehouse, Inc.",Brooklyn,Brooklyn,718-834-8794,Presenting,Presentation,Artist Fees and Presenting Costs-Minimum 75 performances,30010
2014,"Fourth Arts Block, Inc.",New York,New York,917-587-6889,State & Local Partnership,General Support,Artist & Audience Support Services,16000
2005,"Lower Manhattan Cultural Council, Inc.",NEW YORK,New York,212-219-9401,Electronic Media & Film,Exhibition,ArteEast - ArteEast - Cinema East Film Series,3500
2014,Roundabout Theatre Company Inc.,New York,New York,212-719-9393,Arts Education,K-12: In-School Programs,RTC - Bronx Theatre High School/Curtis High School,12100
2010,"Parthenia, Inc.",Woodside,Queens,718-219-6166,Music,Professional Performances,Parthenia Concert Series,6230
2017,The Segue Foundation,New York,New York,212-353-0555,Literature,Book & Literary Mag Pubs,Roof Books Publication,4200
2010,Highlights in Jazz,New York,New York,404-626-8139,Music,General Operating Support,General Operating Expenses,5000
2015,Talujon Inc.,Jackson Heights,Queens,347-661-4134,Music,Project Support,Talujon Concert Series,6000
2019,Explore & More...A Children's Museum,East Aurora,Erie,716-655-5131,Regional Economic Development,Impact Programming,Explore & More Children's Museum,30000
2020,"Martha Graham Center of Contemporary Dance, Inc.",New York,New York,212-229-9200,Dance,Rehearsal Space & Residencies,Provision of Low Cost Rehearsal Hours,10000
2003,"INTA, Inc.",New York,New York,646-239-8591,Dance,ARTISTS-IN-RESIDENCE,Artists' Reh Sals/Adm Exp; 3 Wk Resid @ Kaatsbaan Ctr&Rhinebeck;4Perfs,10000
2010,"The Performance Zone, inc.",New York,New York,212-691-6969,Theatre,New Theatre Advancement,Origin Theatre Company - Origin Theatre Company: Mainstage Season,7500
2006,In Parentheses,Brooklyn,New York,917-526-1789,Individual Artists,Composer Commissions,Adam Silverman - adam silverman,5000
2015,New York Folklore Society,Schenectady,Schenectady,518-346-7008,Folk Arts,General Support,New York Folklore Society Operational Support,56500
2005,Silver Bay Assoc-YMCA,Silver Bay,Warren,518-543-8833,Arts In Education,Project-based Implementation,Adirondack School Residencies,4900
2017,Washington Square Association Music Fund,New York,New York,917-855-4205,Music,Project Support,Washington Square Music Festival,10000
2013,Friends of the New York Transit Museum,Brooklyn,Brooklyn,718-694-4952,Museum,General Support,General Programming Support,30000
2011,Ballet Theatre Foundation Inc,New York,New York,212-477-3030,Dance,Dance Commissions,Choreographer's Fee: New Work by Christopher Wheeldon,21000
2010,"Americas Society, Inc.",New York,New York,212-277-8320,Literature,Public Programs,Peruvian and Mexican Literature Series,6911
2008,The Lyric Chamber Music Society of New York,New York,New York,212-496-9927,Music,Professional Performances,Chamber Ensemble Performances,8000
2013,"Gallim Dance Company, Inc",Brooklyn,New York,917-455-3153,Dance,Professional Performances,Artists' Salaries; Gallim Dance at Brooklyn Academy of Music,5000
2008,"Congress for Jewish Culture, Inc.",New York City,New York,212-505-8040,Folk Arts,Presentation,Kavehoyz (Coffeehouse of Yiddish Folk Song),6500
2014,"Dance Theatre of Harlem, Inc.",New York,New York,212-690-2800,Special Arts Services,General Support,General Operating Support,40000
2007,"Spanish Theatre Repertory Company, Ltd",New York,New York,212-225-9934,Arts In Education,ESP Project-based Impl,Arts Partnership with Academy of Finance & Enterpr,7000
2013,UnionDocs Inc,Brooklyn,New York,917-544-2278,Electronic Media & Film,General Support,General Operating Expenses,11000
2018,"David Hochstein Memorial Music School, Inc.",Rochester,Monroe,585-454-4403,Special Arts Services,Instruction and Training,Music & Dance Scholarships for students of color,15000
2008,"Harlem School of the Arts, Inc.",New York,New York,212-926-4100,Special Arts Services,Services to the Field,Technical Assistance Program (TAP) (*Federal*),51900
2017,Utica College,Utica,Oneida,315-223-2464,Literature,Public Programs,The Ruth and Harry Jackson Lunch Hour Series,2500
2012,The Writers Room,New York,New York,212-254-6995,Literature,General Oper Support,General Operating Expenses,9670
2012,New York Folklore Society,Schenectady,Schenectady,518-346-7008,Folk Arts,Partnership Projects,Folk and Tradtitional Arts Internship,5500
2008,Arts Council in Buffalo & Erie County,Buffalo,Erie,716-875-2707,State & Local Partnership,General Operating Support,General Operating Expenses,55400
2006,"Geneseo Migrant Center, Inc.",Perry,Livingston,585-658-7960,Special Arts Services,Instr/Train - Pre-Professional,CAMPS(Creative Artists Migrant Program Services),12000
2003,"ArtsWestchester, Inc.",White Plains,Westchester,914-428-4220,Decentralization,REGRANT PROGRAM,DEC Program in Westchester County,77000
2015,"Electronic Arts Intermix, Inc.",New York,New York,212-337-0680,Electronic Media & Film,General Support,EAI: General Operating Expenses,27400
2008,"Harvestworks, Inc.",New York,New York,212-431-1130,Presenting,Presentation,LISTEN IN - 7 performances,6900
2012,The Elizabeth Foundation for the Arts,New York,New York,212-563-5855,Visual Arts,Workspace Facilities,RBPMW Studio Immersion Project,22570
2013,"Career Transition for Dancers, Inc.",New York,New York,212-764-0172,Dance,Services to the Field,Career Counseling Program for New York Dancers,6000
2003,Women's Studio Workshop,Rosendale,Ulster,845-658-9133,Visual Arts,SERVICES TO THE FIELD,Services to the Field,60000
2009,Community Arts Network of Oneonta ,Oneonta,Otsego,781-883-4338,Arts In Education,Regrants,"Creative Partnership Grants (Regrant $15,600)",23700
2004,Elaine Kaufman Cultural Center,New York,New York,212-501-3357,Presenting,Presentation, Kaufman Center Presentations in Merkin Hall,22500
2018,"Auburn Public Theater, Inc",Auburn,Cayuga,315-253-6669,Regional Economic Development,Facilities,Auburn Public Theater Facilites Improvement,600000
2017,"ARS Nova Musicians Chamber Orchestra, Inc.",Buffalo,Erie,716-662-3598,Music,General Support,General Operating Support,5000
2008,Lake George Opera Festival Association Inc,Saratoga Springs,Saratoga,518-584-6018,Music,General Operating Support,General Operating Expenses,35000
2017,n+1 Foundation,Brooklyn,Brooklyn,718-797-0750,Visual Arts,Project Support,Paper Monument Artists' Publication,6000
2012,Intrepid Museum Foundation,New York,New York,646-381-5253,Museum,Project Support,Access Initiative,19000
2014,New Museum of Contemporary Art,New York,New York,212-219-1222,Electronic Media & Film,Exhibitions & Installations,First Look,19000
2018,"Jewish Community Center of Greater Rochester, Inc.",Rochester,Monroe,585-461-2000,Electronic Media & Film,Film Festivals and Screenings,Rochester International Jewish Film Festival,6000
2019,ANCRAM OPERA HOUSE THEATER INC,Ancram,Columbia,917-535-5436,Regional Economic Development,Facilities (Mid-Size),Summer 2018,50000
2005,West Indian American Day Carnival Association,Brooklyn,Brooklyn,718-467-1797,Folk Arts,Presentation,Traditional Folk Arts Presentations at Pre-Carnival Events,6000
2005,The Jewish Museum,New York,New York,212-423-3334,Museum,General Operating Support,General Operating Expenses,48500
2003,The Historical Society of Rockland County,New City,Rockland,845-634-9629,Folk Arts,PRESENTATION,Folklife Festival,11000
2010,Lark Theatre Company Inc,New York,New York,212-246-2676,Theatre,General Operating Support,General Operating Expenses,12000
2005,High 5 Tickets To The Arts,New York,New York,212-750-0555,Theatre,Services to the Field,$5 Tickets to Theater Events for Teenagers,14600
2007,"Downtown Community Television Center, Inc.",New York,New York,646-484-4633,Individual Artists,Film & Media / New Tech Prod.,Leyla Leidecker - Golden Gloves,5000
2007,"Coalition of Arts Providers for Children, In^The",Buffalo,Erie,716-949-8139,Arts In Education,Services to the Field,WNY Service Organization Program,30000
2015,Openhousenewyork inc.,New York,New York,212-991-6470,Architecture + Design,Project Support,Education Programs: 11th Annual openhousenewyork Weekend,25000
2010,Arts & Cultural Council for Greater Rochester,Rochester,Monroe,585-244-1854,Arts Education,Regrants,"Regrant: Local Capacity Building ($13,800 regrants)",21360
2014,White Columns Inc.,New York,New York,212-924-4212,Visual Arts,General Support,General Operating Expenses,30000
2011,Council on the Arts & Humanities for Staten Island,Staten Island,Staten Isl,718-447-3329,State & Local Partnership,General Operating Support,General Operating Expenses,22154
2004,"ArtsWestchester, Inc.",White Plains,Westchester,914-428-4220,Arts In Education,Regrants,Arts Partners Challenge Grants,29000
2015,Community Music School Of Buffalo,Buffalo,Erie,716-884-4887,Music,Community Music Schools,Scholarship funds for music lessons,5000
2018,"BANG ON A CAN, INC.",Brooklyn,New York,718-852-7755,Music,General Support,Bang on a Can - New Music For All,30000
2016,Openhousenewyork inc.,New York,New York,212-991-6470,Architecture + Design,Project Support,Education Programs: 11th Annual openhousenewyork Weekend,25000
2010,"1891 Fredonia Opera House, Inc.",Fredonia,Chautauqua,716-679-0891,Music,Professional Performances,Bach & Beyond Baroque Music festival,6516
2010,Women Make Movies,New York,New York,212-925-0606,Individual Artists,Film & Media / New Tech Prod.,Sarah Foudy - Raising Noha,8000
2005,"CSC Repertory, Ltd.",New York,New York,212-677-4210,Theatre,General Operating Support,General Operating Expenses,19500
2017,Houses on the Moon Theater Company,New York,New York,646-228-2292,Theatre,Professional Performances,World premiere of gUN COUNTRY,3000
2017,"Hallwalls, Inc.",Buffalo,Erie,716-854-1694,Visual Arts,General Support,General Support for Visual & Media Arts,35100
2011,Untitled Theater Company No 61 Ltd,New York,New York,917-669-2067,Theatre,New Theatre Advancement,Mainstage Activity,4154
2003,Stony Brook Foundation Inc.,Stony Brook,Suffolk,631-324-4929,Museum,MUSEUM EDUC & INTERPRETATION,"""See it, Get it, Do it!""  An art workshop for the classroom & museum",5000
2012,"Paul Taylor Dance Foundation, Inc.",New York,New York,646-214-5811,Dance,Long Term Residencies in NYS,Artists' sals./admin.costs: 3-wk LTR Binghamton (Taylor 2);1 perf. Paul Taylor Dance Co.,42000
2003,"Speculum Musicae, Inc",New York,New York,212-865-3492,Music,GENERAL OPERATING SUPPORT,General Operating Expenses,9400
2009,"Pelham Art Center, Inc.",Pelham,Westchester,914-738-2525,State & Local Partnership,General Operating Support,General Operating Expenses,21000
2006,"Trisha Brown Company, Inc.",New York,New York,212-977-5365,Dance,Rehearsal Space,"FoundSPACE Project:Subsidized Rehearsal Space: 1,500 hrs. ($10/hr.) for Nonprofit Dance Cos.",7300
2003,"Spanish Dance Arts Company, Inc.",New York,New York,212-736-4499,Special Arts Services,PROFESSIONAL PERFORMANCES,Flamenco Week; A Touring Program,9000
2019,Bard College,Annandale-on-Hudson,Dutchess,845-758-7434,Literature,Book & Literary Mag Pubs,Support for Production and Promotion of Conjunctions,10000
2010,Manhattan Chamber Orchestra,New York,New York,212-942-0602,Music,Professional Performances,New York Concerts,2500
2016,Education Through Music Inc.,New York,New York,212-972-4788,Arts Education,General Support,Education Through Music - General Support,25000
2020,"Bronx Council on the Arts, Inc.",Bronx,Bronx,718-931-9500,State & Local Partnership,Regrants,"Bronx Council on the Arts Regrant Program - $44,430 Admin; $103,667 Regrants",148097
2019,Haiti Cultural Exchange,Brooklyn,Brooklyn,347-565-4429,Special Arts Services,Project Support,Lakou NOU (OUR Yard),20000
2008,Council of Literary Magazines and Presses,New York,New York,212-741-9110,Literature,General Program Support,General Program Support for NYS-Based Activities ,36000
2015,"ABC No Rio, Inc.",New York,New York,212-254-3697,Visual Arts,Exhibitions & Installations,ABC No Rio Exhibitions,5500
2005,The Jazz Gallery,New York,New York,212-861-5617,Presenting,Presentation,Artists Fees & Expenses- Minimum 20 Jazz Concerts,10300
2008,Aquila Theatre Company Inc,New York,New York,914-401-9494,Theatre,Professional Performances,Mainstage theatre season  ,7000
2010,Staten Island Children's Museum,Staten Island,Staten Isl,718-273-2060,Museum,General Operating Support,General Operating Expenses,24000
2020,Artists in Residence Inc.,Brooklyn,Brooklyn,212-255-6651,Electronic Media & Film,Exhibitions & Installations,Exhibitions and Installations,7000
2020,Genesee Valley Council on the Arts,Mount Morris,Livingston,585-243-6785,State & Local Partnership,General Support,Services and Operations of the GVCA,28000
2017,Rector Church Wardens & Vstry Mmbrs of Chch St L,New York,New York,212-633-2167,Music,Project Support,Concert Series 2017,4500
2011,Jonah Bokaer Arts Foundation,Brooklyn,Brooklyn,718-418-4405,Dance,Rehearsal Space,"Chez Bushwick; 3,500 hrs @ $5/hr for 587 dancers",3758
2005,Museum of Contemporary African Diasporan Arts,Brooklyn,Brooklyn,718-230-0492,Museum,Institutional Development,Institutional Development - Education Director,18500
2015,"Young Dancers in Repertory, Inc.",Brooklyn,Brooklyn,347-702-7155,Arts Education,Community-Based Learning,"Center for Dance Studies, Dance Training",3200
2009,Arts Horizons Inc,New York,New York,212-268-7219,Arts In Education,General Program Support,Creative Classroom,10800
2013,"PUSH Physical Theatre, Inc.",Rochester,Monroe,585-415-7874,Theatre,Professional Performances,New Theatre Advancement,6000
2014,"ArtsWestchester, Inc.",White Plains,Westchester,914-428-4220,State & Local Partnership,Regrants,"DEC Arts Regrant: Westchester ($19,800 Admin/$46,200 Regrants)",66000
2012,Community Works,New York,New York,212-459-1854,Presenting,Presentation,Theater Connections-Minimum 60 Presentations,11820
2010,"Indo-American Arts Council, Inc",New York,New York,212-951-7395,Presenting,Presentation,IAAC Annual Erasing Borders Dance Festival,4000
2017,Historic Cherry Hill,Albany,Albany,518-434-4791,Museum,Project Support,Historic Site Collections Reinstallation,18000
2020,"King Manor Association of L.I., Inc.",Jamaica,Queens,718-206-0545,Regional Economic Development,Workforce Investment,Workforce Expansion,28000
2015,Independent Feature Project,Brooklyn,Brooklyn,212-465-8200,Individual Artists,Film & Media / New Tech Prod.,Jessica Dimmock - Brick,25000
2010,"Added Value and Herban Solutions, Inc.",Brooklyn,Brooklyn,718-855-5531,Architecture Planning & Design,Design and Planning Studies,Red Hook Center on Sustainability and Culture,27149
2005,Council on Arts for Clinton County,Plattsburgh,Clinton,518-563-5222,State & Local Partnership,General Operating Support,General Operating Expenses,13700
2017,THE EYEBEAM ATELIER,Brooklyn,Brooklyn,347-378-9163,Electronic Media & Film,General Support,Eyebeam General Support,20000
2017,"Sculpture Space, Inc.",Utica,Oneida,315-724-8381,Regional Economic Development,Workforce Investment,Sculpture Space REDC Project 1617,28000
2020,"Recess Activities, Inc.",Brooklyn,New York,6468633765,Visual Arts,General Support,Recess's Core Programs,22500
2009,American Museum of the Moving Image,Astoria,Queens,718-777-6827,Electronic Media & Film,General Program Support,General Program Support,70000
2006,"Schola Cantorum of Syracuse, Inc.",Syracuse,Onondaga,315-471-3036,Music,General Operating Support,General Operating Expenses,2700
2020,"Manhattan Theatre Club, Inc.",New York,New York,212-399-3000,Arts Education,Pre-K-12: In-School Programs,WrOTE Residencies in P2G and YABC Schools,28000
2007,Bardavon 1869 Opera House Inc.,Poughkeepsie,Dutchess,845-473-5288,Music,Professional Performances,Hudson Valley Philharmonic ,37590
