OrganisationLabel,ReportingPeriodType,ReportMonth,MonumentID,ReferenceID,RecordType,RecordTypeDesc,Name
Lincolnshire,Quarterly Snapshot,2021-01,MLI123449,26658,,,"Rosemead, Holbeach"
Lincolnshire,Quarterly Snapshot,2021-01,MLI117166,57047,,,"Unnamed farmstead, South Kelsey"
Lincolnshire,Quarterly Snapshot,2021-01,MLI99025,56570,,,"Post-Medieval Field Boundary, Newton on Trent"
Lincolnshire,Quarterly Snapshot,2021-01,MLI82744,44409,,,Medieval salterns near Friskney and Wainfleet Tofts
Lincolnshire,Quarterly Snapshot,2021-01,MLI125244,49528,,,Hogsthorpe War Memorial
Lincolnshire,Quarterly Snapshot,2021-01,MLI93016,47840,,,"The Cottage, Roughton"
Lincolnshire,Quarterly Snapshot,2021-01,MLI81025,61294,,,"Penny of Coenwulf of Mercia, precise findspot unknown"
Lincolnshire,Quarterly Snapshot,2021-01,MLI120311,412056,,,"(Thorpe Farm), Thorpe St. Peter"
Lincolnshire,Quarterly Snapshot,2021-01,MLI94366,25225,,,"65 North Street, Crowland"
Lincolnshire,Quarterly Snapshot,2021-01,MLI50786,50786,,,UNDATED LINEAR FEATURE
Lincolnshire,Quarterly Snapshot,2021-01,MLI30679,30679,,,"ROMAN BRITISH PAVEMENT NEAR HIGH BRIDGE, STAMFORD"
Lincolnshire,Quarterly Snapshot,2021-01,MLI84536,62812,,,"Undated cropmark enclosure, Ruskington"
Lincolnshire,Quarterly Snapshot,2021-01,MLI32851,32851,,,C19 FARM BUILDING
Lincolnshire,Quarterly Snapshot,2021-01,MLI53220,53220,,,DESERTED MEDIEVAL OF WESTLABY
Lincolnshire,Quarterly Snapshot,2021-01,MLI82390,44233,,,"Possible salt working features. Sea Bank Farm, Grainthorpe."
Lincolnshire,Quarterly Snapshot,2021-01,MLI85936,63012,,,"Medieval earthwork ridge and furrow, north of Carlton-Le-Moorland"
Lincolnshire,Quarterly Snapshot,2021-01,MLI43572,43572,,,Brackenborough Deserted Medieval Village
Lincolnshire,Quarterly Snapshot,2021-01,MLI91654,24082,,,"5 and 7 South Street, Crowland"
Lincolnshire,Quarterly Snapshot,2021-01,MLI96678,55904,,,"Prospect House, Glentham"
Lincolnshire,Quarterly Snapshot,2021-01,MLI117747,410550,,,"The Manor (Manor House), Fotherby"
Lincolnshire,Quarterly Snapshot,2021-01,MLI118267,410804,,,"Biscathorpe House, Gayton Le Wold"
Lincolnshire,Quarterly Snapshot,2021-01,MLI41794,41794,,,"MEDIEVAL OCCUPATION REMAINS, SOUTH OF ADDLETHORPE"
Lincolnshire,Quarterly Snapshot,2021-01,MLI98778,48546,,,"K6 Telephone Kiosk, Market Place, Binbrook"
Lincolnshire,Quarterly Snapshot,2021-01,MLI80342,35222,,,"Two stone axeheads, Hambleton Farm"
Lincolnshire,Quarterly Snapshot,2021-01,MLI41950,41950,,,SALTERN SITES IN ORBY
Lincolnshire,Quarterly Snapshot,2021-01,MLI122416,14821,,,"North Fields, Swineshead"
Lincolnshire,Quarterly Snapshot,2021-01,MLI52900,52900,,,MESOLITHIC CORE FOUND NEAR GRAYINGHAM GRANGE
Lincolnshire,Quarterly Snapshot,2021-01,MLI97644,48294,,,"Merrilodge, Station Road, Wainfleet All Saints"
Lincolnshire,Quarterly Snapshot,2021-01,MLI98847,56546,,,"Enclosure Ditches and Pits, Old Street Farm, Hemswell Cliff"
Lincolnshire,Quarterly Snapshot,2021-01,MLI91405,55484,,,"39 Lord Street, Gainsborough"
Lincolnshire,Quarterly Snapshot,2021-01,MLI80063,43780,,,Several worked flints from near Virgin's Plantation
Lincolnshire,Quarterly Snapshot,2021-01,MLI87999,63755,,,"Romano-British finds, north of Heckington"
Lincolnshire,Quarterly Snapshot,2021-01,MLI118807,411128,,,"Unnamed farmstead, Chapel St. Leonards"
Lincolnshire,Quarterly Snapshot,2021-01,MLI97594,71070,,,"Neolithic flint javelin or arrowhead found on allotments near Earls Drive, Lincoln"
Lincolnshire,Quarterly Snapshot,2021-01,MLI91577,47076,,,"12 Market Street, Spilsby"
Lincolnshire,Quarterly Snapshot,2021-01,MLI85721,62866,,,"Stone axe, Bassingham"
Lincolnshire,Quarterly Snapshot,2021-01,MLI42898,42898,,,LINEAR CROPMARK NORTHWEST OF THORNTON LODGE FARM.
Lincolnshire,Quarterly Snapshot,2021-01,MLI97578,38992,,,"Probable Iron Age pits on land at Southfield Business Park, Bourne"
Lincolnshire,Quarterly Snapshot,2021-01,MLI117639,57359,,,"Usselby Hall, Osgodby"
Lincolnshire,Quarterly Snapshot,2021-01,MLI124395,412417,,,"BOUNDARY FARM, Friskney"
Lincolnshire,Quarterly Snapshot,2021-01,MLI93285,47674,,,"Low Farm Cottage, Scremby"
Lincolnshire,Quarterly Snapshot,2021-01,MLI125196,49514,,,"Royal Observer Corps Post, Coningsby"
Lincolnshire,Quarterly Snapshot,2021-01,MLI121203,14643,,,"Mayfield House, Holland Fen with Brothertoft"
Lincolnshire,Quarterly Snapshot,2021-01,MLI94954,37456,,,"Fountain, Uffington"
Lincolnshire,Quarterly Snapshot,2021-01,MLI89846,64455,,,Stone axe found to the south of Westmorelands
Lincolnshire,Quarterly Snapshot,2021-01,MLI81315,61484,,,"Dovecote to the rear of Elysium, Pelham Lane"
Lincolnshire,Quarterly Snapshot,2021-01,MLI20140,20140,,,MEDIEVAL HAMLET OF BELNIE
Lincolnshire,Quarterly Snapshot,2021-01,MLI82160,44071,,,"Barrow cropmark, Binbrook"
Lincolnshire,Quarterly Snapshot,2021-01,MLI34773,34773,,,"ROMANO-BRITISH POTTERY FOUND, SOUTHWEST OF ELMS FARM CAYTHORPE"
Lincolnshire,Quarterly Snapshot,2021-01,MLI92894,14468,,,"1, 2 and 3 Witham Place, Boston"
Lincolnshire,Quarterly Snapshot,2021-01,MLI89578,64360,,,"25 Victoria Street, Billinghay"
Lincolnshire,Quarterly Snapshot,2021-01,MLI83806,36089,,,"House, King Street, West Deeping"
Lincolnshire,Quarterly Snapshot,2021-01,MLI123620,26829,,,"North Farm, Gedney Hill"
Lincolnshire,Quarterly Snapshot,2021-01,MLI54176,54176,,,UNDATED CROPMARK EXTRACTIVE PITS
Lincolnshire,Quarterly Snapshot,2021-01,MLI50100,50100,,,"Cross, St Peter and St Paul's Churchyard, Kettlethorpe"
Lincolnshire,Quarterly Snapshot,2021-01,MLI50196,50196,,,"DESERTED HAMLET OF DRAYCOTT, NETTLETON"
Lincolnshire,Quarterly Snapshot,2021-01,MLI124311,15335,,,"Quakers Lodge, Benington"
Lincolnshire,Quarterly Snapshot,2021-01,MLI120879,66507,,,"Tower Farm, Dorrington"
Lincolnshire,Quarterly Snapshot,2021-01,MLI81718,44005,,,Various Roman finds from East Keal metal detecting rally
Lincolnshire,Quarterly Snapshot,2021-01,MLI50825,50825,,,PREHISTORIC FLINTS FOUND EAST OF BECK FARM
Lincolnshire,Quarterly Snapshot,2021-01,MLI51162,51162,,,Dug-out boat found near Horsley Deeps in c.1815
Lincolnshire,Quarterly Snapshot,2021-01,MLI89034,46669,,,"Salter Fen lock, Alvingham"
Lincolnshire,Quarterly Snapshot,2021-01,MLI118995,411316,,,"Unnamed farmstead, Tetford"
Lincolnshire,Quarterly Snapshot,2021-01,MLI30065,30065,,,"The Hermitage moated site, 400m north east of Corby Pasture Farm"
Lincolnshire,Quarterly Snapshot,2021-01,MLI83711,35985,,,"Milepost, Market Deeping"
Lincolnshire,Quarterly Snapshot,2021-01,MLI50514,50514,,,Hackthorn medieval settlement and cultivation remains
Lincolnshire,Quarterly Snapshot,2021-01,MLI93981,70913,,,"22 and 22A Newland, Lincoln"
Lincolnshire,Quarterly Snapshot,2021-01,MLI50260,50260,,,"Hengiform Monument, Owmby"
Lincolnshire,Quarterly Snapshot,2021-01,MLI123291,26500,,,"Whaplode Lodge, Whaplode"
Lincolnshire,Quarterly Snapshot,2021-01,MLI53792,53792,,,POST MEDIEVAL ENCLOSURE
Lincolnshire,Quarterly Snapshot,2021-01,MLI121871,31388,,,"The Barns (Glebe Farm), Castle Bytham"
Lincolnshire,Quarterly Snapshot,2021-01,MLI97965,48393,,,"Medieval pottery sherd, Willoughby"
Lincolnshire,Quarterly Snapshot,2021-01,MLI83142,54766,,,"Post medieval remains, High Street"
Lincolnshire,Quarterly Snapshot,2021-01,MLI60561,60561,,,"Undated linear feature, south of High Street, Heckington"
Lincolnshire,Quarterly Snapshot,2021-01,MLI90752,64989,,,"The Cottage and Rowan Cottage, Beck Lane, Heighington"
Lincolnshire,Quarterly Snapshot,2021-01,MLI52374,52374,,,"Bronze Hoard, Nettleham"
Lincolnshire,Quarterly Snapshot,2021-01,MLI81931,44039,,,"A mid- to late Saxon cemetery beneath St Helen's Church, Cumberworth"
Lincolnshire,Quarterly Snapshot,2021-01,MLI118203,410740,,,"Duck Pond Cottage, Little Carlton"
Lincolnshire,Quarterly Snapshot,2021-01,MLI34420,34420,,,"SAXON SETTLEMENT SITE, HACONBY"
Lincolnshire,Quarterly Snapshot,2021-01,MLI97707,39019,,,"Human remains and possible Roman artefacts, Stamford"
Lincolnshire,Quarterly Snapshot,2021-01,MLI88662,46464,,,"Earthwork Enclosure, Saltfleetby"
Lincolnshire,Quarterly Snapshot,2021-01,MLI52551,52551,,,"Undated Boundary, Enclosures and Field System, Torksey"
Lincolnshire,Quarterly Snapshot,2021-01,MLI119356,411521,,,"Lowfield, Tupholme"
Lincolnshire,Quarterly Snapshot,2021-01,MLI60931,60931,,,"Roman finds, land at Smithy Farm, Swaton"
Lincolnshire,Quarterly Snapshot,2021-01,MLI123060,15040,,,"Unnamed farmstead, Frampton"
Lincolnshire,Quarterly Snapshot,2021-01,MLI124452,15384,,,"AURACERIA HOUSE FARM, Wrangle"
Lincolnshire,Quarterly Snapshot,2021-01,MLI122617,26092,,,"Unnamed farmstead, Pinchbeck"
Lincolnshire,Quarterly Snapshot,2021-01,MLI41958,41958,,,ROMAN RUBBISH PIT AND HUMAN SKELETON
Lincolnshire,Quarterly Snapshot,2021-01,MLI93318,47707,,,"Fortescue Arms and Coach House, Tattershall"
Lincolnshire,Quarterly Snapshot,2021-01,MLI97753,39033,,,"Prehistoric features, Rectory Farm, West Deeping"
Lincolnshire,Quarterly Snapshot,2021-01,MLI32873,32873,,,FLINT SCRAPER
Lincolnshire,Quarterly Snapshot,2021-01,MLI125441,31762,,,"Triple-Ditched Linear Cropmark, Long Bennington"
Lincolnshire,Quarterly Snapshot,2021-01,MLI53427,53427,,,MEDIEVAL ENCLOSURE
Lincolnshire,Quarterly Snapshot,2021-01,MLI87779,46073,,,"Ridge and furrow south west of Ludney, Grainthorpe"
Lincolnshire,Quarterly Snapshot,2021-01,MLI52431,52431,,,RIDGE AND FURROW
Lincolnshire,Quarterly Snapshot,2021-01,MLI83417,62569,,,"Roman pottery waster fragment, from west of River Brant"
Lincolnshire,Quarterly Snapshot,2021-01,MLI53595,53595,,,MEDIEVAL BOUNDARY
Lincolnshire,Quarterly Snapshot,2021-01,MLI116579,65884,,,"Fen Side Farms, Metheringham"
Lincolnshire,Quarterly Snapshot,2021-01,MLI60669,60669,,,Worked Flints
Lincolnshire,Quarterly Snapshot,2021-01,MLI85875,62984,,,"Possible prehistoric cropmarks, Swaton"
Lincolnshire,Quarterly Snapshot,2021-01,MLI12780,12780,,,"Post-Medieval Sword, Frieston Shore Bank"
Lincolnshire,Quarterly Snapshot,2021-01,MLI83737,36007,,,"No 60 (formerly listed as School House), Church Street, Market Deeping"
Lincolnshire,Quarterly Snapshot,2021-01,MLI40061,40061,,,"MEDIEVAL POTTERY, STONE AND BONE"
Lincolnshire,Quarterly Snapshot,2021-01,MLI85099,45070,,,"Bronze Age barrow cropmark, south east of Burwell"
Lincolnshire,Quarterly Snapshot,2021-01,MLI119563,66009,,,"Highfield House (Leigh Farm), Canwick"
Lincolnshire,Quarterly Snapshot,2021-01,MLI52757,52757,,,South-East Quarter of Market Rasen
Lincolnshire,Quarterly Snapshot,2021-01,MLI119383,58040,,,"Old Exchange, Bardney"
Lincolnshire,Quarterly Snapshot,2021-01,MLI97368,14487,,,"16th Century Ditch, Norfolk Street, Boston"
Lincolnshire,Quarterly Snapshot,2021-01,MLI30410,30410,,,"Enclosure, north of Thirteen Acre Plantation"
Lincolnshire,Quarterly Snapshot,2021-01,MLI95877,38379,,,"24 St Mary's Street, Stamford"
Lincolnshire,Quarterly Snapshot,2021-01,MLI117750,410553,,,"Sea View Farm, Saltfleetby"
Lincolnshire,Quarterly Snapshot,2021-01,MLI98777,39237,,,"Undated postholes and linear feature, Deeping Gate Trees, Market Deeping"
Lincolnshire,Quarterly Snapshot,2021-01,MLI51931,51931,,,FIELD SYSTEM
Lincolnshire,Quarterly Snapshot,2021-01,MLI94931,37433,,,"17 Market Place, Grantham"
Lincolnshire,Quarterly Snapshot,2021-01,MLI52130,52130,,,GRANGE OR MANOR OF SIXHILLS PRIORY
Lincolnshire,Quarterly Snapshot,2021-01,MLI82416,35504,,,"Medieval cropmark extractive pit, adjacent to the A1"
Lincolnshire,Quarterly Snapshot,2021-01,MLI30504,30504,,,"CHERRY HOLT MOATED SITE, GRANTHAM"
Lincolnshire,Quarterly Snapshot,2021-01,MLI13030,13030,,,"Medieval Jug, Kirton Holme"
Lincolnshire,Quarterly Snapshot,2021-01,MLI94007,70939,,,"Letalls Crown Mill, Princess Street, Lincoln"
Lincolnshire,Quarterly Snapshot,2021-01,MLI84187,36313,,,"Earthwork ridge and furrow, Ingoldsby"
Lincolnshire,Quarterly Snapshot,2021-01,MLI86823,45730,,,"K6  Telephone Kiosk, Ramsgate, Louth"
Lincolnshire,Quarterly Snapshot,2021-01,MLI90108,64597,,,"No. 37 Eastgate, Sleaford"
Lincolnshire,Quarterly Snapshot,2021-01,MLI52682,52682,,,"Caistor Grammar School Old Building, Church Street, Caistor"
Lincolnshire,Quarterly Snapshot,2021-01,MLI34378,34378,,,"IRON AGE SALTERN SITE, DOWSBY"
Lincolnshire,Quarterly Snapshot,2021-01,MLI60677,60677,,,Romano-British Artefact Scatter
Lincolnshire,Quarterly Snapshot,2021-01,MLI97651,48301,,,"3 St John Street, Wainfleet All Saints"
Lincolnshire,Quarterly Snapshot,2021-01,MLI117035,57007,,,"South Barff Farm (Mill Hill), North Kelsey"
Lincolnshire,Quarterly Snapshot,2021-01,MLI125694,58326,,,Mill House Farm
Lincolnshire,Quarterly Snapshot,2021-01,MLI116095,39462,,,"Parish boundary between North Stoke and South Stoke, Stoke Rochford"
Lincolnshire,Quarterly Snapshot,2021-01,MLI84104,36256,,,"Medieval earthwork enclosures, Easton"
Lincolnshire,Quarterly Snapshot,2021-01,MLI122345,14751,,,"Barley Close, Holland Fen with Brothertoft"
Lincolnshire,Quarterly Snapshot,2021-01,MLI22247,22247,,,ROMANO-BRITISH CROPMARKS
Lincolnshire,Quarterly Snapshot,2021-01,MLI98912,48759,,,"General Baptist Chapel, Coningsby"
Lincolnshire,Quarterly Snapshot,2021-01,MLI50940,50940,,,ANGLO-SAXON POTTERY FOUND WEST OF MIDDLE STREET
Lincolnshire,Quarterly Snapshot,2021-01,MLI120544,412289,,,"Moor Farm, Kirkby on Bain"
Lincolnshire,Quarterly Snapshot,2021-01,MLI119177,411390,,,"The Firs, Langton By Wragby"
Lincolnshire,Quarterly Snapshot,2021-01,MLI87249,23941,,,"Post medieval cellar floor, pit and ditches at Fleet Road, Fleet Hargate"
Lincolnshire,Quarterly Snapshot,2021-01,MLI91107,65153,,,Unlocated Romano-British finds from Silk Willoughby parish
Lincolnshire,Quarterly Snapshot,2021-01,MLI82250,44160,,,"Barrow cropmark, South Ormsby Cum Ketsby"
Lincolnshire,Quarterly Snapshot,2021-01,MLI51044,51044,,,ROMANO-BRITISH POTTERY SHERDS FOUND SOUTH OF GLENTHAM GRANGE
Lincolnshire,Quarterly Snapshot,2021-01,MLI81940,35392,,,Settlement of Normanton
Lincolnshire,Quarterly Snapshot,2021-01,MLI91409,55488,,,"32 Lord Street, Gainsborough"
Lincolnshire,Quarterly Snapshot,2021-01,MLI86340,23901,,,"Post-medieval dyke, Moulton Chapel Road, Cowbit"
Lincolnshire,Quarterly Snapshot,2021-01,MLI82239,44147,,,"Barrow cropmark, Kirkstead"
Lincolnshire,Quarterly Snapshot,2021-01,MLI89965,36814,,,"Early medieval pottery found on land at Manor Farm, Sudbrook"
Lincolnshire,Quarterly Snapshot,2021-01,MLI97221,25593,,,"11 West End, Holbeach"
Lincolnshire,Quarterly Snapshot,2021-01,MLI97481,56342,,,"Former Post Office, Front Street, Tealby"
Lincolnshire,Quarterly Snapshot,2021-01,MLI23607,23607,,,ROMAN COINS
Lincolnshire,Quarterly Snapshot,2021-01,MLI117048,410220,,,"Unnamed farmstead, North Cotes"
Lincolnshire,Quarterly Snapshot,2021-01,MLI53884,53884,,,STONE QUARRY
Lincolnshire,Quarterly Snapshot,2021-01,MLI80059,35168,,,Somerby medieval settlement and field system
Lincolnshire,Quarterly Snapshot,2021-01,MLI89220,64109,,,Roxholm St Leonard chapel (unlocated)
Lincolnshire,Quarterly Snapshot,2021-01,MLI124566,412461,,,"Farmstead, Sibsey"
Lincolnshire,Quarterly Snapshot,2021-01,MLI60848,60848,,,"Romano-British pottery, east of Dunsby Pit Plantation"
Lincolnshire,Quarterly Snapshot,2021-01,MLI94373,25232,,,"Bell Tower, Hall Gate Fleet"
Lincolnshire,Quarterly Snapshot,2021-01,MLI90568,64788,,,"Galley Hill Farmhouse, The Drove, Sleaford"
Lincolnshire,Quarterly Snapshot,2021-01,MLI124983,67019,,,"Probable Medieval Ridge and Furrow, Heighington"
Lincolnshire,Quarterly Snapshot,2021-01,MLI99415,56611,,,"The Sun Hotel, 1 North Street, Gainsborough"
Lincolnshire,Quarterly Snapshot,2021-01,MLI98606,65784,,,"Barn at Top Farm, Walcot near Folkingham"
Lincolnshire,Quarterly Snapshot,2021-01,MLI42302,42302,,,VARIOUS METAL DETECTOR FINDS FROM LOW TOYNTON
Lincolnshire,Quarterly Snapshot,2021-01,MLI121451,66778,,,"Highgate, Scredington"
Lincolnshire,Quarterly Snapshot,2021-01,MLI84275,36390,,,"Earthwork ridge and furrow, Londonthorpe and Harrowby Without"
Lincolnshire,Quarterly Snapshot,2021-01,MLI123328,26537,,,"Thursley Farm, Whaplode"
Lincolnshire,Quarterly Snapshot,2021-01,MLI86841,45745,,,"The Rectory, Upgate, Louth"
Lincolnshire,Quarterly Snapshot,2021-01,MLI124066,27210,,,"Unnamed farmstead, Sutton St. Edmund"
Lincolnshire,Quarterly Snapshot,2021-01,MLI117283,57164,,,"Unnamed farmstead, Grayingham"
Lincolnshire,Quarterly Snapshot,2021-01,MLI60400,60400,,,"Site of St Mary's Chapel, Holdingham"
Lincolnshire,Quarterly Snapshot,2021-01,MLI95562,38064,,,"Westfield Farm, Westborough and Dry Doddington"
Lincolnshire,Quarterly Snapshot,2021-01,MLI85301,45260,,,"Medieval earthworks, Miningsby"
Lincolnshire,Quarterly Snapshot,2021-01,MLI85154,45112,,,"Undated cropmark enclosure, north of South Ormsby"
Lincolnshire,Quarterly Snapshot,2021-01,MLI125519,49590,,,"Outbuildings, Gunby Hall"
Lincolnshire,Quarterly Snapshot,2021-01,MLI91104,65150,,,Brickworks at Gorse Lane
Lincolnshire,Quarterly Snapshot,2021-01,MLI86921,55002,,,"Post-medieval pit on land at The Cottage, Aisby, Corringham"
Lincolnshire,Quarterly Snapshot,2021-01,MLI90805,46924,,,"Undated timber posts near the former course of the river, Church Lane, North Thoresby"
Lincolnshire,Quarterly Snapshot,2021-01,MLI82629,62216,,,Undated extraction pits and ditches at Norton Bottoms Quarry
Lincolnshire,Quarterly Snapshot,2021-01,MLI42853,42853,,,"POSSIBLE REMAINS OF A MOAT AT MOAT FARM, MUMBY"
Lincolnshire,Quarterly Snapshot,2021-01,MLI13157,13157,,,"POSSIBLE ROMANO BRITISH SALTERN SITE, WRANGLE"
Lincolnshire,Quarterly Snapshot,2021-01,MLI84976,45001,,,"Earthwork ridge and furrow, Horsington"
Lincolnshire,Quarterly Snapshot,2021-01,MLI92092,47278,,,"25 Bridge Street, Horncastle"
Lincolnshire,Quarterly Snapshot,2021-01,MLI83935,23821,,,"Pottery scatter west of A16, Pinchbeck"
Lincolnshire,Quarterly Snapshot,2021-01,MLI89206,64104,,,"Boat house at Ashby Hall, Ashby de la Launde"
Lincolnshire,Quarterly Snapshot,2021-01,MLI119233,411398,,,"(America Farm), Langton By Spilsby"
Lincolnshire,Quarterly Snapshot,2021-01,MLI88089,63813,,,"Barbed and tanged arrowhead, Court Row Farm, north east of Heckington"
Lincolnshire,Quarterly Snapshot,2021-01,MLI35094,35094,,,UNDATED LINEAR FEATURE CROPMARK
Lincolnshire,Quarterly Snapshot,2021-01,MLI33831,33831,,,"Windmill, Ingoldsby"
Lincolnshire,Quarterly Snapshot,2021-01,MLI88446,36643,,,"Possible unknown date cropmark linear feature, Hougham"
Lincolnshire,Quarterly Snapshot,2021-01,MLI88824,36737,,,"Possible modern searchlight battery, Aslackby and Laughton"
Lincolnshire,Quarterly Snapshot,2021-01,MLI90947,70582,,,"Cropmark post medieval to modern enclosure and extractive pits, Boultham, Lincoln"
Lincolnshire,Quarterly Snapshot,2021-01,MLI85164,45036,,,"Medieval earthwork ridge and furrow, Hundleby"
Lincolnshire,Quarterly Snapshot,2021-01,MLI70028,70028,,,"Possible Roman Cemetery, Long Leys Road"
Lincolnshire,Quarterly Snapshot,2021-01,MLI83967,36146,,,"Later Prehistoric features, King Street, West Deeping"
Lincolnshire,Quarterly Snapshot,2021-01,MLI89866,64465,,,"Park to the west of Asgarby village, Kirkby la Thorpe and Aswarby"
Lincolnshire,Quarterly Snapshot,2021-01,MLI91846,65369,,,Coachman's cottage at Nocton Hall
Lincolnshire,Quarterly Snapshot,2021-01,MLI96988,56214,,,"Gazebo at the Old Rectory, Lea"
Lincolnshire,Quarterly Snapshot,2021-01,MLI41485,41485,,,"MOATED SITE, BILSBY"
Lincolnshire,Quarterly Snapshot,2021-01,MLI83410,13638,,,"Medieval Pit found off White House Lane, Fishtoft"
Lincolnshire,Quarterly Snapshot,2021-01,MLI122271,31639,,,"Elm Farm, Langtoft"
Lincolnshire,Quarterly Snapshot,2021-01,MLI53121,53121,,,"Beehive Quern, Craypool Cottage, Scothern"
Lincolnshire,Quarterly Snapshot,2021-01,MLI122748,26223,,,"Sycamore Farm, Spalding"
Lincolnshire,Quarterly Snapshot,2021-01,MLI98076,65713,,,"K6 Telephone kiosk, High Street, Bassingham"
Lincolnshire,Quarterly Snapshot,2021-01,MLI81662,35374,,,"Two Samian Bases, Willoughby Road, Ancaster"
Lincolnshire,Quarterly Snapshot,2021-01,MLI82320,44210,,,Possible round barrow cropmark south east of Driby Carr
Lincolnshire,Quarterly Snapshot,2021-01,MLI98689,48622,,,Possibly late prehistoric or Roman enclosure in Ludborough
Lincolnshire,Quarterly Snapshot,2021-01,MLI93220,47609,,,"The Old Rectory, Langton by Spilsby"
Lincolnshire,Quarterly Snapshot,2021-01,MLI81245,61454,,,"Food vessel, south of the Witham, on Branston island"
Lincolnshire,Quarterly Snapshot,2021-01,MLI30378,30378,,,"ST NICHOLAS' CHURCH, CARLTON SCROOP"
Lincolnshire,Quarterly Snapshot,2021-01,MLI50447,50447,,,SITE OF BARROW NEAR AUDLEBY
Lincolnshire,Quarterly Snapshot,2021-01,MLI41331,41331,,,"Grainthorpe Hall, Grainthorpe"
Lincolnshire,Quarterly Snapshot,2021-01,MLI119218,58010,,,"Field Farm House, Nettleham"
Lincolnshire,Quarterly Snapshot,2021-01,MLI120793,66421,,,"Bridge Dale Farm, Billinghay"
Lincolnshire,Quarterly Snapshot,2021-01,MLI84608,44667,,,"Prehistoric enclosures and trackways, north of South Elkington"
Lincolnshire,Quarterly Snapshot,2021-01,MLI51548,51548,,,"Earthwork Enclosure, Nettleton"
Lincolnshire,Quarterly Snapshot,2021-01,MLI80389,60965,,,Second to fourth century grey ware sherds
Lincolnshire,Quarterly Snapshot,2021-01,MLI83134,62446,,,"Hurst Farm House, High Street"
Lincolnshire,Quarterly Snapshot,2021-01,MLI81070,61323,,,Flints from north of Fen Road (Field 12)
Lincolnshire,Quarterly Snapshot,2021-01,MLI118886,411207,,,"Unnamed farmstead, Hogsthorpe"
Lincolnshire,Quarterly Snapshot,2021-01,MLI43113,43113,,,"Possible prehistoric long barrow, Skegness"
Lincolnshire,Quarterly Snapshot,2021-01,MLI89717,34587,,,Late Iron Age/Romano-British pottery scatter to the south of Neslam Road
Lincolnshire,Quarterly Snapshot,2021-01,MLI86394,13802,,,"Undated features on land at Plos 5 and 6, Caleb Hill Lane, Old Leake Commonside, Boston"
Lincolnshire,Quarterly Snapshot,2021-01,MLI60754,60754,,,"Pre-Enclosure Field Boundary, Scopwick"
Lincolnshire,Quarterly Snapshot,2021-01,MLI53492,53492,,,MEDIEVAL WELLS AND POTTERY
Lincolnshire,Quarterly Snapshot,2021-01,MLI60442,60442,,,"Old Wood, South Kyme"
Lincolnshire,Quarterly Snapshot,2021-01,MLI82262,44172,,,"Barrow cropmark, Swaby"
Lincolnshire,Quarterly Snapshot,2021-01,MLI98630,48576,,,Post medieval enclosure in Orby parish
Lincolnshire,Quarterly Snapshot,2021-01,MLI51713,51713,,,CROPMARK PITS
Lincolnshire,Quarterly Snapshot,2021-01,MLI82178,44081,,,"Barrow cropmark, Ludford"
Lincolnshire,Quarterly Snapshot,2021-01,MLI84377,62717,,,Undated cropmark trackway east of Aunsby
Lincolnshire,Quarterly Snapshot,2021-01,MLI118004,57510,,,"Saxy Lowlands Farm (Low Farm), Saxby"
Lincolnshire,Quarterly Snapshot,2021-01,MLI92656,14230,,,"3 Church Close, Boston"
Lincolnshire,Quarterly Snapshot,2021-01,MLI90739,64978,,,"37 & 39 High Street, Heighington"
Lincolnshire,Quarterly Snapshot,2021-01,MLI34327,34327,,,"Kirton Wood, Ropsley and Humby"
Lincolnshire,Quarterly Snapshot,2021-01,MLI51443,51443,,,POST MEDIEVAL METALWORK FOUND NORTHWEST OF WEST FIRSBY MANOR HOUSE
Lincolnshire,Quarterly Snapshot,2021-01,MLI51482,51482,,,"Herringbone masonry, west of Washdyke Cottages, Hackthorn"
Lincolnshire,Quarterly Snapshot,2021-01,MLI120814,66442,,,"Fenways, North Kyme"
Lincolnshire,Quarterly Snapshot,2021-01,MLI93987,70919,,,"78 to 88 Newland, Lincoln"
Lincolnshire,Quarterly Snapshot,2021-01,MLI12752,12752,,,"Post-Medieval Pottery, Fishtoft"
Lincolnshire,Quarterly Snapshot,2021-01,MLI52095,52095,,,"90 Bridge Street, Gainsborough"
Lincolnshire,Quarterly Snapshot,2021-01,MLI121738,31255,,,"Dairy Barn, Irnham"
Lincolnshire,Quarterly Snapshot,2021-01,MLI116940,410148,,,"The Old Coach House, Horncastle"
Lincolnshire,Quarterly Snapshot,2021-01,MLI93224,47613,,,"The Cottage, Sausthorpe"
Lincolnshire,Quarterly Snapshot,2021-01,MLI81259,61432,,,"Nos 3 and 5, High Street, Heighington"
Lincolnshire,Quarterly Snapshot,2021-01,MLI50556,50556,,,"SITE OF ROMAN VILLA, AT THE WATER HOUSE, BURTON"
Lincolnshire,Quarterly Snapshot,2021-01,MLI40449,40449,,,"Straight parallel ditches, Springfield, Tattershall"
Lincolnshire,Quarterly Snapshot,2021-01,MLI12652,12652,,,"Pottery Kiln, Boston"
Lincolnshire,Quarterly Snapshot,2021-01,MLI51109,51109,,,"Possible Medieval Building Foundations, Chapel Road, Fillingham"
Lincolnshire,Quarterly Snapshot,2021-01,MLI125022,49444,,,Fulstow Primary School
Lincolnshire,Quarterly Snapshot,2021-01,MLI41967,41967,,,"Medieval Pottery, Hogsthorpe"
Lincolnshire,Quarterly Snapshot,2021-01,MLI121467,66794,,,"Unnamed farmstead, Osbournby"
Lincolnshire,Quarterly Snapshot,2021-01,MLI120595,412340,,,"Hurn Bridge Farm, Coningsby"
Lincolnshire,Quarterly Snapshot,2021-01,MLI116767,56862,,,"Unnamed farmstead, Swallow"
Lincolnshire,Quarterly Snapshot,2021-01,MLI119684,66130,,,"Low Moor Farm, North Scarle"
Lincolnshire,Quarterly Snapshot,2021-01,MLI99089,48895,,,"Thorpe-Fendikes Wesleyan Methodist Church, Thorpe St Peter"
Lincolnshire,Quarterly Snapshot,2021-01,MLI97740,25667,,,"Wesleyan Methodist Chapel, Seas End Road, Surfleet Seas End"
Lincolnshire,Quarterly Snapshot,2021-01,MLI60847,60847,,,"Medieval pottery, west of All Saints Church"
Lincolnshire,Quarterly Snapshot,2021-01,MLI98152,39148,,,A Bronze Age looped palstave found near Stamford
Lincolnshire,Quarterly Snapshot,2021-01,MLI50589,50589,,,"SITE OF AN ANGLO-SAXON CEMETERY, SEARBY HILL"
Lincolnshire,Quarterly Snapshot,2021-01,MLI51022,51022,,,ROMAN POTTERY FOUND SOUTH OF BARFF LANE
Lincolnshire,Quarterly Snapshot,2021-01,MLI13295,13295,,,"Electric light, Boston Docks"
Lincolnshire,Quarterly Snapshot,2021-01,MLI50483,50483,,,"MEDIEVAL WARREN, GOLTHO DEERPARK"
Lincolnshire,Quarterly Snapshot,2021-01,MLI120130,411875,,,"The Laurels Farm, Mareham on the Hill"
Lincolnshire,Quarterly Snapshot,2021-01,MLI30352,30352,,,"NEOLITHIC STONE AXE FOUND, ANCASTER"
Lincolnshire,Quarterly Snapshot,2021-01,MLI34321,34321,,,"Ponton Great Wood, Great Ponton"
Lincolnshire,Quarterly Snapshot,2021-01,MLI122804,26279,,,"The Poplars, Cowbit"
Lincolnshire,Quarterly Snapshot,2021-01,MLI98812,48706,,,"General Baptist Chapel, Asterby"
Lincolnshire,Quarterly Snapshot,2021-01,MLI117222,57103,,,"Chestnut House, Normanby Le Wold"
Lincolnshire,Quarterly Snapshot,2021-01,MLI96663,55889,,,"Pigeoncote at Hall Farm, Caenby"
