OrganisationLabel,ReportingPeriodType,ReportMonth,MonumentID,ReferenceID,RecordType,RecordTypeDesc,Name
Lincolnshire,Quarterly Snapshot,2021-01,MLI95266,37768,,,"Three Gravestones, Church of St Michael and All Angels, Edenham"
Lincolnshire,Quarterly Snapshot,2021-01,MLI89256,64144,,,"Prehistoric cropmark enclosure and ditch, north east of Moor Farm, Ruskington"
Lincolnshire,Quarterly Snapshot,2021-01,MLI52361,52361,,,WORKED FLINT
Lincolnshire,Quarterly Snapshot,2021-01,MLI93482,47995,,,"11 The Market Place, Burgh le Marsh"
Lincolnshire,Quarterly Snapshot,2021-01,MLI122928,26298,,,"Unnamed farmstead, Weston"
Lincolnshire,Quarterly Snapshot,2021-01,MLI125224,39486,,,Dowsby Village Hall
Lincolnshire,Quarterly Snapshot,2021-01,MLI88688,23973,,,"Animal burial, Spalding"
Lincolnshire,Quarterly Snapshot,2021-01,MLI98527,25744,,,"Post medieval hayrick, Crowland"
Lincolnshire,Quarterly Snapshot,2021-01,MLI125170,49506,,,"Royal Observer Corps Post, Mablethorpe"
Lincolnshire,Quarterly Snapshot,2021-01,MLI95204,37706,,,"Manor House and attached outbuilding, Bitchfield and Bassingthorpe"
Lincolnshire,Quarterly Snapshot,2021-01,MLI121367,30985,,,"Costa Row Farm, Long Bennington"
Lincolnshire,Quarterly Snapshot,2021-01,MLI13507,13507,,,"GRANARY COMPLEX, LATER KNOWN AS THE CARLTON WORKS"
Lincolnshire,Quarterly Snapshot,2021-01,MLI33115,33115,,,Dunsby village cross
Lincolnshire,Quarterly Snapshot,2021-01,MLI93215,47604,,,"Church of St Mary, West Torrington"
Lincolnshire,Quarterly Snapshot,2021-01,MLI82926,62378,,,Flints found at Osbournby
Lincolnshire,Quarterly Snapshot,2021-01,MLI86658,45638,,,"Medieval ridge and furrow, Louth"
Lincolnshire,Quarterly Snapshot,2021-01,MLI54106,54106,,,POSSIBLE RING DITCH
Lincolnshire,Quarterly Snapshot,2021-01,MLI35081,35081,,,"LATE SAXON POTTERY, UFFINGTON ESTATE GOLF COURSE"
Lincolnshire,Quarterly Snapshot,2021-01,MLI86517,45545,,,"Malthouse, Aswell Street, Louth"
Lincolnshire,Quarterly Snapshot,2021-01,MLI51628,51628,,,EARTHWORK HOLLOW WAY
Lincolnshire,Quarterly Snapshot,2021-01,MLI125303,49548,,,"Undated Pit, Glebe Close, Donington on Bain"
Lincolnshire,Quarterly Snapshot,2021-01,MLI34164,34164,,,BELGIC BROOCH FOUND E OF WYVILLE
Lincolnshire,Quarterly Snapshot,2021-01,MLI91980,13970,,,"Boston Christian Fellowship Assemblies of God, Tower Street, Boston"
Lincolnshire,Quarterly Snapshot,2021-01,MLI84999,44967,,,"Undated cropmark trackway, north east of Scamblesby Thorpe, Scamblesby"
Lincolnshire,Quarterly Snapshot,2021-01,MLI99488,25783,,,"Site of an 18th century house on High Street, Spalding"
Lincolnshire,Quarterly Snapshot,2021-01,MLI80592,61142,,,Undated cropmark and earthwork road
Lincolnshire,Quarterly Snapshot,2021-01,MLI13040,13040,,,"Pottery, Kirton"
Lincolnshire,Quarterly Snapshot,2021-01,MLI33691,33691,,,"Remains of the Knights Templar Preceptory, watermill and fishponds, South Witham"
Lincolnshire,Quarterly Snapshot,2021-01,MLI116725,410093,,,"(Low Farm), Tetney"
Lincolnshire,Quarterly Snapshot,2021-01,MLI117157,57038,,,"Middlegate (Nettleton Top), Nettleton"
Lincolnshire,Quarterly Snapshot,2021-01,MLI51661,51661,,,STONEWORK AND ROMANO-BRITISH POTTERY FOUND IN STREAM
Lincolnshire,Quarterly Snapshot,2021-01,MLI33309,33309,,,"Ditches and enclosures visible in cropmarks, Billingborough"
Lincolnshire,Quarterly Snapshot,2021-01,MLI53252,53252,,,"St John the Baptist Church, Lissington"
Lincolnshire,Quarterly Snapshot,2021-01,MLI99437,39393,,,"Roman Coin, Park Farm, Stoke Rochford"
Lincolnshire,Quarterly Snapshot,2021-01,MLI85189,45121,,,"Possible Settlement Site, Brinkhill"
Lincolnshire,Quarterly Snapshot,2021-01,MLI118169,410706,,,"Corner Farm, Theddlethorpe St. Helen"
Lincolnshire,Quarterly Snapshot,2021-01,MLI98188,48461,,,"Medieval and post medieval artefact scatter, Jubilee Way, Horncastle"
Lincolnshire,Quarterly Snapshot,2021-01,MLI33950,33950,,,WORKED FLINTS FOUND S OF WYVILLE LODGE
Lincolnshire,Quarterly Snapshot,2021-01,MLI52844,52844,,,ROMAN COIN
Lincolnshire,Quarterly Snapshot,2021-01,MLI85048,44980,,,"Prehistoric settlement cropmarks, north of M Plantation, Maidenwell"
Lincolnshire,Quarterly Snapshot,2021-01,MLI53340,53340,,,SAND PIT
Lincolnshire,Quarterly Snapshot,2021-01,MLI118449,410939,,,"Twyne Road Farm, Strubby with Woodthorpe"
Lincolnshire,Quarterly Snapshot,2021-01,MLI85340,45216,,,"Prehistoric cropmark enclosures, south of Belchford"
Lincolnshire,Quarterly Snapshot,2021-01,MLI81303,61474,,,Holy well and conduit starting north of Glebe Cottages
Lincolnshire,Quarterly Snapshot,2021-01,MLI40442,40442,,,"Undated Cropmark Ditch and Linear Feature, Tattershall"
Lincolnshire,Quarterly Snapshot,2021-01,MLI87288,23947,,,"Nineteenth century brewery, Station Street, Donington"
Lincolnshire,Quarterly Snapshot,2021-01,MLI96574,55800,,,"Till Bridge Farm Cottages, Scampton"
Lincolnshire,Quarterly Snapshot,2021-01,MLI119948,411693,,,"The elms (Elm Cottage), Irby in the Marsh"
Lincolnshire,Quarterly Snapshot,2021-01,MLI33009,33009,,,"Medieval sculptural fragment, All Saints Church"
Lincolnshire,Quarterly Snapshot,2021-01,MLI97285,48221,,,"38 East Street, Horncastle"
Lincolnshire,Quarterly Snapshot,2021-01,MLI41023,41023,,,ROMANO BRITISH SITE W OF STICKFORD
Lincolnshire,Quarterly Snapshot,2021-01,MLI123621,26830,,,"North Barn Farm, Gedney Hill"
Lincolnshire,Quarterly Snapshot,2021-01,MLI83048,35676,,,"Land at Hillside Farm, Lound"
Lincolnshire,Quarterly Snapshot,2021-01,MLI82296,35449,,,Roman pottery near Denton Cottages
Lincolnshire,Quarterly Snapshot,2021-01,MLI95056,37558,,,"The Old Rectory, Counthorpe and Creeton"
Lincolnshire,Quarterly Snapshot,2021-01,MLI84350,62694,,,Prehistoric cropmark trackway to the south of the A52 near Newton
Lincolnshire,Quarterly Snapshot,2021-01,MLI86133,54946,,,Romano-British artefact scatter from west of Nettleham
Lincolnshire,Quarterly Snapshot,2021-01,MLI125686,31826,,,"Post-Medieval Artefacts and Pits, Vine Street Surgery, Grantham"
Lincolnshire,Quarterly Snapshot,2021-01,MLI122950,26320,,,"Detached Cottage, Weston"
Lincolnshire,Quarterly Snapshot,2021-01,MLI51323,51323,,,MEDIEVAL POTTERY AND POSSIBLE BONE KNIFE HANDLE FOUND AT FORMER METHODIST C
Lincolnshire,Quarterly Snapshot,2021-01,MLI40168,40168,,,"MEDIEVAL ROOF FINIAL IN THE FORM OF A HOUSE, TATTERSHALL"
Lincolnshire,Quarterly Snapshot,2021-01,MLI51021,51021,,,ROMAN COIN FOUND SOUTH OF BARFF LANE
Lincolnshire,Quarterly Snapshot,2021-01,MLI89598,64386,,,"Hall Close, Wilsford"
Lincolnshire,Quarterly Snapshot,2021-01,MLI81910,44032,,,"An undated probable medieval pond, Nightingale House"
Lincolnshire,Quarterly Snapshot,2021-01,MLI82983,62385,,,"Medieval and post medieval pottery scatter, north of caravan site"
Lincolnshire,Quarterly Snapshot,2021-01,MLI84793,44846,,,"Prehistoric cropmark boundary, north west of Moses Farm, Stenigot"
Lincolnshire,Quarterly Snapshot,2021-01,MLI118038,57544,,,"Spitals Farm, Glentworth"
Lincolnshire,Quarterly Snapshot,2021-01,MLI41954,41954,,,"ROMAN SALTERN SITE, HOGSTHORPE"
Lincolnshire,Quarterly Snapshot,2021-01,MLI23580,23580,,,"Pillbox, Crowland"
Lincolnshire,Quarterly Snapshot,2021-01,MLI124576,412471,,,"HURN HOUSE FARM, Sibsey"
Lincolnshire,Quarterly Snapshot,2021-01,MLI30374,30374,,,Romano-British finds near Honington Camp
Lincolnshire,Quarterly Snapshot,2021-01,MLI89988,64536,,,"Prehistoric agricultural activity on land off Five Mile Lane, Washingborough"
Lincolnshire,Quarterly Snapshot,2021-01,MLI86551,45589,,,"22-28 (even), Cornmarket"
Lincolnshire,Quarterly Snapshot,2021-01,MLI115906,49170,,,"Undated Enclosures, Hundleby"
Lincolnshire,Quarterly Snapshot,2021-01,MLI95936,38438,,,"Barn at The Mount, Corby Glen"
Lincolnshire,Quarterly Snapshot,2021-01,MLI88963,64042,,,"Medieval to post medieval earthwork pillow mound, South Kyme"
Lincolnshire,Quarterly Snapshot,2021-01,MLI51439,51439,,,UNLOCATED FIND OF A PAIR OF HORSE BARNACLES FROM WEST FIRSBY
Lincolnshire,Quarterly Snapshot,2021-01,MLI52023,52023,,,Middle Rasen Tupholme Settlement
Lincolnshire,Quarterly Snapshot,2021-01,MLI60573,60573,,,Undated bronze plate found in North Rauceby
Lincolnshire,Quarterly Snapshot,2021-01,MLI12776,12776,,,"Whiteloaf Hall, Freiston"
Lincolnshire,Quarterly Snapshot,2021-01,MLI51485,51485,,,"Saxon grave slabs and grave marker, St Michael's Church, Hackthorn"
Lincolnshire,Quarterly Snapshot,2021-01,MLI89022,46659,,,"Medieval ridge and furrow (earthworks and excavated features), Tattershall Thorpe"
Lincolnshire,Quarterly Snapshot,2021-01,MLI30427,30427,,,"LIMEKILN, SYSTON PARK"
Lincolnshire,Quarterly Snapshot,2021-01,MLI52917,52917,,,BRONZE AGE SPEARHEADS FROM THE WITHAM
Lincolnshire,Quarterly Snapshot,2021-01,MLI90260,64753,,,"Carre's Grammar School, Northgate, Sleaford"
Lincolnshire,Quarterly Snapshot,2021-01,MLI42330,42330,,,POLISHED STONE AXE FOUND N OF MAREHAM ON THE HILL
Lincolnshire,Quarterly Snapshot,2021-01,MLI97796,71088,,,"Monks Abbey Mine, Lincoln"
Lincolnshire,Quarterly Snapshot,2021-01,MLI118429,410919,,,"Longlands Farm, Withern with Stain"
Lincolnshire,Quarterly Snapshot,2021-01,MLI94076,71008,,,"Jews House, The Strait, Lincoln"
Lincolnshire,Quarterly Snapshot,2021-01,MLI41465,41465,,,MEDIEVAL FINDS FROM HANNAH CUM HAGNABY
Lincolnshire,Quarterly Snapshot,2021-01,MLI52299,52299,,,POSSIBLE MODERN EARTHWORKS
Lincolnshire,Quarterly Snapshot,2021-01,MLI122030,66965,,,"Unnamed farmstead, Helpringham"
Lincolnshire,Quarterly Snapshot,2021-01,MLI97904,25698,,,"Possible Former Building, Sutton Bridge"
Lincolnshire,Quarterly Snapshot,2021-01,MLI53712,53712,,,PREHISTORIC SETTLEMENT
Lincolnshire,Quarterly Snapshot,2021-01,MLI118254,410791,,,"Glebe Farm, Welton Le Wold"
Lincolnshire,Quarterly Snapshot,2021-01,MLI92610,14184,,,"Milestone, Swineshead"
Lincolnshire,Quarterly Snapshot,2021-01,MLI95451,37953,,,"Gateway to Belton Park, Belton and Manthorpe"
Lincolnshire,Quarterly Snapshot,2021-01,MLI99248,56585,,,"Possible Kiln Feature, Newton on Trent"
Lincolnshire,Quarterly Snapshot,2021-01,MLI91497,37064,,,"Church of St John the Evangelist, Station Road, Grantham"
Lincolnshire,Quarterly Snapshot,2021-01,MLI120281,412026,,,"Primrose Farm, Thorpe St. Peter"
Lincolnshire,Quarterly Snapshot,2021-01,MLI90190,64685,,,"No. 11 Southgate, Sleaford"
Lincolnshire,Quarterly Snapshot,2021-01,MLI89017,46654,,,"Bronze Age cropmark round barrow, Tattershall Thorpe"
Lincolnshire,Quarterly Snapshot,2021-01,MLI95865,38367,,,"Conduit House, 14 St Paul's Street, Stamford"
Lincolnshire,Quarterly Snapshot,2021-01,MLI43530,43530,,,"Medieval Finds, Lagoon Walk, Skegness"
Lincolnshire,Quarterly Snapshot,2021-01,MLI33917,33917,,,"Cross, Easton"
Lincolnshire,Quarterly Snapshot,2021-01,MLI53926,53926,,,QUARRY
Lincolnshire,Quarterly Snapshot,2021-01,MLI118351,57681,,,"Bleashy Field, Legsby"
Lincolnshire,Quarterly Snapshot,2021-01,MLI81684,43982,,,"Eighteenth century bronze token, north of South View Farm"
Lincolnshire,Quarterly Snapshot,2021-01,MLI54237,54237,,,"Undated Features, Main Street, Kirkby-cum-Osgodby"
Lincolnshire,Quarterly Snapshot,2021-01,MLI90263,64756,,,"Nos. 3, 4 and 5 Parry's Court, Northgate, Sleaford"
Lincolnshire,Quarterly Snapshot,2021-01,MLI92521,14095,,,"Traphouse at Skirbeck Grange, Fishtoft"
Lincolnshire,Quarterly Snapshot,2021-01,MLI91399,55478,,,"Clergy house to Roman Catholic church of St Thomas of Canterbury, Cross Street, Gainsborough"
Lincolnshire,Quarterly Snapshot,2021-01,MLI52422,52422,,,RECTANGULAR DITCHED ENCLOSURE
Lincolnshire,Quarterly Snapshot,2021-01,MLI33723,33723,,,"RB POTTERY FOUND, IRNHAM"
Lincolnshire,Quarterly Snapshot,2021-01,MLI97523,65694,,,"Iron Age pottery from land at Manor Farm, Quarrington"
Lincolnshire,Quarterly Snapshot,2021-01,MLI51445,51445,,,LARGE QUANTITIES OF ROMAN POTTERY FOUND NORTHEAST OF WEST FIRSBY MANOR HOUS
Lincolnshire,Quarterly Snapshot,2021-01,MLI50276,50276,,,SUPPOSED FORMER MOATED SITE AT BUTYATE
Lincolnshire,Quarterly Snapshot,2021-01,MLI52928,52928,,,"Roman Artefacts, Cromwell's Grave Long Barrow, Swinhope"
Lincolnshire,Quarterly Snapshot,2021-01,MLI95790,38292,,,"2 Broad Street, Stamford"
Lincolnshire,Quarterly Snapshot,2021-01,MLI33102,33102,,,ROMANO-BRITISH SETTLEMENT
Lincolnshire,Quarterly Snapshot,2021-01,MLI97039,56265,,,"Stables, Holton Hall, Holton le Moor"
Lincolnshire,Quarterly Snapshot,2021-01,MLI30770,30770,,,Early Bronze Age Scraper
Lincolnshire,Quarterly Snapshot,2021-01,MLI123624,26833,,,"Unnamed farmstead, Gedney Hill"
Lincolnshire,Quarterly Snapshot,2021-01,MLI125360,58226,,,"Workshops, Mill Yard, Bardney"
Lincolnshire,Quarterly Snapshot,2021-01,MLI123394,26603,,,"Penny Hill House, Holbeach"
Lincolnshire,Quarterly Snapshot,2021-01,MLI51772,51772,,,"FLINT FLAKES, SCRAPERS, SLUG KNIFE AND TWO LEAF ARROWHEADS"
Lincolnshire,Quarterly Snapshot,2021-01,MLI86300,13768,,,"Manor House, Middlegate Road, Frampton"
Lincolnshire,Quarterly Snapshot,2021-01,MLI51859,51859,,,RIDGE AND FURROW
Lincolnshire,Quarterly Snapshot,2021-01,MLI53739,53739,,,EXTRACTIVE PIT CROPMARKS
Lincolnshire,Quarterly Snapshot,2021-01,MLI83750,36068,,,"Cottage, 20 High Street, Thurlby"
Lincolnshire,Quarterly Snapshot,2021-01,MLI117391,57272,,,"Brook Farm, Blyton"
Lincolnshire,Quarterly Snapshot,2021-01,MLI81440,61619,,,One flint flake from north of White Lane (Plot 1)
Lincolnshire,Quarterly Snapshot,2021-01,MLI53232,53232,,,EARLY BRONZE AGE AXE
Lincolnshire,Quarterly Snapshot,2021-01,MLI116089,25803,,,"Former Barn and Stables, Town Dam Lane, Donington"
Lincolnshire,Quarterly Snapshot,2021-01,MLI118645,57723,,,"The Hollies, Lissington"
Lincolnshire,Quarterly Snapshot,2021-01,MLI118001,57507,,,"Turn House Farm, Owmby"
Lincolnshire,Quarterly Snapshot,2021-01,MLI84582,60290,,,"Linear cropmark west of Asgarby Village, Kirkby La Thorpe"
Lincolnshire,Quarterly Snapshot,2021-01,MLI97689,25656,,,"Former Wesleyan Methodist Chapel and Sunday School, Dowsdale Bank, Dowsdale, Whaplode"
Lincolnshire,Quarterly Snapshot,2021-01,MLI81358,70214,,,"Possible Roman structure, Flaxengate/Danes Terrace"
Lincolnshire,Quarterly Snapshot,2021-01,MLI81312,61481,,,"Russell's House, Heighington Road"
Lincolnshire,Quarterly Snapshot,2021-01,MLI91638,65279,,,Park associated with the Hussey manor house at Old Place
Lincolnshire,Quarterly Snapshot,2021-01,MLI116449,56768,,,"Former School, School Lane, North Kelsey"
Lincolnshire,Quarterly Snapshot,2021-01,MLI121613,66839,,,"Unnamed farmstead, Walcot Near Folkingham"
Lincolnshire,Quarterly Snapshot,2021-01,MLI98023,39143,,,"Undated Ditch and Pit, Deeping St James"
Lincolnshire,Quarterly Snapshot,2021-01,MLI125775,58345,,,"Water Tower, Ash Grove, Gainsborough"
Lincolnshire,Quarterly Snapshot,2021-01,MLI123720,31672,,,"Beck Cott, Uffington"
Lincolnshire,Quarterly Snapshot,2021-01,MLI117536,410394,,,"Glebe Farm, Conisholme"
Lincolnshire,Quarterly Snapshot,2021-01,MLI35001,35001,,,MEDIEVAL POTTERY FOUND AT OLD HALL FARM
Lincolnshire,Quarterly Snapshot,2021-01,MLI87513,63642,,,Iron Age ring ditch
Lincolnshire,Quarterly Snapshot,2021-01,MLI123011,14991,,,"Unnamed farmstead, Kirton"
Lincolnshire,Quarterly Snapshot,2021-01,MLI94756,37258,,,"5 Austin Street, Stamford"
Lincolnshire,Quarterly Snapshot,2021-01,MLI51197,51197,,,EARLY BRONZE AGE AXE-HAMMER FOUND NORTHEAST OF THE OLD POSTHOUSE
Lincolnshire,Quarterly Snapshot,2021-01,MLI93189,47578,,,"The Grove, Theddlethorpe All Saints"
Lincolnshire,Quarterly Snapshot,2021-01,MLI99169,48969,,,"Wesleyan Methodist Chapel, Scamblesby"
Lincolnshire,Quarterly Snapshot,2021-01,MLI92921,47745,,,"Ashleigh Farm, Theddlethorpe St Helen"
Lincolnshire,Quarterly Snapshot,2021-01,MLI81291,43935,,,"Late post-medieval footpath, off Fortescue Close"
Lincolnshire,Quarterly Snapshot,2021-01,MLI34946,34946,,,"MEDIEVAL CULTIVATION REMAINS, MILL DROVE"
Lincolnshire,Quarterly Snapshot,2021-01,MLI82622,62201,,,"Roman activity off Stephens Way, Sleaford."
Lincolnshire,Quarterly Snapshot,2021-01,MLI99226,49025,,,"Former Wesleyan Methodist Chapel, Sloothby"
Lincolnshire,Quarterly Snapshot,2021-01,MLI89899,64472,,,"Church Farmhouse, Great Hale"
Lincolnshire,Quarterly Snapshot,2021-01,MLI53213,53213,,,PERFORATED STONE HAMMER OR MACEHEAD
Lincolnshire,Quarterly Snapshot,2021-01,MLI86707,45614,,,"House, 47 Eastgate, Louth"
Lincolnshire,Quarterly Snapshot,2021-01,MLI50645,50645,,,"SECOND WORLD WAR GUN EMPLACEMENT, CHUCK HATCH, WEST RASEN"
Lincolnshire,Quarterly Snapshot,2021-01,MLI89746,34664,,,Romano-British artefact scatter to the south west of Birthorpe
Lincolnshire,Quarterly Snapshot,2021-01,MLI118567,411057,,,"The Beeches, Asterby"
Lincolnshire,Quarterly Snapshot,2021-01,MLI123908,27052,,,"Empsons Farm (Green Lodge), Crowland"
Lincolnshire,Quarterly Snapshot,2021-01,MLI52856,52856,,,UNDATED CROPMARK MOUND
Lincolnshire,Quarterly Snapshot,2021-01,MLI118375,410865,,,"Eastfield House, Mablethorpe and Sutton"
Lincolnshire,Quarterly Snapshot,2021-01,MLI84374,62714,,,Undated cropmark enclosure near Dembleby Gorse
Lincolnshire,Quarterly Snapshot,2021-01,MLI125417,67078,,,"Hawker Hurricane Aircraft Crash Site, Scopwick"
Lincolnshire,Quarterly Snapshot,2021-01,MLI86865,45765,,,"House, 94-102 Upgate, Louth"
Lincolnshire,Quarterly Snapshot,2021-01,MLI43563,43563,,,The site of the deserted medieval village of Maltby
Lincolnshire,Quarterly Snapshot,2021-01,MLI60860,60860,,,Norman brooch from east of Brauncewell
Lincolnshire,Quarterly Snapshot,2021-01,MLI50126,50126,,,FLINT IMPLEMENTS FOUND IN THIS AREA
Lincolnshire,Quarterly Snapshot,2021-01,MLI94322,25181,,,"18 Market Place, Donington"
Lincolnshire,Quarterly Snapshot,2021-01,MLI92537,14111,,,"Milestone by Struggs Hill, Sutterton"
Lincolnshire,Quarterly Snapshot,2021-01,MLI51732,51732,,,"Possible Cropmark Enclosure, Swallow"
Lincolnshire,Quarterly Snapshot,2021-01,MLI51716,51716,,,ROMANO BRITISH POTTERY SCATTER
Lincolnshire,Quarterly Snapshot,2021-01,MLI95430,37932,,,"Steps and a pair of statues on the North Terrace, Belton House, Belton and Manthorpe"
Lincolnshire,Quarterly Snapshot,2021-01,MLI93392,47905,,,"75 High Street and adjacent shop, Wainfleet All Saints"
Lincolnshire,Quarterly Snapshot,2021-01,MLI87896,63599,,,"Roman coin, Foster Street, Heckington"
Lincolnshire,Quarterly Snapshot,2021-01,MLI90253,64746,,,"No. 43 Northgate, Sleaford"
Lincolnshire,Quarterly Snapshot,2021-01,MLI96764,55990,,,"Old Rectory, Owersby"
Lincolnshire,Quarterly Snapshot,2021-01,MLI121925,66862,,,"(Fen Farm), Asgarby and Howell"
Lincolnshire,Quarterly Snapshot,2021-01,MLI117305,57186,,,"The Old Granary, Snitterby"
Lincolnshire,Quarterly Snapshot,2021-01,MLI99144,48951,,,"Wesleyan Methodist Chapel, Kirkby-on-Bain"
Lincolnshire,Quarterly Snapshot,2021-01,MLI88625,63987,,,"Probable modern cropmark and earthwork aircraft obstruction, Brauncewell"
Lincolnshire,Quarterly Snapshot,2021-01,MLI50717,50717,,,CROPMARKS NORTH-WEST OF HOME FARM
Lincolnshire,Quarterly Snapshot,2021-01,MLI85221,45144,,,"Prehistoric cropmarks, east of Tetford"
Lincolnshire,Quarterly Snapshot,2021-01,MLI90821,13904,,,"Cropmark prehistoric or Romano-British rectangular enclosure and ring ditch, Fishtoft"
Lincolnshire,Quarterly Snapshot,2021-01,MLI42656,42656,,,A NEOLITHIC AXE FROM SALMONBY
Lincolnshire,Quarterly Snapshot,2021-01,MLI40724,40724,,,"STONE MACEHEAD, FOUND NEAR WATKINSON'S BRIDGE"
Lincolnshire,Quarterly Snapshot,2021-01,MLI60578,60578,,,"Medieval and post medieval manor at Hall Field, Water Lane, Bassingham"
Lincolnshire,Quarterly Snapshot,2021-01,MLI51040,51040,,,FLINT SCRAPER FOUND SOUTH OF PROSPECT HOUSE
Lincolnshire,Quarterly Snapshot,2021-01,MLI122911,14957,,,"Unnamed farmstead, Algarkirk"
Lincolnshire,Quarterly Snapshot,2021-01,MLI92273,14022,,,"Wyberton Park, Wyberton"
Lincolnshire,Quarterly Snapshot,2021-01,MLI95872,38374,,,"11 and 12 St Mary's Hill, Stamford"
Lincolnshire,Quarterly Snapshot,2021-01,MLI87014,36560,,,"Roman-Saxon glass bead found on land at Poplar Farm, Grantham"
Lincolnshire,Quarterly Snapshot,2021-01,MLI121734,31251,,,"The Kennels, Kirkby Underwood"
Lincolnshire,Quarterly Snapshot,2021-01,MLI88503,36694,,,"Possible unknown date cropmark enclosure and trackway, Uffington"
Lincolnshire,Quarterly Snapshot,2021-01,MLI82546,44346,,,"Roman enclosure, near Greenfield Farm"
Lincolnshire,Quarterly Snapshot,2021-01,MLI98549,39216,,,"Beacon Cottage and ha-ha to west, Halls Hill, Grantham"
Lincolnshire,Quarterly Snapshot,2021-01,MLI121555,31086,,,"Ashes Farm, Allington"
Lincolnshire,Quarterly Snapshot,2021-01,MLI60508,60508,,,"Palaeolithic handaxe, north of Kirkby Green, Scopwick"
Lincolnshire,Quarterly Snapshot,2021-01,MLI85626,54880,,,"Medieval pottery sherd, Brocklesby"
Lincolnshire,Quarterly Snapshot,2021-01,MLI118945,411266,,,"Unnamed farmstead, Willoughby with Sloothby"
Lincolnshire,Quarterly Snapshot,2021-01,MLI82764,62257,,,"St Andrew's church and churchyard, Heckington"
Lincolnshire,Quarterly Snapshot,2021-01,MLI33186,33186,,,"RB quern and possible hut site, south of Northorpe Fen Farm"
Lincolnshire,Quarterly Snapshot,2021-01,MLI51779,51779,,,"Roman Villa Cropmarks, Hoe Hill Farm, Swinhope"
Lincolnshire,Quarterly Snapshot,2021-01,MLI117733,410536,,,"Unnamed farmstead (Woodhouse Farm), Brackenborough with Little Grimsby"
Lincolnshire,Quarterly Snapshot,2021-01,MLI34968,34968,,,"Post medieval remains, Appletrees"
Lincolnshire,Quarterly Snapshot,2021-01,MLI42142,42142,,,HOARD OF ELIZABETHAN COINS
Lincolnshire,Quarterly Snapshot,2021-01,MLI96458,55684,,,"Brick cottages, Osgodby"
Lincolnshire,Quarterly Snapshot,2021-01,MLI42677,42677,,,"PARTLY POLISHED FLINT AXE, BRINKHILL"
Lincolnshire,Quarterly Snapshot,2021-01,MLI94687,37189,,,"25 St George's Street, Stamford"
Lincolnshire,Quarterly Snapshot,2021-01,MLI93095,47484,,,"Church of St Philip, Brinkhill"
Lincolnshire,Quarterly Snapshot,2021-01,MLI53208,53208,,,"Probable Iron Age farm or settlement, Grayingham Grange"
Lincolnshire,Quarterly Snapshot,2021-01,MLI116112,65838,,,"Glebe Farm Cottages, Blankney Drove"
Lincolnshire,Quarterly Snapshot,2021-01,MLI123119,15099,,,"White House, Wyberton"
Lincolnshire,Quarterly Snapshot,2021-01,MLI84456,62772,,,"Prehistoric cropmark boundary ditch, Ashby de la Launde and Bloxholm"
Lincolnshire,Quarterly Snapshot,2021-01,MLI119044,57868,,,"Cereals House, Goltho"
Lincolnshire,Quarterly Snapshot,2021-01,MLI122664,26139,,,"Unnamed farmstead, Pinchbeck"
Lincolnshire,Quarterly Snapshot,2021-01,MLI53461,53461,,,TWO FLINT SCRAPERS
Lincolnshire,Quarterly Snapshot,2021-01,MLI123588,26797,,,"Unnamed farmstead, Gedney"
Lincolnshire,Quarterly Snapshot,2021-01,MLI120687,66315,,,"Unnamed farmstead, Martin"
Lincolnshire,Quarterly Snapshot,2021-01,MLI116430,49349,,,"Ridge and Furrow, Legbourne Furze"
Lincolnshire,Quarterly Snapshot,2021-01,MLI41476,41476,,,Moated site at Thurlby in Bigby parish.
Lincolnshire,Quarterly Snapshot,2021-01,MLI22979,22979,,,POSSIBLE SALTERN
Lincolnshire,Quarterly Snapshot,2021-01,MLI50221,50221,,,PREHISTORIC FLINTS FOUND IN NETTLETON
Lincolnshire,Quarterly Snapshot,2021-01,MLI91437,55516,,,"27 Silver Street, Gainsborough"
Lincolnshire,Quarterly Snapshot,2021-01,MLI42793,42793,,,"Ridge and Furrow, Alvingham"
Lincolnshire,Quarterly Snapshot,2021-01,MLI34721,34721,,,UNDATED CROPMARKS
Lincolnshire,Quarterly Snapshot,2021-01,MLI91725,65330,,,"Baptist chapel on Eastgate, Sleaford"
Lincolnshire,Quarterly Snapshot,2021-01,MLI40409,40409,,,"SETTLEMENT, WOODHALL SPA"
Lincolnshire,Quarterly Snapshot,2021-01,MLI13476,13476,,,"POST MEDIEVAL PITS TO REAR OF 51 WIDE BARGATE, BOSTON"
Lincolnshire,Quarterly Snapshot,2021-01,MLI121365,30983,,,"Unnamed farmstead (Valley Farm), Long Bennington"
Lincolnshire,Quarterly Snapshot,2021-01,MLI83070,35684,,,Roman pottery found at Wilsford Lane
Lincolnshire,Quarterly Snapshot,2021-01,MLI89877,24012,,,"Hall Gate House, King's Gate, Gedney"
Lincolnshire,Quarterly Snapshot,2021-01,MLI89378,64216,,,"75 Main Street, Ewerby"
Lincolnshire,Quarterly Snapshot,2021-01,MLI99240,49036,,,"Former Wesleyan Methodist Chapel, High Street, Skegness"
Lincolnshire,Quarterly Snapshot,2021-01,MLI120850,66478,,,"Unnamed farmstead, Scopwick"
Lincolnshire,Quarterly Snapshot,2021-01,MLI118404,410894,,,"Unnamed farmstead, Mablethorpe and Sutton"
Lincolnshire,Quarterly Snapshot,2021-01,MLI96877,56103,,,"32 South Street, Caistor"
Lincolnshire,Quarterly Snapshot,2021-01,MLI120247,411992,,,"Brookfield, Croft"
Lincolnshire,Quarterly Snapshot,2021-01,MLI12699,12699,,,"POST MEDIEVAL WAREHOUSES, BOSTON"
Lincolnshire,Quarterly Snapshot,2021-01,MLI53674,53674,,,SETTLEMENT OF BIGBY
Lincolnshire,Quarterly Snapshot,2021-01,MLI83497,35798,,,"A sherd of Romano-British pottery, Manor Pit"
Lincolnshire,Quarterly Snapshot,2021-01,MLI88151,46264,,,Aircraft obstruction at Saltfleetby All Saints
Lincolnshire,Quarterly Snapshot,2021-01,MLI118075,57581,,,"Walk Farm (Walk House), Upton"
Lincolnshire,Quarterly Snapshot,2021-01,MLI23119,23119,,,"Iron Age Saltern Site, Tyrell's Farm, Cowbit"
Lincolnshire,Quarterly Snapshot,2021-01,MLI118577,411067,,,"Highfield House, Scamblesby"
Lincolnshire,Quarterly Snapshot,2021-01,MLI84566,62829,,,"Prehistoric Settlement, Ruskington and Leasingham"
Lincolnshire,Quarterly Snapshot,2021-01,MLI43591,43591,,,"SITE OF ST MARTIN'S CHURCH, DALDERBY"
Lincolnshire,Quarterly Snapshot,2021-01,MLI30450,30450,,,"MILLS, BELTON"
Lincolnshire,Quarterly Snapshot,2021-01,MLI50099,50099,,,"Medieval Deer Park, Kettlethorpe"
Lincolnshire,Quarterly Snapshot,2021-01,MLI95103,37605,,,"18 High Street and attached bakery, Great Gonerby"
Lincolnshire,Quarterly Snapshot,2021-01,MLI53989,53989,,,RIDGE AND FURROW
Lincolnshire,Quarterly Snapshot,2021-01,MLI33581,33581,,,"Dovecote, Shillingthorpe Hall"
Lincolnshire,Quarterly Snapshot,2021-01,MLI123611,26820,,,"Sycamore Lodge, Gedney"
Lincolnshire,Quarterly Snapshot,2021-01,MLI82081,44046,,,Settlement of Helsey
Lincolnshire,Quarterly Snapshot,2021-01,MLI116024,39460,,,"Former Quarry Pit, Little Ponton"
Lincolnshire,Quarterly Snapshot,2021-01,MLI43711,43711,,,"Early Anglo-Saxon pottery sherd found on land off Watery Lane, Mareham Le Fen"
Lincolnshire,Quarterly Snapshot,2021-01,MLI40263,40263,,,"MEDIEVAL HOUSES (SITE OF), LANGTON BY HORNCASTLE"
